user_nickname,userIdNo,comments,visible,replyLevel,regTime,parentCommentNo,sympathyCount,antipathyCount,replyAllCount
naya****,1plos,"문형배씨는 사퇴가 답입니다 이런 극좌 정치사상의 사람이 헌재 재판소장 대행이라니 말이 됩니까? 우리법연구회 회장출신, 좌측에서도 더 좌측, 김제동을 좋아하고 김어준과 이재명을 팔러우하고, 이재명과 연수원동기에 술친구, 북한이랑 평화롭게 지내는것은 비위맞춰주고 퍼주는것이라는 답이라고 했다, 이진숙 방송통신위원장은 임명 하루만에 탄핵되었는데 국회에서 왜 일을 안해서 빈 헌재 재판관 임명안했느냐고 호통쇼를 했지만 탄핵인용, 2명 의결 하나만 해결하면되는데 180일 가까이 방통위심판걸리면서 내란협의 입증 어려운 대통령 탄핵심판은 신속히?",True,1,2025-01-27T21:26:12+0900,849647581221879873,69,19,4
de10****,99yZy,"대통령 방어권,인권 보장하라 검찰기소로 헌재는 중단되어야한다",True,1,2025-01-27T22:04:12+0900,849650029017694267,55,12,2
tjsg****,3CN4p,현재 헌법재판소 판사8명중 4명이 우리법연구회 회원이라는 것은 말이 안되는 상황이다. 여기에 마은혁이 더해지면 5명이 되는 상황이다. 게다가 헌법재판소 재판관 중 1명(정계선)은 국회측 변호인이 대표로 있는 로펌에 배우자가 근무하고 있는 상황이다. 이런 불공정한 헌법재판소의 결정을 국민 누가 받아들일 수 있겠는가,True,1,2025-01-27T22:13:21+0900,849650618183188577,46,8,0
torw****,4jQzS,윤석열 죄가 없고 석방 해야 된다면 공감을 파면 하고 물러나야 한다면 비공감 눌러주세요,True,1,2025-01-27T22:17:26+0900,849650881904246911,31,18,1
phw7****,baG30,다 썩어빠진 사법부를 규탄합니다. 헌재는 당장 탄핵을 각하해야한다. 말도 안되는 짓거리를 하고 있다. 불법을 하지 않으면 사법부가 아닌가 보다.,True,1,2025-01-27T22:20:08+0900,849651055682650156,19,6,0
kns9****,aKu3a,하루빨리 탄핵 결정해야 한다고봅니다 경제가 내리막. 국민 피로도가 사상최악 입니다.,True,1,2025-01-27T22:57:49+0900,849653482842489044,5,1,0
hche****,2mcJn,"문재인 시절 무엇을 잘했나.북한에서 미사일 쏘고 그럴때 뭐.
미상에 물체. 라고했고 북한편을 들어주고 대한민국 국민이 
바다에 빠지고 북한으로 압송되고 불에 타죽어도 모르세로
말하고 딸은 술취해서 언론에 나오고 이혼은 왜 했고 그전에
사위는 어느 항공사에서 때돈받고. 이런 것은 왜. 수사 안하냐.
 이재명은 재판관 바꿔달라고 하고 변호사 바꾸고 시간끌기하고 이게 민주당이냐. 국민 세금으로 먹고사는 너희들 양심도 없지. 두고보자. 국민에 심판이 있을꺼다. 민주당이 무엇을 잘 했냐? 탄핵해서 나라가 잘 돌아가냐? 그래 두고보자.",True,1,2025-01-27T23:11:37+0900,849654372320149661,3,2,0
gree****,,,False,1,2025-01-28T01:42:37+0900,849664100823728203,0,0,0
2255****,dlnab,대통령은  탄핵이 아니다 이건잘못된거다  빨리 돌아와야한다  우리나라가산다 빨리    제발유     잘 생각 하시유,True,1,2025-01-29T05:51:15+0900,849772889409323023,1,0,0
kpha****,6xeyP,아  빨리 끝내라  지겹다,True,1,2025-01-28T08:35:06+0900,849690673903829019,1,0,0
iop6****,1b7u1,니들만 하지 말고 국민들도 쫌 해보자. 계엄 정지 권한을 국민들이 갖게 해라..,True,1,2025-01-28T07:01:41+0900,849684656436543546,1,0,0
lexy****,2IkkP,"대법이고 헌재고 확실히 말해줘라 모두다합법이고 니네가 불법이라고 주장하는게 불법이고 선동이라고!!
이것들은 뭐 맨날 지들 입맛에 안맞으면 다 불법이래",True,1,2025-01-27T23:01:13+0900,849653702154256451,2,2,0
bae2****,328Uj,"빨리 끝내는방법
무조건 대통령복귀 뿐이다",True,1,2025-01-28T14:46:36+0900,849714607810412689,1,1,0
namm****,,,False,1,2025-01-29T12:33:33+0900,849798807439802486,0,0,0
gbti****,,,False,1,2025-01-28T23:29:11+0900,849748275757056050,0,0,0
kymy****,5JTDk,법 좀 지키자 사법부들아....,True,1,2025-01-28T18:01:36+0900,849727171378282642,0,0,0
kcw7****,,,False,1,2025-01-28T17:01:26+0900,849723295119966325,0,0,0
bae2****,328Uj,형사재판시 헌재 심의는  중단하는게 원칙이다,True,1,2025-01-28T14:45:20+0900,849714526961008726,0,0,0
kkmo****,1mEqm,내란 수괴는 사형이다,True,1,2025-01-28T11:14:46+0900,849700960719601837,0,0,0
phm7****,jXVk,됐고요ㅡㅡㅡㅡ죄인이  말이  많타.,True,1,2025-01-28T08:55:10+0900,849691967276187672,0,0,0
myki****,5xL07,헌법재판소 판사중 민주당 졸개 대장동 50억 클럽 관련 판사들  그리고 우리법 연구회  출신들은  전부교체해야한다,True,1,2025-01-28T06:57:10+0900,849684365553172492,0,0,0
heys****,eVkhq,"공정과 상식~
우리나라법은 도무지 상식적으로 이해가 안가요.",True,1,2025-01-28T06:22:09+0900,849682109638377484,0,0,1
jeen****,cJ1Eo,먼놈의증거임멸 문형배퇴빈시키고 재명이는교도소가고 그다움에 일을벌려도된다 범죄자가나대면서먼놈의정권교체 지금얼마나잘하고있는데 동훈이는 머하냐 재명이 품으로들어가라,True,1,2025-01-28T05:47:59+0900,849679907964321867,0,0,0
key2****,4Mwjt,"윤석열 탄핵 심판 정지 요청....윤석열은 불사존재라는 맨토..허위주장으로..법원으러부터 고발 명예를 심각하게 해쳣다...신변호사. 고발...가짜뉴스가..문제다.,",True,1,2025-01-27T22:25:44+0900,849651416594120900,0,0,0
news****,1JfjD,"윤과 그 졸개들아, 더이상 장난질 치지 말거라. 추하고 징그럽다",True,1,2025-01-27T22:15:54+0900,849650782868340991,0,0,0
wls5****,DHEO,"이재명이는 모든 방어권을 충분히 보장하는데 국민의 대표인 대통령은 방어권 보장도 안 된다고? 반국가세력, 종북좌파, 간1첩들 몇 조금이나 가나 두고 보겠다.  부정선거 사범들은 반드시 사형이다. 모1가지 댕강. 몇 일 남았을까?",True,1,2025-01-27T22:31:04+0900,849651760342499349,1,2,1
feed****,3QfTu,"기울어진 운동장에서  무슨 재판이냐!!
문형배 퇴임후 재판 하자",True,1,2025-01-28T09:47:20+0900,849695327685443671,0,2,0
asdf****,8Oxxd,고마해라~짐승들아~마이 처 뭇다아이가~어이그 내란당들,True,1,2025-01-28T01:33:28+0900,849663510852927566,0,2,0
hong****,9klB,찌질하고 구차하다. 그런다고 변하는건 없다!,True,1,2025-01-27T22:08:09+0900,849650283695833137,0,5,0
