user_nickname,userIdNo,comments,visible,replyLevel,regTime,parentCommentNo,sympathyCount,antipathyCount,replyAllCount
ggoi****,30j4v,"윤두환이 선거부정충인거 다 알고도 개고기 판놈이 헛소리 하고 있네.. 거기다 지보다 배로 나이많은 의원들도 민주주의 지키겠다고 목숨걸고 담넘어서 계엄해제하는데 간사하게 양쪽 간보다 보좌관인지 누가 담넘어서라도 가야되는거 아니냐구 하니까 ""시끄러임마"".. 라는 희대의 짤까지 남긴 놈 ㅎㅎ + 명태균 녹취록에 의하면 지 성상납 문제 김명신이랑 딜한거 같은 정황나왔잖아 ㅎㅎ 글구 실제로 김명신 디올백 무혐의 준 검새 = 이준석 성상납 무혐의 준 검새 = 김승호 부장검사(형사 1부) 동일인임 ㅎㅎ",True,1,2024-12-15T11:41:50+0900,845620767239438552,814,60,27
kyoc****,,,False,1,2024-12-15T11:43:45+0900,845620891189510360,0,0,4
didi****,29g9y,못된것부터 배운 젊치인은 사양한다.,True,1,2024-12-15T11:46:18+0900,845621055773999189,308,31,6
nach****,26rb6,"큰정치를해야할 사람이 고작 한다는 말이 저 따위 밖에 없나
네녀석도 윤석열정부 수립 1등공신이었음을 똑똑히 기억한다",True,1,2024-12-15T11:41:40+0900,845620756485243067,195,10,1
suth****,1S6qt,한숨돌리는거같니??출마가아니라 출석하고 명태균옆방으로들어가야자 어딜나가니,True,1,2024-12-15T11:49:54+0900,845621287232471310,131,4,3
redb****,1lqS0,이준석 니가 윤석열을 뽑아야한다고 떠들고 다닌것 같은데? 격이 다른 후보라고,True,1,2024-12-15T11:46:12+0900,845621048761122887,56,3,0
sy78****,2oY8l,국회 담장도 안넘은 비겁한 젊은놈. 계엄군 막는 시늉만한놈. 계어해제표결도 안한놈.,True,1,2024-12-15T12:23:53+0900,845623476290060529,57,5,0
alfm****,8w7Br,"아무리 그래도 꼴 좋다가 뭐냐.
인간성 간신같아.",True,1,2024-12-15T12:03:36+0900,845622170502561966,37,2,1
pooy****,YcpC,"이 사태의 빌미를 제공헜다는 죄책감은 없냐...? 너의 선동에 넘어간 철없는 MZ 사내놈들만 아니었어도 이런 소란은 없었을 거다. 넌 굥이 이 정도일 줄은 몰랐다고 변명하지만, 대선 기간동안 그렇게 겪고도 몰랐다면 너도 정상은 아니겠지. 암튼 이제는 좀 책임을 지지 그러냐?",True,1,2024-12-15T14:25:32+0900,845631313749737634,31,3,1
omcr****,4wt6,갈수록  가관입니다 .  조사받고   감옥 가야지요 .,True,1,2024-12-15T12:05:38+0900,845622300945416364,27,3,0
jung****,1Ly8h,"명태균 관련 이준석도 터질내용 적지 않다는데 대선출마로 뭐 피해보겠다 이건가? 명태균이 녹취에도 나오잖아. 윤상현 사법리스크도 윤석열 선대위원장 직책맡으며 감옥갈거 무죄로 뒤집히고 덮여졌다고..
개고기를 양고기로 속여 팔아먹은 사기꾼이었으면서 이제 본인이 직접 선수로 뛰겠다고?? 그러던가..",True,1,2024-12-15T11:41:16+0900,845620731302641755,23,1,0
mefo****,2kh81,너랑 한동훈이랑 나와서 개싸움하면 재미는 있겠다만.  격은 너무 떨어질거 같네,True,1,2024-12-15T11:46:35+0900,845621074111496367,21,2,3
dhks****,2b6Kh,놀고 있네 못된것만 배워가지고 원 정신 차려라 팔량개비처럼 가벼운 네가 감히?,True,1,2024-12-15T11:59:24+0900,845621899785404524,19,2,0
fish****,14B5P,쫄아서 계엄령 떨어진 날 국회 담도 못 넘은게 무슨...,True,1,2024-12-15T12:49:15+0900,845625110541893701,18,1,0
qwer****,e0asN,아직도 반성 없는 윤석열이 이거 완전 4차원 세계에서 살고 있다. 이준석도 책임 있다. 이준석도 윤석열이 대통령 한 거에 대해서 자유로울 수 없다. 이준석도 반성부터 해라.,True,1,2024-12-15T11:35:53+0900,845620383812944113,14,0,0
mott****,qVpQ,"국회 앞에서 쑈하는 넌 안돼! 담장은 넘을 줄 알아야 통 자격 있지,",True,1,2024-12-15T13:30:46+0900,845627785350217929,15,2,0
gmlh****,1tMWJ,"에고 애는 정치를 입으로 하고 행동은 삼류로 하고
국민에게 용서를 구해도 모자르는 현실을 전혀 모르는군",True,1,2024-12-15T13:30:02+0900,845627738910883848,14,1,0
lake****,3IiK3,너도 윤석열 찍어달라고 같이 선거운동하고 다니더니 꼴 좋다~ 너눈 잘난 척 안했냐,True,1,2024-12-15T11:59:51+0900,845621928642216182,13,0,1
kdww****,bD7bB,좋아하지는  않지만  싫어 하지도  않는데   너무   나대는건  보기 좋지 않은듯    어떤  말이던  지금은  자제해야 될때     가만 있어도     사람들이   불러  세울때가  있는데  ㅎㅎ,True,1,2024-12-15T12:30:08+0900,845623879345897502,13,1,0
plai****,eKwII,또 사기치려구? 개장사나 해라...월담 안하고 경찰한테 호통쇼???,True,1,2024-12-15T13:56:13+0900,845629425591517240,12,0,0
hjh8****,36V4V,자격이 됩니까?  명태균게이트  아직 해결되지 않았을텐데,True,1,2024-12-15T14:42:41+0900,845632418730737843,11,1,0
4219****,,,False,1,2024-12-15T12:38:42+0900,845624430779433160,0,0,0
yooy****,1SZJd,"준석아 니가 잠시 야권으로 쫒겨와서 탄핵대열에 동참하긴 했지만 너의 원죄는 사라지지 않아 벌써 갈리치기,너의 저열한 이대남녀 갈라치기 등을 결코 망각하지 않는다 대선 나오겠다고..헐 정신차려라 갈라치기대왕아",True,1,2024-12-15T12:11:50+0900,845622700276711660,10,0,0
star****,6Q1mC,시끄러워 임마,True,1,2024-12-15T22:09:17+0900,845661190750208106,10,1,0
tjsd****,2A29i,어린놈이  썩은개고기 팔때부터 알아봤다!!꺼지고 명태균게이트중심 당장 수사받아라,True,1,2024-12-15T22:00:56+0900,845660653308870955,9,0,0
duni****,uOB5,"이준석 본인이 안될거 알면서 나오는거임. 대선후보로 나와서 본인 인지도 넓히기 기회용이고,  막판에 단일화 카드 쓰면서 , 명태균하고 엮인거 딜해볼 심산도 있을거임.  펨코에서 이미 몇주전부터  기존 남여 갈리치기 수법 부활했고,  이재명까지 움직임도 포착된지 오래임.  정치 못돼게 배우고, 윤석열 올릴때 무슨 방법 썼는지  국민들은 잊으면 안됨",True,1,2024-12-15T12:51:40+0900,845625266972655817,9,1,1
cogp****,2GcIJ,이준석이가 윤석렬 지원유세 한 걸 기억하고 있다...넌 안 돼..솔직히 윤석렬 대통 만든 공신이면서 이제와서 아닌척?? 양심이 없네????,True,1,2024-12-15T12:55:32+0900,845625515443224744,8,0,0
free****,3mFuq,준석아 너 똑똑한건 인정한다.하지만 너한텐 겸손이 좀 필요하다.우선 장가부터 가라 그리고 아이를 낳고 정상적인 가정을 꾸려라.이제 평범하지 못한 삶을 사는것들이 대통령되는일은 없어야 할것이다!!,True,1,2024-12-15T13:12:02+0900,845626579252936719,8,1,1
ajin****,465mA,이준석 비상계엄때 담도 안넘고 쇼한 주제에,True,1,2024-12-15T21:30:51+0900,845658714701562139,7,0,0
ntae****,3713m,그냥 넌 젊은 윤석열이야 같이 손잡고 좋아 빠르게 가자고 외칠땐 언제고 나쁜것만 배워 가지고,True,1,2024-12-15T12:57:30+0900,845625642429972638,7,0,0
yuri****,NtRZ,"ㅋㅋㅋㅋㅋ
대선?
명태균 게이트 이제 시작이다",True,1,2024-12-15T11:54:00+0900,845621551691726849,7,0,0
aswq****,4zoXQ,"이준석은 입때문에 망한다.
 어릴때부터 정치권 들어와 신선함도 없구 애늙은이 이미지가 강하고 입이 느무 가볍고 경박스러워.
 지식인척 하는것도 웃긴다. 한동훈 이준석 말투나 행동거지보면 도찐개찐",True,1,2024-12-15T20:05:51+0900,845653239037690125,7,1,0
pmy1****,12ghc,이사람이 대선에 나올 깜냥이 되나. 너무 오바하네,True,1,2024-12-16T02:45:47+0900,845679004227731523,6,0,0
step****,1nri8,개고기를 양고기로 속여 판 자가 대선후보?넌 진짜 답없는 어린 양아치에 불과한 놈이다.진짜..,True,1,2024-12-16T00:09:52+0900,845668958903206084,6,0,0
mska****,2cGi04,준석아  니 누가찍어주겠냐  맘이삐뜰어서,True,1,2024-12-16T00:08:21+0900,845668861310140502,6,0,0
wnsg****,1iXgI,너도 인성이 덜되었어   초등학교 인성수업부터  다시 받아야되,True,1,2024-12-15T21:20:32+0900,845658049635942592,6,0,0
bin9****,s76u,"인마 억수로 뻔뻔한 놈이네, 명태균이 하고 싸바싸바한 놈아이가…인마는 어린 놈이 정치를 꼬롬하게 배웠네, 대가를 지불하는 삶을 치열하게 증명해봐라, 국민을 위한 대가!",True,1,2024-12-15T18:04:35+0900,845645426039193765,6,0,0
elte****,,,False,1,2024-12-15T17:18:47+0900,845642476017418451,0,0,0
tldm****,7CWr3,준석아 시끄러 인마,True,1,2024-12-15T16:25:28+0900,845639040815333529,6,0,0
jang****,RPCJ,이분 진짜 이번에 보니 별로임.. 똑같음,True,1,2024-12-15T18:18:56+0900,845646350782562560,6,1,0
namj****,bFuvf,에고. 대선...개나 소나... 당신은 안됩니다,True,1,2024-12-15T11:53:09+0900,845621496595349547,6,1,0
mini****,6nlyK,준석아 명태균없이 되겠어? ㅋㅋㅋㅋ 면회가서 상담받게? 누가 찍어준다고 어딜 나온다고?,True,1,2024-12-16T03:55:15+0900,845683479650762763,5,0,0
obak****,1Uclb,까분다  주디로만 할수 있는게 아니다  니는 인간이 먼저 되야지 마늘 더먹고 와라,True,1,2024-12-16T00:10:48+0900,845669018999193790,5,0,0
ejr3****,JaV7,"니 딴엔 체급을 키우고 싶은 모양인데, 김대중 노무현 문재인은 어려움을 겪고, 어려운 사람들을 보듬으며 어려운 길을 걸어온 분들이다. 넌 봉사정신이 없기에 국민들 대다수의 마음을 얻을 수 없어. 딱 국짐당에 어울려!",True,1,2024-12-15T23:56:31+0900,845668099171549333,5,0,0
rham****,1NWkl,언론들 이준석 밀어주기로 말 맞췄나본데 국민 수준 우습게 보지 마라.,True,1,2024-12-15T23:15:44+0900,845665471339430109,5,0,0
mj95****,6zU5q,아마 널 뽑을 일은 없을듯,True,1,2024-12-15T17:06:13+0900,845641665761771578,5,0,0
kky2****,Qnuf,석열이 만든자가 이놈이에요,True,1,2024-12-15T14:36:25+0900,845632014886371450,5,0,0
blue****,JllL,명태가 깜방에 있는데 그냥 파던 코나 계속 파지~,True,1,2024-12-15T14:12:15+0900,845630458027835456,5,0,0
cho4****,,,False,1,2024-12-15T12:55:01+0900,845625482475995145,0,0,0
nant****,1k8Ed,예전같으면 콧방귀를 뀔텐데. 윤 당선되는 걸 본 후로는 또 어떤 세력들이 좋다고 뽑아줄까봐 너무 무섭다…,True,1,2024-12-15T12:48:30+0900,845625062290620558,5,0,0
litt****,1JXN2,니가 그놈 도와줬자나 기회주의자,True,1,2024-12-15T12:23:21+0900,845623442517524592,5,0,0
lwj2****,hini,너도 수사 대상이야,True,1,2024-12-15T11:49:37+0900,845621268693647518,5,0,0
pass****,8CTZc,누가 뽑아준대?,True,1,2024-12-15T23:11:21+0900,845665189331206240,6,2,0
suls****,,,False,1,2024-12-15T22:38:58+0900,845663103470272816,0,0,0
leek****,4iBib,준석아 니도 윤석열 당선에 지분이 있다는걸 알아라 '찍고나서 이놈은 대통령감이 아니었어요. 울던놈이 야부리 털면 안되지?' 너도 인간을 가장한 벌레라는거 알았으니 관심없다~,True,1,2024-12-15T17:57:45+0900,845644986090258654,5,1,0
skm2****,27mKU,준석아 아직은 아니다   더 성숙하고 더 내공을 키운 후에 먼저 인간이 된 후에  입맛을 다셔라,True,1,2024-12-15T15:51:08+0900,845636828672294957,5,1,0
hunt****,Ly9n,준석이도 이제 명태균게이트로 조사받고 구속돼야지???ㅋㅋ,True,1,2024-12-15T13:36:11+0900,845628134450528298,5,1,0
kepc****,9Un9m,너같은 애들은 절대 안된다. 천불사나 가서 홍매화나 심어라. 명태균이랑도 놀고. 곧 너도 수사받을거다. 참 재수없는 인간,True,1,2024-12-15T13:35:30+0900,845628090779435159,5,1,0
butt****,YdET,담도 못넘은 두제에,True,1,2024-12-16T00:14:04+0900,845669230157234198,4,0,0
yban****,2Um81,"이준석, 안철수는 윤석열 당선의 1등 공신이지. 윤석열에게 팽당해서 고소하다 싶겠지만 괴물 대통령을 탄생시킨 죄과가 작지 않아.",True,1,2024-12-16T00:14:01+0900,845669226868899846,4,0,0
daha****,z7Kf,명태가 동태라서 조용하지~! 황태가 될 즘이면 니 꼴도 좋을것 같다. 개혀나 열심히 팔아라~!!,True,1,2024-12-15T23:39:12+0900,845666983302135869,4,0,0
qqop****,wjGq,끄지라 주디만살고 담도 못넘는 졸보야,True,1,2024-12-15T22:44:06+0900,845663433964650547,4,0,1
sdj1****,,,False,1,2024-12-15T22:20:43+0900,845661926934446276,0,0,0
cuck****,2H08O,니가 좀 죽기전꺼지 쳐 마자 봐야겠지?,True,1,2024-12-15T20:49:55+0900,845656077558087959,4,0,0
akju****,3qQTJ,시끄러 임마!,True,1,2024-12-15T20:25:50+0900,845654526118592766,4,0,0
getg****,1k0aK,미친거 아니냐..ㅋㅋㅋㅋ 쇼준석 쇼 펼치더니만 대권 나온다고..ㅋㅋ 동탄의 일부 팬들만 뽑을듯,True,1,2024-12-15T16:01:00+0900,845637464881102852,4,0,0
goto****,4YGT9,니가만든놈 데리고 너두꺼져라,True,1,2024-12-15T15:33:53+0900,845635717433393388,4,0,0
bbam****,,,False,1,2024-12-15T14:53:47+0900,845633134245445851,0,0,1
62le****,1RQHy,쪼무래기에 싹아지 넌 사람부터 되거라,True,1,2024-12-15T14:39:42+0900,845632226228961472,4,0,0
kenj****,,,False,1,2024-12-15T14:33:07+0900,845631802084163624,0,0,0
djbh****,,,False,1,2024-12-15T14:18:16+0900,845630845833183310,0,0,0
bjb7****,,,False,1,2024-12-15T14:11:24+0900,845630403602546797,0,0,0
khy7****,4drzg,"말하는거 행동하는거 정치인으로 기본이 안되있는 
인성이 젤 문제",True,1,2024-12-15T14:05:00+0900,845629990832701441,4,0,0
pipe****,1ObAf,ㅋㅋㅋㅋㅋ 윤석열 당선에 일등 공신이잖아? ㅋㅋㅋㅋㅋㅋㅋㅋㅋㅋㅋㅋㅋㅋㅋㅋ,True,1,2024-12-15T14:02:25+0900,845629824654377060,4,0,0
rosa****,1Jbkq,니가 만든 대통령이잖아. 운명공동체로 가야지. 명씨랑 새벽에 나무 심은 주제에...,True,1,2024-12-15T13:54:31+0900,845629316086628499,4,0,0
ja71****,2jdfR,"이번내란사태겪으면서
진정한정치인이누군지알게됐네요..
당신은좀더
자라야할듯..",True,1,2024-12-15T13:51:28+0900,845629118904008823,4,0,0
cast****,2HfD4,지가 만들어놓고 무슨?,True,1,2024-12-15T13:40:57+0900,845628441742016791,4,0,0
bulp****,35gcP,대선?? ㅎㅎ진짜 얘는 지 주제를 모르나보네,True,1,2024-12-15T13:18:40+0900,845627006467965126,4,0,0
sysg****,BKfZ,저 놈 참 뻔뻔하네 ㅋ,True,1,2024-12-15T12:40:31+0900,845624548387717252,4,0,0
psj2****,2cGJia,주접을 떠네ㅋㅋㅋㅋㅋ검찰이 나가래?,True,1,2024-12-15T12:14:12+0900,845622852479615030,4,0,0
jami****,l37N,너도 똑같아. 너도 너 잘난줄알잖아~,True,1,2024-12-15T12:08:11+0900,845622465093697594,4,0,0
chal****,8qWQ0,오바하지마라,True,1,2024-12-15T12:01:14+0900,845622017762787420,4,0,0
mayb****,1RnCB,그냥 카메라 들고 정문에서 욕이나 하고 서 있어라.,True,1,2024-12-15T11:52:08+0900,845621430727999523,4,0,0
jyje****,,,False,1,2024-12-15T17:57:47+0900,845644988053192951,0,0,0
soly****,231u8,"이번 계엄때도 70살 가까운 의원들도 담넘어 들어가는데 혼자 쇼만하던 쇼쟁이..너 뒤에서"" 대표님 담넘는거 어때여? ""이러니까 ""시끄러 임마"" 하는거 다 찍혔어ㅋㅋ",True,1,2024-12-15T15:06:12+0900,845633934283767853,4,1,0
ejr3****,JaV7,국민들을 개돼지로 보냐! 이준석. 넌 국짐당 태생이지. 올바른 사람이었으면 애시당초에 그쪽 동네에 기웃대자도 않았어. 이제와서 난 아니야 하는 건 어디서 배웠냐?,True,1,2024-12-15T13:55:47+0900,845629397221245123,4,1,0
art2****,NA3h,니꼴은 좋냐? 꼴갑한다.,True,1,2024-12-15T12:49:49+0900,845625147720204526,4,1,0
jeda****,1b57r,조용히 있으면 중간은 갈텐데! 국회정문에서 했던쇼는 잘봤는데 대통령감은 안되는거같다! 좀더 신뢰를 쌓을수 있는 방법을 찾아봐! 쇼할생각하지말고! 진심을 보여보라고!,True,1,2024-12-16T09:18:14+0900,845704287106367562,3,0,0
jaem****,9ZIuP,ㅋㅋㅋㅋㅋ 당대표시절 명태균 여론조작 다 알고있었으면서 스을쩍? 넘어가네 ㅋㅋㅋㅋ,True,1,2024-12-16T07:22:31+0900,845696832133660747,3,0,0
kbjp****,2bjp7,명태균 게이트 수사나 받고 하자 준스가 ㅋㅋ,True,1,2024-12-16T00:11:36+0900,845669070773682326,3,0,0
jbs4****,1fsjX,그런다고 명씨에서 자유로울까 ? ㅡ,True,1,2024-12-16T00:08:58+0900,845668901827117296,3,0,0
oh38****,1NTAP,너도 미치광이를 대통령 만드는데 일조했잖어. 일단 손가락 하나정도는 자르고 나대자,True,1,2024-12-16T00:03:51+0900,845668572020605135,3,0,0
tov0****,4vRCJ,"사내놈이 가벼워도 너무 가벼워
넌 정치인 이잔어 ,,나같은 일반 국민이 꼴~~~조~~옿~~네 해야지",True,1,2024-12-16T00:00:59+0900,845668386917581026,3,0,0
pwld****,n8e1,"준석아 참아
 아무리 사람이 싫다 해도 남에 불행이 너의 행복은 아니다
인생사 다 굴곡이 있다
그리하여 아직 넌 어리다
누가 널 선택하냐 
밥 더~~ 먹고 인생 공부 더 하고 도전해라",True,1,2024-12-15T23:56:23+0900,845668090598391919,3,0,0
tjqt****,5QVQX,열려라! 명태균 게이트,True,1,2024-12-15T23:53:13+0900,845667886503559228,3,0,0
sjmd****,1mJ4k,명태 때문에 니 놈은 끝난겨. 어린 놈이 쇼맨십만 늘어가지고 되것냐?,True,1,2024-12-15T23:48:05+0900,845667555572973593,3,0,0
good****,3O1rK,어이 윤석열 일등공신 시끄러임마,True,1,2024-12-15T23:03:42+0900,845664696466931948,3,0,0
tulb****,2akmw,bbc에서 왜 계엄해제표결 참여 안했나도 좀 물어보지,True,1,2024-12-15T22:49:09+0900,845663758687666228,3,0,0
pyjs****,28rSZ,급떨어진다,True,1,2024-12-15T22:45:43+0900,845663538553815243,3,0,0
y987****,2ylhd,시끄러임마 너 명태균게이트 한가운데 있잖아 수사받아야지,True,1,2024-12-15T22:22:50+0900,845662063886860554,3,0,0
lees****,25TJt,젊은보수가 필요해,True,1,2024-12-15T22:15:54+0900,845661616992157961,3,0,0
sh11****,2ozpA,양두구육. ㅋㅋㅋ  못돤것만 배워서 ㅋㅋㅋ 명태가  가만 안있을텐데  ㅋㅋㅋ,True,1,2024-12-15T22:03:14+0900,845660801200029779,3,0,0
sts7****,2p1xv,개고기 장사꾼은 자중해라,True,1,2024-12-15T21:56:03+0900,845660338132090892,3,0,0
thek****,2JBoA,준석아 너 다음 총선에 뱃지나 달수있을지 모르겠는데 무슨 대선이냐,True,1,2024-12-15T21:13:08+0900,845657573733433395,3,0,0
leei****,54AoU,넌 조금더 경력과  인격좀 다스리고,True,1,2024-12-15T20:56:38+0900,845656510880022730,3,0,0
fayn****,1p674,"??? : 대통령 바꿨더니 국격이 올라간거 같다.

다음 번 절에 가면 무슨 나무 심을지 궁금허네...",True,1,2024-12-15T20:41:45+0900,845655551542034654,3,0,0
hjdo****,afGp9,꿈    깨~~~~,True,1,2024-12-15T18:59:35+0900,845648969018114203,3,0,0
toic****,28RrF,쭌석이 답다 ㅎㅎㅎ 명태균이 수사결과 나오면 한가하지 않을텐데.. 밤중인지 새벽인지 홍매화는 왜 심었는지…,True,1,2024-12-15T17:13:23+0900,845642127638528119,3,0,0
lss3****,5Vyxy,ㅋㅋ 멍청한놈이 윤석열 죽이면 너는 무사할줄아냐? 방패가 없어졌는데,True,1,2024-12-15T16:13:41+0900,845638281377874114,3,0,0
ryu7****,2QYwq,니꼴도 곧 좋게될꺼야~,True,1,2024-12-15T16:12:09+0900,845638183214383152,3,0,0
kps2****,2wXbe,현역미필(장애등으로 인한 면제 제외) 대통령 출마 제한 줘야함,True,1,2024-12-15T16:04:00+0900,845637658053967878,3,0,0
wjca****,aCfVg,"양두구육 이준석, 명태균의 황금폰이 폭로되는  순간, 너의 정치생명도 끝이다",True,1,2024-12-15T15:50:03+0900,845636759315283987,3,0,0
83so****,3F9e,하버드출신 개고기장사 ㅎㅎㅎ,True,1,2024-12-15T15:31:36+0900,845635569995219103,3,0,0
namz****,1XFDZ,너도 같은 놈이잖아 조금 어린 윤석녈,True,1,2024-12-15T15:28:51+0900,845635392660046081,3,0,0
seao****,dBn5,ㅋㅋㅋ 명태국 시원하게 한사발 하자 준스가~~~~~~성접대도 좀 더 받고~~~~~~,True,1,2024-12-15T15:26:38+0900,845635250036932780,3,0,0
kira****,,,False,1,2024-12-15T14:59:16+0900,845633487657500740,0,0,0
ktx7****,21mV6,"새벽 4시에 홍매화 심었으니, 나오면 되는 줄로 아는 모양. 제발 , 무속으로 정치하려는 넘들. 떨어져라. 질린다. 나라가 무당 점쟁이들 통치하는 곳이냐 !!",True,1,2024-12-15T14:56:48+0900,845633327971958994,3,0,0
kky2****,Qnuf,이대남들 선동해서 이재명공격하던 이준석이 윤석열 내란 반란군자를 만들었어요,True,1,2024-12-15T14:37:58+0900,845632114610143475,3,0,0
spoo****,30jLF,양두구육의 수괴  이준석,True,1,2024-12-15T14:27:23+0900,845631432935080035,3,0,2
kkky****,5Ttj1,국민의 민심도 못읽는 니가? 🐕 가 웃것다,True,1,2024-12-15T14:24:25+0900,845631241825812574,3,0,0
bjle****,1oaKe,얘는 명태게이트 핵심피의자 아닌가? 왜 나서서 깝치지?변호사나 알아봐,True,1,2024-12-15T14:13:11+0900,845630518727802922,3,0,0
hans****,,,False,1,2024-12-15T14:10:50+0900,845630366860443878,0,0,0
fort****,,,False,1,2024-12-15T14:07:13+0900,845630133388705852,0,0,0
tele****,1aggd,지나가는 개가 웃겠다 개고기를 양고기로 판 인간아,True,1,2024-12-15T14:04:23+0900,845629951154585702,3,0,0
jiye****,6cZEF,명태균 아저씨 옆에 자신의 편인 변호사를 심어두니까 예전 김 변호사가 방송에 나와서 다 깔 때보다는 마음이 편한가보다 이렇게 뻘소리를 하고 있는거 보니까....대한민국 국민이 어떤 민족인지 이번에 확인하고도 저런 소리를 방송에 나와서 하고 싶을까? 그럼 그동안 떳떳하고 당당하게 살았어야지! 당신이란 사람에 대해 잘 몰랐던 나도 당신이 하는 짓들을 보고 당신에 대해 알게 됐고 느꼈다!!!! 넌 아니야!!! 시끄러 임마!!! 이걸로 당신의 정치 인생은 끝이다! 정신차려 임마!,True,1,2024-12-15T13:55:21+0900,845629369387843681,3,0,0
jmyh****,21nSS,이노마 본색을 드러 내는군.명태균 수사 좁혀오니까 대선출마 운운하네.김건희 특검 반대하면서 수사대상에 넌 이미  올라와 있다.대통후보 수사하면 정치탄압.정적제거 운운하며 수사 안받을려는 꼼수.국민이 바보로 보이냐?,True,1,2024-12-15T13:51:04+0900,845629093469749258,3,0,0
godm****,3x5ZT,"전형적인 기회주의자 이준석. . .  윤석열이 이런 놈인걸 다 알면서 자기 정치적 이득때문에 다 무시하고 윤석열을 대통령 만들기위해 개장수를 자처 했던 이준석.  이후 윤석열에게 팽당하고나서 탄핵정국에는 지가 마치 정의로운 척, 윤석열 비판에 누구보다 앞장섰지만 ㅋㅋ 이게 다 국민과 국가을 위해서일까??ㅋㅋ 아니지 너같은 기회주의자는 지가 최우선이라 나라, 국민 이딴거 후순위지...  너가 대통력이 된다면 남녀갈등, 계층갈등 등등 사회갈등을 조장하여 정치적 이득만 얻을 것이기 때문에 너같은 건 대통령이라는 막중한 자리에 있으면 안됨",True,1,2024-12-15T13:46:42+0900,845628811981619388,3,0,0
imhe****,7voWL,"욕심만 많은 이준석, 명태균 황금폰과 함께 몰락하리라 본다. 김건희 범죄자를 두둔한 이준석, 섞은 양심과 잔머리만 있는 얄팍한 인간일 뿐",True,1,2024-12-15T13:35:32+0900,845628092792701090,3,0,0
bipa****,,,False,1,2024-12-15T13:29:01+0900,845627672624103430,0,0,0
uley****,13jkz,넌 명태균 조사가 제대로 시작되면... 무조건 감옥인데... ㅋㅋㅋ 뭔 대선이냐??? 왜 명태균 사면 시켜줄라고??? ㅋㅋㅋ,True,1,2024-12-15T13:25:37+0900,845627453597548730,3,0,0
kimy****,3l6iZ,"개고기를 제일 앞장서서 팔았는 놈이 바로 네놈 아니냐? 이젠 덮어졌던 명태균의 황금폰얘기로 온언론이 도배할건데, 과연 살아남을 자신은 있나??",True,1,2024-12-15T13:22:12+0900,845627234101231662,3,0,0
blue****,2iA0h,시끄러 임마!!!,True,1,2024-12-15T13:20:10+0900,845627102232313901,3,0,0
airm****,ibJ6,시끄러 인마,True,1,2024-12-15T13:14:40+0900,845626748031729844,3,0,0
yoon****,cIwyG,명태황금폰만 열리면 너도 끝이다.,True,1,2024-12-15T13:13:13+0900,845626655052398668,3,0,0
jida****,10srd,시끄러 임마,True,1,2024-12-15T13:08:54+0900,845626376835825935,3,0,0
high****,2Nttl,"웃긴다 밉상이준석 너같은게 무슨 대톰령감이라고 너 국회의원된것도 명태균도움이의심되는데 엉강생심 대톰령을꿈꾼다고 니가뭘한게있는데 
카메라앞에서 쇼나잘하지 뭘했는데?!",True,1,2024-12-15T13:05:16+0900,845626143045320776,3,0,0
bjan****,Ygym,명태균하고 상의했냐?,True,1,2024-12-15T13:00:28+0900,845625833203695722,3,0,0
medi****,17uj0,너도 나쁜 놈이지. 니가 이 나라를 이렇게 만드는데 일조한 놈이니 반성이나해라. 니같은게 무슨 대권이냐. 윤씨같은 놈도 못거르는 놈이 얼마나 나라를 망치려고.,True,1,2024-12-15T12:57:46+0900,845625659676950749,3,0,0
roti****,3qzjG,시끄러워 임마,True,1,2024-12-15T12:51:17+0900,845625241806831678,3,0,0
sara****,da3PS,얘도 정신이 온전치는 않네.,True,1,2024-12-15T12:51:08+0900,845625231908274219,3,0,0
mwk0****,,,False,1,2024-12-15T12:47:39+0900,845625008335093941,0,0,0
zxc2****,1XAyD,쭌서기도 첨에 나쁘지 않다했는데 알면 알수록 기존 꼴통 정치인보다 더 한사람이더만.나이 어린 석려리라고 해야하나,True,1,2024-12-15T12:43:10+0900,845624718693236787,3,0,0
creb****,1kAWR,어디 언감생심?! 니 민낯은 이번에 완벽히 벗겨졌어. 젊은 놈이 어디 못된것만 배워서...ㅉㅉㅉ,True,1,2024-12-15T12:42:09+0900,845624653664747558,3,0,0
