user_nickname,userIdNo,comments,visible,replyLevel,regTime,parentCommentNo,sympathyCount,antipathyCount,replyAllCount
sbja****,,,False,1,2025-02-06T08:34:33+0900,850525580917997711,0,0,27
uni2****,2reFh,"공직에 있는, 아니, 윤석렬이  임명한것들이  전부 미쳐 가는군!.",True,1,2025-02-06T08:38:43+0900,850525848598479037,456,41,13
chor****,2pU4R,헌재를  없애버리라고 지령내린 김용원을 입건 부탁드립니다.,True,1,2025-02-06T08:43:59+0900,850526188353880326,345,24,7
saji****,fl0u,내돈으로 이런 반국가 세력에게 급여를 준다니 홧병으로 돌아가시겠다. 윤석열 왕권 성공했으면 이런게 완장차고 설쳤을듯.,True,1,2025-02-06T09:04:14+0900,850527493117968454,279,25,3
yoku****,2usLW,세상이 아니 극우들이 미쳐 돌아간다,True,1,2025-02-06T08:34:27+0900,850525573821235321,144,16,7
room****,4aSbh,"핵 페기물 수준의 변호사가  인권위원이라니, 윤석열은 쓰레기 수집가처럼 여기저기 쓰레기를 모아 국가기관에 심어두었네.",True,1,2025-02-06T09:04:49+0900,850527530011066621,71,1,3
wjqt****,4i4oA,와. . .윤석열이가 어디서 저런인간들만 데려다 요소요소 다 심어 박아뒀는지. . .담번 대통령 참 힘들겠다 저런것들 다 치워내고 제정신박힌 사람으로 채우려면. . 이정부들어 왜이렇게.극우들의 세력이 커졌나? 윤석열이란 절대 대통령자리에 앉으면 안되는 극우성향 인간을 앉혔기 때문이네,True,1,2025-02-06T09:04:09+0900,850527487178833970,65,2,1
sara****,xAuJ,"어떻게 저런 말 하는 사람들만 죄다 모아놨대
나라 말아먹으려고 작정하지 않고서야 ㅉㅉ",True,1,2025-02-06T08:44:55+0900,850526248986738912,50,1,0
yoon****,dyXdp,"저렇게 극단적이고 폭력적인 언행 하는데 인권위 상임위원이라고? 아무리 고위직이 좋아도 최소한의 적성에 맞는 일을 해라 좀.. 민주주의 싫어하는 민주주의 국가 대통령, 헌재 때려부순다는 인권위 상임위원, 국회 해산권 대통령 주자는 국회의원ㅜㅜ",True,1,2025-02-06T08:39:33+0900,850525902335901823,42,2,0
jeki****,3bCdo,"법을 무시하는 자들이 인권위라니..참나...인상들도 더럽다,,저 나이에 인상은 그 내면을 보여준다던데...",True,1,2025-02-06T09:31:10+0900,850529228016320562,35,0,0
muri****,5weyb,윤돼지 인사들이 어떤인식을 갖은사람들인지 놀라움을떠나 두렵기까지하다..비정상인사람들이 정부요직들에배치돼 사회혼란야기하는 암약하는 간첩들같다..무섭다,True,1,2025-02-06T12:33:05+0900,850540947824443422,27,1,0
dkap****,,,False,1,2025-02-06T09:26:05+0900,850528900105633830,0,0,0
imoo****,B9R5,요즘 새삼 매일 놀라고 있다. 우리나라에 이런 미친생각을 가지고 있는 사람이 꽤 있다는것에...,True,1,2025-02-06T09:40:27+0900,850529825637531825,22,0,0
sm40****,1ZVBY,김용원이 점마 코를 보면 주먹으로 완전히 눌려주고 싶은 생각이 나만 드나? 사람을 사람으로 대접하고 인권을 저런 짐슴보다 못한 것이 무슨 인권위원. 이러니 나라 꼬라지가 이모양이지,True,1,2025-02-06T09:03:20+0900,850527435152687201,22,1,0
lokh****,3sbKW,이런 정신병자 놈들이 고위직에 있으니 사회가 잘돌아가겠냐! 같이 사형시켜라.,True,1,2025-02-06T14:48:33+0900,850549675114103007,16,1,0
dipp****,5FoD5,서울법대 출신이나 되는 사람이 때려부수는 행위가 범죄행위인 걸  모르나.  저런 분이 국가인권위원? 대한민국  망조다. ㅠㅠ,True,1,2025-02-06T12:16:52+0900,850539902922654050,15,0,1
wnsd****,1j30Q,하디하다 헌법재판소가 내란수괴 탄핵시킨다고 그걸 부숴서 없애자고 선동하는게 한 나라의 인권위원장? 이게 반국가세력이야 능지박살난 놈들아;,True,1,2025-02-07T00:18:17+0900,850586380642811986,15,1,0
sang****,,,False,1,2025-02-06T08:49:32+0900,850526545373036692,0,0,0
luck****,,,False,1,2025-02-06T10:27:08+0900,850532833960132667,0,0,0
wons****,1puu2,윤석열은 저런 폐급들만 그것도 인권위에 넣었다니 지 수준에 딱 맞다.,True,1,2025-02-06T09:47:13+0900,850530261811593292,13,1,0
hots****,q5aI,"참 나라꼴 잘 돌아가네요..
차관급이라는 고위공직자가 어찌 저런 쓰레기 언행을 할수있지요.
저런 사람을 피같은 혈세로 먹여살리고 있으니 기가 막히네요
이 정권은 어찌도 저리 하나같이 상식을 벗어난 사람들 뿐이니 대통령이란 작자가 탄핵당하고 콩밥먹고있겠지만요  좌우지간에 현재 정상적인 나라는 아닙니다..몇몇 쓰레기 패거리들이 위대한 대한민국을 요모양요꼴로 만들어놓고 사리사욕 채울려고 발악하고 선동하며 이판사판으로 행동 하네요.
천불이나고 원통해요..",True,1,2025-02-06T09:36:15+0900,850529555172032607,13,1,0
kbbo****,2sWvi,인권위에 있다는 사람이 이런생각을 가지고 있다니...  나라가 엉망으로 돌아간 이유가 잘~ 보인다,True,1,2025-02-06T09:32:10+0900,850529292491161648,12,0,0
papa****,3oBz0,내란범 탄핵 막겠다고 헌법 기관을 부순다니... 정신 나갔냐,True,1,2025-02-07T00:08:06+0900,850585723596701729,12,1,0
lck5****,1dFKB,"권영세, 권성동, 김용원, 이진숙, 김문수, 전한길, 전광훈 등등 참 몽타주 자체가 범죄자 같은 건 그냥 내생각?",True,1,2025-02-06T14:50:35+0900,850549806815248641,12,1,0
seon****,,,False,1,2025-02-06T14:22:07+0900,850547972394450991,0,0,1
chrr****,2HDIG,이런 것들이 우리가 낸 세금으로 살아가고 있다,True,1,2025-02-06T08:55:50+0900,850526952254079165,11,0,0
hees****,2bTjcm,민간인이 아닌 공직자가 헌법기관을 부셔야 한다는 건 해임사유다. 즉시 해임하고 형사처벌을 검토해라.,True,1,2025-02-06T15:01:56+0900,850550537093906849,10,0,0
bing****,VXth,와 저런 사람만 모아놓은 정부가 대단하다. 무법주의가 법치주의를 사칭하다. 고결해야한 재판부와 법치주의를 걸레짝으로 만들고 있다,True,1,2025-02-06T10:05:20+0900,850531429237391479,10,0,0
icde****,r8GP,국가 인권위원회에 저런 사람이 있다는거에 경악을 금치 못하겠다. 저런 자들을 곳곳에 꽂아놨으니 탄핵을 할 수 밖에 없었지. 공직 내려놓고 길거리가서 선동을 하던~ 무료변론을 하시던 맘대로 하시길.,True,1,2025-02-06T09:59:36+0900,850531060356743397,10,0,0
jpmu****,2foeu,윤석열이가 잘한 일 딱한가지는 저런 쓰레기를 분리수거하기 좋게 모아놓은거다.,True,1,2025-02-06T09:31:11+0900,850529229408829506,10,0,0
spac****,,,False,1,2025-02-06T11:06:12+0900,850535350743859286,0,0,0
kes0****,3Bkho,이런자가 국가인권위원장이니 국민의 인권이 보호되겠나? 대한민국 역사상 이런 무모한 정권은 없었다. 최악이다.,True,1,2025-02-06T10:26:00+0900,850532760610144265,10,1,0
zzag****,KNGS,헌재를 부정하면 헌법도 부정하겠다는거 아닌가... 이참에 저런 사람들 죄다 뿌리 뽑아야함,True,1,2025-02-06T09:27:28+0900,850528989477863594,10,1,0
ells****,2xGcT,"윤석열  정부가  다 부패했나?
아니면 윤석열  본인처럼
부패한 자들만 골라 임명해서 그런가?
다들 왜  이 모양인지... 이런 자에게 월급 주는
국민의 세금이 진정 아깝다.",True,1,2025-02-06T13:15:00+0900,850543648268353541,9,0,0
mxb1****,4unWc,인권위 있다고 인권변호사 흉내내고 있네. 겸직 금지니까 내려놓고 변호해 국민세금으로  따뜻한 밥 처먹지 말고,True,1,2025-02-06T12:38:37+0900,850541304726159636,9,0,0
kdhu****,dw5JO,법질서를 파괴목적으로 선동하는 자들은 엄중 처벌해야 한다..법알기늘 식은죽 먹듯이 위반자가 너무 심하다,True,1,2025-02-06T12:35:33+0900,850541107325436132,9,0,1
outc****,1Lg31,저런것들을 인권위에.......에라이....이게 나라냐?? 인권위라는게 제일 인권을 안지키는넘들 임명해가지고.....이러니 탄핵당하지.....,True,1,2025-02-06T11:20:46+0900,850536288892223786,9,0,0
u726****,33Qlc,생긴거 봐라 저런놈이 무슨 국가인권위원회 상임위원???? 저런놈이 있으니 국가인권이 없는는다 진짜 윤석열 정부는 안썩은데가 없구나,True,1,2025-02-06T10:33:51+0900,850533266141217140,9,0,0
kgtn****,2QnOC,헌법재판소를 부순다고.... 정신 나간 놈 아냐? 이런 자가 인권위 위원이라니...당장 그 자리에서 내려와라~~~~~,True,1,2025-02-06T09:42:30+0900,850529958328533170,9,0,0
cand****,81DLv,법위에 인권위가 있냐? 저런 사람이 인권위에 있다니...,True,1,2025-02-06T09:26:17+0900,850528913930059877,9,0,0
sura****,1AMMe,대통령이 C급이다 보니 자기보다 잘난 인물들은 철저하게 배척하고 D급이나 F급만 고르고 골라서 중용하다보니 정신병자 천지다,True,1,2025-02-06T15:28:39+0900,850552259275129114,9,1,0
pbn9****,2ak73,저런 법과 사회질서를 위협하는 인물을 인권위원으로 앉히고  국가 요직에 능력도 안되는 극우들과 검사출신들만 임명하니 탄핵을 해서라도 막으려는것이다!! 문제의 출발점이 어디에 있는지 좀 알고 떠들어라!!,True,1,2025-02-06T14:14:35+0900,850547487331582186,9,1,0
ljg0****,5mz1p,생긴게 악마를 보는듯함,True,1,2025-02-06T14:08:08+0900,850547071759941687,9,1,0
choc****,49ZFj,인권위는 무슨.. 내란죄 선동! 김용원 파면하라!,True,1,2025-02-06T12:32:30+0900,850540910411251887,9,1,0
yoon****,1X60y,2년반동안 정부기관 곳곳에 저런 이상한 애들이 들어가서 뭔 짓을 하고 있는 건지. 앞으로도 깜깜하다.,True,1,2025-02-06T09:54:46+0900,850530748753510722,9,1,0
mixi****,,,False,1,2025-02-06T23:58:18+0900,850585092890820707,0,0,0
good****,2z0lC,"관상은 과학이다.
왜냐하면 나이 먹으면 그사람의 고나상은 그사람의 마음이 들어나기때문이다.
가끔 흉직하게 변한 사람들의 면면을 보면 답이나오더라.
잘생기고 못생기고의 문제가 아니라 인상에서 그의 마음을 읽어낼 수 있을 정도로 추악해진 사람들을 보면  관상가가 아니라 하더라도 그게 보인다.",True,1,2025-02-06T14:45:07+0900,850549453923287099,8,0,0
wyy1****,,,False,1,2025-02-06T12:31:57+0900,850540874776445251,0,0,0
vipk****,4b1mC,하나같이 생긴 꼬라지가 사람 얼굴은 아니다~!,True,1,2025-02-06T14:24:58+0900,850548156138520952,7,0,0
skk0****,2vOc6,"자유가 있기에 너희같은 동물이 살고있는게 
고맙게 생각하라 
윤씨가 행동하는게 동물들이나 하는짖이지",True,1,2025-02-06T14:13:20+0900,850547406415069336,7,0,0
wons****,3cKKE,인권위원회의 위원이란 자가 헌재를 부숴버리자는 대한민국의 법을 무시하는 발언을 하다니... 이런 자는 내 입이 더러워질까 욕도 아까운 자이다. 윤석열의 인사가 다 이러니 나라가 이 모양이다. 민주당이 탄핵을 너무 적게 했네... 윤석열이 대한민국 다 망쳤다!!!,True,1,2025-02-06T12:34:56+0900,850541066942677398,7,0,0
wind****,1Q7yh,국짐을 궤멸시켜야 하는 이유는 너무나도 명백하다. 이런 류의 인간들이 해방후 지금가지 나라를 이끌어서 이지경이 된거다. 국짐의 씨를 말려야 한반도는 번영을 누릴수 있다.,True,1,2025-02-06T12:05:17+0900,850539157041184864,7,0,0
mari****,4aBNi,관상은 과학입니다!!!,True,1,2025-02-06T11:26:02+0900,850536628043644940,7,0,0
jin1****,mfvf,"정말이지 관상은 과학인건가... 노상원, 김문수, 이진숙 등등 이런 인간들만 모으기도 정말 힘든데 이번 정권의 순기능이라면 딱 하나다. 사회 곳곳의 이런 세력들을 일거에 조기 발견 할 수 있었다는 것.",True,1,2025-02-06T10:15:56+0900,850532112070082933,7,0,0
shin****,83alV,김용원 불법적인 룸살롱에서 술 처먹다가 퇴폐업소 단속 나온 경찰관 폭행 취재하던 KBS 기자 뇌물죄로 기소했다가 옷 벗은 개 검 출신..,True,1,2025-02-06T10:13:20+0900,850531945136783514,7,0,0
love****,3DlNY,어디서 저런 것듷만 모아놨냐!! 그러니 국가가 🐕판이었지,True,1,2025-02-06T10:02:08+0900,850531222844080169,7,0,0
ultr****,4WK5e,저런것들이 인권위에서 도대체 뭔일을 하겠는가 한심한 인간들,True,1,2025-02-06T09:39:05+0900,850529737624256546,7,0,0
yhma****,ybky,저런게 인권위라니 진짜 인사 개판으로 해놨으니,True,1,2025-02-06T09:24:45+0900,850528815078703340,7,0,0
65dr****,3avZe,인권위원회에는 인권은 없고 인권 탄합만 있다. 이런 자들은 직권남용으로 모두 감옥으로 보내야 한다.,True,1,2025-02-06T08:41:20+0900,850526017729593435,7,0,0
hmch****,1MGdF,내란수괴 짝눈 멧돼지의 안목이 대단하다. 단군이래 어디서도 수집할 수 없는 저런 개 쓰레기들을 어디서 저리 수집해 앉히는지? 국민들 알기를 얼마나 개무시하면 저런 넘을 인권위원으로 앉힐 수 있겠나.,True,1,2025-02-06T17:26:53+0900,850559875829203339,8,2,0
mode****,6ba9Y,아오 저런 막말해도 그냥 냅둬야 하는건가? 진짜 개돼지들 무시했더니 너무 심하게 떠들어 대네 대책이 필요함,True,1,2025-02-07T00:47:18+0900,850588249842778175,7,1,0
lchh****,aErbW,"법이고 조지고  다 때려부수고  대한민국을 전복 시키겠다는 야긴가?무정부  상태를  만들겠다는  
  야기네  대한민국에 암약해온 불순분자네",True,1,2025-02-06T14:46:39+0900,850549552489431331,7,1,0
shsh****,aCmYY,"김용원 이것도 나중에 내란선동죄로 잡아 처 넣어야함
이 사람 뇌속엔 인권이란게 없는게 인권위원장이라니",True,1,2025-02-06T14:36:45+0900,850548914821005605,7,1,0
jbje****,2DL2J,국민이라고 말 하지말고  국힘을 지지하는 사람들이라고 해라  대한민국에는 정치하는 인간들이 옛날부터 갈라치기 한 빨간 국힘국민  파란 민주 국민  이 달라도 너무 다르다   목숨 바쳐 일제치하에서 독립을 했는데  일제 앞잡이들 청산도 못하고  그 후손들은 너무 잘 사는 이 나라가 참 ......,True,1,2025-02-06T11:30:22+0900,850536907199742106,7,1,0
sepi****,,,False,1,2025-02-06T10:15:13+0900,850532066066956375,0,0,0
joyf****,195dM,윤정권이 권력을 잡으면서 수면위로 드러난 극우세력들의 민낯,True,1,2025-02-06T10:03:41+0900,850531322836287753,7,1,1
alal****,1vf3W,대통령 누가해도 똑같다는 말하던것들아 아직도 생각에 변함이없냐? 모지리가 밑에것들을 무능하고 사악한것들만 골라썼다.,True,1,2025-02-06T09:28:00+0900,850529024122814468,7,1,0
kira****,3fCVS,룸에서 술 먹다가 단속 나온 경찰관 폭행하신 검사출신다운 워딩이네,True,1,2025-02-07T00:46:11+0900,850588177885298725,6,0,0
rins****,3m6Lv,무려 인권위원회 상임위원이 폭동 선동… 멧돼지가 대한민국에 독을 푼 수준,True,1,2025-02-07T00:05:14+0900,850585539936518204,6,0,1
stin****,7PN0,말하는게 완전이 빨간애들인데?? 헌법재판소 파괴하자?? 이 놈들이 반국가세력이 아니면 누가 반국가 세력인데??,True,1,2025-02-06T14:43:25+0900,850549344686833833,6,0,1
fesh****,5wkD0,"저런눔이 인권위원이라고 뽑은놈이 더 나쁜놈이지.
기본도 안되는 인간이 인권위에 있으니..ㅉㅉ",True,1,2025-02-06T12:59:14+0900,850542632542142566,6,0,0
nasc****,3kZJJ,"헌법재판소를 부숴 없애야 한다고? 헌법질서를 부정하는 이런 인간이
인권위원회 상임의원이라니...어이가 없다. 윤정부 인사들은 그냥 다 수구꼴통들인듯.",True,1,2025-02-06T12:52:13+0900,850542181067260001,6,0,0
good****,4Xq9e,인권위를 보면 윤석열정권의 민낯을 보는 것 같다.씁쓸하고 창피하다.,True,1,2025-02-06T12:35:42+0900,850541117089775900,6,0,0
kenn****,1TPPs,"대한민국에 괘변들 하는 괴물들이 이리 많은지. 
유튜브가 교육이 아니라 정규교육에 인문학교육을 필수로 해야.. 
아무리 AI 로봇시대가 오더라도 인간의 인문학적 토론을 어려서부터 해야.. 
이런 양극화 된 사회가 바뀔듯",True,1,2025-02-06T12:33:22+0900,850540965725733008,6,0,0
byun****,5rkOG,윤석열 애비도 친일파였으니 그 밑에서 자란 썩열이 맗해서 뭣하랴.국짐내란당은 예전부터 친일파로 득실대는당이고 대통령 주변에도 뉴라이트들로 채워놓았으니 나라꼴이 엉망이 됐지. 만약 썩열의 계엄이 성공했다면 독도는 일본에 넘겨주고 차후에는 아예 국호를 일본으로 바꿀려고 했을것이다.결국 대한민국은 패망하는것이다.,True,1,2025-02-06T12:30:21+0900,850540771797893255,6,0,0
davi****,d6E5G,사회곳곳이 쓰레기천지네,True,1,2025-02-06T12:24:31+0900,850540396290244771,6,0,0
sjh6****,1vlYH,국가적 비극에도 애도는 못할 망정 더러운 정치에 멱살잡혀서 지역 감정이나 자극하는 더러운 댓글들을 보면 구역질 난다. 수구꼴통들은 어느나라 국민이냐. 일본의 극우 만도 못한 ~ 침을 뱉고 싶다.,True,1,2025-02-06T11:58:25+0900,850538714558890167,6,0,0
jay2****,1G9mj,생긴게 둘이 똑 닮았네... 깡패들 같어. 세월이 좋구나 이런 놈들도 날뛰니~,True,1,2025-02-06T11:55:10+0900,850538505699328068,6,0,0
city****,fK3X,헌재를 부숴 없애야 한다는 자체가 대한민국의 법 체계를 무시하고 우습게 본다는건데 그럼 대한민국의 법은 어디에 있는거냐? 너네가 곧 법인거야? ㅋㅋ,True,1,2025-02-06T11:43:32+0900,850537755506114770,6,0,0
rudq****,HPGz,"저쪽은 헌법이니 민주주의니 이런거 없음. 
자기 뜻에 반하면 적임. 수단은 가리지 않음",True,1,2025-02-06T11:12:41+0900,850535767875780881,6,0,0
soju****,14Asv,"현직 인권위원이“헌법재판소를 두들겨 부수어 없애야 한다”?........ 이놈도 헌법파괴 내란선동죄를 물어야겠네..
멍청하고 한심한...",True,1,2025-02-06T09:58:45+0900,850531005327474973,6,0,0
eliu****,QtZH,"정신나간 인간들이 많군요.. 자기 마음에 안든다고 그럼 아무때나 비상계엄을 해도 아무 잘못이 없다는 말인가? 상식적인 사람이라면 이해할 수 없는 행동을 하는 사람들이 많으니, 대한민국이 이모양이지요..ㅉㅉ",True,1,2025-02-06T09:56:24+0900,850530853644665007,6,0,0
aja7****,3v8Sj,내란폭동 소요죄로 이 견자넘 10년 감방 쳐 넣자,True,1,2025-02-06T09:51:18+0900,850530525297770598,6,0,0
sain****,1WK97,"이 아저씨는 매를 버는 재주가 있어요.
저런 사고를 가진 인사가 인권위원장을 하고 있으니 대한민국 인권 수준을 저 인사을 기준으로 판단할까 심히 우려됩니다.
저런 인간은 국민소추 안되나요?
죽창으로 ... 회초리를 때려도 시원찮네요",True,1,2025-02-06T09:45:14+0900,850530134036316266,6,0,0
cool****,2LJzx,국가전복세력이 인권위원장이라..,True,1,2025-02-06T09:40:09+0900,850529807182594109,6,0,0
bioa****,2qIAd,니들이 반국가세력이다,True,1,2025-02-06T09:38:31+0900,850529701838454970,6,0,0
dkst****,83M4L,김용현도 수사대상이네 인권위란 자리가 어떤 자리인지도 모르는 자를 갖다 앉혀놓으니 물불도 못가리는 망나니 같네,True,1,2025-02-06T09:37:19+0900,850529623958618231,6,0,0
yong****,30NgI,미친놈이  국가인권워원하고 있으니 국민들 인권이 땅에 떨어지고 미친놈들이 날뛰지~~~,True,1,2025-02-06T09:23:15+0900,850528718559379539,6,0,0
wins****,1QU3z,병원에 좀 가봐라.,True,1,2025-02-06T09:21:04+0900,850528576926122010,6,0,0
heoy****,2zFSo,가장 약자의 편에 서야할  인권위가 저 모양인데ᆢ  다른 부처는 말해 뭣하겠나,True,1,2025-02-06T09:20:04+0900,850528513357250591,6,0,0
nule****,1dj9c,투샷 참 쥑인다. 지금 괴물들의 집단을 그대로 표현한 걸작일세~,True,1,2025-02-06T09:17:12+0900,850528328254226494,6,0,0
narr****,27389,"인권이 무엇인지도 모르는 인간에게 
인권위 상임위원을 맡겼다고?
저렇게 인사권을 개판으로 질러놨으니 여기저기 탄핵당하고 난리지.",True,1,2025-02-06T09:08:23+0900,850527760530014331,6,0,0
thou****,2gkJ3,정말 무서운 생각을 가진 사람이구만 우리나라에서 없어지고 북한 보위부가 잘 어울린다,True,1,2025-02-06T09:05:41+0900,850527585828864186,6,0,0
sdg0****,2odeZ,"저런 인간이 인권위원이라는게 개탄스러울 일이다.
대한민국의 수치다.",True,1,2025-02-06T09:00:30+0900,850527252113260674,6,0,0
piaf****,7orwc,저건 의견이 아니고 협박이자 선동이쟎아. 공직자라면 당연히 옷 벗어야 함.,True,1,2025-02-06T08:44:52+0900,850526245480300762,6,0,0
bbn4****,2eKfV,저딴걸 인권위장이라고 임명해대니 그렇게 탄핵을 하지.. ㅉㅉ,True,1,2025-02-07T02:50:58+0900,850596216268914999,8,3,0
kkan****,1UU9N,관상봐라~~~정부관료 뽑을때도 좀 인물좀  보고  뽑아라.어디  거지를 대려다가 나랏일 시키냐,True,1,2025-02-06T19:09:24+0900,850566480650043518,7,2,1
miss****,35I4P,진짜 무법천지다ㅠㅠ 이제 모든 범죄자가 경찰구속영장에 따르지도 않고 재판도 증언않겠다고 하면서 범죄자 세상되는 게 그려진다. 대한민국 미래가 걱정된다. 뭐든 아니면 아니라고 출석하여 조사에 응해서 무죄를 증명해서 소신을 밝혀야지 무슨 이런 행태가 있을꼬!! 빨리 끝나야 한다.,True,1,2025-02-06T12:41:49+0900,850541510515491103,7,2,0
dkst****,83M4L,김용원은 그 자리에서 당장 내려와야 한다 저러한 사고를  가진자를 감히 인권위라는 자리에 앉히다니 경악할 노릇이다,True,1,2025-02-06T12:40:29+0900,850541425035575488,7,2,0
mari****,2JkEd,룸살롱에서 개버릇 아직도 안버렸네 🤬🤬🤬 저런게 뭔 인권위에서 일한다고 ㅉㅉㅉ,True,1,2025-02-06T11:34:47+0900,850537192278196523,7,2,0
popu****,djZVR,내란당 옹호애들은 제정신을 가진 넘이 없네,True,1,2025-02-07T09:45:03+0900,850622893938180124,6,1,0
wjdw****,BnEl,"관상은 과학이다. 니가 헌재를 부숴버리면, 
만약 탄핵이 안되면 나 정말 한번도 거리로 나가본적 없는 40대인데 
이번에야 말로 서울로 가보겠다.",True,1,2025-02-07T00:42:15+0900,850587923911802941,6,1,0
sukl****,2AhzN,미친 또 폭동 일으켜서 내란 완성하려고 진짜 내란수괴와 적극가담자는 사형밖에 답이 없구나,True,1,2025-02-06T23:56:38+0900,850584985030099113,6,1,0
k_gu****,49zoj,진짜 쓰레기만 곳곳에 다 심어놨네 내란수괴는,True,1,2025-02-06T23:53:17+0900,850584769862303825,6,1,0
kyc5****,1z4cR,"검사출신이지 이놈,  법을 어떻게 배워 처먹었냐,  이놈도 굥가 말대로 이번에 싹 정리해고 노상원 계획대로 수거해 실미도인지 백령도에서 썩게 만들라",True,1,2025-02-06T13:04:05+0900,850542944665468954,6,1,0
nive****,bCmCt,저런 놈이 저자리에 계속있도록  놔두냐? 저거야말로 내란 선동이고 획책이다.윤석열이가 자리를 준것들은 하나같이 이나라의 암덩어리다.우리의 후손들이 뭘보고 배우겠나? 당장 체포해서 집어처넣어라.,True,1,2025-02-06T12:27:08+0900,850540565186478127,6,1,0
bfsc****,XQI8,"윤석열정부에서 이런것들 다들 한자리씩 차지하고 국정을 운영했으니, 나라가 제대로 돌아갈리가 없었지.",True,1,2025-02-06T12:22:19+0900,850540253952344193,6,1,0
ziro****,,,False,1,2025-02-06T10:47:43+0900,850534159897067802,0,0,0
hsc0****,2by38,현정부의 무능력과 정체성을 여실히 보여준다. 헌법재판소를 부숴 없애야한다는 것은 무슨 망상인지. 이런 사람들을 인권위원 올리고 국민세금 탕진하는가? 국가전복을 옹호하는 글인데 가만놔두는 국가는 정말 위험하다.,True,1,2025-02-06T10:34:21+0900,850533299175555221,6,1,0
kyoo****,1qaHh,"확실한건  윤두광이와 쥴2가  나라를 완전히 말아먹을 생각이였다는거ㅡㅡ  그렇지 않고서야. 국가의  각처 부서장등,중요한.자리 마다  모든 이런 사람들만 앉혀놓은걸 보면ㅡㅡ
나라가 몇년 사이에 후진국으로 떨어졌다....",True,1,2025-02-06T10:31:02+0900,850533084947283995,6,1,0
km10****,3KFIY,국민 분노 유발자 중 한 명이 또 국민의 분노를 도발하는군요! 저런 인간이 대한민국 국가인권위원회 상임위원이라는 것이 한심스럽기 짝이 없습니다. 윤석열은 하나같이 자기와 같은 혐오유발자들만 뽑아 놓았는지 대단하다는 생각입니다.,True,1,2025-02-06T09:53:55+0900,850530693757796695,6,1,0
biam****,2lWAk,저런 것들이 인권위원? 참 윤석열스럽다.,True,1,2025-02-06T09:17:35+0900,850528352681853086,6,1,0
kjhp****,,,False,1,2025-02-06T08:49:00+0900,850526512019931140,0,0,0
phil****,3UCDb,저따위 인간들만 뽑아서 공직에 앉히니 나라가 이모양 이꼬라지~,True,1,2025-02-06T15:26:36+0900,850552126953226466,5,0,0
hms8****,qyRS,인간이기를 포기한 자. 니가 변호사냐?,True,1,2025-02-06T14:53:28+0900,850549991884718274,5,0,0
ichu****,OKNJ,이것들은 극우도 아니다. 그냥 내란세력이다,True,1,2025-02-06T14:24:04+0900,850548098240348186,5,0,0
9619****,RJNz,저런놈이 검사질을 했으니 얼마나 선량한 사람들 피해를 줬을지 가늠이 안된다,True,1,2025-02-06T13:55:24+0900,850546250917871774,5,0,0
