user_nickname,userIdNo,comments,visible,replyLevel,regTime,parentCommentNo,sympathyCount,antipathyCount,replyAllCount
gims****,193Up,그래  두들겨 부서봐라....너기 그자리에서  끌려내려와야할것이야... 경찰 수갑채워지고 호승줄에 묶어  감옥가고 싶은거냐???   입에 바이러스달았냐?  저런것이  인권위에  앉아있는  이건  무슨  아이러니?   ㅉㅉㅉ,True,1,2025-02-06T09:23:05+0900,850528707620634662,4,0,0
djka****,1qhVh,나이 값 좀 하시라 진짜 꼴값이네요 학교는 왜 다녔는지 둘다하는 모양이 ~~~,True,1,2025-02-06T09:14:09+0900,850528132313120816,4,0,0
brok****,2lgXo,인권위원회가 인권제거하잔 소릴 처하고 앉았네. 당신네들한테 인권은 최고위층에게만 존재하나봐?,True,1,2025-02-06T09:12:44+0900,850528040105541869,4,0,0
gogi****,1t5qC,민주당보고 탄핵남발했다는 미친자들은 정신좀차려라..  저런사람들을 국가기관곳곳에 임명시켜서 나라를 엉망진창으로만들었는데 탄핵남발이란소리가 나오냐??,True,1,2025-02-06T09:12:01+0900,850527994840612873,4,0,0
zeus****,Rtq5,지지세력들은 불법을 해도 지지자들이 용인하면 불법이 아니라는 논리는 정당한건가? 법위에 국민이 있으니 지지자들 모아서 테러를 하든 계엄을 하든 다 합법인건가? 무섭다 무서워,True,1,2025-02-06T09:10:37+0900,850527903689998546,4,0,0
hur6****,cANZ4,헌재는 이런넘을 봐서라도 윤내란을 탄핵시켜야합니다. 그리하여 헌법의 권한을 보여주세요,True,1,2025-02-06T09:09:33+0900,850527835322843308,4,0,0
coco****,1HRvG,나라 수준을 60년전으로 후퇴 시키는 발언들이네. .이런 미개한 수준의 인간들 잘도 뽑아 놓으셨네..,True,1,2025-02-06T09:09:27+0900,850527829199159444,4,0,0
kch3****,1sDN3,와...김용원 쟤는 인간 아니구나  가축수준인듯,True,1,2025-02-06T08:54:52+0900,850526889490514170,4,0,0
jyg1****,,,False,1,2025-02-06T08:53:10+0900,850526780052734004,0,0,0
ccam****,2wo2o,ㅉㅉㅉ 헌법이 최상위법임을 모르는 무지한 자,True,1,2025-02-06T08:51:32+0900,850526675060916371,4,0,0
ksj1****,2CHGS,"저두사람얼굴이 사람맞아요?흉하네
마음이 못돼서 얼굴에 그대로 나오네",True,1,2025-02-06T08:50:14+0900,850526590889623613,4,0,0
xmus****,2Fwqv,그렇게 다 맘에안들면 걍 니들끼리 무인도가서 썩열이모시고 살아라. 왜 대한민국에서 이래라저래라 난리야?,True,1,2025-02-06T08:48:20+0900,850526468080402549,4,0,0
good****,21xn5,"나라가 곳곳이 병들어있다는걸 새삼 느낀다 윤석렬 하나로 2년반동안 온나라를 이렇게 까지 망쳐놓았다는걸 보고 공당인 국힘당까지 나라를 바르게 서워야할 공익기관, 우리의 미래세대인 2030 젊은 청년들까지 너무 많이 병들게 하는구나 싶어서 기성세대로서 너무 마음이 아프고 속이상한다 앞으로 우리는 정신을 똑바로 차리고 더이상 나라가 망가지는 일이 없도록 2030 청년들을 보듬어 품어 안아 다시 제자리로 돌아오길 뼈를 깍는 심정으로 기성새대는 노력해야한다",True,1,2025-02-06T08:48:00+0900,850526447041773570,4,0,0
jymy****,dfP4k,"저런눈은
   주먹을 부르는눈",True,1,2025-02-06T08:47:16+0900,850526399495143498,4,0,0
face****,21Nfk,능력이다 이런넘들 모아놓는것도..그래라..다 부셔라..,True,1,2025-02-06T08:45:46+0900,850526303009374409,4,0,0
aji2****,17CsQ,"치매같은 이친구는 입만 열면 대형사고치네
  국민의 이름으로  처단 해야함.",True,1,2025-02-06T08:45:15+0900,850526269924704322,4,0,0
yoop****,4pMpU,인권위가 원래 이렇게 수준 떨어지는 곳이었나? 본인의 정치색을 위해 인권 운운하는 거 진짜 웃기네,True,1,2025-02-06T08:44:48+0900,850526240581353685,4,0,0
dia3****,15L9a,이게 정상국가냐 석열이는 취임후 꿈꾼게 극우공화국이냐,True,1,2025-02-06T08:41:03+0900,850525999492759577,4,0,0
chsd****,aHBr,조갑제가 품격있는 보수가 될 줄을 누가 알았는가?,True,1,2025-02-06T08:38:50+0900,850525856584433881,4,0,0
happ****,12zwt,잘못된 신념이 이성과 합리를 깨부수는 모습을 우린 목도 하고 있습니다. 지식인이 얼마나 잘못된 신념과 믿음을 가지면 저렇게 망가지는지 보고 계십니다.,True,1,2025-02-07T08:49:15+0900,850619298513682509,6,3,2
kuma****,2BakF,"저런놈이 있는한 인권위 해체해서, 국민에 혈세 낭비 마라.",True,1,2025-02-06T19:43:21+0900,850568667459485810,6,3,0
baco****,,,False,1,2025-02-06T10:00:51+0900,850531140535058778,0,0,0
eagl****,2oGiO,국민의 인권을 지키는 인상은 아니고 특정인의 하수인 노릇에 어울릴듯.....,True,1,2025-02-07T05:21:44+0900,850605929756885035,4,1,0
fish****,5fq5H,55년생 ㅋㅋ 진짜 노인혐오 든다 ㅋㅋㅋ,True,1,2025-02-06T23:35:49+0900,850583644564095203,4,1,0
hi******,,,False,1,2025-02-06T23:10:26+0900,850582008466768000,0,0,0
stor****,2Uqek,"친일들이 환생해서 다시 설치나봄 
니들뜻대로는 되는일이 없을것이다",True,1,2025-02-06T15:41:51+0900,850553109443772751,4,1,0
jaag****,1lp2G,저런건 탄핵안되나? 못시키나?,True,1,2025-02-06T14:30:07+0900,850548487538868283,4,1,0
top6****,HVcy,"정말 가지가지다.
  전한길이  이렇게 망가지다니",True,1,2025-02-06T14:13:54+0900,850547443492716934,4,1,1
7454****,3dRIJ,서울대를. 해체해라. 김용원 서울대출신 이정도면 해체가정답이다,True,1,2025-02-06T14:08:08+0900,850547071004966980,4,1,0
sjm5****,28pfm,극우테러범들 저것들은 사회불순분자들이다.,True,1,2025-02-06T13:41:44+0900,850545370466353437,4,1,0
jmls****,2KbDV,헌법재판소에 대해 저런 말을 공개적으로 하는 사람이 어떻게 세금으로 월급을 받는 공직자일 수 있나요?,True,1,2025-02-06T13:20:51+0900,850544025202065724,4,1,0
saji****,fl0u,윤석열 공산당 아니었으면 이런 사람이 지도층입네 하면서 국익을 갉아먹고 있는걸 몰랐을테니 고맙다고 해야하나? 이참에 머리내민 윤석열 내란세력들을 꼭 엄단해서 자유민주주의 대한민국을 바로 세우자.,True,1,2025-02-06T13:11:11+0900,850543402230480963,4,1,0
cino****,2IK9h,보수조차 부끄러울 인권위의 민낯이다.,True,1,2025-02-06T12:08:08+0900,850539340198051891,4,1,0
bbon****,,,False,1,2025-02-06T11:57:18+0900,850538642819514484,0,0,0
blue****,3ywgG,"발본색원! 이 글이 이번처럼 와 닿기는 첨인듯~
자유는 그냥 얻어지는것이 아니다. 이번에야말로 국익에 반하는 인물들은 과감히 대한민국 국적을 포기하길 바랍니다.",True,1,2025-02-06T11:57:16+0900,850538640571367530,4,1,0
luna****,15nQg,발본색원. 한마리 한마리씩 모두 나와야지. 그렇지? 이번 기회에 깨끗하게 정리하자. 나와줘서 고맙다.,True,1,2025-02-06T11:46:42+0900,850537960020377857,4,1,0
west****,,,False,1,2025-02-06T11:46:41+0900,850537959030522115,0,0,0
ksle****,,,False,1,2025-02-06T11:22:45+0900,850536416600391990,0,0,0
euna****,1NgPz,"봐라 윤석렬이 이런 작자를 그것도 인권위원회 상임위원에 앉혔다, 그러니 야당이 탄핵을 안할수 있겠나. 전부 이런 극보수 문제아들만 요직에 등용한 것이 윤석렬이ㅏ, 그러다보니 윤석렬부터 전부 거짓말만 늘어놓고 있다, 정직한 자들은 찾아볼 수 없다, 내란의 힘도 내란동조자로서 전부 허위주장만 늘어놓고 있다, 이게 현 정권세력들이다, 전두환 때도 이러지는 않았다,",True,1,2025-02-06T11:08:37+0900,850535506771968290,4,1,0
kkoo****,2FcMP,10원짜리도 안되는 것들을 윤석열이  꽂았지,True,1,2025-02-06T10:40:57+0900,850533724108882311,4,1,0
sync****,,,False,1,2025-02-06T10:35:16+0900,850533357191168106,0,0,0
nan-****,aokBP,진짜 기가 찬다 저따위가 인권위 상임위원이라니 인상은 과학이라고 어디서 전부 저따위 극우 쓰레기 골라서 담았나  즉각 사퇴하라 즉각 징계하라  나라꼴이  내란정당은 영원히 집권하면 안되는 유전자다  분통터진다,True,1,2025-02-06T10:11:55+0900,850531853013090654,4,1,0
hhlh****,XYEW,대한민국에 간첩보다 더 사악한 극우부터 쓸어거려야 할 거 같다ᆢ 사실 간첩은 극우가 주장하는 허깨비에 불과하다ᆢ,True,1,2025-02-06T09:20:48+0900,850528559813361931,4,1,0
kdy2****,wBDr,참  인상들이  거시기  하다. 50살  이후  얼굴은  자기책임 이라는데  평생을  독선과  아집. 교만함이  얼굴에  차고  넘치네.  인상은  과학이다. 맞는말임.,True,1,2025-02-06T09:15:57+0900,850528247740367177,4,1,0
oskk****,3Jspj,어찌한결같은 인간들이네요! 나라를 갈수록 혼란과 국민들간 갈등만조장하는인간들! 모조리 잡아다 수도권매립지로 갖다버려요~,True,1,2025-02-06T08:59:51+0900,850527210287661337,4,1,0
gobw****,1ORDu,"국가 인권위원이란 인간이 헌재를 없애버린다고 그럴려면 사표내고 주장해라
내란동조범으로 사형시켜야 알어",True,1,2025-02-06T08:52:49+0900,850526756950507748,4,1,0
ej16****,3bVv1,이번엔 정확하게 구별이가능할것같네요~~ 고민할일을 덜어주네요.스스로들~ 자신들에 가치를~ 아낌없이 거침없이 속까지 시원하게들 거짓없이들보여주시네요~~~ㅋㅋㅋㅋ 누구라할것없이~~,True,1,2025-02-06T21:30:05+0900,850575543635017770,3,0,0
leer****,2LcqK,사진이 좀비 특수분장한거냐??,True,1,2025-02-06T19:52:05+0900,850569230267973656,3,0,0
qwbn****,2bJutz,계엄 성공했으면 저런 인간들이 앞장서서 인간 청소시작됬을듯 ㄷㄷ 나도 윤석렬 싫어하니 잡혀가는구나 ㄹㅇㅋㅋ,True,1,2025-02-06T19:10:53+0900,850566575558754604,3,0,0
simp****,sjw8,"이런게. 
선동 아닌가요",True,1,2025-02-06T17:44:11+0900,850560990037672009,3,0,0
prca****,2b1Ss,헌재를 부숴 없애? 대놓고 법치주의를 훼손하는 막말을 남발하며 저렇게 소양과 자격이 안되는 무식쟁이를 국가인권위원에 임명하는 윤석열의 인력풀. 자기와 결이 같은 나쁜 놈들을 병풍처럼 깔아놨구나.,True,1,2025-02-06T15:26:26+0900,850552116031258817,3,0,0
tkdw****,4aBGc,제대로 된 인간이 리더로서 직에 있지 않으면 나라가 어떻게 되는지 잘 보여주는 예다. 이런 인간 밑에 누가 포진하고 있겠는가. 일제 간신보다 지금의 간신배들이 넘처난다. 나라꼬라가 암울하다.,True,1,2025-02-06T15:17:21+0900,850551531009736878,3,0,0
knam****,3tj2T,총암고 애들이 하는 짓 그렀치 뭐,True,1,2025-02-06T15:03:07+0900,850550613581234232,3,0,0
leeg****,3VvpJ,지독하게도 생겼다 진짜,True,1,2025-02-06T15:00:41+0900,850550457301467418,3,0,0
spee****,2c1oJy,김용원이는 일본앞잡이로써 우리나라를 어떻게든 망치려고 별의별 노력을 다하는구나,True,1,2025-02-06T15:00:22+0900,850550436464165004,3,0,0
rhkd****,359J1,"법을 아는자들이 법을 어기는 현실이 참담하다
니라가 개판이다 탄핵이 답이다",True,1,2025-02-06T14:47:33+0900,850549610974806278,3,0,0
sang****,4vQU1,"이 보다 더한넘들도 계속 나올 듯~윤 이 깔아논 판 에서 국힘,극우단체,간혹 무지한 지지자들 잘 놀고 잇냉. 이 모든 사단에 대해서 판 을 깐 윤 은 뒷전에서 책임 회피하고 힛죽힛죽웃으며 줄기고 잇고, 판 깔아논 쫄 들에게 모든 책임 떠 넘기는 판.",True,1,2025-02-06T14:44:25+0900,850549409597882547,3,0,0
lchh****,aErbW,"그라믄 탄핵여부는  누구한테 묻노? 점집에가서 
  물어봐야  하는교? 아니면 하느님한테 물어봐야
  하는교? 아니면 헌법 재재판소를  새로  만들어 거기에  물어봐야 하는교? 그안한 공직에서 세금 받아 축내고있으면 당신이 하는 말이 말인지 똥인지  된장인지는 구별해서 지껄여야  되는거 아닌겨",True,1,2025-02-06T14:35:43+0900,850548849104650560,3,0,0
lll2****,21JAi,시간은간다. 어차피 사라질 자들이다.,True,1,2025-02-06T14:30:34+0900,850548516731224326,3,0,0
ssgs****,DVNf,이 넘  감옥에 왜 안 넣냐구    ?,True,1,2025-02-06T14:19:14+0900,850547787022991457,3,0,0
wj13****,,,False,1,2025-02-06T14:11:04+0900,850547260956606492,0,0,0
foor****,1eSZ7,"이것들은. 하는짖거리가 영락없는  공산당이
하는짖거리. 너희는 극우라는표현도 아깝다
공산당이야 개인 이기주의. 감옥에서. 한 20년만
썩어라",True,1,2025-02-06T13:45:35+0900,850545618836259050,3,0,0
qotn****,1qpiK,즉각체포후 수사해야합니다!! 헌법을 정면으로 부정하는자! 내란수괴입니다!,True,1,2025-02-06T13:27:53+0900,850544478321115455,3,0,0
koko****,J9rU,얼굴이 모든걸 대변한다 생긴대로 노는구나 ㅋㅋ 겁나 찌질하게 생김,True,1,2025-02-06T13:13:13+0900,850543533042434145,3,0,0
j933****,2xpni,현재의 극우보수들은 단체로 정신적문제를 가지고 있는 것 같다.,True,1,2025-02-06T13:11:45+0900,850543439392014634,3,0,0
gusu****,,,False,1,2025-02-06T13:10:07+0900,850543333846548527,0,0,0
1217****,YWl0,이런인간이  인권위에  있다는것이  참으로 한심하고 진심 딱하다 !!!!,True,1,2025-02-06T13:09:05+0900,850543267677208601,3,0,0
mnkj****,aiVIp,깜도 안되는  윤썩열씨가 당선된 것과  이태원 참사 등으로 여론이 안좋았을텐데 국짐당이 108석 씩이나 당선된게 더 의문스럽다,True,1,2025-02-06T12:57:20+0900,850542509917470845,3,0,0
godm****,2C4ZQ,위법발언 쏟아내는데 처벌 못 하나?,True,1,2025-02-06T12:56:11+0900,850542436215160904,3,0,0
kim_****,15qBs,그런 넌 감옥에 쳐 받혀야 할듯. 상목은 뭐하나 이런 자 안 자르고.,True,1,2025-02-06T12:55:24+0900,850542385631854752,3,0,0
ello****,,,False,1,2025-02-06T12:53:38+0900,850542271865553165,0,0,0
esti****,,,False,1,2025-02-06T12:46:42+0900,850541825490944269,0,0,0
cjmi****,21kBm,"헌법을 무시하고 때려부수는게 니들이
말하는 애국이냐?",True,1,2025-02-06T12:45:13+0900,850541729995030619,3,0,0
hdmi****,1kWJP,현재 인권위원회 수준..나라 꼴이 말이 아니네..,True,1,2025-02-06T12:40:19+0900,850541414348488836,3,0,0
kmsn****,MI8a,두 쌍판대기를 보면 토 나올것 같음,True,1,2025-02-06T12:31:31+0900,850540846842380484,3,0,0
ksno****,1K91i,나라의 근간인 법을 유지하는 역할을 하는 헌재를 무시하는 사람들은 대한민국의 법을 지킬 의사가 없다는 것을 천명한 자들이라 국민이 아니고 반역자다. 내란에 준하는 행위로 처벌해야 한다.,True,1,2025-02-06T12:29:58+0900,850540747554816377,3,0,0
da12****,IYKI,민주당   할일이  많다~~~~  용서하면  나라 망한다,True,1,2025-02-06T12:24:05+0900,850540368104521756,3,0,0
kdla****,IAwc,이런 쓰레기가 국민인권 권익을 보호한다고?ㅋㅋㅋ기가찬다ㅋㅋㅋㅋㅋㅋ,True,1,2025-02-06T12:16:24+0900,850539872891437218,3,0,0
coco****,1HRvG,인권위에서 해임 좀 해라 진짜 이런 인간이 인권위라니..말세다,True,1,2025-02-06T12:13:13+0900,850539668595277915,3,0,0
okcr****,3j6wf,이놈은 어쩌다 이렇게 망가졌을까?  완전히 정신과 진료를 받아야하는 놈인데 강제입원시킬수 있는 방법은 없는건가?,True,1,2025-02-06T12:10:39+0900,850539502702166246,3,0,0
douf****,1y1tZ,"저딴 게 인권위 상임위원으로 있는 인권위가 제 기능을 할 수 있었을까? 인권유린이 자행될 게 뻔한 계엄을 지지하는 인권위? 지들이 욕하는 공산당 빨강이들 거수기 딸랑이랑 뭐가 달라? 부정선거 운운 하는 것도 지들 이상대로 백프로 아니 이백프로 윤통 득표율이 나와야 되는데 안나오니 부정선거라는 거지 ㅎㅎㅎ김정은 미치광이가 백프로 득표율이니, 우리 윤통은 그보다 더 나와야되는데 안나오니, 이야말로 부정선거!!",True,1,2025-02-06T12:04:21+0900,850539096995528836,3,0,0
mdrd****,2rTvb,국민들의 뜻이 탄핵이고 사형시켜야 하는다는거다.  너희들 쓰레기들의 뜻이 아니다,True,1,2025-02-06T12:03:08+0900,850539018041950255,3,0,0
lees****,1qRpU,공무원들 겸직 금지 시켜놓고 지들은 열심히 투잡하네 ㅋㅋㅋ이러니 나라꼴이.개판이지,True,1,2025-02-06T12:02:19+0900,850538965613150361,3,0,0
jooj****,25gV4,얘들은 품격이 없고 왜이리 과격한지.....,True,1,2025-02-06T11:58:27+0900,850538717260021923,3,0,0
pyp6****,4jIbV,김용원  니가  인권위라는게  진짜  아이러니다  인권위가  윤통시녀집단이냐  아주  별난리부르스쇼를  하는구만,True,1,2025-02-06T11:54:49+0900,850538483016532315,3,0,1
podo****,2sDQJ,재판관들 서둘러라 나라가 미쳐가는데 마지막보루인 법원도 파괴시켜버린다는 걸래들을 계속 봐야되냐,True,1,2025-02-06T11:54:08+0900,850538438271696959,3,0,0
scry****,2UcKH,김씨..선을 넘은 것 같아...공직자로서의 발언에 해당하지 않음..인권을 아는가? 비상계엄이란   전쟁 또는 전쟁에 준하는 때에 발동되는데 이것이 선포되면 군인에 의한 통치가 발생됨.언론출판집회결사의 자유가 박탈됨...영장없이 너를 구금체포폭행할수 있음을 왜 모르는가?어찌 이런자가.....,True,1,2025-02-06T11:43:26+0900,850537748929446056,3,0,0
sam9****,dEnPn,유유상종이라더니 석열이와 정부각료들  정부기관위원장들  위원들이 하나같이 망상가이자 꼴통들이네,True,1,2025-02-06T11:19:09+0900,850536184823152690,3,0,0
bloo****,4kOVI,"전한길 ㅋㅋ 진짜 솔직히 뭐 대단한 역사학자도 아니고 전공은 지리에 그냥 공시생들 강사인데 
요새 보면 저런 강사들 띄어주기 심하다고 생각함 솔직히 저런 사교육 강사들이야 뭐 책임질일이  뭐가 있음 그러니 그럴듯한 얘기야 맘 놓고 하지
학교 선생이 했어봐 좋은 얘기여도 바로 학부모 신고 들어옴",True,1,2025-02-06T10:55:41+0900,850534673548312891,3,0,0
kdu9****,8ki3w,진짜더럽게 생겼다,True,1,2025-02-06T10:43:31+0900,850533889096024288,3,0,0
hseb****,2OwxM,왜케 비루해보이냐...빌어먹고 사는 삶이라 그게 다  새겨진 듯~,True,1,2025-02-06T10:39:09+0900,850533608346091589,3,0,0
gjgh****,bBCah,가지가지한다 정말,True,1,2025-02-06T10:36:56+0900,850533465437766040,3,0,0
ba98****,1xaPN,완죤 돌아이 영감이네... 어쩌면 저렇게 될 수 있는거지?,True,1,2025-02-06T10:34:41+0900,850533320264515849,3,0,0
jhee****,,,False,1,2025-02-06T10:32:22+0900,850533171031179424,0,0,1
aste****,2zdsa,저것도 빨리 잡아 쳐 넣어야지,True,1,2025-02-06T10:28:41+0900,850532933683904784,3,0,0
john****,,,False,1,2025-02-06T10:28:38+0900,850532930160689410,0,0,0
a188****,3Engs,입을 용접해버려라,True,1,2025-02-06T10:23:52+0900,850532623791948119,3,0,0
kaig****,aNwzP,민주주의를부정하고 헌정질서 어지럽히는사람들이 정부각처에 부서장들이라  탄핵이늦어지고 법치가무너지고있다.맘에안들면 다때려부수는게 애국인가?그럼 국짐사무실때려부셔도애국이겠네?,True,1,2025-02-06T10:23:40+0900,850532610504392977,3,0,0
ashf****,nKh9,인권이 두둘겨 패라는 명태권이 되었네~ 저런 인간이 인권위원인것도 세금 쳐받아가는것도 용납이 안된다. 그냥 길가다 넘어지면 까마귀 수백마리가 쪼아줬으면...속이 시원 할 듯..,True,1,2025-02-06T10:22:32+0900,850532537070518486,3,0,0
blue****,c3cNv,김요원 내란죄로 입건해라 헌재 권능 무력화 선동 국헌문란이다 경찰 검찰 즉시 수사해라,True,1,2025-02-06T10:19:30+0900,850532342068936937,3,0,0
j752****,Ylvl,"이것들 주장하는걸 종합해보면 ""특정대상에 대한 혐오와 공격선동"" ""민주주의, 법치주의 기본 합의에 대한 부정"" ""망상수준의 실체없는 주장의 반복과 확대생산"" 그리고 ""몰 윤리성""으로 요약할 수 있을 듯. 이런걸 반 국가세력, 국가 전복세력 이라고 부를 수 있을 듯.",True,1,2025-02-06T10:16:47+0900,850532166730252590,3,0,0
goog****,,,False,1,2025-02-06T10:16:35+0900,850532153660801230,0,0,0
bati****,iiCF,폐기물들.생긴게 왜저러냐,True,1,2025-02-06T10:14:56+0900,850532048081781092,3,0,1
summ****,eehH,관상봐라ㅋㅋ 다 늙어서 패가망신 할 관상이다ㅉㅉ,True,1,2025-02-06T10:12:35+0900,850531896801624326,3,0,0
in_a****,1qWFw,헌법을 부정하는 것들은 내란범이다. 무조건 사형시켜라.,True,1,2025-02-06T10:12:33+0900,850531894721249497,3,0,0
rlaw****,bMndn,저런물건이인권위원이라니~~~임명한놈이나똑같구만!,True,1,2025-02-06T10:06:44+0900,850531519985352972,3,0,0
cfma****,3XyUv,이야....생긴거 봐라   어이가 없네,True,1,2025-02-06T10:05:08+0900,850531416570593325,3,0,0
bsj8****,1LThU,한반도 산간지역 출신들은 상하 수직관계에 편안함을 느낀다. 북한이랑 경상도가 왜 그렇게 과잉충성 하는지 이해가 됨. 독재와 노예에 특화된 근성들. 경상도 출신 보수진영 대통령들 다 독재or구속ㅋ 그래도 충성하는 그 지역들.,True,1,2025-02-06T10:03:45+0900,850531327550685482,3,0,0
blue****,,,False,1,2025-02-06T10:01:59+0900,850531213834715487,0,0,0
mbs9****,bLsO,"저놈 생김새만 보면 환자처럼 보이냐ㅡㅡ
 짠한인간ㅡ 니 처자식들은 너를 부모로
남편으로  여길까?",True,1,2025-02-06T10:01:16+0900,850531167529599080,3,0,0
jgs3****,4Vkr5,윤 내란수괴인사들은 모두 결이 같다,True,1,2025-02-06T09:50:27+0900,850530469966512304,3,0,0
rohk****,5TFWc,헌재 부수려고 하는 순간 니 눈앞에 몇천만명의 시민 보일거다 ㅋㅋㅋ 지금 잠잠코 바보들의행진을 보는 시민들이 얼마나 많은지 모르나바,True,1,2025-02-06T09:49:41+0900,850530421530689818,3,0,0
mvps****,1n7kE,헌재 폭동 부추기는거 봐라  쯧   해봐라 니들어찌 되는지 보자 멍청한인간!!!  석열이는 파면이 답이다 저런것들 설치는꼴  언제까지 봐야하니   이사실만 봐도 석열이는 대통령 자격 없음 거니가 집에서 다 사주하고 있나봄!!!,True,1,2025-02-06T09:49:38+0900,850530417621598447,3,0,0
pang****,sAYk,전햔길이나 김융원이나  생긴것이 형제 같네~~  하는짓도  그렇고 ㅜㅜ 몬생긴것들이 꼴값 떤다는 말이 있는데 이들에게 적합한 표현 같기도ㅜㅜ 세상 돌아가는거시 ㅠㅠ,True,1,2025-02-06T09:49:12+0900,850530390073409620,3,0,0
ston****,1ny5O,인권위원호기   윤가넘  조직중에서도  젤  극우들이네   이걸  왜  보고만  있지?  싹  털어서  위원회 구성원을  바꾸던지  해야는거 아님?  너희들이 말하는  국민의  뜻은  몇안되는  극우들이지!    저눔부터  털어보자.,True,1,2025-02-06T09:48:41+0900,850530356082770185,3,0,0
indi****,26lwS,극우라고 지칭되는 민족반역자들에 대한 지극히 우호적 표현에 심한 불쾌감이 든다.,True,1,2025-02-06T09:47:27+0900,850530276676206756,3,0,0
shg5****,envLg,미쳐가는대한민국 어찌될까나,True,1,2025-02-06T09:45:48+0900,850530170543538500,3,0,0
yoon****,2ukIw,오만과 고집불통 으로 기득찬 저 눈빛 진짜 개극혐,True,1,2025-02-06T09:43:57+0900,850530051811180896,3,0,0
dkap****,,,False,1,2025-02-06T09:43:51+0900,850530045351952722,0,0,0
wnst****,PL8y,"한국사 강사, 국가 인권위원회 상임 위원. 이런 사람들의 생각이 이렇구나 !!ㅋㅋ 어디부터 잘 못 된걸까",True,1,2025-02-06T09:43:31+0900,850530024128774323,3,0,0
scar****,26nYK,저런 썩어빠진 정신상태로 인권을 논하다니...공무원들 정년을 55세로 줄여야 한다. 제정신일때까지만 근무하게,True,1,2025-02-06T09:36:29+0900,850529570573516971,3,0,0
kcki****,qF6Q,인권위가 아니라 내란위다.,True,1,2025-02-06T09:32:32+0900,850529315744383188,3,0,0
bs54****,2fnEe,여기가 어느나라 무정부 폭력집단이냐? 😡😡😡😡😡,True,1,2025-02-06T09:32:16+0900,850529298665177176,3,0,0
jbsn****,,,False,1,2025-02-06T09:31:05+0900,850529222647611417,0,0,0
eung****,2BUGU,헌재를 없애겟다고.. 흠..  스스로  광기에 찬 폭도임을 천명하는구나.. 어리석은 것들아..   자유민주주의수호??  개나줘라.,True,1,2025-02-06T09:31:04+0900,850529221288656928,3,0,0
cjw0****,dKZE0,"딱 ! 봐도..극우친일 매국노 같이 ..
인권위가..범죄자  권력비호하고  변호하는 형태는 첨 봄, 에라이~~",True,1,2025-02-06T09:30:50+0900,850529206340157748,3,0,0
6201****,2StjA,저리 헌법 무시하고 자기뜻에 안맞으면 다 부숴버리는게 보수지 ㅋㅋ 대한민국을 망가뜨리는게 지금 보수잖아~,True,1,2025-02-06T09:29:51+0900,850529142771286324,3,0,0
smil****,9ULkQ,"같은 법조인도 무차별 공격하는 윤석열측.  현재 대한민국에선 북한의 공산당이 김씨 3대 우상화하듯, 윤석열을 그와 비슷할 정도로 우상으로 삼고 상식도, 법도 버리고 나라와 국민도 버리고, 오직 윤석열 구하느라 여기저기서 체제를 전복이라도 할 태세다.  아직도 계엄은 진행중",True,1,2025-02-06T09:25:26+0900,850528858246480026,3,0,0
futu****,1pSzv,이런 반헌법적 주장을 해도 안잡아가는 우리나라 참 대단합니다. 인권도 좋지만 우리나라는 그동안 너무 지나치게 범죄자 인권을 올려놓은게 문제입니다. 살인죄 형량이 10-15년인것도 우리나라만의 변종형량이죠...,True,1,2025-02-06T09:25:02+0900,850528833416200206,3,0,0
