user_nickname,userIdNo,comments,visible,replyLevel,regTime,parentCommentNo,sympathyCount,antipathyCount,replyAllCount
mira****,kqwb,"정신차려 한씨
이용당하는줄도 모르고
똑같은 내란범쥬제에 대통령놀이 하고싶어 정신이 나갔네",True,1,2024-12-08T16:13:39+0900,844988879957131483,0,0,0
zxcz****,,,False,1,2024-12-08T16:13:25+0900,844988865478393982,0,0,0
gige****,1xDyt,총안든 내란죄 ㅎㅎㅎ당론으로 탄핵은 반대 불출석하고 정권은 둘이 나눠갖는다?? 멍멍멍,True,1,2024-12-08T16:13:11+0900,844988850211127351,0,0,0
reds****,1wewA,니가 뭔데??,True,1,2024-12-08T16:13:06+0900,844988844741754910,0,0,0
pooh****,,,False,1,2024-12-08T16:12:55+0900,844988832829931823,0,0,0
vivi****,36A2b,니들이 뭔데? 윤가가 니들한테 일임했다고?? 이 참에 권력 한번 쥐어보려구? 니들도 탄핵감이야..니들도 제 정신은 아닌듯.,True,1,2024-12-08T16:12:52+0900,844988829944250616,0,0,0
sull****,5rLOX,국정 질서를 무너트린 윤석렬을 질서있게 조기퇴진? 당장사임 아니면 탄핵밖에 답이 없다,True,1,2024-12-08T16:12:49+0900,844988826756579629,0,0,0
tax0****,40MWF,한가발 신났네. ㅂㅅ,True,1,2024-12-08T16:12:18+0900,844988793588023403,0,0,0
sryo****,3vbJS,"국방장관 사임, 이상민 사임.  뭐 탄핵 올리는넘들  도망간다...질서있는 조기. 퇴진.  이거냐?  시간. 끌며. 한 놈씩 도망가게.",True,1,2024-12-08T16:11:44+0900,844988756460044515,0,0,0
yski****,d7wzF,"악의축 국립서울대출신 카르텔끼리 또 해쳐먹을려고?
윤석열 한덕수 한동훈 장동혁 나경원….",True,1,2024-12-08T16:11:33+0900,844988744833433786,0,0,0
ichw****,4TSjE,동훈이도 책임지고 사퇴해야지.,True,1,2024-12-08T16:11:33+0900,844988744497889457,0,0,0
bbi2****,1UKPx,한동훈 당신이 질서가 없어.헌법 무시하고 대통령권한은 국민이 주는거지 대통령이 너에게 주는게 아니야.,True,1,2024-12-08T16:11:25+0900,844988736746815624,0,0,0
sion****,335K3,한동훈 똑똑한 줄 알았더니 뇌가 아픈 사람?,True,1,2024-12-08T16:11:24+0900,844988735069094021,0,0,0
lshu****,2ttFM,내란수괴의 동조자 부역자 다 멸해야 한다.,True,1,2024-12-08T16:11:00+0900,844988709819383812,0,0,0
yjhm****,2eX9a,애초에 계엄해제 권리도 없는놈이 본인덕에 계엄해제 한척 여론몰이하고 탄핵 할 것처럼 하더니 윤내란이랑 짝짜꿍 해서 본인이 왕노릇 하려고 하는 놈이다,True,1,2024-12-08T16:10:49+0900,844988697504907519,0,0,0
yang****,KiKL,국민선동질하는찢죄명방탕질그만하고감옥에처넣어라.,True,1,2024-12-08T16:09:54+0900,844988638885314879,0,0,0
shjl****,aydeA,정치적 혼란을 수습하겠다는데 그걸 못참냐?  더듬당한테  가는 순간  더   혼란스러울게  불보듯 훤하다,True,1,2024-12-08T16:09:39+0900,844988622930182376,0,0,0
ihc7****,3lvUS,둘이왜저럼? 참나 이건또 무슨코메디?,True,1,2024-12-08T16:09:28+0900,844988611236462760,0,0,0
eise****,4fMT9,"저겄들 공범인걸 잊었냐?한총리 ㄴ은 국무회의 참석한 내란동조범,한 국짐족속은 국회탄핵 입장못하게 막은죄,,,",True,1,2024-12-08T16:09:23+0900,844988605414768776,0,0,0
dirn****,lz79,한동훈 이 개shakeit야 왜 니가 탄핵에 반대했는지 이제 알겄다...니미C8 shakeit,True,1,2024-12-08T16:09:14+0900,844988595432325211,0,0,0
jjuk****,1n3nK,"국민의힘 대표가 왜 국회에 협조를 구하냐?
국회의원도 아닌 자유인인 사람이 내란 동조자인 국무총리와 협의를 한다는 것부터가 이해 안간다.",True,1,2024-12-08T16:08:58+0900,844988578403451206,0,0,0
3379****,,,False,1,2024-12-08T16:08:56+0900,844988576222413098,0,0,0
ha40****,1GIgH,"hota/ 야,임마.계엄군들이 총부리룰 언제 국민한테 겨눴다는 거냐 ? 중국 앞잡이 민주당 국회의원들에게 겨눈것을 왜 국민으로 겨눴다고 국민 타령을 해 자식아",True,1,2024-12-08T16:08:55+0900,844988575601656094,0,0,0
awoo****,byIeF,내란범과 내란 동조당이 무슨 지랄한다 ㅋㅋ,True,1,2024-12-08T16:08:24+0900,844988542516985981,0,0,0
pro4****,,,False,1,2024-12-08T16:08:04+0900,844988520522055705,0,0,0
mnfk****,2yCcw,동훈아. 너는 법적 권한이 하나도 없는데? 무슨 수로? 너는 그냥 허수아비일 뿐.,True,1,2024-12-08T16:07:36+0900,844988490876715215,0,0,0
pks2****,VgAJ,"두사람 표정이 대조적이네.
한분은 침울.비장함. 한놈은 신나서 깝쭉깝쭉. 검사시절 저녀석한테 걸린 사람들 속 엄청 상해서 화병 났을거 같네",True,1,2024-12-08T16:07:34+0900,844988488628568222,0,0,0
h239****,30wnl,18,True,1,2024-12-08T16:07:25+0900,844988478293803125,0,0,0
nari****,aBImQ,엄지발가락,True,1,2024-12-08T16:07:21+0900,844988473965281404,0,0,0
sdae****,,,False,1,2024-12-08T16:07:19+0900,844988472572772442,0,0,0
vani****,2ABL1,너네 그렇게 나란히 서서 마이크 잡고 이야기 하면 아 그렇구나 할줄 알았냐????,True,1,2024-12-08T16:07:10+0900,844988462439333943,0,0,0
bo******,4aq4,"본인들 주장으로는 불법계엄에 대해서 철저히 진상조사를 하겠다고 하지만, 아니 그럴것 같으면 왜 윤석열이가 권력을 이양하겠다고 말하겠음? 검찰이나 군부에서 내란죄 혐의로 윤석열을 조사하면 피의자 신분이 되는데 조사를 철저히 하겠다는 저 말을 믿어야 됨? ㅋㅋㅋㅋ",True,1,2024-12-08T16:07:06+0900,844988458513465369,0,0,0
dpdd****,4v3CV,사람들이 OOO인지 아나보네 ㅋㅋㅋㅋㅋ,True,1,2024-12-08T16:07:00+0900,844988451668361220,0,0,0
bsra****,3lQFC,얼마나 웃긴넘인가  윤가랑 딜을하고 권력을잡으려 옳고그름은 온데간데없는 모사꾼,True,1,2024-12-08T16:06:46+0900,844988436820525282,0,0,0
sein****,11vLS,능력이 안 돼 용병을 비싸게 데려왔는데 지독한 먹튀네.,True,1,2024-12-08T16:06:46+0900,844988436417872101,0,0,0
j2he****,19RVK,"저둘은 확실한 내란공범이네..  
대한민국 법어디에도 너그들에게 대통령권한 부여한것이 없는데 지들이 하겠단다...  
대통령이 멍해서 직수행못하면 새로 뽑마야 하는것인데 저놈둘이 우리가 해먹겠다 이러는거네  ㅋㅋㅋ
OOO둘이네  완전히....",True,1,2024-12-08T16:06:31+0900,844988420680843430,0,0,0
pro4****,,,False,1,2024-12-08T16:06:23+0900,844988411839250567,0,0,0
kj3s****,Vuww,"부정선거 수사는 왜 말이 없노? 이것도 신속하게 수사하라 검찰 개망나니 종자들아,",True,1,2024-12-08T16:06:07+0900,844988394508386340,0,0,0
kslo****,5tfBR,"OOO 들인가??!!!
국민주권자가 투표로 대리한 대통령이란 직책의 권한을,,
대통령이란 인간이 헌법을 유린하며 범죄를 저지르더니
국민들이 맡긴 권한을 지 맘대로 공동전범인 총리와 소속 당에 위임하고 저것들은 또 뭔대 지들이 맘대로 그 권한을 행사하겠다는거냐??!!
국민의 투표로 선출된 것도 아닌 것들이 지들이 뭔대 마음대로 그 권한을 이용해 나라를 통치하겠다는거냐고??!!!
이렇게 눈가리고 아웅하며 짜고 치려고 국민을 버리고 범죄자 감싸려고 국회에서 튄거내!!! 
도대체가 저 암덩어리들은 어떻개 도려내야 하는거냐!!!",True,1,2024-12-08T16:05:42+0900,844988368604365019,0,0,0
iwab****,2F23J,"뻔뻔한 정부힘 국가권력은 국가변란 국민혼란 국가경제를 망치죄,,,절에 가서 참회 불공드리고  예ㅅ수에게 고개푹 숙이고 티비에 국민교란 어떻게 하겟다 경제 경제  웃긴 소리 하지마라.....조ㅓ용히  너희들힘 끼리 경제잘챙겨ㅣ면 된다,,,,국회 및 여야정당과 히ㅏ면 되는 것을 국민에게 티비로 일이ㄹ히 해명 변명 하지마라,,팍,,,얼굴도 보기싫어,,,,죄인들아  국가헌법및 국가경제를 망친  권력힘자유힘들아,,,,,조용히 여야정당과 장관이 알아서 해  담화선동하지마라,,,티비 및 뉴스 담화문 발표 하지마라...머리 아프다,,,,티비팍,,",True,1,2024-12-08T16:05:30+0900,844988354796716216,0,0,0
sein****,11vLS,"""헌법질서에 맞는 윤한 퇴진, 한총리 국회에 무한 협조"" 
이게 맞다.",True,1,2024-12-08T16:05:10+0900,844988334110408762,0,0,0
f1sh****,7yAOx,국힘 너희야 말로 용공 좌빨이다. 헌법을 유린하고 공산당마냥 당론으로 내란 수괴를 탄핵으로 무효시키는게  민주주의를 지킬려는 의지는 있냐? 북에 대한민국을 받치려는 수작이냐,True,1,2024-12-08T16:04:59+0900,844988322399912246,0,0,0
jwyo****,1ylL0,국민의 힘을 우습게 보지마라,True,1,2024-12-08T16:04:54+0900,844988316863430938,0,0,0
vivo****,3vmGy,콩고물 주워 먹을라고 아주 안달났냐 ㅋㅋ,True,1,2024-12-08T16:04:14+0900,844988273712431170,0,0,0
sadt****,1khuv,왜 권한행사지? 선춘,True,1,2024-12-08T16:03:54+0900,844988251751055659,0,0,0
dlsr****,2jRES,아주 끼리끼리 운영하네~ 이제 세금도 내고 싶은 사람들만 내게 해라,True,1,2024-12-08T16:03:50+0900,844988247573528846,0,0,0
youn****,2toEx,이게 나라가?,True,1,2024-12-08T16:03:36+0900,844988232859910303,0,0,0
yeon****,,,False,1,2024-12-08T16:03:35+0900,844988231970717858,0,0,0
g120****,HNHp,하루 강아지  정치초병   윤통이  잘못키웠어  주인을 물어 버리는 미친 개xx,True,1,2024-12-08T16:03:28+0900,844988224018317444,0,0,0
hosu****,6RL3O,뭐 하나 법적으로 허용되는게 하나도 없는데 지 혼자 권력을 이양받고나서 국회랑 협의를 한다고????저 병X같은 놈이 가발정리를 몇주째 못하다보니 정신이 나가버렸나보네,True,1,2024-12-08T16:02:33+0900,844988165432279215,0,0,0
comm****,2cTB6u,한동훈씨 --------- 주제 파악좀 하세요 ㅋㅋㅋㅋㅋㅋㅋ ( 국민이 뽑은 대통령이 당신입니까 ? ),True,1,2024-12-08T16:02:22+0900,844988153369460869,0,0,0
shoh****,eQyty,꺼지세요,True,1,2024-12-08T16:01:59+0900,844988129008943397,0,0,0
onen****,,,False,1,2024-12-08T16:01:48+0900,844988116526694635,0,0,0
ican****,,,False,1,2024-12-08T16:01:39+0900,844988106829463762,0,0,0
bsse****,bYIVY,이번기회에 한동훈 니도 같이 퇴진해라/ 여당이 되어가지고 대통령 하고 각이나 세우고말야 /,True,1,2024-12-08T16:01:31+0900,844988098877063325,0,0,0
0520****,,,False,1,2024-12-08T16:01:28+0900,844988095873941653,0,0,0
moo6****,1Capi,니가 뭔데??? 그럴 권리가 있니?,True,1,2024-12-08T16:01:18+0900,844988084129890378,0,0,0
stim****,,,False,1,2024-12-08T16:01:13+0900,844988079314829378,0,0,0
wnet****,3zE0r,"퇴진이면 퇴진이지 무슨 질서 있는 퇴진
시간 끌고 본인이 대통령인 것처럼 행동",True,1,2024-12-08T16:01:05+0900,844988070825558034,0,0,0
skyc****,,,False,1,2024-12-08T16:01:03+0900,844988068929732629,0,0,0
phdy****,2Ip8N,동훈 덕수 거기서 뭐하노~국민들한테 혼나기전에 빨리 내려온나~,True,1,2024-12-08T16:00:53+0900,844988057554780428,0,0,0
kth5****,3MGJO,윤석렬 딱갈이 시간벌기 검찰동원에서 내란죄 꼬리자르기하고. 이후 다시  정권잡고. 국정운영할려고. ㅠ,True,1,2024-12-08T16:00:51+0900,844988055474405613,0,0,0
miky****,2zb7v,국민을 개돼지로 여기는구나,True,1,2024-12-08T16:00:38+0900,844988042102964430,0,0,0
iwab****,2F23J,"뻔뻔한 한덕ㅆ,쓰 한심한 한동당. 촤순시 같은 집단 같은..무리발상 ...나에게. 국가사무통치권력을 투표없이 위임하라..국무ㅁ 위원 장광 차관 정부권력인원 국무교체 정부조직 전부 교체 갈아버리게...난 국법을 어긴 것으로 고발 고소하면 감방르로 직해한다...갑방..건방. ㅇ.ㄹ. 법이 뭐시기 필요하노..헌법투표없이. 대통령 국무위원 장관. 법원장 위이뫄면되지...한심한 뻔뻔한자유당 만만세....국법은 필요없엉...개돼지지유노예만 우리편이면 되는...이기적자유힘만 누리면 ㄷ되지. 국가법 헌법보다 이기적자유힘권력만 필요하다..",True,1,2024-12-08T16:00:26+0900,844988029318725754,0,0,0
sdae****,,,False,1,2024-12-08T16:00:12+0900,844988013413924932,0,0,0
nock****,1O3kn,내란수괴 윤석열은 질서있는 퇴진이  아니라 즉각 추포야 한뚜껑아,True,1,2024-12-08T16:00:00+0900,844988000562577409,0,0,0
iloa****,6W7Ac,그러니까 행정부의 권력을 정당에서 가져가겠다 이거지? 삼권분립은 개나 줘 버렸구나 ㅋㅋㅋ 공산당이냐?,True,1,2024-12-08T15:59:57+0900,844987997207134485,0,0,0
manb****,1qSw5,니 뭐 되나??,True,1,2024-12-08T15:59:49+0900,844987988768194774,0,0,0
phdy****,,,False,1,2024-12-08T15:59:34+0900,844987973081497783,0,0,0
miky****,,,False,1,2024-12-08T15:59:28+0900,844987966152507551,0,0,0
lhsw****,,,False,1,2024-12-08T15:59:19+0900,844987956925038693,0,0,0
leea****,2NG2M,이것도 비선이지....국민이 준 권한을 왜 지맘대로 국힘에 준다는건가요? 이젠 대놓고 권한을 나누는건가요?  절대 안되요,True,1,2024-12-08T15:59:06+0900,844987942496632866,0,0,0
ksks****,,,False,1,2024-12-08T15:59:00+0900,844987936406503431,0,0,1
oil5****,1F3zj,배제는 법적 효력이 없다   즉  수사하는동안 대통령으로써   윤석열의 권력과 권한이   유지가 된다는거야   뒤에서  국정에 관여한들 법적 책임도 없고,True,1,2024-12-08T15:58:39+0900,844987914076029145,0,0,0
lshu****,2ttFM,그래 니들 좋아하는 법대로 하자. 이게 국정농단이고 위헌이지,True,1,2024-12-08T15:58:33+0900,844987907415474347,0,0,0
dldy****,2im2e,한덕수는  심지어 비상계엄 할때  같이 심의했던사람이다   자진출두로 조사는  못받을  망정 국정운영이 왠말인가,True,1,2024-12-08T15:57:46+0900,844987857469702366,0,0,0
papa****,,,False,1,2024-12-08T15:57:24+0900,844987833612501113,0,0,0
subm****,3k73E,최규하 생각이 나네. 옆에 계엄사령관이 새로 임명됐나?,True,1,2024-12-08T15:57:18+0900,844987827019055200,0,0,0
cubi****,,,False,1,2024-12-08T15:57:16+0900,844987825072898138,0,0,0
leei****,,,False,1,2024-12-08T15:57:12+0900,844987820945702977,0,0,0
dang****,aBr2s,"정권  찬탈에  눈이  뒤집혔구나/  제2의  박근혜  사태는 막아야한다   국론분열  국가혼란   국력소모  김정은 하고  민주당만  좋아한다/ 임기내내  특검  탄핵  이재명 방탄   판사 겁박    지들 조사하는 검사  감사원장  탄핵   국민의 피와같은   예산  농단 /검경  특활비 삭감  때문에  대통령이  피를 토하는심정 인것이다
다시  문재앙  시절로 돌아가서   금전 살포식  포퓰리즘, 원자력 폐쇄,통계조작이 반복되면  국가는 산으로간다/ 전과4범이  정권찬탈 하는것은  막아야한다/  구관이  명관이다",True,1,2024-12-08T15:56:50+0900,844987797004615939,0,0,0
munb****,,,False,1,2024-12-08T15:56:45+0900,844987791921119457,0,0,0
bik6****,16ihU,"무슨 권리로 너희들이 국정 운영을 공동으로 하냐?
제정신인가?

대통령도,총리도,여당대표도 모두 한통속
내란죄로 모두 수사하고 탄핵시키길!!!",True,1,2024-12-08T15:56:08+0900,844987752226226213,0,0,0
myja****,6PM6,잇속은 끝까지 다챙기려는 구나. 그래 증거인멸 재산도피등 시간이 많이 필요하겠지. 블룸버그에서 이 계엄사태의 댓가는 국민의 혈세로 치르게 될거라더라. 추정151조가 몇일만에 증발한단 말이다. 외국인 투자도 그만둔단다. 이  이사달을 일으킨 수괴와 가담자. 한동훈과 그 일당에게서 추징해라.,True,1,2024-12-08T15:55:57+0900,844987739542651198,0,0,0
0520****,,,False,1,2024-12-08T15:55:50+0900,844987732496220454,0,0,0
ahff****,6SmS8,대통령 직무 정지는  탄핵절차를 밟고 국회 차원에서 결의해서 하는게 원칙임.  니가 뭔데 총리랑 둘이서 밀실에서 수군거리면서  둘이서  퇴진할지 직무정지할지를 결정하냐?   같이 순장되기 싫어서 잔머리 굴리나 본데 적당히 해라,True,1,2024-12-08T15:55:48+0900,844987730046746928,0,0,0
tt15****,,,False,1,2024-12-08T15:55:43+0900,844987724946473227,0,0,0
nand****,LfwG,"한동훈 당신도 윤석열을 쫓아가려 얘를 쓰는구나… 한심 또 한심 국힘당…. 
국민 무서울줄 모르는 가짜 보수들…",True,1,2024-12-08T15:55:30+0900,844987711407259832,0,0,0
merk****,AGmW,"박근헤가 멍청하니 최순실한테 위임 했다는 거랑 뭐가 다름?
대통령 권한을 지멋대로 행사(위임)하는게 국정농단이야.
이게 뭔 개소리야.",True,1,2024-12-08T15:55:28+0900,844987708873900193,0,0,0
zjff****,,,False,1,2024-12-08T15:55:27+0900,844987708253143179,0,0,0
0256****,1n6Yo,"내란수괴범을 대통령에 앉혀 놓고,~ 내란 동조범 국무총리와 장관, 그리고 내란동조당 국민의힘이 대통령 권한을 넘겨 받아 일 한다고요 = 미쳣어요~~ 현 내각 국무위원들은 다 내란죄로 조사, 수사 대상입니다, 국민의힘 국회의원도 마찬 가지구요 == 대안은)) 국회의장이 국무총리 대리 역할, 그리고 각 상임위가 장관 역할 하면 됩니다. 이게 최선의 해결책이에요.",True,1,2024-12-08T15:55:26+0900,844987706323763347,0,0,0
dldy****,2im2e,"국빙부장관  체포다  대통령은 피의자  입건이다  대통령 
새로뽑을 투표 준비나  할것이지 누구맘대로  대통령을  대신해  국정을  운영한단  말이냐!",True,1,2024-12-08T15:55:23+0900,844987703689740406,0,0,0
dbst****,,,False,1,2024-12-08T15:55:00+0900,844987679010455558,0,0,0
notm****,ecTG7,"한동훈은 국민들한테 표를 받은 적도 없는데 왜 저럼?? 내란수괴가 지명한 사람이 위임받는 게 말이 되나 이게??? 총기난사하려다가 실패한 범인이 총내려놓을 기회는 가져다버리고, 총기난사범이 지명한 난사범 후배가 총기를 가겠다고 저러고 있는거임. 법적으로 절차가 있는데 한동훈 가발에 독발랐나 왜저라노 ㅋㅋ",True,1,2024-12-08T15:54:57+0900,844987676024111410,0,0,0
bjh0****,2uREy,너희는 정치생명 끝났어~,True,1,2024-12-08T15:54:55+0900,844987672953880865,0,0,0
mdy1****,,,False,1,2024-12-08T15:54:39+0900,844987655824343232,0,0,0
buja****,2HVYk,"애초에  야당하고 대화한번안하고 극우유튜브만   보는
싸이코패스대통령을  여당니들이 만들어놨잔아~~책임은디들이져야지  ~~ 왜 국민보고 기회를달라니?",True,1,2024-12-08T15:54:35+0900,844987651445489849,0,0,0
drug****,2icDP,도대체 국민을 정말 개 돼지로 보는건가? 정말 어이없다..,True,1,2024-12-08T15:54:27+0900,844987643291762831,0,0,0
trut****,2gTT2,"개헌도 안했는데 우리나라가 언제부터 의원내각제였냐? 그리고 그걸 선출되지도 않는 벌레 한한이 맡는다고? 이게 내란이지 
우리가 뽑은 대통령이 똥볼찼느니 대통령을 다시 뽑겠다고 니들이 뭔데 통치하냐고",True,1,2024-12-08T15:54:25+0900,844987640875843717,0,0,0
kwh5****,3wf0v,내란동조당 한심하다 해체해라,True,1,2024-12-08T15:54:24+0900,844987640187977865,0,0,0
love****,5JeeZ,"니네가
뭔데 어쨋든 국민이 선출한 대통령의 권한을 주네 안주네 하냐? 국정농단이냐? 헌법이란게 없냐? 제2의 국정농단이지 뭐냐 .
아주 헌법위에 있네? 저짓거리 할려고 내란수괴랑 짜고 야합한거 아니냐 민주주의가 뭔지는 아냐? 이거 완전 북한 공산당 놈들이네",True,1,2024-12-08T15:54:06+0900,844987620994842668,0,0,0
heey****,,,False,1,2024-12-08T15:54:03+0900,844987617555513358,0,0,0
djmj****,4F2DN,깐족이 없에 있는 메주대가리 같은 넘은 꿔다놓은 보리자루처럼 생겼네. ㅋㅋ,True,1,2024-12-08T15:54:01+0900,844987615340920843,0,0,0
skj3****,26kou,"가발벗고 진정성 있게 떠들어봐 새끼야
그.럼 들어나 줄게",True,1,2024-12-08T15:53:56+0900,844987610307756311,0,0,0
sdae****,,,False,1,2024-12-08T15:53:53+0900,844987607254303011,0,0,0
tlsr****,ONtB,"국가권력은 국민으로부터 나옵니다
그권력을 선거라는 절차를통해 국회의원한테 위임시킨겁니다 
국민의 80%가 원하는 탄핵의결에 투표조차 하지않았습니다
대통령 유고상황이아닌이상 총리와 여당대표가 권력을 대리하겠다는건 헌법에도 없는 내용입니다
그어느나라도 국가원수는 2선후퇴라는건 없습니다 
하야또는 탄핵이지만 하야할생각없는것같고 탄핵도 안되니
국민이 뽑은 대통령이니 국민이 나서야합니다
대한민국 국민들이 40년간 힘들게 꽃피워온 
민주주의가치를 한순간 짓밟아버린 중대한사건입니다",True,1,2024-12-08T15:53:31+0900,844987583699091626,0,0,0
stor****,2cyx9m,정말 제정신입니까? 한동훈 대표가 뭔데 나라 운영을 해요?,True,1,2024-12-08T15:53:25+0900,844987576233230475,0,0,0
beck****,,,False,1,2024-12-08T15:53:03+0900,844987553181335567,0,0,0
yulc****,1aw82,한동훈 체포해라 저자가 쿠데타다 국회의원 않님 당장 체포해라 = 최순실 동급,True,1,2024-12-08T15:52:57+0900,844987546671776023,0,0,0
buja****,2HVYk,한일합방이  왜  이루졌는지 알겠구만~~,True,1,2024-12-08T15:52:31+0900,844987518251172020,0,0,0
regi****,2bNQBo,"옛다~하고 주면 덥썩 받아 대통령 하면 되는거야?
지네끼리 짜고 치는 고스톱을 국민들이 용인하라고? 웃기고들 있네!",True,1,2024-12-08T15:52:22+0900,844987508956594288,0,0,0
liva****,4CUMM,헌법위반입니다. 제2의 내란이 아닌가..의심이 듭니다.,True,1,2024-12-08T15:51:47+0900,844987471476293851,0,0,0
yski****,1xmsh,내란수괴 윤석열부터 체포하고 직무정지시키는게. 최우선이다!!!!!!탄핵하라!!!!!!!탄핵하라!!!!!! 내란수괴아래  둘이 뭘할수있는가!!!!!! 이는. 위헌이다,True,1,2024-12-08T15:51:41+0900,844987464899625154,0,0,0
msg9****,1uPhm,"배신자 한동훈은 정치계에서 사라져라, 넌 끝났다. 니가 뭔데 대통령 직무를 정기 시키네 마네 한다는거냐 ?",True,1,2024-12-08T15:51:30+0900,844987452752920739,0,0,0
dbst****,,,False,1,2024-12-08T15:51:29+0900,844987452450930849,0,0,0
mong****,3B5iZ,한동훈 대통령님 임기는 알려주시고 대통령을 하시는게 순서 아닌가요?,True,1,2024-12-08T15:51:19+0900,844987441176641642,0,0,0
na10****,,,False,1,2024-12-08T15:51:11+0900,844987432855142463,0,0,0
rei1****,A74O,미친.. 다들 쳐돌아가지고,True,1,2024-12-08T15:50:56+0900,844987416396693803,0,0,0
hann****,1IHhD,"한덕수 ㆍ 한동훈 ㆍ 국힘 제정신이냐?
다들 꺼젼라!  국민들을 무시하는 거다.",True,1,2024-12-08T15:49:57+0900,844987353314361632,0,0,0
ad50****,1Oi5z,꼴값한다는 말밖에 해줄말이 없다..,True,1,2024-12-08T15:49:43+0900,844987338315530473,0,0,0
jhbi****,21Hzn,이민을 가야하나 이런 미친나라는 못살겠다,True,1,2024-12-08T15:49:22+0900,844987315448184950,0,0,0
ddsm****,4U8M4,누가 너희 2명에게 대통령 권한을 줬냐? 헛소리 짓거리지마라,True,1,2024-12-08T15:49:21+0900,844987315162972305,0,0,0
alpi****,bIv95,"얄 흉악한 짐승들아~~~ 느그들이 뭔데 대통령 임기에 대해서 이러쿵 저러쿵 씨부리면서 짖고 자빠졌는데...  대통령이 느그들한테 일임할 권한도 없는데.... 느그들이 뭘 일임 받았는데..... 국민들이 느그들한테 무슨 권한을 줬는데 흉악한 인간들아~  탄핵이 되었으면 그 순서가 국무총리 순으로 가지만, 지금은 탄핵도 느그들이 안 되게 막아 놓고서는 무슨 권한으로 한 뚜껑하고 한 떡수 하고 국정을 운영하려고 하는데.... 한뚜껑 니도 조만간에 땅을 치면서 후회할 날이 조만간에 올끼다.  니도 동조한 공범으로 감빵에 갈끼다.",True,1,2024-12-08T15:49:15+0900,844987308552749126,0,0,0
eheh****,2BINs,"단체란 단체는. 이익집단이라 혐오했기에 동조하기 싫어서. 촛불집회랑 거리뒀었는데... 법치주의 나라에서 위반하는 통치자는 필요없다.. 국회의원도 아닌 것들..
매번 한표 한표 국힘당 민주당 어디든 투표는 해야한다고 나갔던. 국민을 무시했다 나쁜놈",True,1,2024-12-08T15:49:13+0900,844987306539483199,0,0,0
pooh****,2IAil,뭐 나라운영이 동네 소꿉장난이냐?! “넌 대통령 많이 했으니 이번엔 내가 대통령할께!”“,True,1,2024-12-08T15:48:54+0900,844987285769290011,0,0,0
tomr****,1TQdU,"이게 말이 되냐? 이것도 불법 이네. 둘다 구속 수사해라.
말이 되는 소릴 해라. ㅂㅅ 들아 법도 몰라?말로 줄수있으면 대통령 권한 차라리 나한테 줘  내가 할께. 내가 니네보다 잘할수 있다. 이건 또다른 위법이고 쿠데타 동조 행위야.",True,1,2024-12-08T15:48:44+0900,844987275098980553,0,0,0
ajil****,2b0zH,저새끼들도 몰아 내야되 지네가 뭔데 법을무시하고 정권잡겠다 ㅈㄹ들이냐,True,1,2024-12-08T15:48:37+0900,844987267817668793,0,0,0
k118****,18IMM,동후이.... 맹태균이 봤지? 뒤에서 그 짓해도 깜빵가는데... 대놓고 앞에서 깐죽 대면 어떻게 되겠니?,True,1,2024-12-08T15:48:05+0900,844987233239826460,0,0,0
bigs****,fDf3,이OOO들 아닙니까 내란수괴을 보호하고 내란동조자 하고 권력 행사하겠다  국민이 지들을 뽑아주지도 안했는데 지들끼리 알아서 하겠다이건데 이게 정상 입니까  국짐쓰레기와내란동조자가 하는게 말이됩니까,True,1,2024-12-08T15:47:59+0900,844987226797375788,0,0,0
saka****,,,False,1,2024-12-08T15:47:50+0900,844987216764600607,0,0,0
