user_nickname,userIdNo,comments,visible,replyLevel,regTime,parentCommentNo,sympathyCount,antipathyCount,replyAllCount
radi****,1Ew1E,국민들 벙쪄있음!! 내란의 주범과 내란의 힘당 대표가 국가 운영을 들먹이는게 뭐지?? 국민을 호구로 생각하나?? 지금은 조용히 빠져서 내란당에서 빠져나오는거만 생각해도 시원찮다.,True,1,2024-12-08T13:03:33+0900,844976632841109663,1,0,0
jklh****,m2Cy,니들이 뭔데 대통 노릇이야,True,1,2024-12-08T13:02:23+0900,844976557662404718,1,0,0
jjal****,1J5zv,국수본은 즉각 윤씨와 저 무리들을 체포해야 된다  검찰에 끌려다니지 마라,True,1,2024-12-08T13:01:09+0900,844976478557831218,1,0,0
toto****,3wAXG,살인 할려다 실패했다고 그냥 넘어가라는 개소리와 머가다른가,True,1,2024-12-08T13:00:43+0900,844976450489549016,1,0,0
air-****,9xI4h,왕놀이 할 권리도 없는 자들이 왕놀이를 하겠다는데 기가 찹니다. 니들이 뭔대 나라를 좌지우지하겠다는거야?? 국민들 목소리에는 관심 1도 없는 놈들이 새빨간 거짓말로 또 국민을 우롱하려 드네.,True,1,2024-12-08T13:00:34+0900,844976440909758641,1,0,0
hesi****,1HcLi,질서있는 퇴진을 법에 따라 탄핵 하면 되는데 니네들이 무슨 권한으로 방법을 정하는 가?,True,1,2024-12-08T13:00:15+0900,844976421079089232,1,0,0
isee****,1hzdP,빨리 윤석열 긴급체포해라. 대통령 권한은 이런 권한 없는 잡것들이 짬짜미로 나눠먹을 게 아니다. 또한 한동훈 말로 보아 검찰쿠데타가 진행될 수 있으니 검찰은 내란죄 수사에서 철저히 배제하고 국짐당은 대표가 대통령 권한을 자의적으로 이어받겠다는 위헌적인 말을 했으니 위헌정당심판에서 자유롭지 못할 것이다. 혼란을 틈타 검찰권을 장악한 한동훈 입법부가 대통령의 군사행정권한까지 독점하겠다는 독재적 망발을 태연히 하고 있다. 검찰쿠데타로 번질 수 있으니 검찰은 철저히 배제해라.,True,1,2024-12-08T13:00:15+0900,844976420441555024,1,0,0
hama****,2MMJC,정치는 신뢰가 생명이다 당론을 배신한 당대표는 당을 배신할수 있고 나라를 팔아먹을수 있다 또 대통령을 탄핵하려는 한동훈은 민주당으로 가는게 옳다,True,1,2024-12-08T13:00:00+0900,844976404603863048,1,0,0
geag****,1vnJj,국민은 당신들에게 그런 권한을 준적이 없다. 또 다른 형태의 독재를 행하고 있는 것이나 다름없는 행동을 당장 그만둬라,True,1,2024-12-08T12:59:59+0900,844976403748225354,1,0,0
wish****,,,False,1,2024-12-08T12:59:56+0900,844976400459890980,0,0,0
crez****,CB9R,니들이 뭔대요? 이 어려운 시기 동조자들...! 국무회의 계엄 입다문자! 탄핵 반대한자! 둘다 구속 수감해야함,True,1,2024-12-08T12:59:27+0900,844976369472372874,1,0,0
asd1****,,,False,1,2024-12-08T12:59:24+0900,844976365563281545,0,0,0
we_a****,,,False,1,2024-12-08T12:58:56+0900,844976336001827107,0,0,0
yoka****,IBro,이게 말이 되나? 국민들이 니들을 뽑아준게 아닐텐데?,True,1,2024-12-08T12:58:46+0900,844976325079859413,1,0,0
ngan****,2FcN9,한동훈은 헌법에도 없는 세자놀이 그만둬라....너가 무슨 권한으로 그러냐,True,1,2024-12-08T12:58:04+0900,844976280267915288,1,0,0
ithu****,,,False,1,2024-12-08T12:57:55+0900,844976270168031519,0,0,1
snoo****,2E0Wz,한덕수 저것도 수사대상인데 뭘 협치를 해? 그리고 헌법어디에 야당대표가 국정운영이 가능하다고 돼있냐? 탄핵 되면 법에 명시된 대로 총리 총리가 안되면 경제부장관 그놈도 안되며 다 이렇게 순서가 정해져있는데,True,1,2024-12-08T12:56:41+0900,844976191130566850,1,0,0
dund****,LcSX,국민들이 부여하지도 않는 권리를 내세워서 니들이 선거도 없이 대통령 대행할려고?  쿠데타보다 더 웃긴다. 치워라.대통령 과 국정협의체를 운영한다면 또 몰라..한동훈 너무 까분다.,True,1,2024-12-08T12:55:43+0900,844976128400556238,1,0,0
asd1****,,,False,1,2024-12-08T12:55:35+0900,844976119475077308,0,0,0
naqk****,GRYi,법대로 해야지...왜 법을 어길려고 하나요...법 어기면 기소당하고 재판하고 선고받잖아요...,True,1,2024-12-08T12:55:32+0900,844976117059158190,1,0,0
sebo****,,,False,1,2024-12-08T12:55:31+0900,844976115666649230,0,0,0
hnpa****,,,False,1,2024-12-08T12:55:18+0900,844976101372461152,0,0,0
kdam****,,,False,1,2024-12-08T12:55:16+0900,844976100030283859,0,0,0
trai****,1g7ke,내란범죄에 방조했던 놈들이 뭐 국정을 안정시키고 국민을 위하겠다고???? 사과한다는 놈이 그 와중에 야당보고 예산안 통과시켜달라 뭐 하나로 뭉쳐야되니 아주 같잖은 개소리만 짖어대는데 누가 이기나 두고 보자,True,1,2024-12-08T12:55:03+0900,844976085551546381,1,0,0
seur****,549H5,ㅋㅋ 차기 대통령 한동훈 만들기 국짐. 니넨 답없다 진짜. 박그네는 양반이었음.,True,1,2024-12-08T12:54:52+0900,844976073488728309,1,0,0
mira****,AYtx,"헌법에 어디도 선출된 권력이 아닌
총리와 여당대표에게 권리를 부여한적없습니다.

그걸 행사한다면 그것도 내란인데요????",True,1,2024-12-08T12:54:40+0900,844976061224583376,1,0,0
kihy****,,,False,1,2024-12-08T12:54:26+0900,844976046141866098,0,0,0
lunc****,,,False,1,2024-12-08T12:54:13+0900,844976031914786871,0,0,0
kjeu****,9MKI4,"총리가 내란 동조자인데 뭔 국정을 운영한다고 하지?! 국무회의 같이 해서 계엄령 선포할 거 미리 알고 있었는데 내란 동조자 아닌가?! 계엄령 반대할 거면 법무부 감찰관처럼 사표를 냈어야지.. 한 총리는 수사대상인데 왜 저러고 서 있는가! 한 총리를 비롯 국무회의에 참석한 국무위원들 누군지 밝히고 계엄령을 미리 알고도 침묵했기 때문에 어떤 식으로든 책임을 물어야 한다. 법이 누구한테는 매우 촘촘하고 왜 정부, 여당 인간들에게는 이리 허술할까?! 계엄령 해제 투표 참여 안 한 국짐당 의원 모두 내란 동조자이다.",True,1,2024-12-08T12:53:14+0900,844975968194920508,1,0,0
chsu****,3gDU7,"윤통은 헌법에 부여된 비상대권으로 부정선거 수사함,  한동훈은 위헌적 파렴치 행동으로  겁박하는 반역 아닌가?  국국통수권자의 권한을 니가 뭔데 정지하나???   이게 무슨 나라꼴이냐??/ 부정수사해보자. 그러고 난 뒤 판단하자. 왜 수사 원천 봉쇄 하냐??  &lt;부정선거 공개수사&gt;만이 정답이다.",True,1,2024-12-08T12:52:57+0900,844975950293631288,1,0,0
ider****,8lo6B,"한동훈 - 본인이 대한민국 상왕 으로 착각 중.
직권남용, 위법 행위 - 정신병 심각함 ~",True,1,2024-12-08T12:51:34+0900,844975860736852154,1,0,0
jjch****,,,False,1,2024-12-08T12:51:20+0900,844975846291669063,0,0,0
supe****,1541U,윤석열과 국민의힘만 도와주는 꼴이다. 국민은 안중에도 없다.,True,1,2024-12-08T12:50:41+0900,844975803878867162,1,0,0
leea****,,,False,1,2024-12-08T12:50:39+0900,844975801613942967,0,0,0
kjs1****,2qOB4,저거 지가 뭐 됀줄아네?? 너 뭐하냐??,True,1,2024-12-08T12:49:55+0900,844975754419634456,1,0,0
unab****,1WCLB,헌법상 국무총리와 여당대표는 대통령을 직무정지 시킬 아무런 권한이 없다. 이들의 이러한 야합은 위헌적인 정권연장 꼼수일 뿐이다. 반헌법적인 꼼수를 당장 집어치워라.,True,1,2024-12-08T12:49:51+0900,844975751013859586,1,0,0
jmsy****,,,False,1,2024-12-08T12:49:11+0900,844975707527315524,0,0,0
pnk8****,1XpUE,질서있는 퇴진이머냐 ㅋ ㅋ그래 차례대로 질서있게 앞에 윤가부터해서 국힘까지 그냥 감옥이나가라 다 한패같아보이니깐,True,1,2024-12-08T12:48:26+0900,844975659141824640,1,0,0
sola****,17srP,"동훈아, 네가 대통령 노릇하겠다는 거냐?  대통령이 엄연히 있는데 헌법 어디에 여당 대표가 대통령을 대신할 수 있다는 조항이 어디에 있냐?  위헌적 내란 행위로 인한 문제 해결 방법이 또 위헌적 방안이냐?  국무총리도 계엄에 동의한 자가 아니냐? 헛소리 말고 국민의 뜻을 받들어라. 탄핵이 정답이다.",True,1,2024-12-08T12:48:22+0900,844975655064961138,1,0,0
idon****,IbbO,법을 가장 잘 안다는 대통령과 당대표가 법을 유린하는군,True,1,2024-12-08T12:47:51+0900,844975621929959659,1,0,0
yhja****,,,False,1,2024-12-08T12:46:23+0900,844975527390347357,0,0,0
rkfk****,,,False,1,2024-12-08T12:46:08+0900,844975510864789537,0,0,0
dano****,2Fc1T,국민의 뜻 운운하며 간본게 그냥 당내 권력 장악을 위한 것이었구만..... ㅎㅎ 한동훈가 자신의 명언을 스스로 부정하네...,True,1,2024-12-08T12:45:46+0900,844975487158583536,1,0,0
jyjp****,1N7SX,대통령의 권한을 총리와 여당이 행사하는 것이 오히려 매우 무질서해 보이며 혼란 및 분쟁의 소지로 작용하여 더 무질서해질 것이 뻔해 보입니다. 우리나라 헌법은 이런 경우 어떻게 행동해야 하는지 어쩐 시스템으로 나아가야 하는지 잘 정리해 놨으므로 이 절차대로 가는 것이 매우 질서 있어 보입니다.,True,1,2024-12-08T12:45:41+0900,844975482242859213,1,0,0
yeah****,160bV,"이들이 한 말이 이렇게 느껴진다. 한덕수 왈, 나는 내란 동조범이긴 한데, 이거야 그냥 묻어두고, 침묵하면 아무것도 아닌 일이 되잖아? 그냥 권력은 내가 가질테니까 민주당은 예산 (돈) 이나 줘. 한동훈 왈, 윤석열 퇴진은 시킬게. 그런데 우리가 이재명에게 한 짓이 있어. 수사가 730번이 넘고 압수수색도 350건인가 그 정도로 털었는데 안털려서 20여년전 일 까지 끌어들여서 재판 중이란 말이야. 사법부와 검사들이 다 편향되어 있잖아. 내가 대통령으로 당선될 때까지 시간을 끌어볼게라고 들린다.",True,1,2024-12-08T12:45:25+0900,844975464526119031,1,0,0
ange****,1BruI,한동훈 왜 니가 하냐 그걸??,True,1,2024-12-08T12:44:57+0900,844975435350540548,1,0,0
kuk1****,,,False,1,2024-12-08T12:44:30+0900,844975405872971919,0,0,0
supi****,6hbRr,한동훈 미친거 아녀~~?  내란범과 협상를 하다니~~~~질서 있는 퇴진~~?  내란범에게 무슨 질서 있는 퇴진~~?,True,1,2024-12-08T12:42:57+0900,844975306350526751,1,0,0
nell****,2IwPX,위법한 계엄령이라면서 왜 그 수습도 위법한건데? 니랑 국힘이 뭔데 대통령 업무를 협의해서 대신하는데?,True,1,2024-12-08T12:42:00+0900,844975244576817158,1,0,0
lell****,23RKM,그냥 지들 하고싶은대로 던지네,True,1,2024-12-08T12:41:33+0900,844975215854223531,1,0,0
s98t****,wkHV,"미국무부 VOA - ""국힘에 대통령 권력양도, 절차 근거가 뭔가? "" 완벽한 위헌, 연성쿠데타.",True,1,2024-12-08T12:41:05+0900,844975185722343448,1,0,0
luxo****,,,False,1,2024-12-08T12:40:02+0900,844975117690732557,0,0,0
lieb****,2huBQ,니네 둘 부터 사퇴해라~  공범자들아..,True,1,2024-12-08T12:39:00+0900,844975051487838211,1,0,0
s3ww****,2z3R0,"지금 환율 방어 국민연금이 보유한 해외자식 빵꾸내면서 하고 있다. 안 그래도 고갈될 국민연금 갈아가면서 환율 방어하는 중인데, 해외자산 강제 청산 마지노선이 1410원이었다. 계엄 전에. 그런데 미친 돼지가 내란을 일으켜서 지금은 평상이 1410원이다. 국민연금? 그런데 이 상황을 질질 끈다고? 이게 단순히 정치 영역인 줄 알아? 이거 경제 문제고 생존과 직결된 문제야. 지금 당장 금융만 문제 있어 보이지? 이거 지속되면 바로 실물 경제로 연결된다. 이것을 다 알면서 이것들은 자리 보전 하겠다고 헌법조차 무시하면서 개짓거리하는 중",True,1,2024-12-08T12:37:01+0900,844974923997773837,1,0,0
yhja****,,,False,1,2024-12-08T12:35:43+0900,844974840430461152,0,0,0
myjj****,bxDbW,어쩌면 이것은 윤석열과 국힘을 없애려는 하늘의 뜻일 수도. 명태균 녹취 터져도 기소 안되는 대통령이 기소되는 내란죄를 저지르고. 탄핵에 반대한 국힘도 사라지고. 역사는 반드시 옳은 길로 간다. 동훈아. 너의 꼼수는 너의 머리카락 만큼 빈약하구나.,True,1,2024-12-08T12:33:51+0900,844974719617728769,1,0,0
back****,,,False,1,2024-12-08T12:32:10+0900,844974611018809401,0,0,0
kkim****,27CbN,"니들이 버틸수록 종말은 처참할 것이다,,,",True,1,2024-12-08T12:29:46+0900,844974457171738854,1,0,0
dhk9****,17xdo,반 헙법적인 인간들.,True,1,2024-12-08T12:18:52+0900,844973754256720143,1,0,0
lk78****,1fBPQ,이정부보다 재명이가 더싫타 감옥보내라.,True,1,2024-12-08T13:01:38+0900,844976509964779726,6,6,1
84sk****,2X8AG,더불어 민주당이 도가 지나친건 사실이지. 중국의 앞잡이 노릇이나 하는 더불어 간첩당을 놔둔다고? 국가 비상사태인건 맞고 비상계엄도 옳았다.,True,1,2024-12-08T14:12:25+0900,844981070397964414,4,4,2
bc58****,2Lq77,재명이를 빨리  감방으로 보내세요ㆍ그래야 나라가 안정됩니다,True,1,2024-12-08T15:59:06+0900,844987942815399981,3,3,0
stup****,,,False,1,2024-12-08T12:26:04+0900,844974218364846103,0,0,0
tmtl****,5O1Yb,윤통단죄에 앞서 이재명의 법적처분이 먼저다.현재 국정마비의 원흉은 이재명방탄국회다,True,1,2024-12-08T15:04:29+0900,844984423911784587,2,2,0
wdk0****,,,False,1,2024-12-08T15:03:49+0900,844984381733863675,0,0,0
melc****,GElz,국민이 탄핵시키라는데 뭔 자꾸 질서를 찾냐? 탄핵하면 무질서냐? 국민의 적 너희들이 혼란에 빠질까봐 국민 버린거잖아 본인들 살 궁리만하고 자빠졌으니 내란 수괴 부역자 국민의 적,True,1,2024-12-08T14:35:00+0900,844982524277948417,2,2,0
kimj****,,,False,1,2024-12-08T13:03:57+0900,844976659214893338,0,0,0
daij****,3mfbg,"대놓고 ""국정농단"" 선언 잘 봤다. 니네들은 이제 국민의 심판만이 남았다.",True,1,2024-12-08T12:47:06+0900,844975572974043174,2,2,0
yaff****,1WHtH,한동훈 미쳤나봄. 부정선거 밝히려는 대통령 훼방이나 하지마,True,1,2024-12-08T12:40:13+0900,844975130441416774,2,2,0
drsm****,1YZjs,지금 이 공동 담화 자체가 위헌이고 불법이다. 탄핵 만이 대통령 직무 정지의 법적 효력을 갖는데 누구 마음대로 니들이 권력을 일임 받으며 그것이 어떤 법에 근거한단 말인가? 내일이라도 당장 대통령이 말 바꾸면 끝인거구 그 누구도 현행 대통령직의 결재라인을 대체할 수 없다. 속지 마라. 이 것들은 내란 현재 진행형이다. 내란은 끝나지 않았다.,True,1,2024-12-08T12:34:33+0900,844974765234978993,2,2,0
bhs6****,,,False,1,2024-12-08T12:32:18+0900,844974620044951642,0,0,1
eyes****,1mag8,이재명하고 묶어서 바다에 던지고싶은 악질 한동훈,True,1,2024-12-08T12:19:32+0900,844973797172838558,2,2,0
ksju****,,,False,1,2024-12-09T16:35:24+0900,845083052634800320,0,0,0
jjsl****,2RaBr,"대통령의 계엄령이 불법 이라면 헌법에는 왜 있는거야?
국회의원들이 지들 월급은 인상하고 전국민 지원예산다 삭감하면 대통령이 계엄이라도 선포해야 되는거 아님?",True,1,2024-12-09T11:07:54+0900,845061953624736135,1,1,0
myp0****,1Uclt,"권한없이 불법을 저지르지말고
국민의 명령에따라 탄핵후
법테두리서 하시죠?",True,1,2024-12-08T22:15:35+0900,845012197133254865,1,1,0
ksh6****,7bHtR,질서있는 조기퇴진만 짖고있네 ㅍㅎㅎㅎㅎ. 오바떨지 말고 내려와라 체포한다,True,1,2024-12-08T22:11:58+0900,845011964852699449,1,1,0
inje****,,,False,1,2024-12-08T21:47:29+0900,845010387341410491,0,0,0
kun0****,,,False,1,2024-12-08T18:46:38+0900,844998736168878263,0,0,0
galr****,ePVBo,권한 따지는데  법적으로 대통령 부재시 누가 대행을 하냐? 총리아녀?  나들은 째묭이가 하야 된다고 우기고 싶은거냐? 이 개들아 나라 어지러울때 니들이라도 좀 짜그려져 있어라. 얼마나 더 나라룰 혼란에 빠트리고 싶어서 요 재롱들이냐,True,1,2024-12-08T17:58:18+0900,844995622149816412,1,1,0
nalb****,1JAyi,선거-대통령판단으로 헌법77조 발령 - 계엄법 11조에 의해 계엄해제요구 - 해제. 민주주의 절차의 극치구만 내란 어쩌구 하는건 1. 대통령 선거에 승복않는 반민주적 행태. 2. 대한민국의 헌법을 우습게 여기는 행태. 지령을 따르는게 민주주의라는 더불당꼬라지.  그리고 한동훈이 나서는게 무질서다. 질서있게 한동훈은 일단 물러나라.  국민의 투표를 우습게 여기고 헌정을 능멸하는 여당대표는 필요 없다.,True,1,2024-12-08T17:57:25+0900,844995565677707407,1,1,0
sun_****,igiE,가장 질서있는 조기 퇴진은 탄핵입니다. 국민의 뜻이 그러합니다.,True,1,2024-12-08T16:41:48+0900,844990694278824223,1,1,0
jayo****,90Mfq,"한가발 잡혀갈까바 발발떨며 탄핵찬성하더니
대통령놀이 하게 해준대너 말바꾼거구나 니도 곧 가발벗고 감빵갈꺼니 준비해라",True,1,2024-12-08T16:25:52+0900,844989666926002453,1,1,0
long****,,,False,1,2024-12-08T16:09:39+0900,844988623064400105,0,0,0
yhm1****,2EWnE,행자부장관 사의는 오늘 대통령이 결재함 ㅋㅋ  니들 머하는 짓?,True,1,2024-12-08T16:09:30+0900,844988612729635006,1,1,0
rain****,16NQ0,더 혼란만 부추기고 있네 에효...,True,1,2024-12-08T16:07:22+0900,844988475525562476,1,1,0
kimk****,1DgxG,국회의 협조를 구한다고 합법이 되진 않아! 니들 좋아하는 법적 책임대로 직무 정지시키려면 탄핵 아님 하야 밖에 없어! 하야 선언을 하던가!,True,1,2024-12-08T16:04:59+0900,844988321896595761,1,1,0
whdt****,1oQm7,한동훈이 주적이다,True,1,2024-12-08T15:59:12+0900,844987949643726920,1,1,0
yomm****,1YjIn,머 이런 이싱한 말도 안되는 소리를 하지?   가장 빨리 질서가 잡히는 퇴진이 탄핵이야. 빨리 처리해.,True,1,2024-12-08T15:57:03+0900,844987811047145490,1,1,0
kasi****,T8UV,"국민이 아무 권한도 주지 않은 한동훈이다
 12.3사태에 권력찬탈을 기도중인 시대의 사기꾼.",True,1,2024-12-08T15:56:52+0900,844987798682337577,1,1,0
8pal****,,,False,1,2024-12-08T15:56:51+0900,844987797726036209,0,0,0
pcmk****,1UtUH,권한도 없는 게 지나치게 촐랑되서 국민이 혼란스럽다,True,1,2024-12-08T15:55:58+0900,844987740784165221,1,1,0
yjhu****,2J2Ci,내란 수괴  ... 윤석열은 .. 그대로 대통령 이고  .. 내란방조 정당 .. 국민의 힘과  ..  내란방조 국무위원들이 .. 국가를 운영 하겠다고 ?  .. 대한민국이  .. 내란민국 이냐 ?  .. 니들이  무슨 염치로  .. 권력을 탐해 ? .. 내란 수괴 에게 ... 질서있는 퇴진 따위는 없다  ..  내란수괴 윤석열에게는  .. 천벌만이 있을것이다 ...,True,1,2024-12-08T15:53:05+0900,844987554942943264,1,1,0
lms7****,6uiQF,동훈이가 내란범이네.무슨 말이 않나온다.,True,1,2024-12-08T15:52:25+0900,844987511976493181,1,1,0
hghj****,3WUF5,대한민국을 졸지에 무법이 난무하는 나라로 만들어 버린 윤석열과 국짐당들은 역사에 역적으로 남을 겁니다,True,1,2024-12-08T15:50:34+0900,844987393210581163,1,1,0
jjjj****,3mpHT,니들이 몬데  니들 맘대로 한다는거야  나라가 니들거니  국민이 주인인데  누가 니들한테 그런 권한준거야  니들은  공범 아니가~~~~나라가  망조들기전에  조용이 살거라   국민이  대노한다,True,1,2024-12-08T15:50:08+0900,844987364957749283,1,1,0
suji****,5QY1V,당신들이 무슨 권리로 국정을 논하는지..국민은 당신들에게 국정을 위임하지 않았다..,True,1,2024-12-08T15:45:34+0900,844987071541018813,1,1,0
appl****,6p1go,"위 두넘들은 대한민국을 말아먹는 적패들... 그 이상, 이하도 아니다!",True,1,2024-12-08T15:43:24+0900,844986931417710712,1,1,0
gtc1****,3gREf,"입법부인 국회를 군화발로 짖밟고, 주요인사를 체포하도록 지시한 수괴 윤석렬현대통령과 그를 저지하지 못한 한덕수국무총리도 내란의 수괴 윤석렬현대통령과 협상을 하여 국정운영을 할려고하는 한동훈국민의힘 당대표를 국정운영할 자격이 없다고 생각합니다. 탄핵이 답입니다.",True,1,2024-12-08T15:39:41+0900,844986692174610642,1,1,0
suhi****,45ao,"윤통은 행안부장관 사표 수리 하며 본인의 권한을 행사하고 있고, 직무도 정지가 안된 상태에서 법률적 근거도 없는데 국무총리와 여당대표가 자기들 마음대로 권력을 행사하겠다! 코미디하는 것도 아니고....나라 말아먹어라 ~~ 기냥 너희들이 좋아하는 법대로 해!! 법대로!!",True,1,2024-12-08T15:38:31+0900,844986616878465193,1,1,0
it10****,4mfnJ,저놈들이 지들 잘못을 모르고 지네가 수습할라고 해?!,True,1,2024-12-08T15:37:49+0900,844986571881971973,1,1,0
flor****,2Sel9,한동훈은 왕 아들이냐? 조선시대냐? 뭔데 좌지우지 난리??,True,1,2024-12-08T15:37:18+0900,844986538746970201,1,1,0
ccho****,2NKUG,"한덕수총리와 장관들 전부다  구속 시켜야하는건데
무슨 ~~
한동훈은 왜 끼는데 뭔짓을 하는겁니까",True,1,2024-12-08T15:37:03+0900,844986522271744020,1,1,0
fedo****,6sE0h,가발의힘당 니들이 뭔데 니들은 대한민국 정당도 의원도 아니야 국민이 버렸어,True,1,2024-12-08T15:37:00+0900,844986519469948930,1,1,0
lbh1****,ES4V,어디 총리랑 국회의원도 아닌 여당 대표가 나라를 휘어잡으려고 하냐?,True,1,2024-12-08T15:21:33+0900,844985523775733921,1,1,0
dhen****,8pDZB,탄핵이면 끝날일을 권력을 그리 놓치기 싫었나 민주당도 똑같은 넘들이지만 니들은 명분을 잃었다,True,1,2024-12-08T15:18:18+0900,844985314530295917,1,1,0
myme****,2cUXzs,윤석열 지켜주고  대통령 가지려는  한동훈 과 국민의힘 을 그냥 두고만보지 않겠습니다,True,1,2024-12-08T15:15:17+0900,844985120300466272,1,1,0
smai****,36kEc,대한민국 국민은 탄핵이 뜻인데 어디 너그 국민은 북한인민이가?아님 일본 신민들이가?,True,1,2024-12-08T15:07:48+0900,844984638072946953,1,1,0
su81****,eRis5,"한동훈놈  가족몰살 시키자
역적들은 모조리 처단",True,1,2024-12-08T15:07:41+0900,844984630892298429,1,1,1
toto****,1Y1jH,네들이 뭐냐? 일단 한총리는 탄핵될 것 같고 국민의힘은 위헌정당으로 해산될 듯.,True,1,2024-12-08T15:04:13+0900,844984407453335631,1,1,0
alom****,,,False,1,2024-12-08T14:56:03+0900,844983881286287380,0,0,0
yiki****,,,False,1,2024-12-08T14:49:26+0900,844983454121590923,0,0,0
leew****,1dp6T,내란수괴 석렬이 즉결심판해서 사형시키고 내란수괴 공범 한덕수 무기징역 처하고 한동훈은 군사반란 정당 수괴로서 징역 100년에 처하라,True,1,2024-12-08T14:47:49+0900,844983350773940484,1,1,1
zint****,2wJ8e,더불어공산당이 한 짓은 내란 아니냐?? 다 읊어줄까!!?,True,1,2024-12-08T14:27:22+0900,844982032520970327,1,1,0
pghk****,,,False,1,2024-12-08T14:25:32+0900,844981915197898916,0,0,0
said****,puk2,국민이 대통령에게 부여한 권력을 누가 마음대로 이양하고 지들끼리 서로 난리를 치는거냐... 국민은 너희들에게 권한을 준적이 없다.,True,1,2024-12-08T14:16:26+0900,844981328112779379,1,1,1
whit****,5zdQ6,이럴수록 국민은 가만히 있어야 한다....사회혼란을 핑계로 또 계엄 선포할지 모른다....쥐가 궁지에 몰리면 고양이를 문다고.....조용히 기다려야,True,1,2024-12-08T14:16:16+0900,844981317962563669,1,1,0
sjw2****,1d26z,"내란 동조세력이 무슨 권한으로 협조를 구하며 질서있는 퇴진 자체를 운운하는거지? 내란 수괴가 버젓이
대통령실에 앉아있고 6개월내 하야같은 말장난치는 니들또한 역사의 심판을 받을거다",True,1,2024-12-08T14:06:48+0900,844980708513415395,1,1,0
cast****,1xlJP,"국민의힘 당, 여전히 대한민국 국민들 한테 쿠데타 놀이를 하네요.",True,1,2024-12-08T13:31:39+0900,844978443706695868,1,1,0
jinh****,6dlXr,탄핵이 왜안된건 더블 범죄폭주당때문이다 촛불꺼진지가 언젠데 국민팔이하고 민생민생 하드만 죄명이 방탄에 입법사법행정까지 탄핵첼린지 하는데 국민들이 는뜬 바보인가? 니들이 잘했면 지금같은 말도안되는 계엄에 국민들이 가만히 있었겠니?  국민들 대다수는 이번탄핵이되도 니네들한테 정권 못맡긴다는게 국민들 생각이다!! 위선주의자들아!!!,True,1,2024-12-08T13:16:57+0900,844977495978541329,1,1,0
sant****,4RoGj,이러다 정말 군부독재보다 백배는 끔찍한 이재명 대통령되는날이 올지도 모르겠다,True,1,2024-12-08T13:16:24+0900,844977461367144596,1,1,0
ohwe****,,,False,1,2024-12-08T13:11:52+0900,844977169376477413,0,0,0
wuth****,,,False,1,2024-12-08T13:03:09+0900,844976607239077936,0,0,0
ksg3****,,,False,1,2024-12-08T12:59:29+0900,844976371133317296,0,0,0
naps****,Fl0c,대표성이 분명한 국회의장이 이끄는게 맞다,True,1,2024-12-08T12:52:55+0900,844975947911266580,1,1,1
0906****,40HQb,"한동훈,  한총리  잘한다          범죄소굴   민주당한테   뽄때를        보여줘라     저놈들이      강제로     정권을        찬탈하려고      수작을   꾸미고 있다      
한총리,     한동훈      난세의   영웅들        만세    !!!",True,1,2024-12-08T12:50:10+0900,844975771029078058,1,1,0
