user_nickname,userIdNo,comments,visible,replyLevel,regTime,parentCommentNo,sympathyCount,antipathyCount,replyAllCount
chan****,2bCLx6,찢재명 혈세두둑넘 떨거지들지지자들아 도둑넘이 대통이 말이되냐 이재명이 줄탄핵 남발이 죄가 더크다 박멸하자 줄탄핵남발이 내란 수괴다,True,1,2025-03-12T10:41:25+0900,853687977736405149,1,0,0
ppga****,1JHkt,개잡범 이재명만 없어지면 나라의 위기는 끝.~~,True,1,2025-03-12T10:40:08+0900,853687895511269449,1,0,0
hsn1****,6jeos,"부산 기장군에 있는 한 은행에 강도가 침입, 검은 비닐봉지를 들고 권총인 것처럼 위협했다고 한다. 용감한 은행 직원과 고객이 힘을 합쳐 강도를 제압, 경찰에 인계했다는데~~ 수상한 비닐봉지에는 장난감 물총이 들어있었다고. 그런데 이 기사에 달린 댓글이 압권이다. *아무 일도 일어나지 않았다. 2분짜리 은행강도가 어디있나? 법의 테두리 안에서 행동한 것이다. 호수에 비친 달빛 그림자 잡는 꼴 아닌가? 구속은 취소되어야한다. 만원한장 도둑맞지 않았다. 아무일도 일어나지 않은 것이다~~! 내가 진짜 은행을 털생각이였나? 이게 맞나?",True,1,2025-03-12T10:37:02+0900,853687695610740749,1,0,0
opal****,5rlnX,헌법에 따라 국민이선출한 대통령이 국민 경호원 경찰을 다치게하지 않으려고 불법 집행에 자기희생을 각오함!!! 이런 대통령이 도주 위험있다고 판사쇼핑 불법 위조 문서등으로 영장발부하고 무죄추정원칙 방어권도 무시하고 구속시킨것들이 막가파 찢죄명+공수처이고 헌법과 국민주권을 짓밟는 내란공범들이다!!! 사기탄핵 원천무효!!! 각하만이 답이다!!! 대통령 복귀 필수!!!,True,1,2025-03-12T10:36:46+0900,853687678497980756,1,0,0
naza****,dS1Va,"사건이  간단해서  박근혜 때보다  빨리 끝낼 수
있다며?  다 헛소리였어?     변론은 숨가쁘게
1주일에 두번씩 해놓고  왜 뜸들이니?
  헌재가 정치질 하니 이 모양이다!  못된 것들~",True,1,2025-03-12T10:34:42+0900,853687545454657854,1,0,0
mang****,2cN1rJ,판사들 어이없네 정말 신뢰가 안간다,True,1,2025-03-12T10:34:09+0900,853687509735964757,1,0,0
sey9****,24h4K,헌재는 저런 비정상적인인간을 다시 대통령자리 앉히면 나라 끝장나는거 알아야한다,True,1,2025-03-12T10:32:13+0900,853687385450348654,1,0,0
inns****,1KfQU,ㅋㅋㅋ 어이가 없네. 숙고할 것이 뭐가 있다고.. 증거가 차고 넘치는데..,True,1,2025-03-12T10:30:12+0900,853687254856499293,1,0,0
rfc9****,18RPu,우리나라 대한민국을 북괴 김돼지 처럼 독재굥산주의 만들려고 한 내란수괴 윤두창이 아직도 열렬히 지지하는 대구 경북 부울경 견 상 도 2찍이 개돼지들은 따로 독립해서 견상민국 만들어서 살아라,True,1,2025-03-12T10:28:10+0900,853687123776110679,1,0,0
by20****,,,False,1,2025-03-12T10:28:07+0900,853687120957538368,0,0,0
ikoo****,eNT1p,내란수괴에 대해 심사숙고할 게 뭐가 있음?.. 진심으로 궁금,True,1,2025-03-12T10:27:47+0900,853687100053127513,1,0,0
free****,3gC5I,숙고 항께 있나요?  그냥 기각이 답이다.,True,1,2025-03-12T10:26:54+0900,853687042909929894,1,0,0
t_ma****,mV6l,길어진다? 음란수괴 행배가 원하는 숫자가 안나왔다는 뜻이다. 5:3 또는 4:4 기각,True,1,2025-03-12T10:26:46+0900,853687033883787594,1,0,0
5039****,1g0rd,심사숙고가 아니라 ㅂㅌ행배가 제 뜻대로 안되니 시간 질질 끄는거겠지,True,1,2025-03-12T10:26:17+0900,853687002694942856,1,0,0
eddy****,10mpk,탄핵 인용하려니 정족수가 부족하여 기각 의견 재판관들 설득하느라 시간이 걸리는 것은 아닌지 의심된다.,True,1,2025-03-12T10:26:04+0900,853686988484640792,1,0,0
sa15****,1bbMh,헌재 이놈들이 장난하냐 전국 자영업자 매출이 3/2 줄어 자영업자 하루에도 수십명씩 망해가는데 폼잡고 기세부리냐 한심환놈들,True,1,2025-03-12T10:24:22+0900,853686879919276197,1,0,0
mom1****,23tnZ,"1더하기1 이 어려운 문제인가? 뭘심사숙고 한다는건지?
지친다 빨리 인용해서 평안좀 하자",True,1,2025-03-12T10:20:46+0900,853686647152181593,1,0,0
bhs0****,2FqFn,판사 -----법원 개혁 반드시 해야 한다 ---이런걸 무서워 질질 시간 끌기 하고 잇다고 보지요,True,1,2025-03-12T10:20:29+0900,853686629234114776,1,0,0
bizm****,2LV9M,단 한명에게 국가의 흥망성쇠를 결정하게 하는것은 지극히 황당무게한 법이다. 국가의 존망과 사회불안을 야기할 수 있는 1인 독점 권력은 필히 법률을 개정해야 한다. 러시아는 물론 한국이나 미국이 하는 꼬라지를 보더라도 ..단 한명의 권력자의 망상적 행동으로 수억명의 생사를 좌지우지 한다는건 정치적 이념과는 별개로 명백한 월권이고 범죄다.,True,1,2025-03-12T10:17:03+0900,853686407590314021,1,0,0
jmbi****,2F7Nx,포고령 한번이라도 읽어봐라. 바로 답 나오지..,True,1,2025-03-12T10:15:51+0900,853686330951991708,1,0,0
puri****,,,False,1,2025-03-12T10:15:35+0900,853686313453355270,0,0,0
angu****,ueJZ,법원판사와 검찰총장에 의해서 석방된 윤석열의 법해석이 잘못되었다는 것을 국힘당에서 스스로 인정했더구나. 석방판결에 대한 즉시 항고권을 삭제하는 법안을 국힘당이 발의했으며 대검은 시간계산이 아닌 일자로 계산하여 석방을 결정하는 지침을 준스하라는 지침을 내렸다 한다. 그러니까 윤석열의 석방은 국힘당과 검찰이 잘못되었다 자인한 것이다.  참으로 무법천지 나라가 되었다,True,1,2025-03-12T10:14:53+0900,853686268070986114,1,0,0
stre****,H5Ad,이재명이 너무너무 싫어요..네.....,True,1,2025-03-12T10:10:21+0900,853685976130650247,1,0,1
crom****,CqB,주사파 선동질을 볼게 아니라...탄핵의 요건인 내란혐의에 대해 입증을 못하면 당근 기각이다..대통령은 군통수권자이며 나라안에 혼란이 있을시 비상계엄령을 선포할수 있다.과연 작금의 사태를 짚어보면 된다..나라안에 간첩에 잇는데도 법에 의해 처벌이 불가하며 온통 나라안에 혼란을 야기하는 집단들이 존재하는데 이를 묵살하는것도 헌법재판소의 직무유기이다.이번 내란혐의로 탄핵이 되었기에 꼼수를 부린 민주당의 권력남용은 탄핵 사유가 될수 없다.절차적하자다.내란혐의가 입증되지 않으면 100% 탄핵 기각이 정답인것이다.,True,1,2025-03-12T10:09:20+0900,853685910498181266,1,0,2
d009****,IlhO,진짜이성적으로좀생각합시다.하루라도빨리새대통령선출해서국가를바로세우는것만이최선아닌가싶다.손쓸수없을정도로더망가지기전에그때는누가돼도힘들것같다.정말괜챦은나라라생각했었는데,True,1,2025-03-12T10:06:40+0900,853685739001479456,1,0,0
idal****,4RhNv,정상인 국민들 속터진다   경제는 점점 안개속으로  사기꾼부부는 국민세금으로 쳐먹고 자고 편하게,True,1,2025-03-12T10:05:52+0900,853685687898079560,1,0,0
ylan****,,,False,1,2025-03-12T10:05:15+0900,853685647800533110,0,0,0
dude****,3CTfq,"왜 심사숙고하지? 곽종근이 민주당으로부터 회유,협박당한 증언 녹취록도 나왔고 , 홍장원 사기위증도 다 밝혀졌는데 당연히 탄핵심판 각하지 왜지? 헌법재판소에 주사파 문형배,이미선,정정미,정계선때문인가? 왜지?",True,1,2025-03-12T09:59:16+0900,853685262327218295,1,0,0
nest****,43nbA,"1찍 개돼지들은 그냥 중국이나 북한으로 이민가라. 니들 지지하는것들의 정체성이 공산당인데, 왜 여기서 깝쳐.",True,1,2025-03-12T09:52:05+0900,853684799779373101,1,0,1
trus****,2m2hb,쟁점이 많아서 숙의는 개뿔...아무리 머리 굴려도 탄핵 기각할 도리가 없으니 결정이 늦어지는 거지..,True,1,2025-03-12T09:48:59+0900,853684599425859972,1,0,0
sols****,hdxA,군인이 헬기타고 국회에 갔는데 쉽지 않나?,True,1,2025-03-12T09:48:14+0900,853684551761789032,1,0,0
kdh1****,2hoFy,"심사숙고할만한 사유가 있나? 윤석열의 위법한 계엄선포, 군을 동원해 국회 찬탈시도, 군의 선관위 점검등 대한민국 및 전세계가 생방송으로 목격했다. 1초도 심사숙고할 가치가 없다. 숙고할 정도의 위법성,불법성을 저지른게 아니다.",True,1,2025-03-12T09:44:54+0900,853684336342335845,1,0,0
murp****,JkJi,"헌재가 범죄자의 뒤를 봐주느라 고의 늑장 평의를 한다면 그건 역대 최악일것
윤석렬과 김건희는 그 뒤를 파봐야 한다 심우정 검총이 나선것도 석연치않은 연결고리다
모든 악랄했던 지난과거가 모든 국민이 수치스럽겠지만 알아야할 진실이고 니넨 벌받아야한다 진심으로",True,1,2025-03-12T09:43:38+0900,853684255157387509,1,0,0
gver****,WkAt,헌법 위반행위 누가 봐도 다 아는데.. 빨리 선고하라고~~,True,1,2025-03-12T09:42:51+0900,853684204657967406,1,0,0
icec****,xrOv,바르고 빠른 판단으로 나라의 안정을 찾게 해야한다!,True,1,2025-03-12T09:42:48+0900,853684201487073598,1,0,0
yeom****,1nEK4,"와......이게 심사숙고해야 하는 일이라고....ㅡㅡ;;

와......TV에서 경찰이 국회의원을 막고 군인이 창문깨고 국회를 들어가는 걸 봤고 헬기가 국회 상공에서 내려오는거 봤고 다 봤는데....심사숙고라고?????????????????",True,1,2025-03-12T09:42:25+0900,853684177311105176,1,0,0
wink****,2cuXYP,"하나님이 판결해도 승복하지 않을 사악한 인간인데... 헌재는 내란수괴의 승복을 기대하지 말고, 절차와 수순에 따라 신속히 판결하시기 바랍니다.",True,1,2025-03-12T09:42:05+0900,853684155165179937,1,0,0
chan****,2bCLx6,더듬만진당 탄핵남발 입법독재 국정마비 죄가 더크다 사기 탄핵이다 더부러 패악질당 저것들 그냥 놔두면 안된다 나라를 너무 어지럽히는건 저것들이다,True,1,2025-03-12T09:40:02+0900,853684023749246992,1,0,0
hyer****,1XQFY,"능력도 안되는 판사가 주심맡아서 내란이 뭐가 어렵다고,,, 빨리 탄핵이나 시켜,,, 답답하네,, 정말,,",True,1,2025-03-12T09:39:02+0900,853683959022747665,1,0,0
gwas****,2XhUn,생중계로 전국민이 다 시청했습니다.위헌과 불법을저질러온 윤석열을... 그냥 초등학생도 알만한 상식 아닙니까~~~~하루 빨리 인용 선고하고 위기의 나라를 살려 냅시다~~~~재판관님들~~~,True,1,2025-03-12T09:35:47+0900,853683749961859370,1,0,0
kjin****,,,False,1,2025-03-12T09:34:59+0900,853683698002821515,0,0,0
gmla****,2UTno,"""시험에 들게 하지 마옵시고 다만 악에서 구하옵소서!"" 민주화이후 헌재가 처름 경험해본 암덩어리. 위험한 수술이 되겠지만 그렇다고 더 지체하면 대한민국이 망할수도.",True,1,2025-03-12T09:34:11+0900,853683646178000968,1,0,0
qqww****,6bEGS,"이 나라는 너무 썩어서 악취가 진동한다...노예근성, 천민근성, 식민근성이 망국을 부르고 있다!!",True,1,2025-03-12T09:33:38+0900,853683610744520919,1,0,0
choi****,,,False,1,2025-03-12T09:33:24+0900,853683595494031522,0,0,0
7067****,4GBHs,증거가 넘치는데?,True,1,2025-03-12T09:27:24+0900,853683209366405285,1,0,0
wnst****,3vNyO,"당연한 파면을 이렇게 질질 끄는 이유가 뭐냐 ㅠ
스트레스받는다",True,1,2025-03-12T09:27:20+0900,853683204987551877,1,0,0
than****,2eg9E,"만장일치가 아닌가 보네.... 일부는 기각, 일부는 인용이라... 한 쪽이 다른 쪽을 설득하고 있는 것인가...",True,1,2025-03-12T09:26:35+0900,853683156367180000,1,0,1
cho1****,1ozf0,군대를 동원한 반헌법적인 내란을 온국민이 지켜 봤는데 최장평의라는게 말이되는가 즉각 판결하라,True,1,2025-03-12T09:26:17+0900,853683137190822009,1,0,0
moon****,,,False,1,2025-03-12T09:25:04+0900,853683059562643484,0,0,0
ssoo****,zU8S,"180일 채우거나 야당대표 3심까지 나온 후에 선고하려나본데.
헌재도 모두 한통속이냐?

'불법은 아니니까 우린 시간 다 가질게' 이러고 철면피들이네.

구속일자 시간계산하라는 판사도 있는 마당에 사법부도 검찰만큼이나 못 믿을 것들이다. 

하긴 그자들이야 가난한 자들 죽어나가는거 무슨상관이겠나. 

하락장에, 달러 급등에 미리 배팅해놓고 이제껏 12월3일부터 이익만 보고 있을텐데. 

좋겠네.",True,1,2025-03-12T09:22:24+0900,853682886774096017,1,0,0
mk78****,1nNbs,헌법재판관 탄핵은 없나? 무슨 최고존엄 천상천이네.,True,1,2025-03-12T09:22:13+0900,853682875768242254,1,0,0
ddsm****,4U8M4,60대 이상이 많이쓴 댓글은 다 정신 아픈 사람들이 쓴것 같음,True,1,2025-03-12T09:21:56+0900,853682857648849239,1,0,0
comi****,YALt,너무 머리 좋고 공부 많이 하셔서들 그런가... 지극히 간단한 사안에 이렇게 심사숙고 하시는 이유를 모르겠다.,True,1,2025-03-12T09:20:41+0900,853682777185321217,1,0,0
ycha****,5P2r6,"계엄 전후 일련의 상황을 보면, 그들만의 공산체제 북한인민재판을 구축한 것으로 보이고, 집권초부터 하야 외치고, 탄핵 특검 남발 국정마비, 성장 안전 안보 입법 예산 거부, 악성선동 연속 등이 설명되지요. 즉 목적자체가 국가전복입니다. 또한 중국 선거 국정개입 간첩, 세계적 문제고, 우리도 확인해야죠. 특히 그들 조직 북한5호감시 범죄 테러 홍위병화, 명백한 내란선동이고 검수완박한 이유죠. 자유진영 동맹 위협 등, 전방위적 공산화 작업이고, 정상국가에선 용납 안되는 계엄상황 맞습니다. 정당한 통치행위이고, 기각이 타당합니다.",True,1,2025-03-12T09:20:41+0900,853682776732336369,1,0,0
syna****,3zhYD,시간을 끌수록 나라만 더 시끄러워 지는데 ㅠㅠ,True,1,2025-03-12T09:18:29+0900,853682634495099060,1,0,0
asd6****,5MAAB,대통령 임기는 정해져 있기 때문에 그대로 두는 것이 더 안정적이다............그 사이에 헌법을 새로 정비하는 것이 順理일 뜻...............,True,1,2025-03-12T09:17:16+0900,853682556346826846,1,0,0
cyji****,c64aL,"빨리 빨리좀 해라 국민들은 뼈가 녹아들어가고 경제는 개판인데 어렵겠지만 날밥을 새서라도
빨리좀 합시다",True,1,2025-03-12T09:16:10+0900,853682485312094270,1,0,0
msch****,Le0R,시간이 오래 걸린다는건 결론이 잘 안나고 있다는거다. 8:0이면 벌써 선고했겠지.. 5:3 4:4 나왔으면 그대로 선고해라. 개수작 부리지 말고...,True,1,2025-03-12T09:14:30+0900,853682378860658854,1,0,0
dgki****,bAbz5,대한민국이바로설려면대통령탄핵이기각(각하)되어야한다그리고결자해지해야한다대통령도개헌과임기단축약속을지키고연금의료노사개혁을이루어내야다시일어설수있다국민소득세계6위면머하냐국민수준이후진국인걸사상누각이다한방에무너질수있다는절박감을가져야한다,True,1,2025-03-12T09:09:59+0900,853682087373308244,1,0,0
wind****,17IC2,계엄날부터 이재명의 그 흥분되고 밝고 거만해졌던 표정이 하루하루 길어질수록 진심으로 점점 썪어있다~마지막 기회일텐데~ㅋㅋㅋ,True,1,2025-03-12T09:09:34+0900,853682060194218188,1,0,0
live****,4TkRn,"""  각 하 :""",True,1,2025-03-12T09:08:40+0900,853682002447040777,1,0,0
user****,5HBVK,국민의힘을 지지함으로 좋은 일을 해봅시다 우리,True,1,2025-03-12T09:08:30+0900,853681992196161714,1,0,0
jhsp****,P4sb,심사숙고 할 이유가 있을까.  즉시 탄핵.,True,1,2025-03-12T09:06:51+0900,853681885761503551,1,0,0
mequ****,1rErs,이걸 숙고 할 거리나 되나 ? 미친놈 빨리 몰아내야지..,True,1,2025-03-12T09:06:17+0900,853681848465752159,1,0,0
bump****,,,False,1,2025-03-12T09:04:44+0900,853681748658094314,0,0,0
yic1****,,,False,1,2025-03-12T08:57:10+0900,853681261749731402,0,0,0
daks****,34FLE,윤석열은 파면한다 국민의힘은 공중분해 될것,True,1,2025-03-12T08:57:06+0900,853681257521872929,1,0,0
qual****,4IUVp,입헌 민주공화국을 포기하고 계엄내란국을 만들어 총칼로 시민들을 억압하겠다는 시대도 읽지 못하는는 철 지난 계략으로 이미 24.12.3일 밤 대통령직을 포기한 자를 신속히 정리해야.. 이재명도 법원판결 나오면 신속정리하고....,True,1,2025-03-12T08:54:13+0900,853681071076671569,1,0,0
jnk5****,,,False,1,2025-03-12T08:52:21+0900,853680950968582229,0,0,0
jnk5****,,,False,1,2025-03-12T08:47:26+0900,853680634751615127,0,0,0
team****,3bd0a,"애초에 홍장원 메모(지렁이 다섯마리), 곽종근 증언(의원빼내라)로 어떻게든 엮어보려는데, 변론하면할수록 더듬어인민당의 짜고친 거짓술수가 다 드러나니 ㅋㅋㅋㅋㅋ 이런증거들가지고 탄핵인용하면, 헌재야, 국민들이 가만히있겠냐 ㅋ",True,1,2025-03-12T08:47:08+0900,853680615474593839,1,0,0
banm****,1EjzZ,심사숙고 할 이유가 없는데 헌재가 눈치를 너무 보네. 내란수괴 윤가놈의 헌법유린과 국회탈취 목적이 적나라하게 드러났는데 뭘 망설이는지..헌재는 빨리 파면해서 국론분열이 더 이상 일어나지 않게 해야 한다. 떨어진 국격을 다스 추스리고 재도약 하기위해 할 일이 너무 많다.,True,1,2025-03-12T08:46:56+0900,853680602270925098,1,0,0
kimy****,2jGvu,자유민주주의 외치는 짝퉁 보수 극우 공신당원들...,True,1,2025-03-12T08:45:43+0900,853680524223316191,1,0,0
milc****,,,False,1,2025-03-12T08:45:35+0900,853680515482386623,0,0,0
thdt****,37aSx,"탄핵반대측은 정권 바뀌어서 민주당 출신이 계엄 선포해도 대통령 정당한 권한 행사니깐  별말 안할거지? 항상 반대입장이 되면 말 바꾸잖아 탄핵 반대가 진짜 권한과 법, 절차 때문이냐 아니잖아",True,1,2025-03-12T08:43:03+0900,853680351854198802,1,0,0
il95****,5n833,얼른  파먼해라  넌덜머리난다,True,1,2025-03-12T08:41:50+0900,853680273638818049,1,0,0
pret****,3rbvq,심사숙고 ?? 전세계가 생중계로 다 봤는데 ??,True,1,2025-03-12T08:39:29+0900,853680122912309400,1,0,0
llhh****,dmewu,"조중동와연 먹어에는 내란수괴 쥴리부부가 키우는 댓글부대가 항상 주둔중.
무지무식 덜떨어진 2찍들과 룬찍이들을 계속 꼬셔댄다",True,1,2025-03-12T08:36:14+0900,853679913431990352,1,0,0
kkh7****,94w3c,나쁜 짓 했는데 뻔한 뻔잔데 오랫동안 기간을 가네. 이게 나라냐 정신 차려라 빨리 사형시켜라,True,1,2025-03-12T08:36:13+0900,853679912123367489,1,0,0
ropi****,3fZTL,깜방이 어울림,True,1,2025-03-12T08:35:07+0900,853679840568541217,1,0,0
ckw3****,fO1I,기각 시킬려고 총 단결해서 피토하는 심정으로 발언하는 국회의원들 보면서...정치나 좀 그렇게 피 토하는 심정으로 잘 해보지..캐비넷이 무섭긴 무섭나 보다. 아니..생방송으로 전국에 나간걸...무슨수로 아니라고 하는데...,True,1,2025-03-12T08:33:55+0900,853679764131545350,1,0,0
llhh****,dmewu,매국매춘 쥴리부부를 탄핵각하 하는 재판관이 있다면 그것은 노상원의 데드 리스트에 오른 야권인사들을 다 죽여도 좋다라 허락하는것,True,1,2025-03-12T08:31:57+0900,853679637128020227,1,0,2
kdx3****,19D0e,맞을까바 겁나는거냐  맞으면  빵에 쳐넣으면 되지,True,1,2025-03-12T08:31:26+0900,853679603925909626,1,0,0
nh70****,5gCuQ,헌재에 심우정 같은 윤술통 꼬봉이 없다면 이런 내란 중범죄의 판단을 이토록 오래 할 사안인가?  만약 윤술통이 파면되지 않는다면 대한민국은 윤술통 처럼 대가리 이상한 놈이 수시로 개엄선포 군을 동원하여 민주주의를 말살할 것이다.,True,1,2025-03-12T08:29:21+0900,853679469674627183,1,0,0
bigw****,12hRe,빠른 파면이 나라안정과 경제회복의 길이다,True,1,2025-03-12T08:29:08+0900,853679455732760608,1,0,0
kspc****,1nXQU,"초등학교 산수문제를 들고 끙끙대는 건, 정답은 정해져 있는데, 정답이 아니게 만들어야 하기 때문이다. 고민이 길어질수록, 정답을 알고 있는 국민들은 대폭동을 준비할 것이다.",True,1,2025-03-12T08:28:59+0900,853679446102638894,1,0,0
goso****,bXBHh,정치권 눈치 보느라 눈깔이 돌아갈 지경인데 이걸 심사숙고라 칭한다 ㅋㅋㅋㅋㅋ,True,1,2025-03-12T08:26:33+0900,853679288916902018,1,0,0
wjdr****,,,False,1,2025-03-12T08:26:30+0900,853679286383542403,0,0,0
skyo****,1htL2,평시에 대통령이 개엄후 군인을  몰고  개엄해제권이 있는 국회로 들어 갔다. 이 탄핵 사건을 기각하면.  앞으로 어떤 대통령이 선출될지도 모르는데 그땐 어떻게 할건가? 매 대통령 당선될 때 마다 혹시 개엄할까 불안에 떨어야 하지 않을까.,True,1,2025-03-12T08:25:20+0900,853679210651189341,1,0,0
ktw8****,5Di6k,빨리 좀 해라 내란수괴가 총들고 설치거 극우 무식한늠들 꼬라지 보기 싫다 이게 뭐 해방후 무법천지도 아니고 나라 꼬라지가 이런데 재판관들 빨리 좀 하쇼,True,1,2025-03-12T08:23:13+0900,853679074218868797,1,0,0
kkck****,3RnJQ,"시간 걸릴 일도. 아니다!!!
세살짜리도 명백히 탄핵이란걸 안다~~",True,1,2025-03-12T08:23:10+0900,853679070980866086,1,0,0
ksh8****,,,False,1,2025-03-12T08:21:58+0900,853678993705009415,0,0,0
choi****,2gbLV,"나라꼴이 국내뿐 아니라 외국에까지 말이 아니다~~하루빨리 탄핵인용하고 파면시켜야 한다~~만에 하나 기각된다면 나라가 어디로 굴러가겠는가? 이미 윤씨는 국민들로부터 모든 신뢰를 잃었다~사실 입증된것도 잡아떼고 뻥근하면 거짓말이다~~즉 대통령으로 인정 안할뿐더러~~앞으로도 좀만 지맘대로 안돼면 또 계엄선포할것 아닌가~~다음 대통령에게도 계엄을할수있는 빌미를 제공해 주는것이다~
나라의 명운이 걸린 반결이다~파면만이 이길을 수습할수 있는 길이다~~",True,1,2025-03-12T08:21:19+0900,853678952248508497,1,0,0
alph****,doRUy,"국헌문란 목적으로 내란 쿠테타 기도 불법 계엄령 선포한 미치광이로 즉결 사형 했어야 하는데 날짜가 맞는데 사법부 재판이니깐 항고도 안 하겠다는 검찰과 시간 단위 구속이라고 사법 유린해 내란 가담 판사, 시간끄는 헌재, 국회의원 중에 분신하는 사람도 없는 민주당도 가만두면 안 된다. 완전히 전복된 파시즘 광기의 나찌 국가. 싹 다 체포해서 사형해야.",True,1,2025-03-12T08:21:05+0900,853678936847024150,1,0,0
pkjk****,1q5Ni,명백한 위헌 내란 계엄의 증거를 전국민이 실시간으로 봤는데 왜 오래걸리냐 빨라 탄핵해라,True,1,2025-03-12T08:20:38+0900,853678908124430479,1,0,0
sosy****,,,False,1,2025-03-12T08:20:36+0900,853678906144719017,0,0,0
lsg7****,1inhv,최장평의 기록경쟁 등이 중요한게 아닙니다. 기간에 구애없이 심사숙고하여 정치성향에 따른 판단이 아니라 공정한 판단이 중요합니다.,True,1,2025-03-12T08:17:48+0900,853678725303107804,1,0,0
jsh7****,2tdDE,"이재명 재판 결과 보고 내릴려나?  어차피 이재명 2심도 유죄로써 민주당 대선후보 없어진다.
차라리 윤석렬 임명하고 개헌이나 하라고 해라",True,1,2025-03-12T08:17:09+0900,853678683225849898,1,0,0
bonn****,1GCdK,반국가세력 고추점자리일당이 얼마나 많이 탄핵했으면 아직도 하냐?,True,1,2025-03-12T08:16:58+0900,853678672085778693,1,0,0
h111****,,,False,1,2025-03-12T08:16:35+0900,853678647372939425,0,0,0
sums****,aGCvu,심사숙고는 gr? 종북주사파 우들연구회가 그냥 뭉개고있는거지~,True,1,2025-03-12T08:14:06+0900,853678486965977120,1,0,0
jsh7****,2tdDE,"헌재는 위헌을 심판하고  국회는 법을 만들고,,,,대통령은 비상계엄 선포 할수 있다,,,
이게 무슨 잘못이냐?     대통령 고유권한이다,,,법을 뜯어 고치던가",True,1,2025-03-12T08:13:46+0900,853678465893794006,1,0,0
hann****,26Vzx,어이가 없군?!  헌법을 위배했냐? 아니냐가 그렇게 어려워?? AI판사 도입하자,True,1,2025-03-12T08:11:28+0900,853678317616758913,1,0,0
pink****,8d6ML,왜? 명확한데?,True,1,2025-03-12T08:09:41+0900,853678202827047072,1,0,0
myun****,,,False,1,2025-03-12T08:05:26+0900,853677928905441395,0,0,0
kchu****,,,False,1,2025-03-12T08:02:01+0900,853677708100501512,0,0,0
boom****,2cMOxa,불법수사 기록으로 대통령을탄핵? 헌재는 법을지켜라,True,1,2025-03-12T07:59:44+0900,853677562021281967,1,0,0
nadi****,4AYGE,정확하게 이건 기각 수준이 아니라 각하다. 아니 뭐 명확하고 확실한게 있으면 이렇게 평의를 오래 할 필요가 있나? 바로 인용 때려버렸겠지. 증인들 얘기도 다 다르고 그리고 탄핵소추단에서 내란 뺏는데 ㅋㅋ 문형배씨 머리통 굴리는거 전국민이 다 보고 있음,True,1,2025-03-12T07:59:38+0900,853677555260063911,1,0,0
even****,1UW5Y,명확한 사안을 기지고 뭘 꾸물대는지.바로즉시 탄핵해라.하루하루가 짜증나고 민주주의가 후퇴위기에 놓여있다.,True,1,2025-03-12T07:55:56+0900,853677317040373968,1,0,0
best****,8Cnec,내란 사건에 이렇게 심리가 길어질 이유가 뭐야? 정말 미친 거야? 빨리 탄핵 시키고 나라 정상화를 시켜야 할 거 아냐?,True,1,2025-03-12T07:55:33+0900,853677291622891652,1,0,1
