user_nickname,userIdNo,comments,visible,replyLevel,regTime,parentCommentNo,sympathyCount,antipathyCount,replyAllCount
rltn****,2WzRq,사기뉴수,True,1,2025-02-21T16:03:09+0900,851946050972287042,6,0,0
rnjs****,aKnUo,"참 나라가 콩가루가  되는구나.
국민의 안위를 보장해야할 군에서도 야단법석.
국회도 검찰 경찰도 하물며 국민들 까지도  편갈라 싸우니.
세상살다 내 이런일은 처음이다^^ 
윤석렬 대통령 이 사람을 죽였냐 나라를 팔아 먹었냐~?
이 모든 사단의 주역은 이재명 이다.
국민들이 결국 나라를 망친다.
뭐하러 민주당에 국회의원 그리 많이 찍어서 이사단을 만드냐고~????",True,1,2025-02-21T20:35:07+0900,851963572492697633,3,0,0
kywf****,,,False,1,2025-02-23T13:30:29+0900,852121757430055034,0,0,0
