user_nickname,userIdNo,comments,visible,replyLevel,regTime,parentCommentNo,sympathyCount,antipathyCount,replyAllCount
topw****,9NSlj,"마은혁 안되고 안되노 이미선 안되고..그럼 전놩훈당원이었고 수억 기부한 정형식과 국짐이 추천한 조한창.이 선고해야돼?

초등수준도 안되는  것들르  선동하면..탄핵을 버는 엑스맨들..",True,1,2025-01-29T18:25:50+0900,849821503355617449,1,0,0
matt****,9SAO2,이재명 절친 문형배 예전부터 유명하던데 이건 진짜 아니잖아 이래서 누가 판결을 납득함?,True,1,2025-01-29T18:25:44+0900,849821496963498138,1,0,0
madm****,In5B,국짐해체로 돌려받을것,True,1,2025-01-29T18:25:37+0900,849821488927211676,1,0,0
xeux****,310aN,하나회랑 우리법연구회랑 다른걸 모르겠다. 재명이 부역자 문형배가 무슨 재판을 보냐 캐약~~~퉷,True,1,2025-01-29T18:24:17+0900,849821403380187206,1,0,0
ori0****,1m29e,"별 말도 안되는 걸로 생트집을 잡네, 비열한 놈들.",True,1,2025-01-29T18:23:53+0900,849821377560051905,1,0,0
hoju****,2b95t,친윤검사들 다 동원해서 먼지털이 수사로 이재명 기소하는건 괜찮고?,True,1,2025-01-29T18:23:09+0900,849821330399297571,1,0,0
summ****,eehH,찢석열 지지자는 그냥 한강으로 가서 죽던가ㅉㅉ 저렇게 수준이 천박해서야~,True,1,2025-01-29T18:22:23+0900,849821281577599066,1,0,0
aji1****,2kvPv,탄핵당할짓 을 했으니까 탄핵이지.판사가 누구랑 친하다고 판결이 바뀌냐?,True,1,2025-01-29T18:22:20+0900,849821278205378623,1,0,0
yhy5****,vvcr,어차피 정형식도 탄핵 찬성할텐데 뭐하세요,True,1,2025-01-29T18:22:01+0900,849821257468739591,1,0,0
kong****,5oOsk,친윤이 뽑은 판사가 몇명인데 이런 헛소리를 하냐!!,True,1,2025-01-29T18:18:58+0900,849821061192089789,1,0,0
k1ji****,81kru,국짐당이 언제부터 형편성을 따졌냐!!입장바꿔서 니들 같으면 바꾸겠냐!!!,True,1,2025-01-29T18:12:01+0900,849820613575966721,1,0,0
muri****,5soNQ,"그러면 윤석열이 임명한 헌법 재판관들 다 손 떼야 
그래야 공정성 훼손 안된다.",True,1,2025-01-29T18:11:55+0900,849820606546313397,1,0,0
june****,3bY7a,"그런 논리면 이재명과 권성동이는 같은 중앙대 고시반이었는데, 그럼 권성동이가  프락치냐?",True,1,2025-01-29T18:11:42+0900,849820592671555730,1,0,0
samu****,1pgGP,어이구...친분있는 검찰들 데리고 처가의 온갖비리 다 덮고나서 이젠 판사하고 안친해서 재판 못받겠어요?,True,1,2025-01-29T18:11:30+0900,849820579904094330,1,0,0
mont****,1Y7k2,이재명이 내란 일으켰나? 이재명이 피고인인가? 저런 식으로 따지면 이재명과 권성동도 막역한 사이인데?,True,1,2025-01-29T18:11:18+0900,849820567103078470,1,0,0
dydv****,2bMNay,"김용현 국방장관의 증언거부권 행사에대해 왈가불가하며 ""알아서 하세요"" "" 이경우 판사들은 ~"" 운운하며 압박 협박성 발언하는 등 좌편향 판사는 헌법재판관으로서 자질을 갖추지 못하였으니 즉각 사퇴하여야 합니다",True,1,2025-01-29T18:10:42+0900,849820528951689353,1,0,0
kys1****,c3WKZ,"한덕수 총리에 대한 재판을 서둘렀어야 한다. 순서가 그렇지 않은가? 2월 3일에 헌재는 이런 결론을 내릴려고 답을 내놓고 서두르는 건 설마 아니겠지?
1. 한덕수 총리 탄핵 정족수 합번 2. 최상목 대행은 마은혁을 임명하라
당신들이 이런 결론을 생각하고 있다면 민주당과 한패라는 걸 만천하에 드러내는 것이다.  필연적으로 국민저항을 맞닥뜨릴것이다.",True,1,2025-01-29T18:07:44+0900,849820337238442147,1,0,0
whit****,1nDj6,응~ 그래봤자 파면 못막아 푸헿🤣🤣🤣🤣,True,1,2025-01-29T18:07:40+0900,849820333027360908,1,0,0
iqeq****,184oF,또 시간 끌기 전략이냐? 지긋지긋하다...이 후안무치한 인간들아,True,1,2025-01-29T18:05:12+0900,849820173945798701,1,0,0
paul****,7muQ,색깔 논쟁하지 말고 객관적 사실에  근거하여 적법한 결정을 내리길 바랍니다.   이재명 대표도  잘못이 있으면 처벌받으면 됩니다.,True,1,2025-01-29T18:01:37+0900,849819943225524339,1,0,0
kyc1****,1J5kI,왜 바른소리 하니까 찔려서 교체 못하는겨 판사가 편향을 가지고 있는데 공정한 판결을 기대할 수 있을까?!,True,1,2025-01-29T18:00:16+0900,849819856202104885,1,0,0
duri****,,,False,1,2025-01-29T17:58:52+0900,849819766594994353,0,0,2
cy******,1Jrv9,기사가 사실이라면 사퇴해라.,True,1,2025-01-29T17:56:13+0900,849819595769380921,1,0,0
clea****,3n6Ip,법원 건물에 저울을 새겨놓은 이유는 법원은 공정해야한다는 의미를 구성원 스스로에게 각인시키기 위함에서 일 것입니다. 매일 그 저울을 보고 출근하면서 마음에 다짐을 하고 절대로 한쪽으로 기울지 말고 공정한 잣대로 심판을 하라는 무언의 압력이 담긴 의미인 것입니다. 그런데 편향된 이념으로 정치에 기대어 기생하는 기울어진 저울을 들고 있는 법복이 있다?...그러한 법복은 국민이 벗기는 것이 마땅치 않나 싶다.,True,1,2025-01-29T17:56:12+0900,849819594594975776,1,0,0
tmah****,bUXFY,문형배 구질구질하게 굴지말고 자진사퇴해라,True,1,2025-01-29T17:53:31+0900,849819421353443456,1,0,0
hsch****,3am1Z,국민이 선출한 대통령을 사퇴하려면 국민투표를 통해서 해야 한다.,True,1,2025-01-29T17:49:50+0900,849819184526262469,1,0,0
01in****,bM6Rb,형배야 대놓고 un군 비판하는게 판사 자격은 있냐?,True,1,2025-01-29T17:48:58+0900,849819128691687647,1,0,0
ssoj****,,,False,1,2025-01-29T17:48:11+0900,849819078007717938,0,0,0
winn****,4qKJr,"이미. 구성 된. 헌재까지. 정쟁 대상으로 몰아넣나?
에그~질린다-질려~",True,1,2025-01-29T17:46:42+0900,849818982545359009,1,0,0
skck****,xKC9,애초에 객관성을 얻기위헤 좌편향 우편향 재판관 3명씩 중립 3명인데 ㅋㅋㅋㅋ,True,1,2025-01-29T17:45:56+0900,849818933203566787,1,0,0
01in****,bM6Rb,우리법연구회 후신 국제인권연구회 출신 좌파판새들은  지들 사상을 위해 헌법도 어기는 인간들 아니냐,True,1,2025-01-29T17:45:09+0900,849818882167275567,1,0,0
yunm****,eEWWp,정형식 재판관은??  니네편이라서?? 놔두고?,True,1,2025-01-29T17:45:04+0900,849818877268328471,1,0,0
thys****,5ixNW,"전부 손떼게하고 국짐당 율사출신들이 헌법재판과해서 윤 석방시켜라 균성동 권영세등...
    아이구 모지리들",True,1,2025-01-29T17:44:50+0900,849818861514522794,1,0,0
sjsj****,94rl8,"또 이렇게 사람 보내는구나....이렇게 시간끌기가 목적이였나 이재명이랑 친분있다고 다짜고짜 문상까지 간거아니냐는 아니면 말고식, 친분있다고 편파 판정할꺼라는 생각이 꼬이고 반 민주적인거 아닌가...윤석열 친구는!!!! 아주 법을 그냥 무시하는구나 너무 심하다",True,1,2025-01-29T17:44:12+0900,849818821534416939,1,0,0
jhjy****,1mKdn,민주당과 우덜법연구회 때문에 조만간 제2의 4.19 민주화 운동이 폭발할거 같다.,True,1,2025-01-29T17:44:05+0900,849818814185996304,1,0,0
life****,,,False,1,2025-01-29T17:44:02+0900,849818810042023945,0,0,0
kl09****,1abb6,이재명과 문형배 친분 의심하는 국민이 많다. 공정성 훼손하지 말고 재판에서 물러나야 마땅하다. 최고의 헌법기관에서 뭐하는 것인지! 화가 솟구칩니다!!!,True,1,2025-01-29T17:43:46+0900,849818793063481508,1,0,0
sdm8****,14wqH,당장 재명시켜라,True,1,2025-01-29T17:40:54+0900,849818608346333384,1,0,0
koot****,1kHwo,좌편향 극좌 우리 밥그릇 연구회 소속 문씨와 정씨는 스스로 사퇴하라. 당신의 편향성으로 두고두고 판결에 오점으로 진영론에 또다시 혼란이다,True,1,2025-01-29T17:40:48+0900,849818602423976135,1,0,0
lkmj****,17jov,"문형배 민주당사 가서 ""느그 대표 대장동 살제? 아니 백현동 사나? 내가 임마 느그 대표하고 술도 먹고 사우나도 가고 다 했어.""",True,1,2025-01-29T17:37:18+0900,849818376837529670,1,0,0
ksh0****,1p1o6,"문형배, 이미선, 정계선 다 사퇴해라. 니네가 무슨 재판관이냐?",True,1,2025-01-29T17:36:44+0900,849818340414193831,1,0,0
yub4****,,,False,1,2025-01-29T17:36:02+0900,849818295249928201,0,0,0
kdoh****,4crmb,나이 한개 더 먹고 해가 바뀌면 좀 달라져라..어쩜 한결같냐~국짐당과 일명 보수란 자들은 안면식있고 커피 한잔 하면 다 잘못된거네..에레이.하다하다 별 돌아이 같은 짓거리까지.왜 그렇게 사냐..,True,1,2025-01-29T17:30:23+0900,849817931435999319,1,0,0
mays****,3aQ1b,헌재소장이란게 중립 정의실현과는 거리가 먼 만진당의 아류 마피아추종 공산식 쇄뇌기술자버꾸라지라니 개한국 법치개판 아주 세계를 놀래키네 리죄명과 개딸들이 그래서 카톡검열에 심히 미쳐있구나 요런것 감춰볼라고?  더러운 욕덩이 이재명아 넌 안된다!,True,1,2025-01-29T17:30:02+0900,849817908283441158,1,0,0
klop****,1ulXL,내란의 힘당 웃기다ㅋㅋㅋ 말도 안 되는 억지나 부리는구나 친일매국당이,True,1,2025-01-29T17:29:07+0900,849817849831620628,1,0,0
4688****,1PSe,"니 재판은 6년째 1심에 계류중인 이유가 판사인 니 남편 때문이지? 내로남불 
 하지말고 그것부터 밝히고 인정해라.",True,1,2025-01-29T17:29:06+0900,849817848237785124,1,0,0
zoom****,1w0GV,빨개이와 범죄자들이 대한민국대통령을 판단해?,True,1,2025-01-29T17:27:38+0900,849817753849168024,1,0,0
icee****,1jJlk,문씨의 과거 핼적을 보니 전혀 신뢰가 안간다,True,1,2025-01-29T17:27:00+0900,849817713013424131,1,0,0
jose****,4cRPc,"문형배 종북좌파뿐먼 어니라, 이미선, 정계선은 헌재 쟈판관의 자격을 이미 상실한 자들임을 선포헌다. 사퇴할찌어다.",True,1,2025-01-29T17:26:42+0900,849817693367304365,1,0,0
bstd****,,,False,1,2025-01-29T17:26:04+0900,849817653420752913,0,0,0
xkdg****,1GGoY,수십년간 획책된 기만술의 정점에 대해 문형배는 논하고 서술 하시오,True,1,2025-01-29T17:25:51+0900,849817638874906846,1,0,0
bayd****,3UxZE,아따 좌편향 재판관 문형배는 공정성 문제로 손 떼야하지만 윤두창이 임명한 우편향 재판관 정형식은 참여해도 공정한 재판이랑께요~~ 우덜식 공정이제,True,1,2025-01-29T17:25:13+0900,849817597854613567,1,0,0
buon****,2QD1M,이런식으로 여론몰이 사회안정 도움 안됨ㆍ연합뉴스군~~!!!,True,1,2025-01-29T17:23:23+0900,849817480481210466,1,0,0
kimt****,,,False,1,2025-01-29T17:22:18+0900,849817410704769099,0,0,0
ksh8****,,,False,1,2025-01-29T17:22:01+0900,849817392384049158,0,0,0
inho****,cAAai,내란정당 해체가 답이다,True,1,2025-01-29T17:20:25+0900,849817288499527796,1,0,0
move****,2bTKck,가지가지 한다.  보수가 더  많은데  초딩도 아닌것들이  그냥 윤석열 버려,True,1,2025-01-29T17:20:20+0900,849817283449585725,1,0,0
dmch****,35Cye,ㅋ 악마의 눈에 모두가 악마로 보이거나 악마로 만들거나,True,1,2025-01-29T17:20:06+0900,849817268232650778,1,0,0
ldjs****,3drKA,ㅋㅋ 윤석열내란수괴..나경원..한동훈..최상목.기타등등 내란부역자들하고  서울대 내란과 동문인건 어떻게 해야하노?,True,1,2025-01-29T17:19:51+0900,849817252747280575,1,0,0
djho****,1wnbi,가짜뉴스 퍼나르는 국짐당~,True,1,2025-01-29T17:19:51+0900,849817252143300785,1,0,0
yaxi****,lJcS,"문재앙의..더러운  유산!!
하도  많아서...열거하기도  힘드네요",True,1,2025-01-29T17:18:31+0900,849817166462058631,1,0,0
woow****,2cZglX,저정도 이해충돌을 한꺼번에 보는 재판장은 생전 첨본다 ㅋㅋㅋㅋㅋㅋㅋㅋㅋ,True,1,2025-01-29T17:18:18+0900,849817152453083197,1,0,0
apem****,2bIBtb,여당은 문제를 해결하려는 모습은 없고 그저 어지럽혀서 헤갈리게하는데 특기가 있는 것 같다. 진정한 문제 해법인 뭔지 먼저 명확히 밝히고 주장해라. 리드하지 못하고 간 보고 선동하는 모양이 역겹고 양아치보다 못하다. 부패한 냄새 더 풍기지 말고 다 내려놓고 정치를 떠나는게 애국하는 길이다. 국힘 깃발 빨리 내리고 인간성을 회복하기 바란다.,True,1,2025-01-29T17:17:35+0900,849817106785501297,1,0,0
smk5****,dnS1n,"윤수괴한테 유리하면 합법!!@!!! 윤수괴한테 불리하면 불법!!!!!!!!!
그냥 권성동이 권영세 주진우 유상범  곽규택 임이자 니들이 헌재 재판관해서 심판받지???????????",True,1,2025-01-29T17:17:29+0900,849817099739070573,1,0,0
hanz****,,,False,1,2025-01-29T17:16:34+0900,849817040918151297,0,0,0
smk5****,dnS1n,"그럼 윤수괴가 뽑은 극우 판사는 왜 있니? 원래 그렇게 뽑도록 결정해서 뽑은건데 윤수괴한테 불리하다고 빼라고????????
미쳐도 곱게 미쳐라 ㅉㅉㅉ",True,1,2025-01-29T17:15:37+0900,849816980184629395,1,0,0
718k****,1iJQa,"나도 재판에서 손떼야 된다고 생각한다
ㆍ마누라 안부까지 물어볼 정도면  보통가까운 사이가 아닌듯 싶다
ㆍ생판 모르는 사이에  마누라에게  안부 전해달라고는 안하지~~~",True,1,2025-01-29T17:14:51+0900,849816929970421947,1,0,0
azaa****,,,False,1,2025-01-29T17:13:32+0900,849816845262258292,0,0,0
ohli****,3rVUt,"헌재 8인 체재에 2명만 반대해도 기각 아닌가? 
정형식, 조한창은 보수잖어?
윤통이 저리 떳떳하다는데 뭐가 걱정일까?",True,1,2025-01-29T17:12:19+0900,849816767046877258,1,0,0
reva****,1HGg8,"영화 찍자..""윤석렬과 함께. 사라지다"". . . . . 츌연: 김명신, 이천공, 김용현, 권성동, 나경원, 최상목,명태균...엑스트라: 김성훈, 2찍들...장소협찬: 한남 정신과 병동...",True,1,2025-01-29T17:11:37+0900,849816722067161241,1,0,0
hann****,26Vzx,내란동조당  국힘의 해산을 요청합니다,True,1,2025-01-29T17:10:42+0900,849816663246241963,1,0,0
cale****,53jsE,문형배 SNS계정 사라진거부터 해명 좀. 온갖 극좌 언행이 기록돼 있다던데,True,1,2025-01-29T17:07:50+0900,849816478277435575,1,0,0
haha****,1NKTx,ㅋㅋ 프레임 전환 빠르네 고놈들참,True,1,2025-01-29T17:06:36+0900,849816398518550668,1,0,0
kmd0****,8nyn,헌법재판소가 이렇게 썩은 데 인줄 몰랐다 대행도 부끄러운 줄도 모르고 헌법재판관과 원고인 국회 변호사가 서로 부부인데도 한 쪽을 그만두게 하지 않은 건 최악이다 자기들이 신인양 국민 보기를 물로 보고 있다 이런 양아치들이 헌재에 있다니 대한민국 앞날이 너무 암울하다,True,1,2025-01-29T17:05:12+0900,849816308928217135,1,0,0
jaso****,5OCtE,이런 판결이라면 당연 탄핵무효지 니들끼리 짜고치는 판인데 절반의 국민이 과연 믿을까?,True,1,2025-01-29T17:05:10+0900,849816305992204326,1,0,0
mad3****,6DkIL,판사랑 범죄자가 SNS로 안부 묻는 사이 ㄷㄷㄷ,True,1,2025-01-29T17:04:34+0900,849816267807260806,1,0,0
budd****,19y71,"이래서 뒤에서 댓글조정하는 김건희를 빨리 구속해야하는거다 
실세가 뒤에서 이런 유언비어를 퍼트리게 하는데 가만놔둔다느게  이상한거다 검찰은 즉시 김건희를 구속해라",True,1,2025-01-29T16:59:49+0900,849815962227048652,1,0,0
proz****,2KFRU,9인체제 될꺼 같으니  재판관수 쭐일려는 꼼수,True,1,2025-01-29T16:59:44+0900,849815956438909091,1,0,0
yjk9****,1Hf80,애쓴다  내란의당,True,1,2025-01-29T16:58:07+0900,849815852118179864,1,0,0
exsk****,2WCwX,아무말대잔치 위헌정당부터 해산시켜라!!,True,1,2025-01-29T16:57:45+0900,849815828781072587,1,0,0
jman****,2bXupw,문형배및 나머지  헌재 좌파 재판관  기시기들 퇴출해라이기시들이. 좌파에 정을두고  좌파질이나 하면서 도둑놈이죄명을 두둔 재판을 연기하게  갇은후배  재판관들에게 종용한다고 보는데 헌재 에 사표내라,True,1,2025-01-29T16:56:06+0900,849815722262528022,1,0,0
budd****,19y71,그래 니들이 꼴린대로 재판관 구성하고 새로운 헌법기관 만들고 다해라 어휴 꼴통들에 내란의힘 말종들,True,1,2025-01-29T16:55:54+0900,849815709058859216,1,0,0
baek****,2XTaO,그렇다면 나베 니가하면 공정과 상식이겠냐?,True,1,2025-01-29T16:53:16+0900,849815540212957259,1,0,0
dong****,,,False,1,2025-01-29T16:53:11+0900,849815534827470888,0,0,0
budd****,19y71,이 꼴통들아 이게 윤두광재판이지 이재명 재판이냐 정말 이재명이 그렇게 좋냐 모든 댓글에 이재명으로 윤두광을 쉴드치고 앉았네 그래서 이재명이가 게엄을 했냐  정말 이것저것 법리로 안되니 선동질을 해도 이렇게 터무니없는 선동질을 해데니 참 그렇다고 윤두광이가 살아올줄 아냐 그렇게 헌재를 공격하면 박근헤때처럼 괘심죄로 탄핵인용을 강제하는거야 알겠냐 이꼴통들아,True,1,2025-01-29T16:53:10+0900,849815532965199927,1,0,0
rjjb****,,,False,1,2025-01-29T16:53:07+0900,849815530633166874,0,0,0
dong****,,,False,1,2025-01-29T16:51:32+0900,849815428426367097,0,0,0
ilsa****,,,False,1,2025-01-29T16:49:17+0900,849815283605438524,0,0,0
kns0****,6lZbv,좌파가 나라를 망하게 하는 이유는.. 반대이면 개거품을 물과.. 뒤집어졌을 일들을.. 골라서 하기때문이다. 좌파 포퓰리즘의 망하게 하지않은.. 나라는 지구상에 역사상 없다,True,1,2025-01-29T16:48:28+0900,849815230505549943,1,0,0
kiba****,2chf27,신천지+일베 총출동해서 댓글 공작하네,True,1,2025-01-29T16:46:38+0900,849815112242954375,1,0,0
isco****,4HEaH,그럴수록  니들 끝날날만 더 가까워진다,True,1,2025-01-29T16:45:56+0900,849815067632337134,1,0,0
ccoo****,3nQVI,"마눌안부물을정도 친구면   중립성  없다
편향성 인물은 헌재자격없다  사퇴하라",True,1,2025-01-29T16:43:35+0900,849814916452843656,1,0,0
mick****,2s9OL,얘들은 정당해산이 답이다. 대놓고 내란동조.,True,1,2025-01-29T16:42:04+0900,849814818725560340,1,0,0
phot****,2bF1Gd,"윤미향 담당판사 죽고난다음 능력있는 판사가 대거 퇴임함.
드럼통으로 죽어나간 사람들는 자살 ㄴㄴ
김정남은 사람많은 공항에서 어떻게 죽었는지 찾아봐라",True,1,2025-01-29T16:41:32+0900,849814784265158788,1,0,0
qazx****,71UmR,악마,True,1,2025-01-29T16:40:52+0900,849814741231599816,1,0,0
cjyu****,,,False,1,2025-01-29T16:40:06+0900,849814691084501017,0,0,0
k2za****,NtOH,이미선헌법재판관 이 아줌마도 웃기더만 신랑변호사 공동대표가 권순일 50억 대장동 대법관 하던 자와 같은 공동대표로 하고 이미선 여동생은 이상희라는 변호사  윤미향 과 함께하는 자이고 윤통 탄핵 시민단체 변호 이사가  헌법재판 하는 자가 말이되는가 이런 자들 다 정리해야한다고 본다,True,1,2025-01-29T16:37:58+0900,849814553813319875,1,0,0
dm57****,,,False,1,2025-01-29T16:37:53+0900,849814548981481657,0,0,0
jose****,4cRPc,"믄형배, 이미선, 장계선 재판괸은 적어도 사퇴해야 함. 만약 탄핵심판을 진행할 시, 국민들의 모든 사법부를 신뢰하지 않으며, 국민의 저항을 받게 될 것이다. 이는 시법부 스스로 오동훈 공수처장과 서부지법의 이순형, 신한미, 서준섭, 차은경 같은 판새들의 비합리적인 판결 등으로 신뢰를 잃은 단초를제공하였음을 부인하기 어려울 것이다. 헌재는 스스로 개혁하고, 거듭나길 기대한다. 헌재는 개혁하라, 개혁될 찌어디.",True,1,2025-01-29T16:37:32+0900,849814526298685554,1,0,0
yews****,2KMCv,"대한민국 헌븹재판소가. 특정 사조직. 좌편향. 재판관들이. 점령히고있다 이건 아니다 지긍디 헌재는 엉터리다  전과4범 추후 전과 15범의 가능성이 있는. 희대의. 범죄자 이재명과 절진인 문형배가  헌재를 농락하고 이에 이미선,정계선,,정정미가 합세 헌재를 주물고있다 국민들이 일어나 헌재 판단. 봉콧 총궐기해야. 나라가 바로선다 이대로가다간 대한민국이 사회주의로 갈 위험이 있다",True,1,2025-01-29T16:37:18+0900,849814510947532886,1,0,0
wonh****,2A6u7,윤가가 뽑아놓은 사람들한테는 뭐라 할건가?,True,1,2025-01-29T16:35:47+0900,849814413455130802,1,0,0
jose****,1jzty,이참에 이찍이들은 죄다 흙이불 덮고 고이 잠드소서..ㅋㅋㅋ,True,1,2025-01-29T16:35:41+0900,849814407348224163,1,0,0
wkdq****,50mQK,이재명 모친 문상.조의금 거짓말한 권성동은 사과를 해야지 잘 못 알았다고 하면 끝이야 아님말고식 더럽게 정치한다,True,1,2025-01-29T16:35:39+0900,849814405267849360,1,0,0
neve****,205rF,"권선동 친분 있는 모든 고위직 다 사퇴시켜라 !!!
아니면 개소리 좀 작작해 !!!",True,1,2025-01-29T16:35:05+0900,849814368643186704,1,0,0
supe****,eSSKj,"불리하니 쫄리나보네,  전부 불법이라고 생떼를 쓰더만 이젠 헌재 재판관까지.  윤은 정형식 처형 박선영을 진과위원장에 앉혔다.",True,1,2025-01-29T16:33:42+0900,849814278952190099,1,0,0
home****,bHtzr,"당연한거아니냐
애초에 문형배가  헌재재판관 자격이 있냐고",True,1,2025-01-29T16:32:59+0900,849814233318162654,1,0,0
tjsg****,k33e,그냥 니네 하고 싶은데로 할거면 나라 따로 만들어서 그리로 싹 가라.,True,1,2025-01-29T16:32:24+0900,849814195737198685,1,0,0
pjky****,3WX5C,그런식이면 윤석렬 부하들이 수사한 모든 사건은 무효다.,True,1,2025-01-29T16:31:40+0900,849814147938910348,1,0,0
hshs****,,,False,1,2025-01-29T16:30:03+0900,849814043634958347,0,0,0
pibu****,bkDMa,늘버릇처럼 할수잇는게 메신저공격뿐이지? 넘 명확한심판이라.,True,1,2025-01-29T16:30:01+0900,849814041957236739,1,0,0
emer****,,,False,1,2025-01-29T16:29:44+0900,849814023502299290,0,0,0
shor****,64H1U,또다시 좌파 짖 한다면 서부지원 이상의 꼴 당할거다 올 바른 길 걸어라,True,1,2025-01-29T16:29:31+0900,849814009862422640,1,0,0
shin****,bGMBx,"헌재가 정치적 판단을 할 가능성이 있거나 그렇게 한다면 
그 존재이유 없다.",True,1,2025-01-29T16:29:21+0900,849813998806237257,1,0,0
sam9****,1XFiX,이미...헌재 공정성을 잃었다....헌재 국가을 보위힐 수 없는 반헌법기관으로 전락하여 해체가 맞다,True,1,2025-01-29T16:28:31+0900,849813945471467631,1,0,0
ehsk****,3k3eg,"국짐당 논리라면 헌법재판관들 모두 손 떼야하는데ㅎㅎ
기껏 생각한다는 것이 쯔쯔쯔",True,1,2025-01-29T16:27:08+0900,849813855797248037,1,0,0
lils****,5DhqE,권성동 동기가 있다는 뉴스는 왜 안내보내냐?,True,1,2025-01-29T16:27:00+0900,849813848079728641,1,0,0
nono****,l3rS,"우리법연구회 회장 출신 문형배판사, 진주 선거관리위원회 위원장 출신, 자신의 트위터에 대북지원 옹호하는 글을 올리고, '우리법연구회 중에 자신이 제일 왼쪽'이라하였으며, 북한 남침 625전쟁 당시 우리를 도우러온 UN군을 전쟁으로 통일을 이루려는 침략꾼으로 묘사함. 이재명 김어준 팔로잉~ㅎㅎ 헌재법 40조 1항을 어기고 피청구인과 변호인단과 상의 없이 지멋대로 변론기일을 지정하고, 대통령 변호인단의 인권보호 호소에도 개무시하고 그냥 하겠다고 하고. 심지어 부정선거가 근거없는 의혹이라며 증거증인 거부. 이진숙 방통위원장 탄핵인용.ㅉㅉ",True,1,2025-01-29T16:26:26+0900,849813810683314274,1,0,0
youn****,,,False,1,2025-01-29T16:25:21+0900,849813741359857735,0,0,0
lley****,4WizY,범죄자의 궤변과 쌩트집을 언제까지들어줘야하나?!!!!  이런거 우리가 알 필요있나?  몇안되는  지지자들 선동해서 폭도 일으킬  작전이네 !! 그냥 수사상황만 알려 주라!!,True,1,2025-01-29T16:25:13+0900,849813732333715501,1,0,0
yech****,1nY6E,"없는 사실을 만들고 왜곡하고 갈등조장에 온갖
파렴치한 일들을 일삼은 국짐 분들
그만좀하시고 민생좀챙겨라 제발
당신들은 꼬박꼬박 세비로 배체우고 고급정보로
배체우고 국회의원달만하죠 선거할때만 굽실거리면 5년 먹고사는덴 문제없고 재산도 불리니
이것보다좋은게 없네요
부럽다 파트타임식으로 하는척만해도 먹구살만하시니  국민들이 살든지 죽든지 알게뭐야 그렇죠?",True,1,2025-01-29T16:24:46+0900,849813703577567384,1,0,0
gi03****,Qlmq,민형배가 조용하니까 문형배가 나라를 시끄럽게 하네.,True,1,2025-01-29T16:22:39+0900,849813567514345609,1,0,0
qufe****,2ytpl,왜이러냐...진짜 구질구질하다,True,1,2025-01-29T16:20:38+0900,849813437390258307,1,0,0
ysh3****,,,False,1,2025-01-29T16:18:38+0900,849813309011001486,0,0,0
gkwj****,20TaD,대한민국 사법부는 사망선고!!!!,True,1,2025-01-29T16:17:06+0900,849813209706659870,1,0,0
hisj****,,,False,1,2025-01-29T16:14:00+0900,849813009990680581,0,0,0
yugu****,1EfPX,"새해부터 쓰레기이재명이야기하니 제수없다
쓰레기는 빨리치위야한다",True,1,2025-01-29T16:12:58+0900,849812943938781404,1,0,1
cjsm****,4UfMc,이재명이 헌재 재판받냐 ? 🐕 소리 하지 마라 ᆢ,True,1,2025-01-29T16:04:58+0900,849812428106498253,1,0,0
jsbo****,nc75,공정한 재판을 위해 문형배재판관은 빠지세요,True,1,2025-01-29T16:03:54+0900,849812359571570887,1,0,0
cdh6****,,,False,1,2025-01-29T16:00:09+0900,849812118298427425,0,0,0
