user_nickname,userIdNo,comments,visible,replyLevel,regTime,parentCommentNo,sympathyCount,antipathyCount,replyAllCount
simk****,7J3Bj,정신차리라 국회의원아..아직도 이나라 대통령이 누군줄 모르나..,True,1,2025-01-24T10:22:49+0900,849326529178501447,1,0,0
mont****,1Y7k2,공정과 상식 외치던 윤통 어디 갔나? 이제 범죄자들 전부 풀메이크업 하고 재판받겠다면 어쩔건가?,True,1,2025-01-24T06:22:56+0900,849311074409775214,1,0,0
kimm****,2jOmJ,"더열심히 목이 터져라 짖어야지, 이래갖고 애미추한테 다시 관심받겠나",True,1,2025-01-24T06:14:32+0900,849310533445222439,1,0,0
cdfg****,,,False,1,2025-01-24T06:02:42+0900,849309770434215992,0,0,0
kimn****,2bStVT,찢같은 범죄자는 온갖특혜로 잘만 싸돌아다니네~,True,1,2025-01-24T06:00:01+0900,849309597981212673,1,0,0
da******,2jHHU,어차피 조국사당은 신경 안쓴다..,True,1,2025-01-24T05:53:08+0900,849309154660057106,1,0,0
adda****,2fjaF,김어준 거지꼴로 나와야 국격이올라가냐?,True,1,2025-01-24T05:51:19+0900,849309037756416019,1,0,0
kwh1****,1oGoT,"헌법상 포고령은 상징적 의미가 아니다.  포고령 은 실천적이고, 엄격히 요건을 준수해야할 준수사항이다.",True,1,2025-01-24T05:41:53+0900,849308429733331005,1,0,0
cute****,,,False,1,2025-01-24T05:41:44+0900,849308420673634360,0,0,0
jong****,90Sx8,",민주당은 까마구소리 쪼국신당은 째지는소리 재명이에게 찢길여자들",True,1,2025-01-24T05:41:08+0900,849308381314285579,1,0,0
tlsv****,3YZ8Z,조국멍청당 아웃!!!!!,True,1,2025-01-24T05:29:11+0900,849307611357511692,1,0,0
dt******,l8jd,가지가지  생긴되로 놀구있네~~,True,1,2025-01-24T05:16:49+0900,849306814456528958,1,0,0
gjcj****,,,False,1,2025-01-24T05:09:17+0900,849306329108447251,0,0,0
wkwk****,,,False,1,2025-01-24T05:03:18+0900,849305944524324890,0,0,0
aroo****,4MUlc,조국혁신당 뭘 혁신했나 ? 조국은 감빵에 있는데,True,1,2025-01-24T04:56:49+0900,849305526519988267,1,0,0
gigo****,2x741,할일이 그리없나 트집에 트집에 ㅉㅉ,True,1,2025-01-24T04:53:02+0900,849305282679930884,1,0,0
gofl****,,,False,1,2025-01-24T04:51:03+0900,849305155223420934,0,0,0
bibi****,2vRqf,"선동하기, 조롱하기, 흠집잡기
한번 속지  두번 속냐
평생 속을  더블죄명  추종자들이 안타깝다.",True,1,2025-01-24T04:36:18+0900,849304205079347212,1,0,0
song****,2bHC4J,연합뉴스 체널돌렸다,True,1,2025-01-24T04:21:40+0900,849303262082367541,1,0,0
douk****,1PeGy,박근혜씨는 재심해야되는거 아닌가,True,1,2025-01-24T04:10:16+0900,849302527928172578,1,0,0
rlae****,3YXCp,국민보다 대통령이 위인가? 국민의 노예아닌가?,True,1,2025-01-24T04:00:39+0900,849301907791937571,1,0,0
kcs5****,CSJ2,"국개 자격없음 흠집만찾고 좀스럽기 짝이없음 저런자질로
 국가 국민을위해 일할까 통반장수준도 안된다 한심하다",True,1,2025-01-24T03:49:02+0900,849301159981088776,1,0,0
yuzn****,2crkP,그럼 무슨 서울역에 머리 못감은 그지꼴로 나가냐?,True,1,2025-01-24T03:28:22+0900,849299828272791581,1,0,0
addr****,3hefn,양심도 없고 부끄러움 없는 최악의 인간,True,1,2025-01-24T03:22:13+0900,849299432011726873,1,0,1
long****,JxEE,요원 에서 끝남 ㅋㅋ,True,1,2025-01-24T03:03:53+0900,849298250610507845,1,0,0
sung****,3ttTo,야 참 한심한 야당 국개들.. 박은정이는 참 창피를 모르는자가 확실하다.. 검사때도 그러더니 도대체 저런자가 어찌 국회의원이 되었단 말인가..???,True,1,2025-01-24T03:01:37+0900,849298104950718518,1,0,0
coma****,1hraS,이젠 머리가지고 시비네.참 유치해 초등수준도 않되 요즘 초딩도 이렇게까진 안한다.어른들 맞냐?,True,1,2025-01-24T02:58:24+0900,849297897030680615,1,0,0
omy0****,11ITm,저런거에  신경쓰니  국민은 나몰라라  그저  본인편하고자  주변 곳곳에  비리  인간들을  심어놨으니  경제는 엉망  에혀  스바,True,1,2025-01-24T02:44:14+0900,849296984685674521,1,0,0
resc****,28vFS,쓰레기가 쓰레기 아닌척 연기 쩐다. 배우로 직업 바꿔라.,True,1,2025-01-24T02:40:01+0900,849296713045770244,1,0,0
ilis****,iicj,니들 대통령 특활비 0원 만든거사실이냐? 그래놓고 공수처 소고기와인 먹은거냐?!!,True,1,2025-01-24T02:31:36+0900,849296171057807437,1,0,0
imah****,,,False,1,2025-01-24T02:27:50+0900,849295928610259045,0,0,0
kar4****,2gHub,트집잡을게 그렇게 없냐?,True,1,2025-01-24T02:13:43+0900,849295018664394831,1,0,0
kwan****,HyiV,박은정이는 교도소 안가냐?,True,1,2025-01-24T02:11:34+0900,849294880034259016,1,0,0
ephr****,5M4JV,죄가 입증되어 수감상태가 아니고 구속수사를 위해 수감된 상태이니 어느정도 가능한 일 이라고 보여집니다.,True,1,2025-01-24T02:08:20+0900,849294672047112223,1,0,0
cjh6****,4hjQY,세계도보고 당신은 그래도 당신나라 대통령인데 거지꼴로나오면 국익에 도움이된다 생각하냐,True,1,2025-01-24T02:07:24+0900,849294611733020726,1,0,0
ruby****,c16Nu,평등을 말하는거니?이나라에 평등이있니?똑같이살려면 저쪽가서 사셔요~^위,True,1,2025-01-24T02:03:11+0900,849294340260888601,1,0,0
khkh****,bVWHv,따질꺼를  따져라   !!!!,True,1,2025-01-24T01:57:11+0900,849293953277624334,1,0,0
nada****,bsqAB,이 인간 탄핵이답     목소리만   들어도지겨워,True,1,2025-01-24T01:55:22+0900,849293836743082041,1,0,0
best****,2JXoC,타임머신을 태워서 전두환 군사정권 시절로 보내가지고 삼청교육대로 보내야 하는데..,True,1,2025-01-24T01:54:53+0900,849293805000589418,1,0,0
sanj****,3ykcd,예우를 해줘야지!~~대가리 크게 만들어 줘야지,True,1,2025-01-24T01:49:06+0900,849293433284591634,1,0,0
nam1****,2bOq,거지꼴하고 나왔으면 좋겠냐??,True,1,2025-01-24T01:46:43+0900,849293278799986786,1,0,0
kore****,6NyHu,국회의원이 똥오줌 못가리나,True,1,2025-01-24T01:43:41+0900,849293084318498898,1,0,0
srmo****,10Op3,"저런놈도 예우, 그래 넌 어차피 사형이지",True,1,2025-01-24T01:40:52+0900,849292901966938235,1,0,0
imwi****,4oaH2,이제하다하다 머리깔끔하다고 트집을잡냐ㅋㅋ 대단하다,True,1,2025-01-24T01:20:44+0900,849291605121695853,1,0,0
kimc****,afWYH,수 몇일않먹었다고 얼굴빛좋아졌네,True,1,2025-01-24T01:09:41+0900,849290893633519752,1,0,0
seop****,2DrkU,박은정은 좀 모자란것 같아요. 얼빵한게...참...,True,1,2025-01-24T01:08:13+0900,849290798590591009,1,0,0
kot7****,a9MCV,탄핵이전엔 아직도 국가원수이다.그에 따른 예우가 반드시 따라야 한다.일개 검사출신이 가타부타 할 계제가 못된다.박은정이 누구이더냐? 임믄정.진혜원.서지현과 함께 檢의 권위를 추락시킨 女傑?들이 아니더냐? 그 입을 닫아놓는게 명에회복의 길임을 명심하라 ᆢ,True,1,2025-01-24T01:07:38+0900,849290761210953881,1,0,0
haev****,2Epdv,"응 인정 무늬만 대통령도 스타일은 살려줘야제~~
빨리빨리 정리되면 좋겠다 
GDP6조3000억원 사라진건 어쩌냐 미치놈 하나 때문에 그것도 야당 때려잡겠다고 계엄은 아니다
 석열아",True,1,2025-01-24T01:06:46+0900,849290705024057477,1,0,0
brit****,1o8Se,사사건건시비,True,1,2025-01-24T01:06:14+0900,849290671201189927,1,0,0
quda****,3F2Km,"가찮은게
별 트집을잡네
히한한  법으로 의원된 주제에 꼴갑은",True,1,2025-01-24T01:05:20+0900,849290612766146626,1,0,0
wprk****,,,False,1,2025-01-24T01:02:25+0900,849290425616302165,0,0,0
scsm****,Bmqc,열등의식은 어디 안간다니까... 자신감이라곤 1도 없는 모지리,True,1,2025-01-24T00:56:52+0900,849290067405963429,1,0,0
pks1****,cUJbF,악마같은것~!☆,True,1,2025-01-24T00:54:11+0900,849289895036846119,1,0,0
cags****,3v6CJ,머리빗고 면도한 것이 법무부 특혜냐!,True,1,2025-01-24T00:47:56+0900,849289492098449608,1,0,0
love****,4DYdT,데리고 사는 놈 욕 좀보겠다 저런걸 데리고 살면 피통 터져 1주일 만에 급사 할 것 같다,True,1,2025-01-24T00:46:28+0900,849289397223293029,1,0,0
jado****,2d2Sir,박은정씨야. 조국은 잡법주제에 특혜를 받아서 서울구치소에 몇일이나 있다가 오늘 교도소로 갔자나. 그게 특혜야. 니들 구치소에서 영치금 얘기 꺼내면서 계좌나 우편으로 보내라고 국민들 돈이나 뜯으려는 것들이 정상이냐? 비정상들이니 특혜가 뭔질 모르는구나,True,1,2025-01-24T00:43:29+0900,849289205610709144,1,0,0
nofa****,,,False,1,2025-01-24T00:37:21+0900,849288810003955801,0,0,0
heal****,4ohvH,저거 ㄷH가ㄹI 모양같은 그딴 사소한 거 일일이 트집 잡을 여유가 있다면 계엄때 대체 뭔짓까지 하려고 꾸몄는지 그거나 철저하게 캐내라,True,1,2025-01-24T00:36:22+0900,849288746552524877,1,0,0
kors****,3uBeP,박은정 저거 별 트집을 다 잡네.,True,1,2025-01-24T00:36:12+0900,849288736301645874,1,0,0
jing****,1SEY0,박은정 하여간 수준하고는!!!!!  하긴 저렇게 머리에 든것없이  권력에 빌붙어서 말하는 것들의 수준이 그렇지뭐,True,1,2025-01-24T00:32:07+0900,849288473251676195,1,0,0
yeor****,288l,ㅋㅋ  송영길이는 구속중에 선거운동한다고 옷바꿔입고 영상까지 찍게해줬는데 현직대통령에게 이게특혜라고? 이재명이 지금가장특혜받고있지 좌편향 판사들때문에 ㅋㅋ,True,1,2025-01-24T00:31:52+0900,849288457195880650,1,0,0
kdh_****,cDFXz,니네 남편 전과자한테 거액의 부당수임료 챙긴것 생각안나냐  이 더러운인간아,True,1,2025-01-24T00:31:37+0900,849288440619991195,1,0,0
4the****,,,False,1,2025-01-24T00:29:27+0900,849288300983222378,0,0,0
wisd****,2hhlQ,대한민국 언론 수준이 처참하다.,True,1,2025-01-24T00:28:28+0900,849288238521647227,1,0,0
0629****,5SvxV,조국범죄인당 소속 비례가 넘 설치는것도 꼴보기 싫지 않을까?,True,1,2025-01-24T00:27:37+0900,849288183693705358,1,0,0
yun6****,buCm6,박은정도  꼭  꼭  기억해 줄께,True,1,2025-01-24T00:27:22+0900,849288167000375390,1,0,0
yun6****,buCm6,"머리안감고 덥수룩  해쓰먼 복장불량이라했을거야
추하다고  이래도 지날 저내도 지날

  꼭  아주 꼭
꼭 기억할께  기자야  김다혜",True,1,2025-01-24T00:24:31+0900,849287983910617244,1,0,0
ligh****,23YId,우리나라가 지금의 민주당이나 조국당과 같은 극렬좌파의 협잡과 사기로부터 벗어나는날이 제2의 광복절이다,True,1,2025-01-24T00:24:30+0900,849287982820098166,1,0,0
koo5****,1KBXh,할일드럽게읎나      별걸 다트집~~~ㅋㅋ,True,1,2025-01-24T00:22:26+0900,849287849726443622,1,0,0
kimh****,,,False,1,2025-01-24T00:18:52+0900,849287619794698507,0,0,0
bigh****,5tBHT,대깨가 몸부림칠수록 지지율 쑥쑥 ㅋㅋ,True,1,2025-01-23T22:02:33+0900,849278837609988274,1,0,2
reff****,1tbAv,"전세계가 보는데 그럼 수염 기르고 거지처럼 나오냐?
아직 정지일뿐 탄핵된 상황 아니다
전세계가 보는데 기본적인 용모단장은 당연하다",True,1,2025-01-23T21:26:48+0900,849276534131786014,1,0,0
hyun****,6nBM5,은정아 사적인 감정이 질의냐?,True,1,2025-01-23T21:17:20+0900,849275923910885493,1,0,0
crep****,3f6mK,정치검사 은정아 황제스타일링?ㅋㅋㅋㅋㅋㅋ,True,1,2025-01-23T21:16:49+0900,849275891128205554,1,0,1
comd****,2I0c0,아휴 이것들이 하다하다 이제 머리까지 트집잡네,True,1,2025-01-23T21:15:35+0900,849275811922968786,1,0,2
chih****,4Uov2,깔끔하게 나오는게 당연한건데 요즘 턱수염에 머리 풀어헤치고 노타이로 다니는게 무슨 영웅처럼 그러네.,True,1,2025-01-23T21:12:55+0900,849275639520297260,1,0,0
god1****,5HjJY,머리 가지고 뭐라 하는거 아니다,True,1,2025-01-23T21:08:37+0900,849275363031777486,1,0,0
gudg****,Us47,거지 꼴 모습을 전세계 언론에 송출하라고?  철닥서니가 세살밖에 안되니~~ 한심하다,True,1,2025-01-23T21:07:38+0900,849275299630678232,1,0,0
shki****,2e1s4,트집잡는 지저분한 인간들 좀 눈에 안띄게 투표 좀 잘하자! 부정선거 감시 잘하고!,True,1,2025-01-23T21:05:08+0900,849275138066087987,1,0,0
toda****,,,False,1,2025-01-23T21:01:36+0900,849274911187796157,0,0,0
ymw1****,3ylwA,"재매이햄 감방가면 어떻게하나
머리스탈 봐야겠네",True,1,2025-01-23T21:00:36+0900,849274846847172815,1,0,0
kyh5****,8H2B9,문재인 사냥개가 별 트집을 잡고 있네,True,1,2025-01-23T21:00:26+0900,849274835908427902,1,0,0
dmax****,dUcuk,현직 대통령이고 아직 죄가 확정되지 않았습니다. 조국혁신당 여자 비례대표가 문제 제기 했죠? 조국은 깜빵 갔는데 당 해체 안하나요? 이름이나 바꾸던지! 국민들이 깜빵 가는게 혁신인줄 알 것 아니요!,True,1,2025-01-23T20:59:46+0900,849274793109750008,1,0,0
find****,2BcYn,그럼 어준이 같이 산발하고 나와야 속이 시원하겠냐...,True,1,2025-01-23T20:59:09+0900,849274752844431415,1,0,0
ibma****,,,False,1,2025-01-23T20:58:55+0900,849274738466357550,0,0,0
dkff****,2CIBg,이상한 얘기로 떨어질 지지율 조차 없는 당 아닌가?,True,1,2025-01-23T20:58:40+0900,849274722226012396,1,0,0
cand****,,,False,1,2025-01-23T20:57:57+0900,849274676105445683,0,0,0
park****,2Cm6Y,"현재 대통령이다.
어디서 걸고 넘어지는거야?",True,1,2025-01-23T20:55:06+0900,849274491958722598,1,0,0
duqr****,1vegY,이젠 머리가지고ㅋㅋ연합아 쪼리나?,True,1,2025-01-23T20:54:06+0900,849274427668430868,1,0,0
namo****,2jZSE,치사스럽게 굴지마라  더러워보인다,True,1,2025-01-23T20:44:18+0900,849273796492787815,1,0,0
ju_e****,,,False,1,2025-01-23T20:43:30+0900,849273744886071492,0,0,0
oevi****,CvEM,저ㅇ은 배은망덕하기도하네 정치검사 표본,True,1,2025-01-23T20:35:05+0900,849273202394791961,1,0,0
lmk0****,9Q4iU,이젠 하다하다 별 거지같은 말을 듣는구나..!!!!,True,1,2025-01-23T20:35:02+0900,849273198989017100,1,0,0
cowa****,,,False,1,2025-01-23T20:34:58+0900,849273195264475477,0,0,0
ycho****,1GOjR,피의자가 헤어스타일링하고 법정에 선다고? 저것들 정권 바뀌면 다 물갈이 해라. 미쳐도 유분수다.,True,1,2025-01-23T20:38:26+0900,849273418149789840,5,5,0
jus8****,9q2cA,당연히 현직대통령인데 그것보다 더해도 되지 별걸다 그러네  윤대통령님 존경합니다 힘내세요,True,1,2025-01-23T20:37:04+0900,849273330220400661,5,5,1
chan****,dM17,윤석열은 이미 국민 마음에서 떠난지 한참됐다. 징역살이 해야한다. 집단지성의 힘은 위대하다. 국힘. 친일파. 개신교. 무당 국정개입이 말이 되나. 사형 내지는 무기징역이 옳다.!!!,True,1,2025-01-23T21:17:54+0900,849275960954978622,4,4,0
may1****,dl0tL,"불쌍해 보이려고 일부러 초췌하게 나오는 것도 그렇지만, 수감 중에 헤어, 풀메 전문가 손길 받고 나온 것도 좀 헛웃음이 나긴하네.😂",True,1,2025-01-24T03:29:26+0900,849299897193594923,3,3,0
woo4****,JOQp,개 XX....쥴리의 남편답다...●●●●,True,1,2025-01-24T02:35:10+0900,849296400486236184,3,3,0
ja******,1Qkvt,"아직 죄수 아니고, 현직 대통령이다... 대통령에 대한 예우 규정은 현재 유효하다.. 그런 트집은 탄핵 판결 후 대통령 감투 제거하고 나서 해라... 진짜 같잖은 걸로 트집 잡는 거는 참..",True,1,2025-01-24T01:29:07+0900,849292145868144661,3,3,2
s875****,3KqEC,은정아 너 같아도 잠자고 일어나 추스레한 모습으로 나왔으면 좋겠니 이것아 인정 머리 없는 소리 좀 작작해라! 언 늠은 총을 맞더라도 밀고 가라고 총알받이 하라고 하질 않나! 어째 니네 당은 한결 같이 다 그 모양이냐. 죄다 선거 운동도 안하고 감 떨어지듯 뚝딱 의원 자리 하나씩 꿰고 차지하니 눈에 뵈는게 없지 이것들아,True,1,2025-01-23T21:14:15+0900,849275725671301212,3,3,1
o0je****,3tWkt,대통령이라고~~~이것들아,True,1,2025-01-24T04:58:27+0900,849305631276924954,2,2,0
boo1****,5eBv7,민주당 지지율떨어지는거는 다 이유가있어,True,1,2025-01-24T04:50:12+0900,849305100143820812,2,2,0
kohw****,2FDd1,머리 깎는것까지 기사꺼리가 되나?  드라마를 많이 본듯. 국민이 알고 싶은건 망신주기보다는  why 를 알고 싶은거지. 조만간 구치소장도 탄핵 되겠군.  재명이 맘에 안들면 ALL  탄핵?,True,1,2025-01-24T04:18:03+0900,849303029248163842,2,2,0
tomc****,2FwBG,우리나라 대통령이다. 국격이있지 기사양반 정신차리자,True,1,2025-01-24T02:29:21+0900,849296025448349739,2,2,0
ipij****,3uDb0,"표독스럽고 앙칼진 박은정  아직 아무런 선고도 받지않은 현직 대통령으로서 갖출 기본 예의다  
  무식하고 못되먹은ㄴ 티비에  나오면
 너 앙칼진 목소리에 화가 치밀어
   여 우같은 화면에 때리고 발길질로 분풀이한다
  이죄명 정청래 박찬대 서영교. 추미애 
 최민희 전현희 이성윤 이것들까지",True,1,2025-01-24T01:47:33+0900,849293332520632403,2,2,0
wste****,2iqix,체포시 없던 넥타이는 어디서 난거임? 병원진료부터 온갖 특혜구만,True,1,2025-01-24T01:22:54+0900,849291744540360845,2,2,0
tolt****,2MOcT,현직 대통령이다. 품위유지는 당연한 것.,True,1,2025-01-24T01:17:03+0900,849291368479064073,2,2,0
ruby****,c16Nu,대통령님 힘내셔야됩니다,True,1,2025-01-24T01:15:58+0900,849291298266415274,2,2,0
l120****,5GWpe,석열이가 헌재에서 말하는거 봤습니다. 인간의 탈을 쓰고 뻔뻔한 거짓말을 하는걸 보니 가증스럽더군요. 저런 쓰레기를 빨리 치워야 되겠다는 생각이 드는군요.,True,1,2025-01-23T21:46:48+0900,849277823142068509,2,2,0
coex****,1mgiV,후까시까지...ㅋㅋㅋ 여러가지 한다...그거 할 정신있음 국민과 역사에 사죄나 혀라..천박하게 굴지말고,True,1,2025-01-23T21:31:56+0900,849276865414693173,2,2,1
yage****,2Zeyc,자기잘못을. 부하들 탓으로 돌리는..역대최고의 찌질한 대통령과 국방장관으로 기억될것이다!!,True,1,2025-01-23T21:09:47+0900,849275437572948230,2,2,0
w319****,7GmDr,"이상한여자네
현직 대통령인데 그럼 망나니 봉두난발을
해야 니 속이 시원하겠냐
예의도 없고 매너도 없고
미운 지 기분만 중요하냐",True,1,2025-01-23T21:09:23+0900,849275412675559543,2,2,0
lsy0****,5DuS7,생긴게 구린데 뭔 상관? 나라 꼬라지 이렇게 만들어 놓고 웃어??? 아주 용현이랑 둘이서 상목이 위증죄  만들어 주던데???,True,1,2025-01-23T20:57:58+0900,849274676625539382,2,2,0
lsml****,4DLQ1,쪼잔하게  이런것 가지고 ... 에그,True,1,2025-01-23T20:56:30+0900,849274581985263801,2,2,0
jsle****,6KS1k,박은정씨 가지가지 육갑이네!,True,1,2025-01-23T20:47:45+0900,849274018824454391,2,2,0
fox8****,1hyOv,트집 잡을 걸 잡아라. 간첩아..,True,1,2025-01-23T20:42:02+0900,849273650614894605,2,2,1
jlsl****,3l6BS,나도 저넘 싫지만 겨우 머리 좀 만진걸로 트집잡지마라,True,1,2025-01-24T07:14:35+0900,849314401449148519,1,1,0
nldo****,,,False,1,2025-01-24T06:54:45+0900,849313124132585557,0,0,0
3gkw****,djC73,결국은 대통령이 국민들 앞에 세계 언론앞에 깨 쩨쩨한 모습으로 나오길 바랬나보구나 나라 걱정은 1도 없고 그저 대통령 망신주고 끌어내리기에만 혈안인   이런 사람한테 피 같이 아까운 혈세를 줘가면서 꼭 봐아하나!!  천사란 소리는 못들어도 악녀란 소리는 듣지 말아야지 돈도 명예도 한순간이다,True,1,2025-01-24T06:54:41+0900,849313119837618255,1,1,1
tisu****,4fHaJ,대통령이 초췌하고 추레한 모습으로 비취지기를 바라는데 안 그래서 화난다. 이거잖아. 사악한 인간들 같으니라고.,True,1,2025-01-24T06:08:24+0900,849310137603588134,1,1,0
zion****,,,False,1,2025-01-24T05:20:57+0900,849307081247817783,0,0,0
zxcs****,4CcVh,그래도 현직대통령이고 나라의 얼굴인데,True,1,2025-01-24T05:11:14+0900,849306454836903955,1,1,1
woos****,1KcTl,죄국 혁신당스러운 박은 ㅈㅓㅇ~ 감옥에서 잘난척 하는 죄국.. 안보니깐 좋다.,True,1,2025-01-24T05:07:45+0900,849306230307422253,1,1,0
well****,2Gpgv,"박은정 너도 국개냐,
혈세가 아깝다.국개가 그렇게 할 이야기 없냐",True,1,2025-01-24T05:02:26+0900,849305888136101924,1,1,0
kevi****,1TTCe,국민을 위해 일 하라고 세금으로 월급. 연금혜택. 기사딸린 고급차 주었더니...국민 돌볼 생각은 않고...  이 나라가 온통 자기건줄 아네..... 김건희.특별법 국회 표결할려니.... 국민들 앞에 까발려질께 두려워...나라 지키는 국민의 군대 동원해 판 뒤집고... 월급받는 5년짜리 머슴이 해야 할 국민들 복지에 땀 하나 흘리지 않았으면서,True,1,2025-01-24T04:48:57+0900,849305019428634682,1,1,0
yy73****,1cex3,연합뉴스 기사 꺼리가 없나보네  진찌 구질구질하다  혹시 김다혜 친중 기자인가,True,1,2025-01-24T04:48:02+0900,849304960322502658,1,1,0
sedu****,vEXg,은정아 꼬우면 너도 교도소 들어가. 스타일링이 그리 부럽냐?,True,1,2025-01-24T04:42:04+0900,849304576023592969,1,1,0
kjsl****,1RJy9,야..법 앞에 만인이 평등한대...입벌구 둘아...,True,1,2025-01-24T04:30:15+0900,849303814707085329,1,1,0
yryo****,,,False,1,2025-01-24T04:07:17+0900,849302335476727826,0,0,0
yjs5****,,,False,1,2025-01-24T03:56:26+0900,849301636051370014,0,0,0
mmuo****,1ScTN,"초췌했으면 지지율 더 올라갈거 같은데? ㅋ 출구가없다, 간첩들",True,1,2025-01-24T03:36:22+0900,849300343266213912,1,1,0
kkys****,HGPk,"법무부는 들으시소
내란죄인이 국격은 이미 떨어뜨렀고
내란죄인 헤어스타이링 허용한 건  웃음거리가 되는겁니다
헤어스타일링 해중션 국격은 유지된다고 누가 그러던가요?",True,1,2025-01-24T03:33:53+0900,849300183480008784,1,1,0
stud****,,,False,1,2025-01-24T02:48:03+0900,849297230186676229,0,0,0
tnzo****,3vf5r,특혜가 아니고 그냥 대통령이다.,True,1,2025-01-24T02:24:37+0900,849295721461973050,1,1,0
6545****,cEo7p,깔끔하시니까   또  지들눈에는  너무  배아팠구나   그리고  누가봐도  대통령풓격  이런 대통령이   어디있어  찢은  꿈엔들  그런  포스가  나오냐  사람의  진심은  외모에서도  품어져  나온다,True,1,2025-01-24T02:22:54+0900,849295610430357596,1,1,0
nylo****,1hfyG,삭발시켜라 내란우두머리 머리를 뭣하러? 세금낭비다,True,1,2025-01-24T02:06:41+0900,849294565662785614,1,1,0
open****,D8X7,수감중인데 넥타이를 어떻게 맬 수 있지? 넥타이 금지 물품이잖아? 김용현도 안매고 나왔는데?? 뭐야 이거 ㄷㄷㄷㄷㄷㄷ,True,1,2025-01-24T02:04:33+0900,849294428626485309,1,1,1
my8w****,,,False,1,2025-01-24T02:02:59+0900,849294327677976695,0,0,0
atmo****,1qTBW,깜빵에서 넥타이는 자살 방지 금지품목아님?,True,1,2025-01-24T01:58:00+0900,849294006763388930,1,1,0
gwje****,1wyky,이재명이는 아직도 살아서 돌아댕기는데 특혜아니냐???,True,1,2025-01-24T01:49:38+0900,849293467359117406,1,1,0
hifr****,3EwQ3,"내란은 민주당이다.민주당 원흉은 대로활보중이다.
현직 대통령 왜 수의 입히고 싶어 환장했냐?  탄핵 한번 봤기 때문에 이후로 거저 얻어걸린 인간 하는꼴을 봤기땜에 궐기하는것이다. 나라 거덜내고 해외나가 북한편에서 잘봐달라고 히죽거리는 꼴을 봤기땜에 지금 청년들이 분노하는거 그걸 모르냐???",True,1,2025-01-24T01:49:31+0900,849293459960365142,1,1,1
wjk3****,,,False,1,2025-01-24T01:45:09+0900,849293178455457811,0,0,0
twoh****,,,False,1,2025-01-24T01:42:01+0900,849292976776544259,0,0,1
eklu****,Rh5I,죄수복 입고 왔어야지. 특혜 맞네,True,1,2025-01-24T01:19:43+0900,849291539623444592,1,1,0
icep****,6TyZF,대통령이 그럼 추노로나와야 합당한거냐,True,1,2025-01-24T01:16:27+0900,849291329270710334,1,1,0
jinp****,8bfPf,법꾸라지 법돼지 대한민국 역사의수치,True,1,2025-01-24T00:56:45+0900,849290060141428890,1,1,1
jus8****,9q2cA,별걸 다 트집잡고 난리네 윤대통령님  힘내세요 항상 지지합니다,True,1,2025-01-24T00:52:29+0900,849289785867501685,1,1,0
ywgw****,eohcz,그래도 아직 현 대통령이시다,True,1,2025-01-24T00:33:08+0900,849288538481492004,1,1,0
song****,gCTn,구두로 말만하면 되는구나 특혜에 특혜 특혜다 수용자들도 신청 하겠구만,True,1,2025-01-24T00:02:42+0900,849286578550341858,1,1,0
7058****,9N4Un,죄인에게 특혜라는건없다,True,1,2025-01-23T23:02:28+0900,849282697158197412,1,1,0
ssmh****,,,False,1,2025-01-23T22:15:39+0900,849279681554284830,0,0,0
wmba****,IPj0,이건 좀 아니지. 그지꼴로 망신 줄려는 의도라고 밖엔. 그래도 아직까지 국민이 뽑은 대한민국 대통령이다,True,1,2025-01-23T21:09:19+0900,849275408112156773,1,1,0
jhee****,,,False,1,2025-01-23T20:57:52+0900,849274669797212440,0,0,0
xoqj****,32BbY,찢쮀는. 도대체 언제 사형 될까,True,1,2025-01-23T20:56:44+0900,849274596816322826,1,1,0
acul****,2l6cx,윤카가 안씻어도 찢보단 인물 좋으니까ㅜ괜한 시비걸지 마라 ㅋㅋ,True,1,2025-01-23T20:32:00+0900,849273003668668418,1,1,0
down****,,,False,1,2025-01-25T00:28:11+0900,849380991645515819,0,0,0
whym****,OGPf,현직대통령이다. 다 아가리 닥쳐라,True,1,2025-01-25T00:23:48+0900,849380708982980825,0,0,0
talk****,,,False,1,2025-01-24T22:49:23+0900,849374626386542732,0,0,0
