user_nickname,userIdNo,comments,visible,replyLevel,regTime,parentCommentNo,sympathyCount,antipathyCount,replyAllCount
hddc****,1Ti2M,그날 5천만 국민이 생생하게 본게 다 헛거냐. 진짜 더이상 5천만 국민을 괴롭게 만들지 말고 빨리 탄핵해라. 뭐냐 지금 이게 나라냐. 자신의 죄를 덮고자 내란을 일으킨자를 버젓이 보고 있다니.,True,1,2025-03-12T09:53:27+0900,853684887809425596,335,53,10
ikko****,2v713,"민주의 탈을 쓴 악의 3대 축 : 더불어민주당, 민주노총, 조선민주주의인민공화국 + 덤으로 전교조 : 싹 다 박멸이 자유대한민국 수호의 길입니다.",True,1,2025-03-12T06:16:26+0900,853670906399031350,709,457,44
juyy****,cXO27,죄 있는 줄 알고 잡아가 죠져보니 대통령 권한 내에서 행사한 액션이라 없는 죄 만들어 내려니 머리 아프것다.문행배외 잡연 3마리가 묻지마 좌파라 인민재판 보는것 같더라. 헌법법률이 아닌 정치 성향에 따라 심판한데는게 민주주의? 차라리 공산주의해라 4놈.연,True,1,2025-03-12T06:14:24+0900,853670775285088311,898,650,46
h964****,4nyC4,거짓의 판결문을 작성할려니 계속 말이 꼬이고 앞뒤가 안 맞겠지. 지금까지 헌재 일부 판사들이 이렇게 형편없고 좌경화 된줄 몰랐었다. 어찌 판사복을 입고 아동 포르노를 보고 주식 투자를 하고~~~저런것들을 헌재재판관이라 할수 있는지,True,1,2025-03-12T06:09:32+0900,853670462071242825,1071,834,79
lewk****,16VRu,심사숙고할 사항이라고? 초딩도 아는 이 엄청난 일을...,True,1,2025-03-12T08:29:25+0900,853679473919262830,160,8,0
opic****,1mHry,평시에 군경 동원해서 계엄일으켜도 된단 말인가? 그걸 인정하는 순간 나라 개판된다. 당연 탄핵이다. 그게 상식이지,True,1,2025-03-12T08:24:30+0900,853679157433860240,164,24,0
regi****,vqpx,실체도 없는 내란죄를 뺀이상 탄핵은 당연히 각하되어야 한다 심사숙고할 거리가 못된다,True,1,2025-03-12T06:14:28+0900,853670779445837883,404,266,20
kimy****,EagI,절차가 문제있고 증인의 진술이 문제 투성이 인데.당연히  고민되겠지  기각,True,1,2025-03-12T06:12:25+0900,853670647694360638,402,268,20
stev****,YfQn,노무현 박근혜 때보다도 쟁점 사항이 더욱 명확한 이번 탄핵이 더 길어진다? 71년 동안 있지도 않던 구속취소도 그렇고 왜 이번만 특별하게 진행되지? 그만큼 나라가 기득권에 의해 썩어가고 있는거다.,True,1,2025-03-12T07:22:01+0900,853675131690549252,52,13,0
nini****,dzxS8,답이 나왔으면 그냥 발표하면 되는데 재판장이 답을 정해두고 거기에 맞추려고 평의자들 설득하니 길어지지 않고 배기냐? 심지어 대통령 탄핵은 빨리 처리해야된다고 다른거 다 미뤄놓고 제일 먼저 심리 끝내놓고 이제와서 무슨 사건번호 순서대로 해야된다질않나,True,1,2025-03-12T06:19:37+0900,853671111567605845,44,8,0
wide****,36FCV,대한민국을 잠식한 전체주의 좌파들의 거짓 선동에 언론까지 가세해 여론몰이로 사기탄핵 했으나 계몽되어 실체를 알아채 여론은 반전되고 절차적 흠결은 크고 증거는 오염됐고 재판관들의 사상적 편향까지 낱낱이 드러난 상황이니 각하나 기각으로 결론 난다. 사필귀정!,True,1,2025-03-12T06:50:24+0900,853673094416433208,61,28,2
kjhc****,ff6N,대통령이  민주당의  내란공작에  당한걸  만천하가  다 아는데   뭘  고민??   당연히 기각이지,True,1,2025-03-12T06:59:32+0900,853673682810175562,61,29,7
pji4****,,,False,1,2025-03-12T07:35:47+0900,853676018634850466,0,0,0
kjs4****,2HUJa,우리나라 국민만 본게 아니고 전 세계가 생생하게 지켜봤는데.... 뭘 심사 숙고하나???     탄핵기각이되면.....  쪽 팔려서 한국에서 살겠냐?...아니.... 한국인이라는것도 창피해지겠다...  일고의 가치도 없다.,True,1,2025-03-12T09:49:08+0900,853684610079391816,35,6,0
jaey****,2fYmZ,누구나 알수 있는 명백한 죄를 저질렀는데....무엇을 고민하는가 ???  이제 국민들의 분노가 치밀어 오르고 있다 .... 장난질 거짓 선동 그만하고 조속히 마무리 되어야 한다 !!!!!,True,1,2025-03-12T09:53:21+0900,853684881484415111,28,1,1
rubs****,3Csdh,비상사태선포는 대통령의 법적 권한인데 헌재는 심의를 오래할 이유가 없다.,True,1,2025-03-12T07:35:51+0900,853676023064035513,36,13,1
daha****,317fW,"무슨  꿍꿍이를 모색하는  중 인 모양 입니다.     솔직한것은  그 즉시  발표하세요.     설득 , 회유  등  당하지 말고   상식  그대로   해라.     국민이  보고있다.   두 눈  부릅뜨고    !",True,1,2025-03-12T06:36:27+0900,853672196365615165,21,0,0
jyb6****,MD2B,조작선동이 드러났고 내란이 아니라고 국회와 헌재에서 자백한 이상 탄핵은 원천 무효이므로 각하가 답이다.,True,1,2025-03-12T08:12:42+0900,853678397224648870,27,10,0
jaco****,VK34,기각하는게 맞다.계엄은 잘못됐지만 대통령의 고유권한이고 계엄에 이르기까지 걸핏하면 탄핵.특검.예산삭감으로 나라를 말아먹으려한 야당의 내란 세력에 대응하는 불가피한 조치였다고 본다.국민이 선출한 대통령을 이런식으로 탄핵시키는건 말이 안된다.,True,1,2025-03-12T07:39:37+0900,853676265142485124,29,15,6
auro****,,,False,1,2025-03-12T07:40:19+0900,853676310340304966,0,0,0
jump****,1cfJI,너무나도 명백한 내란 반란 사건이다. 법대로 내란 수괴는 즉각 탄핵 후 총살만이 답이다.,True,1,2025-03-12T09:53:21+0900,853684881467637893,13,1,0
jins****,2uCDm,"댓글들 보니 가관이다 
이나라 청년들의 미래가 걱정이다
이런 계엄같은 말도안되는짓은 
 절대 두번다시는없도록 강력히 해야한다!",True,1,2025-03-12T08:11:51+0900,853678341708841196,19,9,0
seji****,2qsQS,"힘들게 민주주의를 이뤄온 대한민국이 어쩌다 극우, 사이비, 광신도들이 설치는 나라가 되었나... 눈먼 자들을 현혹시키고 나라를 파탄낸 사탄을 확실히 처리하는 길만이 바른 대한민국으로 가는 길이다.",True,1,2025-03-12T09:22:09+0900,853682871003512891,12,2,2
leco****,k0ze,대한민국 사법부가 이렇게 썪었나 누가봐도 사형 때릴 사건을 이렇게 질질끌어,True,1,2025-03-12T10:46:57+0900,853688334201913816,11,1,2
pekl****,OtKO,내란을 일으킨 대통령을 파면하는게 이렇게 어려운 일이야?? 헌법기관에 군인을 보냈는데?? 내란 수괴는 파면만이 답..,True,1,2025-03-12T09:51:22+0900,853684753239376020,10,3,1
gop1****,5akBS,"하루빨리 파면해서 국가를 원래의 상태로 돌려나야한다..경제,외교,국방이 엉망이다,,이게 나라냐! 정말~",True,1,2025-03-12T10:48:31+0900,853688434848432384,8,1,0
domg****,1sMzR,도대체 언제까지 이러고 살아야하나 빨리 선고하고 끝내라 더이상 나라꼴 개판되기전에,True,1,2025-03-12T13:23:16+0900,853698405245911151,7,0,0
heys****,2GiGz,극우들은 윤석열의 독재국가에서 살고싶은가보네 윤건희 줄테니까 니들이 나가라 대한민국국민들은 민주주의국가에서 자유롭게 살고싶다,True,1,2025-03-12T12:59:48+0900,853696892880552243,7,0,0
asa1****,OW8v,심사숙고는 무슨 생중개로 보구 증인들 다자백했는데 무조건 탄핵이지,True,1,2025-03-12T10:18:28+0900,853686499814670545,7,0,0
ohmi****,3Mfgp,팩트는 탄핵 안되면 경제 나락감 아무리 위기였어도 계엄으로 군을 동원하는 자충수는 두면 안됐어 만약 돌아온다면 누가 한국에 투자하겠냐? 지 맘에 안들면 계엄 일으키는데 중국보다 위험한 나라지 이게 ㅋㅋ,True,1,2025-03-12T10:48:37+0900,853688441542541586,8,2,0
haej****,2cQkwg,이게 심사숙고 할일인가? 누가봐도 죽일놈인데 사형만이 답이다,True,1,2025-03-12T13:43:43+0900,853699722005709086,7,1,0
tvsu****,3nTjD,"우리나라 국민만 본 게 아니고 전세계가 주목했다. 역사에 더럽게 남아 가족 3대 4대 자손 대대로 오명을 뒤집어 쓰게 만들 생각이신가요. 마약사건 뒤덮은 검찰총장에 자기가 쓴 책도 번복하며 대통령 풀어주는 판사에, 지 마누라 지린거 품어주려고 국민에게 탱크돌린 대통령에, 이 꼴 저 꼴 아사리판을 답답하게 지켜보고 있는 국민은 안중에도 없고 자기들 재선만 생각하며 눈알 굴리는 국개의원들까지 판치는 이 나라가 얼마나 갈 것 같습니까. 이미 내전에 돌입한 것 처럼 국민들 갈라치기 해서 싸움까지 붙이고 정말 더러워서 치가 떨립니다.",True,1,2025-03-12T16:58:51+0900,853712294163513709,6,0,0
beha****,atBUy,가장 명확한 사건을 가장 오래 심사하는 기이한 행태,True,1,2025-03-12T14:07:26+0900,853701250040987847,6,0,0
wm******,Szic,탄핵기각으로 만약 윤석렬이 대통령 권한을 회복한다면 정말 끔찍한 일이 벌어질것 같아 이 아침 또 나는 고민에 잠긴다 .. 대외경제는 심각하게 추락할것이고 민주주의를 지켜온 대한민국은 나락으로 떨어질것이다 ... 헌재는 이점 잊지 말아야 한다,True,1,2025-03-12T09:29:48+0900,853683363767124279,9,4,0
46******,3nN36,뭔???숙고여!!!  &lt;&lt;&lt;피청구인 대통령 윤석열을*****파      면*****한다&gt;&gt;&gt; 가 당연한데!!!!!!!!!!!!!!!!!,True,1,2025-03-12T10:44:31+0900,853688177301389585,7,2,0
sini****,,,False,1,2025-03-12T09:51:18+0900,853684749649051769,0,0,0
jh92****,2Kcck,윤썩렬은 법 위에있냐? 이런 불공평한 세상이 어딨냐 당장 탄핵 인용하라!!!,True,1,2025-03-12T12:42:12+0900,853695759277621321,5,0,0
jenn****,ezQaY,계엄 문제 없다고 생각하는 인간들 북한 가라고 ㅋㅋㅋ 제발 왜 멀쩡한 민주주의 국가에서 난리임?,True,1,2025-03-12T12:02:31+0900,853693202228576486,5,0,0
lilc****,6opg9,개수작 떨지말고 빨리 각하해라. 애초에 말도 안되는 탄핵이었다.,True,1,2025-03-12T07:42:10+0900,853676429810860076,10,6,2
park****,1msuM,"윤석열 탄핵 찬성이지 민주당을 지지하는건 아닌데, 2찍들은 뇌구조가 참희한해, 원인결과를 혼동하는 인간들 천지다. 단적으로 윤석열 탄핵찬성은 65프로 이상나오지만 민주당 지지율은 그만큼 안나온다. 윤석열 탄핵은 정치성향문제가 아니라, 상식인거다.",True,1,2025-03-12T12:15:27+0900,853694035804553406,5,1,0
jkh1****,7ik1c,인민당 개들의 꿍꿍이?,True,1,2025-03-12T06:12:20+0900,853670642224988217,5,1,0
yee1****,3mB20,나라의 본이 되어야할 대통령 자리를 악의축에게 속아서 잘못 뽑아 놨음에 나라와 국민이 계속 위태로워지고 있습니다. 당분간 고통의 순간들이 오더라도 꼭 파면선고로 나라를 정상으로 되돌려 놓을수 있도록 법의 엄중함을 헌재가 앞장서서 보여주십시요,True,1,2025-03-12T14:46:55+0900,853703794003804571,4,0,0
dnfl****,4iwv0,"법률용어로 계엄선포는 ""사실관계가 너무 명확한 사건"" 이다 탄핵은 당연한것이고 형사상구속과 사형이 적법한 형벌이다. 사형되어야 앞으로 이러한 선례가 남지 않는다",True,1,2025-03-12T13:45:01+0900,853699806713872399,4,0,0
cyan****,chVCC,내란수괴 입니다. 전국민이 다봤습니다. 수고호는 사이에 국민들 숨막힘니다. 한시라도 빨리 탄핵인용 부탁드립니다.,True,1,2025-03-12T13:21:33+0900,853698294465954043,4,0,1
sncj****,1kpk1,절차가 개판인데 평의 의견도 4대4로 갈리겠지 각하가 최선이라 본다,True,1,2025-03-12T10:03:29+0900,853685533631578335,4,0,0
ehdq****,,,False,1,2025-03-12T09:38:08+0900,853683900688367688,0,0,0
hse2****,1bzYc,그게 왜 숙고 할 일이냐?  박근혜와 윤석열 비교해봐라.  박근혜는 새발의 피다~~~,True,1,2025-03-12T09:29:27+0900,853683341570867365,4,0,0
supe****,1541U,계몽령이란 말장난이다. 계엄령이다. 60대 노인들 전광훈한테 돈 받고 댓글 알바한다.,True,1,2025-03-12T09:26:44+0900,853683166685167896,4,0,0
kiy6****,,,False,1,2025-03-12T08:21:27+0900,853678960200908912,0,0,0
djho****,1wnbi,"전 국민이 봤고 온갖 거짓말에ㅜ혼자 나와 웃어 제끼던데
뭘 심사숙고 한다는건지 2주 지났다~",True,1,2025-03-12T08:09:07+0900,853678165900394535,4,0,0
upst****,,,False,1,2025-03-12T06:41:51+0900,853672543721095287,0,0,0
osjs****,6QbOd,헌재야   일러두는데   대한민국은   자유민주주의  국가인거  알겠지   만일  어느한사람   의견에   동참하라고   억압하거나   압박하는거   아니길바란다     만일   인민재판하듯    이런일  있으면   어떤일  있어도    그책임은   헌재가  짖는다,True,1,2025-03-12T06:33:19+0900,853671993730400302,7,4,0
yjk6****,2IYrW,친위쿠테타가 명백한 윤석렬 내란수괴가 하루빨리 파면되고 재구속되야 그나마 나라가 바로잡히고 경제폭망에 힘든 국민 생각좀 해주세요!!,True,1,2025-03-12T08:26:27+0900,853679282692554872,6,3,0
chaa****,7sT5q,"죄 있는  공수처는 아무런 재제도 못하고 죄없는 최고통수권자 대통령을 조져 놨으니  ,  그감당을 어케 하겠나 , , 이제 할일은 잡범부터 민주당이 셀프로 잡아가두면 면책이 어느정도 되겠네 , ,   ,  이재명은 한국 감옥에 가두면 나라가 오염된다 , , 관타나모에  수명이 다할때까지 감금 시켜주세요 트럼프황제님 , ,",True,1,2025-03-12T06:51:07+0900,853673141023539218,6,3,0
pkm-****,bWH14,"2찍 좀비노예들... 계엄을 계몽으로  들었다는  귀를  의심해라...
목사를  신으로 모시는  극우 개신교인들...",True,1,2025-03-12T09:25:22+0900,853683078185353366,5,2,0
mose****,8Nh07,"심사숙고 아니라 100% 각하이다!! 계몽령 국민속이 확 풀렸다~ 썩은 카르텔 곳곳에~~// 이딴 사태의 주동자 리죄명이 사형이면, 나라가 조용할거다!!!",True,1,2025-03-12T08:49:41+0900,853680779052450019,5,2,0
omni****,LbR2,내란정당 내란의힘 내란수괴 내란판사 내란검찰..  국민을 위험에 빠뜨리는구나.,True,1,2025-03-13T02:42:42+0900,853749908430127166,4,1,0
chan****,23Nmn,하루라도 빠른 인용선고 바랍니다. 서민들은 죽기 일보직전입니다. 개엄으로인한 이 혼란스런 상횡종식은 하루라도 빠른 탄핵 인용선고입니다. 제발 국민들 두다리뻣고 잘수 있도록 빠른 탄핵인용선고 바랍니다,True,1,2025-03-12T22:14:08+0900,853732606338924591,4,1,0
feob****,2n0Tk,김건희 방탄용으로 계엄령을 내리는 미.친 윤석열! 이 인간은 대통령이 아니다. 김건희랑 처벌 받아야 할 범법자다.,True,1,2025-03-12T19:57:40+0900,853723813836226762,3,0,0
531s****,3j4GV,"윤석열 탄핵!
윤석열 사형! 내란수괴 사형! 내란동조자 사형! 국민의힘 정당해산!

권력과 돈의 노예 : 검찰 경찰 군인
검찰 경찰 군인 윗대가리들 싹 갈아 엎어라 !
청렴 결백 공명정대 되찾아라 !",True,1,2025-03-12T12:42:05+0900,853695752214413351,3,0,0
rhdm****,TZMr,이렇게 명백한 사건이 어디있냐?심사숙고 따위 웃기지도 않는 말이다 당장 파면하라,True,1,2025-03-12T12:33:28+0900,853695196720791740,3,0,0
cham****,5qKM4,나라가 죽어갑니다.절차법도 좋지만 빨리 탄핵으로....,True,1,2025-03-12T09:48:18+0900,853684555402444910,3,0,0
ehdq****,,,False,1,2025-03-12T09:35:13+0900,853683712833880143,0,0,0
cch0****,1P2N5,이게 심사숙고할 일이냐??,True,1,2025-03-12T08:36:50+0900,853679951767929088,3,0,0
kyp8****,3nVJE,먼저 헌재를 해체하자,True,1,2025-03-12T08:19:31+0900,853678836351500439,3,0,0
cyle****,47Ax2,국민의 한사람으로서 헌법재판소 간판을 내리는 판결이 나오지 않기를 바란다,True,1,2025-03-12T08:16:24+0900,853678634773250150,3,0,0
kimy****,1rnev,공산당과 부화뇌동세력 멸하는 게 정답이다.,True,1,2025-03-12T08:09:48+0900,853678210024472818,3,0,0
the3****,1tqEL,심사숙고 할것이 뭐있나!   전국민이 다아는 사실을,True,1,2025-03-12T08:08:50+0900,853678148166877390,3,0,0
kdm2****,,,False,1,2025-03-12T08:00:37+0900,853677618761826443,0,0,0
lumb****,4J4od,헌법에도  좌파 우파 있다니  참  웃긴 세상이다.,True,1,2025-03-12T08:00:19+0900,853677598696276050,3,0,0
kimh****,,,False,1,2025-03-12T09:15:17+0900,853682429024534620,0,0,0
dbrd****,5QYMA,거짓의 판결문을 작성할려니 계속 말이 꼬이고 앞뒤가 안 맞겠지. 지금까지 헌재 일부 판사들이 이렇게 형편없고 좌경화 된줄 몰랐었다. 어찌 판사복을 입고 아동 포르노를 보고 주식 투자를 하고~~~저런것들을 헌재재판관이라 할수 있는지,True,1,2025-03-12T07:52:51+0900,853677117693493437,5,3,0
kuam****,1haMk,답정시간끌기---기각 땅땅땅,True,1,2025-03-12T06:34:14+0900,853672053037858849,4,2,0
mnfa****,rm2Z,친일극우 내란수괴 옹호하는 친일분자들아. 니들 나라 일본에 가서 살아라. 여기는 일본이 아니라 대한민국이다.,True,1,2025-03-12T22:00:07+0900,853731702449635373,3,1,0
jang****,6GaCz,국민 전체가 총칼든 군 투입을 봤는데.. 뭔 심의가 이리길어.. 두창이가 갈곳은 정해져 있는거아냐?,True,1,2025-03-12T10:15:47+0900,853686326254371197,3,1,0
toro****,1Z68l,윤통 탄핵소추 반드시 기각결정 나와야 이 나라가 삽니다 지금 서울중앙지법 에서 나온 구속취소 결정문 검토하느라 시간이 걸리는것 같습니다,True,1,2025-03-12T10:03:54+0900,853685560441569652,3,1,0
cjdd****,1NP35,아니 뭐 상의할게 따로 있나? 탄핵은 무조건 해야지,True,1,2025-03-12T09:52:39+0900,853684836387258603,3,1,0
msju****,2G9M0,대통령 탄핵은 물론 29번 모든 탄핵은 절차성과 공정성이 무너진 불법 탄핵입니다. 내란죄는  이죄명의 민주당이고 내란 공범은 꼼수처와 헌법개판소입니다.,True,1,2025-03-12T09:23:44+0900,853682973059318064,3,1,0
jyi3****,bshnC,"❤️ 기획음모불법에불법을 쌓아  더듬이들, 헌재, 선관위 공수처 검찰 언론이 짬짜미로 한거 국민들이 다아는데.. 그리고 이들이 하는짓 봐라 인간이가.. 중세시대 아프리카도 안그러겠다.. 욕도 아까운 3기들 ❤️",True,1,2025-03-12T09:14:05+0900,853682351127920679,3,1,0
msju****,2G9M0,"국민이 뽑고 열심히 일하는 대통령을 터무니 없는 탄핵으로 장기간 국정을 마비시키고, 29번 탄핵으로 국정발목을 잡는 행위가 바로 내란죄입니다.줄 탄핵시킨 이죄명의 민주당을 반드시 심판해야 됩니다.",True,1,2025-03-12T09:09:46+0900,853682073028788492,3,1,0
3075****,1KCg1,지금까지 구속을 날로 계산하다가 윤씨만 시간으로 계산을 해???? 너희가 생각해도 이건 아니지 않냐,True,1,2025-03-12T09:08:46+0900,853682008956600575,3,1,0
car1****,1Jcxq,급하게 하지말자. 헌법에 약속된 180일 이내에 하면 되니까 급하게 하지말고 심사숙고하자. 대한민국의 운명이 왔다갔다 한다.,True,1,2025-03-12T08:50:49+0900,853680852670873853,3,1,0
wjdt****,OjfD,시간 끌지말고 사기탄핵 즉각 각하해라!,True,1,2025-03-12T08:40:54+0900,853680214062924056,3,1,0
mimi****,hh7w,"심사숙고 할게어디잇노 
탄핵이지 내란인데 
헌제 미친거아니야",True,1,2025-03-12T08:26:12+0900,853679266720645169,3,1,0
nebu****,,,False,1,2025-03-12T08:16:31+0900,853678643111526541,0,0,0
ksjo****,2cQuzf,나라가 하루빨리 안정되게 윤깡통 빨리 파면 하라,True,1,2025-03-13T13:17:22+0900,853790795713478812,2,0,0
a181****,,,False,1,2025-03-12T19:33:37+0900,853722264376443070,0,0,0
mts5****,3ZnOJ,윤설사형판결광화문효수후세본보기삼자,True,1,2025-03-12T18:53:09+0900,853719657431957561,2,0,0
5150****,,,False,1,2025-03-12T17:17:20+0900,853713484506988698,0,0,0
leeh****,mUjs,이렇게 오래 걸릴 일인가,True,1,2025-03-12T14:27:22+0900,853702534202654876,2,0,0
ceza****,2jxwM,"계엄관련자들은 다 기각되고 있는데 ᆢ
계엄 대한 책임은 누가 지는지 ᆢ
한명은 책임을 지야지 ᆢ",True,1,2025-03-12T14:08:54+0900,853701345419461060,2,0,0
bomn****,4tlTC,"빨리좀선고해라!!!
상식적으로 인용이지않습니까?",True,1,2025-03-12T13:26:03+0900,853698584342691860,2,0,0
kshi****,2URgD,빨리파면하세요,True,1,2025-03-12T13:20:11+0900,853698206100357199,2,0,0
seka****,69AJr,"평의할게있냐? 법치국가에서 그냥 글만 읽어도 파면이라는거 다아는데,,,",True,1,2025-03-12T13:12:36+0900,853697717363278084,2,0,0
dnfl****,4iwv0,※ 빨리 선고해라 ※  5천만이 생중계로 헌정이 유린되는걸 보았는데 모가 더 필요하냐?,True,1,2025-03-12T12:49:52+0900,853696253014311254,2,0,0
csg7****,1kuBh,당연히 권력남용에 탄핵인데 왜 저리꾸물대는지? 정말 상식이 없는 독재주의를 만들셈인지? 역사에 죄인이 되지마라! 빨리 종결시키고 새로 뽑아야한다.,True,1,2025-03-12T12:39:19+0900,853695573151187083,2,0,0
dign****,2rXVX,내란죄가 이렇게 오래 끌 만큼 가벼운 항목인가? 얼른 탄핵하라,True,1,2025-03-12T12:36:38+0900,853695400194867452,2,0,0
kms9****,66oQ2,이거 늦어질수록 나라상태 말이 아닌거같은데 얼른 파면하고 나라상태 돌려놔야한다,True,1,2025-03-12T12:19:22+0900,853694287899000981,2,0,0
luna****,7MkyV,주문 피청구인 윤석열을 파면한다,True,1,2025-03-12T11:59:54+0900,853693034338976094,2,0,0
urba****,,,False,1,2025-03-12T11:36:50+0900,853691547726643557,0,0,0
icon****,,,False,1,2025-03-12T11:03:17+0900,853689386569564299,0,0,0
brf7****,twwK,온국민이 생중계 비상 계엄을 봤는데 그거 보다 확실한 증거가 어디 있나 ? 온국민 한테 보여 준 저의가 국민들도 대통령 앞에 무릎 꿇으라는 경고 아니었나 ? 실패했으니 망정이지 성공 했으면 ? 이번 계엄령이 계몽령 이라는 둥 미화 시켜서 넘어가면 다음 부턴 대통령 기준에 수틀리면 비상 계엄 하는 거다. 그러다 비상 계엄령 실패하면 국민 핑계 대면서 위기 모면하고 그게 성공하면 독재 되고 . 선례를 만들면 안된다.,True,1,2025-03-12T10:49:31+0900,853688500078248175,2,0,0
cred****,2aoCj,시간끌기 그만해라.  기각이든 인용이든 심사숙고한다고 결과가 바뀌냐? 국민들을 탄핵의 터널에서 벗어나게 해줘라,True,1,2025-03-12T10:42:45+0900,853688063937741109,2,0,0
msk1****,10Mo8,억지로 판결 할라니 앞뒤가 안맞으니 결론이 날수가. 있나?ㅋㅋㅋㅋㅋ 시작부터 간주송달로 시작하면서 대통령 직접심문권도 박탈시키고 억지로 초스피드 재판하더니 꼴 좋다.,True,1,2025-03-12T10:36:22+0900,853687652895948966,2,0,0
jjun****,2IloA,아아 나라가 망할라고 그러나.  단체로 인지능력 떨어지는 노인들이 이렇게 많으니.. 북한주민들 쇄뇌당한것과 뭐가 다르냐,True,1,2025-03-12T10:34:43+0900,853687545991528768,2,0,0
nomg****,6cDia,무고한 시민들 싹다 죽이고 독재하려고 했는데 이게 논쟁 거리가 되나 ㅋㅋ,True,1,2025-03-12T10:27:18+0900,853687068545515651,2,0,0
ssam****,,,False,1,2025-03-12T10:16:06+0900,853686347007787051,0,0,0
cha0****,4cSpw,"헌법을 부정하면 나라그간이 흔들리고  심우정은 법을 이랬다저랬다 사람에 따라 적용하면
그게 법이냐???인천마약밀수로 얻은 자리 지키느라  검찰총장이라는 놈이 하는 짓꺼리좀 봐라.",True,1,2025-03-12T09:48:58+0900,853684599023206778,2,0,0
cho2****,5IpjT,이번주 14일 미치광이 내란우두머리 윤석열8대0으로 파면!!!!!!!~~~우리나라전국민 아니 전세계에서 윤수괴가 불법계엄으로 내란을 일으킨걸 생중계 실시간으로 다 봤는데 ~~~아무리 윤석열이 임명한 헌법재판관도 파면할수밖에 없지,True,1,2025-03-12T09:47:30+0900,853684504248713425,2,0,0
nayy****,ImXa,내란우두머리가 탈옥했다. 한시도 지체하지 말고 윤석열을 파면하라 !!!,True,1,2025-03-12T09:43:17+0900,853684232407482489,2,0,0
lcde****,1UEDY,변호사가 '나는 계몽되었습니다' 라는 ㄱ소리를 듣고도 고민이 되나? 지들도 눈으로 다 봤을꺼 아니야. 뭐가 고민된다는 건지. 몇명 계몽된 것들이 다 계몽시킬라고 하니 길어지는 거 아니냐?,True,1,2025-03-12T09:39:29+0900,853683987476906177,2,0,0
corm****,2ovEc,의회에 군대를 투입한 대통령을 파면하지 않으면 이제 대통령은 의회가 말 안들으면 심심하면 군대를 투입할 것이다. 이게 나라아~~~ㅋㅋㅋ 이것이 가능한 곳은 어디? 평양~~~!!,True,1,2025-03-12T09:33:37+0900,853683610375422216,2,0,0
bjgk****,2YJJB,극우 난동에 쫄아 어리석은 판단 내리지 말길. 국가 명운이 달렸다.,True,1,2025-03-12T09:32:36+0900,853683544910725336,2,0,0
