user_nickname,userIdNo,comments,visible,replyLevel,regTime,parentCommentNo,sympathyCount,antipathyCount,replyAllCount
klop****,3T9O2,머리 손질 좀 했다고 특혜 이러고 있네 그럼 법정에서 츄리닝에 슬리퍼 질질 끌면서 나와 있을까? 말 같은 소리를 해라 ㅋㅋㅋㅋㅋㅋㅋㅋㅋㅋ,True,1,2025-01-24T00:58:57+0900,849290201523028131,0,0,0
wprk****,,,False,1,2025-01-24T00:57:25+0900,849290103678304356,0,0,0
vive****,,,False,1,2025-01-24T00:56:53+0900,849290068915912871,0,0,0
cata****,1C97k,너는 엄마가 밥먹으라고 부를때 늦게나가면 숫가린ㄱ치워도 굳소리마라; 굼벵이같은 표현이나하는 족속,True,1,2025-01-24T00:56:37+0900,849290051887038592,0,0,0
krjo****,2cUvMO,이게뭐가 특혜야... 김건희 조사때처럼 방문해서 공손히 휴대폰 맞기고 총찬 경호처직원들 눈치보면서 기억안난다그러면  네 알겠습니다하곤 죄없음... 이런게 특혜지. 앞으로 오랫동안 교도소에서 머리깎아야되는데 이정도는 애교로봐줘야지...,True,1,2025-01-24T00:56:03+0900,849290015480479755,0,0,0
a332****,3anJE,박은 정.. 대구리 박았니.. 참..,True,1,2025-01-24T00:55:26+0900,849289975567482966,0,0,0
oozz****,UFk6,"아무리 물고 빨아도 국민은 안중에도 없는놈은 팩트
국민을 개돼지로 아는데 그걸 좋다고 예우라는 단어를 쓰고 참 대한민국이 잘 돌아간다",True,1,2025-01-24T00:55:13+0900,849289961290072108,0,0,0
kims****,3fk8B,"유튜브 키고 그냥 인플루언서를 해 
왜 나라를 이지경으로 만들어놔 ㅋㅋㅋ
리쨔오밍도 싫은데 윤석열은 더 싫음 ㅋ",True,1,2025-01-24T00:55:05+0900,849289952716914702,0,0,0
bomb****,4RxLk,저 이마에 대못 박고 싶다,True,1,2025-01-24T00:54:23+0900,849289907972079710,0,0,0
cine****,3yq3S,아직도 개차반 윤석열 편드는 자들은 뭐냐?,True,1,2025-01-24T00:52:43+0900,849289799977140387,0,0,0
sant****,,,False,1,2025-01-24T00:50:38+0900,849289666665382008,0,0,0
jwjj****,2v0GP,별의별  트집을 다잡아  선동할려고  좌파 쓰래기,True,1,2025-01-24T00:50:35+0900,849289662789845098,0,0,0
kum2****,,,False,1,2025-01-24T00:49:32+0900,849289595244773487,0,0,0
yaon****,,,False,1,2025-01-24T00:49:24+0900,849289586503843917,0,0,0
jy68****,89HVw,저놈 하나 때문에 국격은 개판되고 경제는 개박살 났는데  저꼬라지가  말이 되나.,True,1,2025-01-24T00:48:40+0900,849289539494084749,0,0,0
real****,4jrT8,진짜 ㅇㅕㅅ같이 생겨먹었네,True,1,2025-01-24T00:48:20+0900,849289517532708944,0,0,0
plas****,,,False,1,2025-01-24T00:46:51+0900,849289422506557600,0,0,0
q717****,5KANI,못생겨가지고 밥맛떨어진다 두룩돼지,True,1,2025-01-24T00:45:58+0900,849289365464023238,0,0,0
syc4****,5jLUN,참으로 한심한년일쎄..꼬투리 잡을게 그렇게도 없나? 국민 절반이상이 지지하는 현직 대통령이다. 비례대표주제에..,True,1,2025-01-24T00:44:05+0900,849289243745320979,0,0,0
love****,4DYdT,빡은정 찢한테 데려다 줄까? 찢기고 싶냐,True,1,2025-01-24T00:43:53+0900,849289230860419261,0,0,0
aloe****,dBWYu,와 진짜 좌파들 악독하네. 별걸 다 지ㅏ랄이네,True,1,2025-01-24T00:43:52+0900,849289230357102795,0,0,0
aa67****,1TFmr,황제 출장 같은 소리하고 있네. 무슨짓을 해서 비례 됐는지 모르겠지만 너같은 것도 같은 국개의원이라고 주둥 둥아리 놀리는 거 보니 국격 다 물 건너 갔다. ㅁ ㅣ 취. 인 련  박은정,True,1,2025-01-24T00:43:05+0900,849289179438252054,0,0,0
leeg****,1V5oi,박은정 이 여자는 한마디로 정신줄 내놓고 사는 여자인듯 합니다. 무엇이 국가에 이득인지 이런 생각은 전혀 없이 사는 이런 여자가 국회에 있으니 개탄스럽습니다. 자신의 성남FC수사와 남편의 거액수임 사건이나 제대로 해명했으면 좋겠습니다. 윤 대통령이 비롯 구치소에 구속된 상태지만 현재 대한민국 대통령 임에는 분명한데 산발을 하고 나타나는 것이 대한민국에 무슨 득이 있는지 생긱좀 하고 살았으면 합니다.,True,1,2025-01-24T00:42:36+0900,849289148282962056,0,0,0
jado****,,,False,1,2025-01-24T00:42:01+0900,849289110685220873,0,0,0
jeon****,1fJSB,사례라고 특혜가 아니다? 그 자체가 특혜다!,True,1,2025-01-24T00:41:24+0900,849289071661416543,0,0,0
mini****,2oV6a,"박은정ㅋ 참 쌓인게 많나봐?ㅎ 성남fc건 조사할려고 하니 성남지청장 박은정이 못하도록 입김 넣어서 조사 흐지부지,,,",True,1,2025-01-24T00:39:38+0900,849288957005922452,0,0,0
jsp7****,1QEZo,진짜 짜증 별걸 트집잡고날리야 당신 남편 범법자 변호해주고 큰돈 받는것보다  도덕적이네,True,1,2025-01-24T00:38:18+0900,849288872046100553,0,0,0
aa67****,1TFmr,별걸 다 트집이다. 저정도도. 못참냐?,True,1,2025-01-24T00:36:29+0900,849288754253267070,0,0,0
pgs8****,5f1fe,이여자 또라이가 맞네,True,1,2025-01-24T00:35:22+0900,849288682178347105,0,0,0
sjs2****,,,False,1,2025-01-24T00:34:56+0900,849288654630158577,0,0,1
heal****,,,False,1,2025-01-24T00:34:41+0900,849288639027347620,0,0,0
goy1****,kMdH,썩아 총 생각나제,True,1,2025-01-24T00:34:19+0900,849288614733938770,0,0,0
kore****,6qz2U,"조국혁신당아 아직 미결수인데 헤어와 외모가 단정한게 뭔죄이며 헌재재판에대한 예의아니냐. 추리링 슬리퍼신고갈까?
어쩌든지 욕보일라고. ㅉㅉ 더러운것들",True,1,2025-01-24T00:34:17+0900,849288613140103250,0,0,0
thda****,75VMo,당연한거지 ᆢ 대통령인데  외국에서도  볼텐데,True,1,2025-01-24T00:34:07+0900,849288602050363422,0,0,0
eunb****,,,False,1,2025-01-24T00:34:01+0900,849288596094451719,0,0,0
what****,1hEys,ㅂㄱㅎ 때랑 너무 다르긴 하지. ㅂㄱㅎ 때려잡은 검사라 역시 다르네.,True,1,2025-01-24T00:33:22+0900,849288553262219345,0,0,0
kg89****,,,False,1,2025-01-24T00:32:02+0900,849288468134625289,0,0,0
hanb****,NmOT,망신주기가 목적이니... 이들은 대한민국 국민이 아닌 듯. 국민이 대외적 비참함을 겪게하고 싶나,True,1,2025-01-24T00:30:59+0900,849288400421781751,0,0,0
mgs6****,,,False,1,2025-01-24T00:28:50+0900,849288261372215506,0,0,0
dmgi****,33VNf,박은정이 와 남편 그야말로 내로남불 법조양아치지.. 국개배지 아니면 죽음이니 개발광을 하는것임..이죄맹이 끈떨어지면 그대들도 줄 끊어진 연 같을것.,True,1,2025-01-24T00:27:44+0900,849288191159566538,0,0,0
bhr2****,2cBrJe,"박은정 검사시절. 무단 휴직사용. 조사는 왜하지않는가
그리고 이제 하다하다 대통령 머리까지
용모까지. 꼬투리 잡을여고
참치졸하다진작 알아봤지안 역시 쓰레기집단이구나",True,1,2025-01-24T00:26:21+0900,849288101837668447,0,0,0
cjs1****,11uqX,대한민국 국민이 개 인 현실 니들이 개 내가 개다 국민들아 정신차려,True,1,2025-01-24T00:24:55+0900,849288009848193240,0,0,0
kerk****,b6Ulw,"별것도 아닌걸로 트집좀 그만 잡어라 
공산좌파 빨갱이당아",True,1,2025-01-24T00:21:08+0900,849287765622259749,0,0,0
hsjo****,8EMTL,조국도 의혹 제기해라,True,1,2025-01-24T00:17:29+0900,849287530942562440,0,0,0
he09****,9tFt8,탄핵은 언제되고 내란죄 평생못나오게 언제되나유 그래야 국민들이 숨쉬고살어요,True,1,2025-01-23T22:43:46+0900,849281492503757113,0,0,0
cnsg****,1eUK2,"미친 ㄴ ㅛㄴ!
그럼 국민앞에 모습보이는덕 
헝클어진 머리로 나와야 되겠니?
너 단발 머리나 잘정리하고 나와라!
이뇨 ㄴ아~~~ 
그것도 트집이라고  꼭 지당처럼 하네 거런것도 국회의원이라고 ㅠ 
150명으로 줄여야해",True,1,2025-01-23T22:25:50+0900,849280337526653208,0,0,0
sun9****,1Jnch,윤계엄 말도 안되는 소리ㅋ 아름답게 대통령답게 밑에 사람들한테 책임전가하지말고 깔끔하게 내가 했습니다 하고 합법한 처벌을 받고 멋지게 물러나라 글구 다음 이죄명 빨리 합법하게 팩트가 있는데 강하게 처벌하라 국민을 농락하는 대통령과 정치인은 엄하게 처벌하라,True,1,2025-01-23T21:30:14+0900,849276755154829386,0,0,0
cole****,26tjY,은정아 니 머리 하는 비용보다 싸다.,True,1,2025-01-23T21:27:49+0900,849276599630037263,0,0,0
jwil****,,,False,1,2025-01-23T21:26:41+0900,849276526380712148,0,0,0
ssig****,5cOXp,"현 대통령이자나 10..8 것 들아 부시시 하게 나와서 해외 언론에 노출 되는 거 대한국민이라면 안 원하지.니들 좌들 말고는, 왠간히 해라.",True,1,2025-01-23T21:25:17+0900,849276436823933015,0,0,0
lcg3****,2rVef,치졸한 찐따들,True,1,2025-01-23T21:23:48+0900,849276341059584290,0,0,0
kimy****,3QXV9,"공개적인 자리에서 용모를 단정히 하는게 예의지!흰머리 염색 안하던 문재앙,찢 그리고 면도도 안하는 털보는 예의가 눈꼽만치도 없음 ㅋ 아 근데 털보는 대가리도 왜 맨날 그러고 다니냐 ㅜ 곱슬이 심하면 매직을 하던가 드라이를 안할거면 스포츠로 밀던가 ㅋㅋㅋㅋㅋㅋㅋ가끔 머리도 안 감은 것 처럼 그지같던데 ㅜㅜ털보야~그짓말로 돈 많이 번거 아냐?너도 준오헤어 정도는 갈 수 있자나!!!!!!!!!",True,1,2025-01-23T21:20:49+0900,849276148457144591,0,0,0
magi****,JnHQ,"꼴깝이 진짜 유치하다. ㅋㅋㅋㅋㅋㅋㅋㅋㅋㅋㅋ
코메디네 이거 완전. ㅋㅋㅋㅋㅋㅋㅋㅋㅋㅋㅋㅋㅋㅋㅋㅋㅋㅋㅋㅋㅋㅋㅋㅋㅋㅋㅋㅋㅋㅋㅋㅋㅋㅋㅋㅋㅋㅋㅋㅋㅋㅋㅋㅋㅋㅋㅋㅋㅋㅋㅋㅋㅋㅋㅋㅋㅋㅋㅋㅋㅋㅋㅋㅋㅋㅋㅋㅋㅋㅋ",True,1,2025-01-23T21:18:59+0900,849276030462984498,0,0,0
ljsl****,8wppn,니나잘해라헛소리하지말고,True,1,2025-01-23T21:16:59+0900,849275902201168190,0,0,0
kbt2****,da25c,대통령이라는 사람이 다 저질러놓고 떠넘기는게 부끄럽지도 않나보다 저런 대통령을 감싸고도는 사람 자식 손주들한테 부끄럽지도않나,True,1,2025-01-23T21:14:57+0900,849275771087225158,0,0,0
yg10****,1yVts,민주당 지지율이 떨어지는 원인. 쪼잔의 극치를 달리는군.,True,1,2025-01-23T21:12:50+0900,849275634990448917,0,0,0
cors****,,,False,1,2025-01-23T21:12:06+0900,849275587628367905,0,0,0
ab80****,,,False,1,2025-01-23T21:10:49+0900,849275504111386872,0,0,0
ilov****,29xGa,멧돼지털 만지는 사람도 고생이 많겠네,True,1,2025-01-23T21:10:35+0900,849275489414545592,0,0,0
9004****,,,False,1,2025-01-23T21:07:48+0900,849275310451982634,0,0,0
mild****,DNfp,진짜 야당 수준  ㅋㅋ,True,1,2025-01-23T21:07:33+0900,849275294211637459,0,0,0
ican****,6dtda,그렇다면 모든 피의자에게 머리손질의 지원해야ᆢ,True,1,2025-01-23T21:06:28+0900,849275224217092253,0,0,0
tops****,5lhvy,탄핵을 기각한다!,True,1,2025-01-23T21:04:53+0900,849275122345836800,0,0,0
miki****,,,False,1,2025-01-23T21:04:11+0900,849275077114462258,0,0,0
jhh4****,4GtDP,ㅋㅋㅋ 박은정??? 변태 원숭이 좋다고 난리치던 그 ×××,True,1,2025-01-23T21:02:03+0900,849274940329820176,0,0,0
soye****,6jHiP,박은정 저 고정간첩yeon이 어디서 나대?? 하여튼 저것들은 인간이기를 포기한 철면피들이야. 대체 뭘 ㅊ먹고 자라면 저렇게 대깨가 되는거냐?? 찢죄명 개딸것들은 하나같이 지능이 의심스러워ㅉㅉㅉ,True,1,2025-01-23T21:01:54+0900,849274930330599701,0,0,0
mom3****,9pPQ,1년에 40억을 챙겨놓고 전관예우가 아니었다고 우기는 너무나 뻔뻔한 뇬이 기가 차네,True,1,2025-01-23T21:01:19+0900,849274892749635687,0,0,0
jan7****,1eL68,적당히  해라  별것도 아닌거 가지고,True,1,2025-01-23T21:01:11+0900,849274883757047862,0,0,0
pott****,,,False,1,2025-01-23T21:00:47+0900,849274858155016426,0,0,0
rkdr****,uEUO,미궁속이다..과연 처벌이 제대로 이루어질것인가?,True,1,2025-01-23T21:00:21+0900,849274830556495985,0,0,0
gugu****,1iiPQ,재수복 입혀라 엄연히 구속됐다.,True,1,2025-01-23T20:59:13+0900,849274757391056958,0,0,0
abs6****,5hfXX,"뻘짓리들 일반인도 그렇게 할수있는디
궁굼힌면 들어가봐",True,1,2025-01-23T20:58:24+0900,849274704492494993,0,0,0
qazw****,,,False,1,2025-01-23T20:57:30+0900,849274646560768167,0,0,0
impt****,26Xlp,꾀죚히한 몰골에 떨어진 옷에 낡은 신발 구해서 신고와야 좌파들의 시선엔 정상적으로 보이는가보네…,True,1,2025-01-23T20:50:50+0900,849274217517023492,0,0,0
stel****,5JOIQ,망나니 거짓부렁 김어준 미용실 머릿값이나 공개해라. 더럽게 더러운더불당아.,True,1,2025-01-23T20:45:32+0900,849273876100677834,0,0,0
ljj7****,52bzV,"죄국 혁신당은 아직 없어지지 않았나? 정신병자도 아니고
아직까진 우리나라 대통령인데 저런 것들을 데리고 당을
만드니 되겠냐? 미친다 미쳐",True,1,2025-01-23T20:45:21+0900,849273863668760678,0,0,0
stel****,5JOIQ,상투 잡으려는 망나니간첩들 수준보소.망나니같은 김어준 꼬라지로 나오길 바라냐?,True,1,2025-01-23T20:44:26+0900,849273804663292043,0,0,0
king****,,,False,1,2025-01-23T20:44:07+0900,849273784832622643,0,0,0
ozzi****,,,False,1,2025-01-23T20:43:53+0900,849273769850569038,0,0,0
ssk9****,,,False,1,2025-01-23T20:42:49+0900,849273700577444111,0,0,0
stel****,a7E9A,화장도 햇던데,True,1,2025-01-23T20:42:48+0900,849273699252044055,0,0,0
chsk****,883a4,싸이코패스같은 년,True,1,2025-01-23T20:40:40+0900,849273562098303187,0,0,0
qazw****,,,False,1,2025-01-23T20:40:02+0900,849273520994123805,0,0,0
chik****,57iwp,찢죄명 범죄자는 출퇴근 하는데 내로남불 찟신도,True,1,2025-01-23T20:38:39+0900,849273431957438655,0,0,0
subn****,ETtE,이런 쪼잔한것에는 넘어가줄게~~,True,1,2025-01-23T20:37:26+0900,849273354329260167,0,0,0
pakr****,,,False,1,2025-01-23T20:34:26+0900,849273161055731859,0,0,0
crh7****,2b87a,다음에는 조선시대 복제 용 그려진 곤룡포 입고 등장해라...왕의 품위는 지켜야지....,True,1,2025-01-23T20:32:58+0900,849273066432233810,0,0,0
kwh1****,1oGoT,관저에 전자결재 등 내부망 통선이들어가 있나? 도청서비스 비화폰은 반드시 열어봐야 한다.,True,1,2025-01-23T20:31:50+0900,849272992780255555,0,0,0
shy-****,bZgqd,우리나라 대통령의 품격이닷!,True,1,2025-01-23T20:31:06+0900,849272946324144156,0,0,2
capt****,51YdD,박은정 저여자 돌았나? 좀 알고  시부리라~~저딴게 국개의원? 참으로 부끄럽다~~,True,1,2025-01-23T20:30:57+0900,849272936559804751,0,0,0
pang****,1sW67,제목이 참 이상하게 작성했네,True,1,2025-01-23T20:30:42+0900,849272920554340603,0,0,0
park****,,,False,1,2025-01-23T20:29:35+0900,849272847791554753,0,0,0
poli****,,,False,1,2025-01-23T20:29:20+0900,849272831802867824,0,0,0
abcd****,5z05h,"이 같은 내용도 기사라고...하는건지 궁금하다.
뉴스 거르고 진행되는 영상만 믿고 판단해야 합니다 .",True,1,2025-01-23T20:29:08+0900,849272819605831725,0,0,0
bung****,,,False,1,2025-01-23T20:28:40+0900,849272789608169693,0,0,0
anns****,4VxQL,대가리에 힘주든말든,True,1,2025-01-23T20:27:26+0900,849272709899616398,0,0,0
dple****,,,False,1,2025-01-23T20:37:53+0900,849273382431097113,0,0,1
mont****,1Y7k2,이제 일반 범죄자들이 전부 다도 하겠다고 요구할 근거가 생겼네. 정말 공정 지껄이던 작자 맞나?,True,1,2025-01-24T06:15:13+0900,849310577367973914,2,3,0
join****,4TF4o,얼굴만 봐도 이제는 뭉클하다 .. 다시는 없을 세상 멋진 대통령..,True,1,2025-01-24T03:25:27+0900,849299639646552110,2,3,0
qsju****,45UXe,"허~ 참...  국민들의 고혈로 짜낸 돈으로.. 월급받아 쳐 드시면서,,,   이따구 말이나 하고 자빠졌냐...? 초딩만도 못한, 니가..  자칭 국민대표나...??  그러니까..  국,개,,라 하는거다...!!",True,1,2025-01-24T01:49:50+0900,849293480160133252,2,3,0
nine****,35SlI,"윤대통령님 애국 국민이 응원합니다. 나라가  얼마나 종북 종중 세력에 의해 곳곳에 숨어들은 좌경화 공산화되었는지 홀로 외로운 싸움하시느라 고생 많으셨습니다. 이젠 자유민주주의 소중한 가치를 바로 세우는데, 특히 다시는 부정선거로 국민의 소중한 투표권을 도둑질 당해 함량 미달인 국개의원이 금뱃지 달고 나라 망치지 못하도록 싸우겠습니다",True,1,2025-01-23T22:38:43+0900,849281167663300833,2,3,0
wnsg****,,,False,1,2025-01-23T21:19:10+0900,849276042995564597,0,0,0
kmis****,1ZQRz,벌써 사형 당했어야  한다.  죄수복  입혀라.  입만 열면 궤변에 구라질!  지가 왕인줄 착각속에 있다.  주변 아첨꾼들은 더 나쁜 종자들!,True,1,2025-01-24T07:12:39+0900,849314277398413400,1,2,0
bmle****,23q1K,그래서 요즘 구치소는 넥타이에다 옷도 새로주냐?????  구속때 입은 옷은 아니잖아!!!!!!!!!!,True,1,2025-01-24T06:06:03+0900,849309986323431431,1,2,0
keyw****,7JBAg,국힘 댓글부대는 정신차려라 돈몇푼에 사람들 국힘당ㅇ 괜찮은줄 알겠끔 현혹시키지마,True,1,2025-01-24T05:56:38+0900,849309379910959149,1,2,0
363s****,4WVzC,이런거 쓰는것도 기사거리 되냐 ?  한심한 기자다 ㅎ ㅎ,True,1,2025-01-24T05:19:37+0900,849306995180699672,1,2,0
mybu****,2wCpL,현직대통령이야. 티비에 꼬질한 모습이라도 나와야 만족하는건가. 그런다고 니네들 지지율 안올라가,True,1,2025-01-24T05:07:38+0900,849306223512649770,1,2,0
dnd5****,1izfu,내란 우두머리가 멋은들었네....머리통은 돌인데 ㅉ,True,1,2025-01-24T05:02:08+0900,849305868540313612,1,2,1
gofl****,3tWNX,이길 자신없으니까 별 시덥잖은 걸로 온갖 딴지  ㅋㅋㅋ,True,1,2025-01-24T04:48:21+0900,849304981428240404,1,2,0
mini****,31QdU,참 더듬어공산당은 별개 다 문제구나?,True,1,2025-01-24T04:38:28+0900,849304343894032417,1,2,2
gall****,2lLtn,댓글 보소 내란 옹호글인가?,True,1,2025-01-24T04:36:40+0900,849304227846029344,1,2,0
sama****,,,False,1,2025-01-24T04:16:02+0900,849302899308625927,0,0,0
kmpw****,45XFe,"특혜? 당연한거 아냐.
대한민국 대통령이다.
니들 국개들보다 더높은 사람.
특혜라면 특혀받을 자격있는 사람이다.
만약 죄가 있다면 그때가서 죄를 물어라.
별거지같은게 국개의원이라고 아무때나 평등 따지네",True,1,2025-01-24T03:18:21+0900,849299183172059162,1,2,1
hsc0****,2by38,간단한 두발정리가 아니지.... 법무부가 감싸네.... 검찰의 행보가 걱정된다.,True,1,2025-01-24T03:18:16+0900,849299177736241176,1,2,0
ysle****,xIq4,시비 걸거를 걸어라! 격 떨어지는게 조국혁신당 스럽네 ㅉㅉ,True,1,2025-01-24T02:41:43+0900,849296822550659132,1,2,0
chul****,79YD2,범죄 저지른놈이  정말  뻔뻔하내  그동안인생 어떻게 살았길래  저모양일까   반성하는게 하나도없고  지살려고만 발버둥치는모습보니  대한민국국민이  불쌍하다,True,1,2025-01-24T02:06:55+0900,849294580812611695,1,2,1
lees****,5fETe,머리가 문제가 아니고 옷과 넥타이가 윤석열 구치소 들어갈때랑 다른게 이상하네~~~넥타이도 없었는데,True,1,2025-01-24T01:56:45+0900,849293925377114210,1,2,0
tear****,20hz2,민주당은 가짜뉴스와 선동으로 박은정을 고소하라,True,1,2025-01-24T01:56:02+0900,849293879021666305,1,2,0
invi****,YJCc,별 ... 자유대한민국 대통이시다,True,1,2025-01-23T21:18:42+0900,849276012628803833,1,2,0
anga****,2dVpn,검찰시절 내쫒겼기 때문에 개인 사감을 너무 내보이는 건 오히려 반감을 살 수 있으니 자중해야 할 필요가 있다. 법리에 맞게 파면하는데만 집중해라.,True,1,2025-01-23T20:50:45+0900,849274212148314352,1,2,0
clev****,2cQBW,"이게 좌우랑 무슨상관이냐!! 국가1급기밀정보를 중국과 북한에 팔아 넘겨도, 선거를 조작해도 아무런 처벌을 받지 않는게 비정상이고 비상식적인거다! 정의와 상식이 무너지고 민주당이 법위에 군림하고 있는게 어찌 민주주의인가!! 신권 지패마냥 빳빳하게 뭉쳐있는 형상기억투표지가 나와도 좌우를 논하며 사리분별 못하고 농락당하는 능지박약아가 많다는것이 문제다!!",True,1,2025-01-24T14:03:52+0900,849340769578778966,0,1,0
leea****,ykCB,아직은 대통령 이잖아요,True,1,2025-01-24T08:30:09+0900,849319270096568361,0,1,0
cam6****,4pjzW,이런걸 기사라고~~~에휴,True,1,2025-01-24T07:27:30+0900,849315233833943134,0,1,0
dnfl****,,,False,1,2025-01-24T07:00:09+0900,849313471840387091,0,0,0
luib****,eQxvL,특혜지?! 00010번 이라며?~,True,1,2025-01-24T06:25:58+0900,849311270233440363,0,1,0
ts19****,1TKli,석열이   애는  지가 무슨 예능 프로에   나왔다고   차각  하는거 같네.,True,1,2025-01-24T06:12:49+0900,849310422279389283,0,1,0
skk1****,288nU,이참에 바리깡으로 빡빡 밀어라,True,1,2025-01-24T05:29:52+0900,849307656001683512,0,1,0
kso3****,1sbhC,이젠 깔끔한 머리땜에 트집잡는거야?ㅋㅋㅋ 기자양반 교도소 안가봤지? 거기도 사람 사는세상이다  일반 재소자도 아침에 뜨신물로 샤워도 하고 전기 면도기도 있고 빗도 있다 법정에 갈때 용모단정하는게 예의다  모자써도 안되고 슬리퍼 신어도 안되고..일반국민들도 기본이란걸 아는데 기자생활  신삥인가보네..,True,1,2025-01-24T04:34:49+0900,849304109566656561,0,1,0
ohs9****,,,False,1,2025-01-24T03:50:53+0900,849301278730223687,0,0,0
teod****,3qKNP,그래 구치소에서 출장 메이크업 받아라 담달이면 탄핵될 것 같으니 그때까지 열심히 받아 ㅉ,True,1,2025-01-24T03:16:23+0900,849299056202088481,0,1,0
tove****,3zndT,"대통령과 기자회견하며 슬리퍼 질질 끌고 나와서 시비거는 무례한 놈 보단 천배 만배 낫다. 
국민의 알권리라는 미명하에 추접스럽고 잡스러운 뇌피셜이나 늘어놓는 기가분들이 예의란걸 알리가 있나. 
박근혜 대통령 올림머리 시비걸어 국민 선동한것처럼 윤대통령 머리도 시비걸고 싶지? 
한 번 속지 두 번 속냐? 
무뢰한들..",True,1,2025-01-24T02:57:53+0900,849297864046673990,0,1,0
wooh****,3pWNQ,박은정이란인간국민을대변하는건아무것도없고오로지이재명애완견이돼버렸네,True,1,2025-01-24T02:53:03+0900,849297553198415875,0,1,0
puri****,2eNpJ,각설이같이 사진 나오길 바라네 ㅋㅋㅋㅋ 조국 면상 한번 보자 ㅋㅋ,True,1,2025-01-24T02:41:25+0900,849296803223306266,0,1,0
heam****,2smmY,"특혜는 얼어죽을
야 니들 기본상식 자꾸 가출할래",True,1,2025-01-24T02:34:06+0900,849296332001640456,0,1,0
yeol****,cxgKJ,"정말 깜도 안돼는게 국개되어서. 토나온다
검찰에서. 능력도 없는게  국개되어서. 대통령의  품격은
너정도는 발아래. 때. 정도도 못 미친다",True,1,2025-01-24T02:33:18+0900,849296280562696225,0,1,0
hunb****,6jKJc,그냥 호텔을 지어주지 그래 ㅋㅋㅋㅋㅋ,True,1,2025-01-24T02:17:56+0900,849295290824392790,0,1,0
ykj8****,6mvJ0,댓글 수준이 사회에서 적응못하고 버려진 백수 오십대 아빠 친구들이네 헛소리 아줌마는 또 뭐야 포주,True,1,2025-01-24T02:09:22+0900,849294738367447091,0,1,0
eric****,4lEpE,OOO들 별걸 다 트집잡네. 하여간 여자들이란 여기자든 여국개든 여자들 생각머리가 저 수준이니 맨날 모함하는거라곤 미신이니 성형이니 3류 가십거리 찌라시수준. 한심한 무뇌야,True,1,2025-01-24T01:43:01+0900,849293040496410628,0,1,0
seam****,a3Zf2,박은정=사이코 같은 사람을 어째 의원이 됐나요,True,1,2025-01-24T01:39:20+0900,849292803216244778,0,1,0
hyun****,wmWT,"깔끔하면 특혜,라고 난리.머리 안만지면 국민의 대힐 예의아니라고 난리",True,1,2025-01-24T01:38:42+0900,849292762414055518,0,1,0
bokb****,1aGzw,박은정 저거 또 자폭하네 아재명이 똥물 튀기지 말라고  한소리할거다,True,1,2025-01-24T01:31:20+0900,849292288709361714,0,1,0
dsdd****,1DCUn,"체포된 내란 수괴는 포승줄에 수의가 올바른 복장 아닌가?
왜 복장이 불량하지?  이것도 특혜 같은데....",True,1,2025-01-24T01:19:54+0900,849291551585599631,0,1,0
nice****,1q2Ns,은정아..너의 그릇이 이것밖에 안되는구나...,True,1,2025-01-24T01:18:45+0900,849291477883289743,0,1,0
rlad****,bE47n,심판은 곳 국민의 부릅입니다  내마음가짐도 떳떳하게 솔직하게 발언하면서  존중히 소심껏 답변하세요 멀만 손질하시지말고요,True,1,2025-01-24T01:16:36+0900,849291339286708312,0,1,0
esdi****,3Ddul,박은정  뭐이런 수준이하의 인간이 있나....,True,1,2025-01-24T01:16:19+0900,849291320362008617,0,1,0
blur****,1jY90,"직무가 정지된놈이고 현재 내란선동범죄자임  탄핵, 사형 선고 전까지는 어느정도 특혜는 주는게 맞다 하지만 저건 의도가 너무 보이잖아  죄수복입고 후즐그레하게 하고 나오면 미디어에 비쳐지는 모습이 참 범죄자로 비춰질것 같으니 나 범죄자 절대아님"" 코스프레중 근데 똑똑한 참 대한민국 국민은 절대 저런모습에 절대 안 흔들린다 윤석열 순순히 사형받자 9질9질 역겹다",True,1,2025-01-24T01:08:57+0900,849290845818454201,0,1,0
baen****,1ZCRu,인권존중하라!! 대통령도 사람이다,True,1,2025-01-24T01:08:48+0900,849290836406435982,0,1,0
