user_nickname,userIdNo,comments,visible,replyLevel,regTime,parentCommentNo,sympathyCount,antipathyCount,replyAllCount
stro****,2YLP9,"아직 파면안됬고, 엄연한 대한민국 대통령임.",True,1,2025-01-23T20:26:56+0900,849272677586698538,1378,340,37
assj****,dhJZT,펄걸 다 트집잡네~ㅜㅜ,True,1,2025-01-23T20:31:41+0900,849272983133356274,420,41,10
dami****,5cTM2,그래도 현직 대통령인데 깔끔하게 나오게 하긴 해줘야지,True,1,2025-01-23T20:25:34+0900,849272589153992885,276,47,8
rlae****,8mIt6,"저게 뭐 어떤데?
별결가지고 걸고 넘어지노",True,1,2025-01-23T20:44:20+0900,849273798153732219,236,20,7
jhee****,7NY2E,힌글에 예우란 단어가 있다. 멍청당,True,1,2025-01-23T20:28:47+0900,849272796201615630,185,30,2
shin****,7iuqd,박은정 정신나가 여자야   구속되었어도  현직대통령이다  단정한 모습으로 재판장  가는게 무슨문제냐? 조국이는 2심까지  실형선고 받고도 교도소 안간게 더큰문제지,True,1,2025-01-23T21:06:30+0900,849275225995477187,93,9,0
bwje****,,,False,1,2025-01-23T20:58:51+0900,849274733483524395,0,0,2
gmla****,4cuYr,현직 대통령이 대국민 공개되는 헌법재판소에 출정하면서 머리 정돈한 것을 특혜라 떠드는걸 보니 좌파놈들은 애당초 대선 결과에 승복할 의지 자체가 없었다는걸 확실히 알겠다. 더듬어 내란당 반드시 해산시켜야된다. 29명 탄핵이 말이나 되는 얘기냐????,True,1,2025-01-24T00:27:54+0900,849288201393668306,64,7,4
sssh****,6BoOJ,대통령 망신이 당신의 주목적인것 같은데. 그러니 당신들을 믿지않는것 같다. 국회의원 이면 최소한으로 사오한것이 아니라 좀 이야기 꺼리가되는 문제를 제기해야 안되나?  죄는 미워도 사람은 미워하지마라는 것 정도는 안배웠나. 속마음 말고 겉으로 라도. 못배워 먹은 사람 같다,True,1,2025-01-23T20:58:06+0900,849274685299359781,54,4,0
meig****,bV5Sy,의료헬기 탄 사람도 있는대 뭐라는거냐???,True,1,2025-01-23T21:07:07+0900,849275266562785330,53,7,0
shy-****,bZgqd,좌파들의 특징! ㅋㅋ생트집,True,1,2025-01-23T20:32:07+0900,849273011453296690,45,7,0
mymy****,13wdT,아이고 아직은 대통령인데 잡범들처럼포승줄에 거지같이 나와야 하는가? 니나 잘하고 다녀랏 왜 이상한 선거제도를 야당넘들 끼리 만들어서 턱도 없는 인간들이 혈세 뜯고 먹고 ~,True,1,2025-01-23T21:01:50+0900,849274926018855185,38,3,0
yooj****,5wh3P,아직 대통령 신분에 거지꼴로 나타나야 좌파들은 신나겠지 어떻게든 나라망신 시키고 싶어서 안달난 집단들이니,True,1,2025-01-24T00:35:42+0900,849288703569297564,34,3,0
hyun****,3Ek9,"하긴... 좌파들은 허름한척 하려고 염색도 안하고, 옷도 지저분하게 입고, 면도도 안하고, 신발굽도 다 뜯어진거 안갈고, 심지어 더듬어만진당의 박모 의원은 안경테 한쪽이 부러진 안경을 쓰고나온적도 있으니, 윤통의 저런 모습이 꼴뵈기 싫긴 하겠다 ㅋㅋㅋㅋ 더듬어만진당좌파페미남페미종북친북친중진보대학생비건들은 ""너저분함""을 ""서민적""이라고 착각함",True,1,2025-01-24T00:21:27+0900,849287785671032952,27,3,0
lawy****,,,False,1,2025-01-23T20:47:29+0900,849274000906387625,0,0,0
lts0****,6j0pm,"박은정이 같은게 국개냐? 참, 개나 소나 다 하는 것이 국회의원이군. 야, 이 걸**레야, 너는 그래도 명색이 국가원수인데 산발하고 거지꼴로 나서야 속이 후련 하겠나? 너 같은게 옆에 있다면 귀싸대기가 몇 번을 올라갔겠구먼...",True,1,2025-01-23T21:12:48+0900,849275632423534860,24,2,0
najo****,3meHV,수염도 안 깎고 머리도 안 빗고 법정에 나오리? 아직 현직 대통령이고 무죄 추정이다.,True,1,2025-01-23T21:15:06+0900,849275780566351910,23,3,0
eyeo****,16auh,트집 잡은 놈이 무려 조국당 의원. 느그 조국이는 실형 선고 받고도 풀려나 정당 만들고 국회의원까지 됐다.,True,1,2025-01-24T00:22:28+0900,849287851420942444,20,2,0
yks1****,24Mc0,어찌됐든 현직 대통령이다. 너무 중요한것도 아닌걸로 트집 잡으려고 하니 오히려 반감 사는거 아니냐 남만 지적 하려고 하지 말고 내가 국민을 위해서 뭘 잘할까를 생각해라,True,1,2025-01-23T20:55:14+0900,849274500162781258,20,3,1
hak6****,6GYx,정말 박은정의 무식함이 들어나는 순간이네~~말이 필요 없다~~  오로지  좌파스럽다는 말밖에 할말이 없다~~,True,1,2025-01-23T20:38:39+0900,849273432242651341,20,6,0
kthf****,BXJB,"우리가 누리고 사는 이 좋은 세상에 누리고 있는것들
당연한것 아닙니다
우리는 자유 민주주의를 위해 목숨을 받친  그 희생을
잊지 말아 주세요
우리의 삶이 이렇게 좋은세상에  누리고 사는건 당연한거 아니에요
베트남등 많은 도움을 받고 죽한끼도 못먹는날들 그속에 전쟁에
나가야했던 어렸던 청년들 그들의 희생이 헛되지 않게
대한민국 국민이 일어나 우리의 주권을 찾아야합니다
지금 현실은 민주주의 아닙니다
부디 국민이 현실을 바라보기를 간절함뿐입니다",True,1,2025-01-24T02:49:16+0900,849297308536274971,13,0,0
podo****,J5yC,다음기사: 윤대통령 재판전 샴푸로 머리감아 특혜논란,True,1,2025-01-24T00:26:32+0900,849288113934041228,9,1,0
beat****,1RnA3,그러니까 머리 산발하고 죄수복 입고 포승줄 묶어다가 고기짝 처럼 해놔야 네 속이 풀린다 이거잖아? 재판이 목적이 아니라 망신주기가 목적이네?,True,1,2025-01-24T00:40:01+0900,849288982708617220,10,4,0
tdon****,5BLXW,비례대표  국회의원제를  폐지해야 한다.  깜도  안되는 국회의원들이  넘  많아.,True,1,2025-01-24T04:23:18+0900,849303367493615650,7,1,0
fore****,1h57V,"검사출신이라더니 돈주고 검사샀나ㅋㅋㅋㅋㅋㅋ미결수용자의 방어권 몰라요??대법원 판례도 있는데???ㅋㅋㅋㅋ일반 서민 미결수용자도 나 재판에 양복입고 깔금하게 나가고 싶어요 하면,양복만 준비하면 재판당일 양복으로 환복후 재판받을수 있다ㅋㅋㅋㅋㅋㅋㅋ법으로 보장해줘요 우리나라는요 박은정씨ㅋㅋㅋㅋㅋ미결수용자는 재판후 판결이 나기전까지는 무죄추정원칙에 의해서 구금은 있지만 죄가 없는 일반일이라 방어권이 주어집니다ㅋㅋㅋㅋㅋ검사 출신이 이것도 모르면… 쯧쯧",True,1,2025-01-23T21:24:26+0900,849276381928882304,7,1,3
shon****,2rJsC,조국당은 해체가 답임...무슨 당이 비례만 있는지...거기다 조국당이 이름인데 조국이 구속되었는데...당이름이나 바꾸던지,True,1,2025-01-24T00:24:54+0900,849288008774451415,6,1,1
khl_****,4lNX7,대통령 욕하지마라 지지율 떨어진다 무식한당아,True,1,2025-01-23T20:51:48+0900,849274278988742926,6,1,0
lugu****,5kbBk,"좌익들은 지금 어떻게든 대통령을 끌어내리고 망신주고 기를 꺾으려고 하는데 그럴수록 2030은 각성된다. 적당히들 하자~ 조기대선하면 김문수 당선, 니들 알아? 몰라?",True,1,2025-01-23T20:35:56+0900,849273257088516410,6,1,0
skh2****,,,False,1,2025-01-24T01:49:46+0900,849293475496067202,0,0,0
k138****,,,False,1,2025-01-24T03:05:26+0900,849298350703378471,0,0,1
love****,6z3l,국민이 뽑지도 않은..비례 투표 의원은 없어져야함..,True,1,2025-01-24T00:56:17+0900,849290029657227303,4,0,0
smma****,4IbWC,박은정 비례의원..쟁쟁거리는  말투가  짜증납니다..목소리부터 좀 고치세요,True,1,2025-01-24T00:33:13+0900,849288543984418878,4,0,2
kyun****,1Dkj0,예우 같은 소리하고 자빠졌네,True,1,2025-01-24T06:21:50+0900,849311003039498340,7,4,0
hell****,2Dxnn,지지율이  50% 인데...당연히  죄인이 아니지..국민이 대통령으로 인정라는데...지지율이  떨어져야  머리도 못하는데..지금  당연히 헤줘야지..지지율 50%  넘으면 틴핵도  각하야..못해...헌재가 국민 여론을 무시하고  탄핵을 할수 없어...체포 하면 지지율이 급락이 되어야 하는데..불법체포하는 바람에  더 올라간거야...,True,1,2025-01-24T00:38:48+0900,849288904291909812,4,1,0
jpar****,Tcdn,정말국민 밉상이네. 박은경. 저런 저질이 국회의원이 되는 현실이니 계엄이 정당하다,True,1,2025-01-23T21:10:51+0900,849275506309202220,4,1,0
yong****,,,False,1,2025-01-24T06:08:35+0900,849310150421381183,0,0,0
m007****,1igbF,그러니까 이유불문하고 당신들은 그냥 망신주기를원하는거잖아? 저런것들에 세금이쓰인다는게...,True,1,2025-01-24T06:01:02+0900,849309663127142405,3,0,0
sooy****,2bC6pr,"조국혁신당,$? ?  비웃음만 나온다.  그런다고 뜰줄아나   너 나 잘 하 세 요",True,1,2025-01-24T05:54:22+0900,849309234418941969,3,0,0
allj****,,,False,1,2025-01-24T05:44:37+0900,849308606263197733,0,0,0
hshs****,,,False,1,2025-01-24T05:42:49+0900,849308490282303551,0,0,0
simo****,,,False,1,2025-01-24T05:03:52+0900,849305980981215284,0,0,0
octo****,2iKCJ,"그럼,,  수감된 다른 살인마도 출장 스타일링 받을 수 있냐?? 특혜 아니라메??",True,1,2025-01-24T04:26:05+0900,849303546238074890,3,0,0
0117****,,,False,1,2025-01-24T03:47:03+0900,849301031333396485,0,0,0
kore****,,,False,1,2025-01-24T03:27:52+0900,849299795993428055,0,0,0
coba****,10ORd,으이그..별걸 다 기사라고..한심,True,1,2025-01-24T02:14:32+0900,849295071143526452,3,0,0
hjs2****,1bmKM,별걸 다 트집이다..니 할일들이나 잘해라 오지랖 떨지 말고..,True,1,2025-01-24T01:44:46+0900,849293153490960499,3,0,0
mont****,3oSOa,"2심 실형 받고도 구속 안되고 넥타이 메고 의원활동하신분도 있는데, 아직 현직 대통령이 머리 손질했다고 시비?",True,1,2025-01-24T01:09:45+0900,849290897290952846,3,0,0
naci****,4SH9v,"송영길이는  선거  운동도  하더만! ㅋㅋ
극좌파들은  우덜식  프레임 쫌 그만해!  지겨워죽겠어  그냥!",True,1,2025-01-24T00:44:43+0900,849289284530733242,3,0,0
net6****,Ksex,얼마나 꼬투리 잡을게 없으면.... 참...  면도하고 머리빚고 옷 좀 제대로 입고 나온거 가지고..... 너무한다.,True,1,2025-01-24T00:44:25+0900,849289265958355060,3,0,0
free****,,,False,1,2025-01-24T00:22:16+0900,849287839039357008,0,0,0
flsv****,,,False,1,2025-01-24T00:19:52+0900,849287683749445855,0,0,0
hys4****,2368y,아이고 저질 인간아 너 어떻게 국개가 되었나 보결이냐,True,1,2025-01-23T21:01:06+0900,849274878556110878,3,0,0
kwan****,1YA6W,국 🐕   머릿수 좀 줄입시다.,True,1,2025-01-23T20:59:33+0900,849274778815561923,3,0,0
danb****,Gqaw,별걸다 트집ㅋㅋ 수준하고는.. 그 시간에 공부 좀 더 해라. 책 한권 더 읽던가.,True,1,2025-01-23T20:31:03+0900,849272942230503450,6,4,0
kthf****,BXJB,"깔끔한 헤어만 보이시나요?
첫 재판 출석일에 코밑을 여러번 만지시는건
안보이나요? 면도하시면 아실텐데요?
그것은 구치소에서 나오는 일회용 면도날 쓰신겁니다
그곳에서 예외없이 일반인과 같이 독방빼고는
같은 대우를 받고 있고 이 대우 또한 이례적으로
없습니다
가족 한사람 여사님도 편지조차도 공수처에서
막았습니다
그런데 헤어? 그게 뭐라구요?",True,1,2025-01-24T02:35:10+0900,849296400503013394,5,3,0
his0****,1dNfE,저게 특혜가 아니면 뭐가 특혜냐??내란수괴를..,True,1,2025-01-24T06:04:19+0900,849309874838831129,4,2,0
yeda****,7UYb0,세월호 생트집 잡아대기처럼 징글딩글하게 달라붙는근~~~현직대통령이야~단정하고 깔끔하게 나오면 두려우신겁니까?  민주당님들!,True,1,2025-01-24T05:43:13+0900,849308515699785743,4,2,1
tkfk****,2DnNf,피곤하다피곤해~ 귀에걸면 귀걸이 코에걸며 코걸이...천하에 나쁜짖을 했지만 그래도 아직 대통령이고 그정도는 딴지걸지말고 죄수들도 재판받으러 판사앞에갈때는 때빼고 광내고 다한다~,True,1,2025-01-24T05:21:38+0900,849307124902133796,4,2,0
bb32****,,,False,1,2025-01-24T03:28:40+0900,849299847684030531,0,0,0
skyl****,5sWyO,현직대통령이다!!! 뭔 시답잖은 생트집 잡을 궁리좀 하지마라,True,1,2025-01-24T03:00:28+0900,849298030191444009,4,2,0
mehy****,esDf0,좌파들은 이제 MBC나 보세요. 그 방송 보면서 행복해 하세요. 윤대통령 머리갖고 트집잡아 자세히 생쇼하며 보여주면서 일그러진 얼굴로 방송하던데요. 그대들이 원하는것은 대통령이 잠비모습하고 귀신처럼 나오는 것을 바라는거죠. 그러면 로마의 피에 굶주린 글라디에이터 관중처럼 끾끽대고 염병날리 치겠죠. 국격이 상실되는것도 모르고요. 지금 대통령이 죄인입니까? 민주주의 수준도 올라가야합니다. 부정선거 바로 잡아야 합니다. 젊은 세대를 위해서요.,True,1,2025-01-24T02:59:08+0900,849297944275320845,4,2,1
deck****,1SY2r,"엥엥 엥  비례 대표 다없애고 국개의원들 수를
딱 반으로 줄여라.
그리고 죄도 대통령이 꼬질꼬질한 모습으로 방송 나와야 하냐? 이것들은 나라망신을 시켜놓고도  지들만 잘났데.
내란수과는 누가갖다 붙인거야. 더불당들이. 바로 내란 대가니들이다.",True,1,2025-01-24T03:56:50+0900,849301662190272558,3,1,0
jaeh****,TiHt,머리털을 몽땅 뽑아버려라,True,1,2025-01-24T01:47:59+0900,849293360823795871,3,1,0
cyk0****,9KN5,빨리 안봤으면 좋겠다,True,1,2025-01-24T01:43:51+0900,849293094166724700,3,1,0
ago0****,4oMgQ,대통령을 불법으로 구치소에 가두고서 탄핵재판을 방해목적이니 이재명이 교도소에 안 들어간 걸 따져야 조국범죄우기당아,True,1,2025-01-24T01:28:23+0900,849292097717534773,3,1,0
k_ms****,4bFKT,전국민이 보는 뉴스에 나오는데 현직 대통령에 대한 예우란 없는거냐? 이젠 트집잡을 것이 없으니 머리스타일 가지고 뭐라하네,True,1,2025-01-24T00:38:41+0900,849288896020742294,3,1,0
csh6****,1GzLj,박은정 이런 듣보잡 같은것이,True,1,2025-01-23T20:55:05+0900,849274490666876952,3,1,0
ssmo****,3yOKn,특혜는 범죄자가 재판 싹다 지연시키고도 구속도 안받고 처벌조차 안받으면서 당대표 하고있는 찢 아닌가?,True,1,2025-01-24T08:36:07+0900,849319654898794535,2,0,0
dbwo****,,,False,1,2025-01-24T08:06:24+0900,849317739897028698,0,0,0
e753****,,,False,1,2025-01-24T07:04:43+0900,849313766364414037,0,0,0
jong****,488J3,너무 특혜주는거 아닌가?,True,1,2025-01-24T06:13:57+0900,849310495159615579,2,0,0
chon****,5iu77,윤석열 이상해요.,True,1,2025-01-24T06:10:33+0900,849310276720263222,2,0,0
gimy****,,,False,1,2025-01-24T06:05:25+0900,849309946074890285,0,0,0
tk95****,,,False,1,2025-01-24T06:03:30+0900,849309822863015984,0,0,0
youi****,2bRAVz,"박은정씨 평소 할일이 그렇게도 없습니까? 그런 지적질이나 하라고 국민들이 국회의원 뽑아준줄 아세요? 좀 제발 민생안정, 국가 미래좀 생각하는 모습을 보여봅시다. 어찌 우리 국회의원들 수준이 이리도 처참할까?",True,1,2025-01-24T05:43:34+0900,849308537795379254,2,0,1
mrbu****,NVSq,특혜는 안잡아넣는 전과자가 특혜 아닌감...,True,1,2025-01-24T05:43:32+0900,849308536050548786,2,0,0
khg1****,28UMU,은정아! 트집 잡을걸 잡아라. 외신도 주목 하는데 아직 파면도 안된 대통령이 머리 산발해서 보도 타면 나라 꼬라지가 우찌 되겠나 너의 한마디가 민주당 지지도만 더 꼴아박을 뿐이다,True,1,2025-01-24T05:42:35+0900,849308474696269865,2,0,0
bulc****,2zcdR,생각이 없는건지... 이래서 비례는 없애야해,True,1,2025-01-24T05:24:09+0900,849307287104258064,2,0,0
pgdo****,,,False,1,2025-01-24T05:09:31+0900,849306345030025251,0,0,0
kyd7****,11KaS,"저 정도는 이해해줍시다..
드라이할날도 얼마 안남았는데...
머리 까칠하게 나오면 불쌍하게 보인다고 극우파들 더 결집할톄니...",True,1,2025-01-24T04:49:45+0900,849305071471558708,2,0,0
sile****,aFoOJ,화장하니 박수무당인줄 깜놀 화장을 하든 머리를 하든 내란수괴다 사형무기징역,True,1,2025-01-24T04:20:28+0900,849303184068313109,2,0,0
vita****,47aXN,언론 수준이 뭐이래? 별껄가지고 다 트집 잡네..,True,1,2025-01-24T04:06:17+0900,849302270817337372,2,0,0
0118****,,,False,1,2025-01-24T03:47:26+0900,849301056515997735,0,0,0
gyl4****,2FdJN,"박은정 함 튀어 보려고  애쓴다..지자식을 위해  남자식 떨어 뜨린  조국 면회가 왜 그랬냐고  꼭  그렇게 해서 아들,딸 인생 망쳐야만 했냐고 물어보라 시간 되면",True,1,2025-01-24T03:46:10+0900,849300975247163410,2,0,1
lh12****,1iJX8,하라는 입법 일은 안하고 실력이 안되니 이런 잡소리로 월급 받겠다는거냐.이런게 국개의원인가.,True,1,2025-01-24T03:44:07+0900,849300842354835469,2,0,0
c21s****,25Ovv,이렇게도 기사거리가 없냐? 하여튼 언론이 제기능을 해야하는데 이러고 있으니.,True,1,2025-01-24T03:42:22+0900,849300729628721183,2,0,0
goop****,2CxPg,그럼 뭐 김어준 처럼  더럽게 나가면 좋은거야?,True,1,2025-01-24T02:23:28+0900,849295647256346678,2,0,0
oran****,3vSAg,"국민세금받으면서 할일이그렇게 없더냐
구속되면 이발도못하냐
무슨 개솔을 그리 정성스럽게하느냐
너 주변이나 잘챙겨살아라",True,1,2025-01-24T02:22:18+0900,849295571440107550,2,0,0
sjk3****,jDz7,야 찌---질한것들아 죄가확정되지않는현직대통령이다 머리손질하는것까지발악을하나  더불어추잡당답다,True,1,2025-01-24T02:07:12+0900,849294599217217560,2,0,0
opkl****,,,False,1,2025-01-24T02:01:59+0900,849294263236690033,0,0,0
ykw7****,F9KN,"에고~~ 유치원 아이들 보다 못한 국회의원 생각
그럼 머리에 밥풀 덕지덕지  붙이고  갈까요?",True,1,2025-01-24T01:57:15+0900,849293958260457506,2,0,0
yeou****,9lWEX,박은정.. 수준,True,1,2025-01-24T01:41:45+0900,849292959244353634,2,0,0
with****,,,False,1,2025-01-24T01:22:26+0900,849291714995683406,0,0,0
coup****,,,False,1,2025-01-24T01:20:58+0900,849291620791615639,0,0,0
whis****,3tMpZ,한심하다 민주당패거리들  무슨말을 한들  지들이 내로남불인데  웃긴다,True,1,2025-01-24T01:18:29+0900,849291460065886290,2,0,0
dna3****,2EUPB,박은정 왜 잘생겼다고 딴지 걸지 그랴??.민주당 완전 쫄려 징징거림 징그럽다,True,1,2025-01-24T00:48:50+0900,849289550701265077,2,0,0
mtho****,2zdLn,현직  대통령이다.    탄핵원천무효*  공수처딱풀불법 영장  불법체포  불법구속&gt;&gt;&gt;석방하라.,True,1,2025-01-24T00:34:48+0900,849288646627426486,2,0,0
jey2****,3wxwY,별게다 시비고 기사거리다,True,1,2025-01-23T21:47:50+0900,849277889764393250,2,0,0
simy****,3C3Uy,"윤석열 계엄 잘못됐지만, 입법부도 함량 미달자 많은 듯!",True,1,2025-01-23T21:16:15+0900,849275854990082147,2,0,0
jado****,2d2Sir,그럼 머리 떡지고 헝클어져서 꼬질꼬질 하게 하고 나오리?? 이건 현 대통령으로서 헌법 재판을 대하는 마음가짐과 예의인것이다 가지가지 별거 갖고 다 트집이다,True,1,2025-01-23T20:59:21+0900,849274765393789053,2,0,0
ekfr****,BlhQ,"찢죄명 패거리한테 민생은 업네.
오로지 죠선족 공안정치.",True,1,2025-01-23T20:52:50+0900,849274345644622119,2,0,0
qazw****,ZKsz,일반인도 구치소소 안과 처가고 댁바리  서렇게 관리가 가능한거  맞나? 공정과 정의 맞냐?,True,1,2025-01-23T20:29:40+0900,849272854032679141,9,8,2
sdso****,4wu4t,박은정. 니가 국개냐. 정말 한심하다. 머리 깔끔하게 정리한 것도 황제냐. 증신병자 아냐? 하는 짓 보면 국민들 짜증난다.,True,1,2025-01-24T03:34:41+0900,849300235053170744,4,3,0
leep****,1dC5k,"별거 다 시비냐? 조국처럼 사문서 위조 했냐? 아직 현직 대통령으로써 그정도는 당연히 할수 있는거야..거지꼴 모습으로 나와야 하니? 그 머리로 시시 통과 한것도 검사짓 한것도 미스테리네..,혹시 검사 조직에서 왕따였지?",True,1,2025-01-24T05:18:09+0900,849306901010186247,3,2,0
sjs1****,qzHH,좌파들은 이전에도 박근혜대통령 올림머리가지고 혐오를 부추겼는데 똑같은 수법 또 써먹네!  이번에는 안속아!!,True,1,2025-01-23T20:40:33+0900,849273554934431933,3,2,1
stel****,5JOIQ,머리 단정히 빗은거 갖고 왜 시비야. 우리나라의 대통령이다.,True,1,2025-01-23T20:38:09+0900,849273399711629359,3,2,0
lbg6****,1oNjM,한국언론 기자들 퇴폐하고 부패하네 한 나라의 현직통이고 재판장에서 청결해야지 별ㅇ것도아닌걸로 기사쓰고.,True,1,2025-01-24T06:06:36+0900,849310022428000307,2,1,0
uytt****,4Eo08,"박은정, 역시 질문하는거보니 역겹다",True,1,2025-01-24T05:52:11+0900,849309093557436431,2,1,0
kame****,27wli,좌팔리더블당은 폐당이 답이다.,True,1,2025-01-24T05:48:10+0900,849308834533998604,2,1,0
yjpa****,eklNV,트집잡을걸  잡아야지 우리나라 대통령 망신시킬일 있냐 법무부에서 아주잘했어요.,True,1,2025-01-24T05:36:03+0900,849308053638479877,2,1,0
ssya****,,,False,1,2025-01-24T05:14:13+0900,849306647019913237,0,0,0
jsle****,1k6y6,정말 어이가 없는 것은 자신들 관련 의혹과 수사에 대해서는 무죄추정의 원칙과 불구속수사 원칙을 강력히 주장하는 진보주의자들이 자신들 이외의 대한민국 국민들에게는 왜 이 두 가지 원칙에 근거한 기본권을 박탈하려 하는가?! 이것이야말로 차별이 아니라고 말할 수 있을까?!,True,1,2025-01-24T04:54:46+0900,849305393812209702,2,1,0
ss33****,1Ciw8,그입이 문제다.. 그냥 좀 조용히.. 유치하다..유치해..좌파들,True,1,2025-01-24T04:44:45+0900,849304748778586166,2,1,1
sukj****,51scH,이좌파들아 트집잡을것 잡아라  이느므 좌파들 징그럽다,True,1,2025-01-24T04:38:55+0900,849304373321269303,2,1,1
many****,8SxCL,박은정이 한국 평균이면 3년 안에 망함,True,1,2025-01-24T04:01:04+0900,849301934534819842,2,1,0
sing****,1iCIu,박은정 저것도 견 같은연 소리잘하는구나,True,1,2025-01-24T03:53:48+0900,849301466165280830,2,1,0
acti****,2fjc7,자유민주주의 제2의 건국대통령 윤석열 .,True,1,2025-01-24T03:29:24+0900,849299894559572001,2,1,0
resc****,28vFS,너의 경솔하고 지극히 감정적으로 보이는 결정으로 대한민국의 국민이 고통을 겪고있다. 네 행동으로 국익에 도움이 된게 있으면 말해보거라. 이 배은망덕한 작자야. 그럼에도 불구하고 사과한마디 없이 국민들을 선동하며 나라를 제대로 반쪽을 만들어 놓고 제놈 살궁리를 도모하고 있는 널 보고있자니 속이 쓰리다. 만일 네놈 일당들이 살아돌아 온다면 대다수의 국민들은 이나라를 더이상 희망이 있는 나라로 여기지 않을것이다.,True,1,2025-01-24T03:15:29+0900,849298998454911026,2,1,0
nwin****,1yzUJ,종북좌파들아 현직대통령이다. 당연히 머리손질 하는게 상식아니냐?,True,1,2025-01-24T02:34:08+0900,849296334518222870,2,1,0
makd****,1kIgC,망신 주려고 무던히 노력하는군. 그런다고 니들이 올라갈줄 아냐?,True,1,2025-01-24T02:06:21+0900,849294544020176938,2,1,0
gold****,csuB8,너무 속상합니다. 내 손으로 뽑은 대통령입니다. 문재인 정부가 엉망진창으로 망가트린 이 나라를 회복 시키기 위해 지난 2년 반동안 하루도 제대로 쉬지 못하고 열심히 나라일만 하셨고 그 결과 정말 많은 수혜가 있었습니다. (윤정부는 굉장히 많은 성과를 냈습니다.) 그런데 왜 저 자리에 있어야 하는지. 탄핵 남발로 국정을 마비시키고 거대 야당은 윤정부가 정상적인 일을 하지 못하도록 각종 예산들을 삭감했습니다. 선관위의 부패와 해킹 조작 등 나열하기도 힘든 이 사태가 계엄을 통해 비상사태임을 알린게 무엇이 그렇게 잘못 되었나요.,True,1,2025-01-24T01:19:37+0900,849291533499760749,2,1,0
jeon****,Ru7T,"윤 대통령이  단정한 모습이  대한민국 국격에 맞다  국민의 50% 지지를 받는 현직 대통령이다   이미 징역판결을 
 받은 전과5범도 단정하게 하고 돌아다닌다",True,1,2025-01-24T01:18:48+0900,849291481003851908,2,1,0
inh7****,2qWiL,깨끗한 것도 트집이냐,True,1,2025-01-24T01:09:49+0900,849290901703360672,2,1,0
sija****,cuiOK,"무늬만 대통령일 뿐 아무 권한이 없는데 세금으로 뒤치닥거리 그만해라. 2찍이들 사이에서 국격얘길 하던데, 2찍이들이 엄청 좋아하는 미국  뉴욕타임스에  이런 기사가 실렸다더라..유트뷰 알고리즘에 중독된 사람이 최초로 일으킨 쿠데타라고...ㅋㅋ",True,1,2025-01-24T00:52:55+0900,849289813583462606,2,1,0
miso****,35pVi,수준떨어지는 박은정 이거 민주당에 빌붙어서 욕먹던 인간아닌가,True,1,2025-01-23T21:16:06+0900,849275844588208172,2,1,0
mu02****,1JI0m,그러면 현직대통령이 산발을하고 나타나야지 만족하나?  하여간 좌파들  윤통 면박줄려고 애를쓰네 애를 써~,True,1,2025-01-23T21:09:11+0900,849275399471890497,2,1,0
yoor****,1bNDS,박은정 하는건 왜 다 비호감?,True,1,2025-01-23T20:43:51+0900,849273767535313165,2,1,0
yuna****,7kxYT,현직 타령 지겹네 불법계엄 수괴인데???,True,1,2025-01-24T12:06:18+0900,849333195756273783,1,0,0
