user_nickname,userIdNo,comments,visible,replyLevel,regTime,parentCommentNo,sympathyCount,antipathyCount,replyAllCount
futu****,,,False,1,2025-05-13T09:14:58+0900,859434228272595251,0,0,0
seed****,2QsMN,그런 넌!~왜!?~탄핵특검때 소신껏 투표하지 못했는데!!??...선거때 얼굴색 바꾸고 입으로만 나불대는건~이제 신물난다!!!~고마해라.....,True,1,2025-05-13T09:56:57+0900,859436933112136053,8,0,0
star****,2EW9T,"12.3 계엄 이후 5월까지 반년동안 주구장창…..계엄 찬성,,,탄핵,파면 반대,,,,체포 방해,반대..,…내란수괴 윤석열 풀어주면서까지 주구장창  주장했었는데…..대선 되어서 선거때 되니,,,.개,돼지들 기억력 떨어진다고……표구걸하면서 사과 한다고 하면.,.,,..,,.그 사과를 받아야 하는 겁니까 ????  내란정당 개,돼지들은 그런걸 사과라고 하나요 ???",True,1,2025-05-13T09:26:47+0900,859434989438107927,7,0,0
whdm****,5BQNX,흰장갑은 끼고 닦아라.. 그리고 이름 앞에 서야지... 사진 찍으려고 묘비 뒤에 서있는데 토나오더라.. 니 묘비 앞에서 너같은 의원이 쇼한다고 생각해봐라.. 하려면 좀 잘해라..,True,1,2025-05-13T09:03:52+0900,859433514016178406,7,0,0
citr****,WpX9,국립묘지가서 문수는 채상병이 누군지도 모르고 용태는 채상병이 연평해전이라 하던데 ㅋㅋㅋ,True,1,2025-05-13T10:53:38+0900,859440584891302147,6,0,1
mrjq****,2cFeR2,내란당 주제에 뚫린 입이라고 말은...그러면 왜 특검은 반대하냐???,True,1,2025-05-13T09:08:00+0900,859433779381403649,6,0,0
hcso****,icrR,그러는 용태 너도 계엄때 투표안했자나,True,1,2025-05-13T10:13:21+0900,859437990244515967,5,0,0
swsw****,7J2Da,"채상병 묘역 미방문도 문제였지만 김문수,김용태 둘 다 누군지도 모르는게 더 문제더라. 김문수가 누구 하니까 김용태가 연평해전 말하고 있더라ㅉㅉ",True,1,2025-05-13T09:21:54+0900,859434675033080116,5,0,0
ksno****,1K91i,탄핵을 반대했다는 것은 내란 잔당이란 의미. 사회에서 격리해야 한다.,True,1,2025-05-13T09:04:29+0900,859433553593630869,5,0,0
last****,1mMWR,탄핵의 강을 넘는건 윤석열 제명부터 시작이다.,True,1,2025-05-13T09:03:03+0900,859433460865957901,5,0,0
just****,F1zg,국짐은 정당해산하고 구태 정치인들 배제한 재창당 아니면 가망없음,True,1,2025-05-13T10:08:58+0900,859437708018188691,4,0,0
jhw6****,4gKyT,용태야 권성동이가 옆에 붙어 있는한 절대로 못이긴다,True,1,2025-05-13T10:07:11+0900,859437592540610634,4,0,0
sun0****,6u5Wg,채상병 묘소 미방문의 문제보단 김문수는 채상병이 누군지도 모르고 채상병사건이 왜 문제가 됐는지 조차 모른다는 거지. 전 국민이 다 알고 있는 문제인데.,True,1,2025-05-13T09:32:35+0900,859435363167371474,4,0,0
337k****,1owGN,사고방식이 상식에 맞지 않는데 어떻게 상식적인 말이 나오죠? 잠깐 표를 받기 위해서는 어떨지 몰라도 김구가 중국인이라는 생각을 가졌는데 그 말을 어찌 신로하나요..,True,1,2025-05-13T09:28:30+0900,859435100234842287,4,0,0
ssup****,2f2I3,이준석 한번 2등 만들어줘보자!!,True,1,2025-05-13T09:13:59+0900,859434165760688425,4,0,0
zwit****,29Q6n,진심도 아닌 질질 끌려서 하는 사과가 무슨 소용이냐? 그냥 하던대로 해라..되도않는 쇼하지 말고..누가 속는다고..ㅉㅉ,True,1,2025-05-13T10:22:55+0900,859438606069006719,4,1,0
bett****,2cgb4,도긴개긴. 채상병이 누고 묻는 놈이나 연평해전이요 답하는 놈이나..,True,1,2025-05-13T11:44:32+0900,859443863964614900,3,0,0
ipar****,4ebGc,입장 같은 소리 하고 있네. 나라와 국민의 입장을 생각했다면 감히 21세기 대한민국에서 게엄할 생각을 했겠냐. 그땐 입장 생각 못했고 지금은 입장 생각하느라 뜸들이냐?,True,1,2025-05-13T09:32:11+0900,859435337280127047,3,0,0
yang****,4mIk6,김용태!!! 너희들이 상식에 맞는 짓은 후보를 내지 않는 것이다. 내란범을 적극적으로 옹호하고 전광훈과 같은 사이비 목사와 손잡은 것을 후보로 내세워 무슨 감언이설로 국민을 농락하려 드느냐!!! 그냥 주~욱 내란범을 옹호하고 탄핵을 반대한 입장으로 국민들의 평가를 받아라.ㅠㅠ,True,1,2025-05-13T09:21:07+0900,859434625020198949,3,0,0
cds0****,15ELW,"젊은 놈이 대가리부터 썩었네. 가짓말을 해도 앞뒤가 맞는 말을 해야지 채상병을 모르는데, 뭔 현장 수행 팀 탓을 해.쓰레기들은 정치를 못하게  정당 해산 해야 된다.",True,1,2025-05-13T09:21:03+0900,859434620825894935,3,0,0
kjsb****,2Dx9D,내란당 전광훈 2중대 🐕 🍎 김문수가 떠드는 것 보다는 내란 수괴 윤석열 국가반역 1호 정당 국민의힘은 해체가 국정 안정에 큰 보탬이 될 것이다.,True,1,2025-05-13T09:14:26+0900,859434194399395967,3,0,0
jhc2****,285m7,피다가 시들어 버리고말 사꾸라 자식,True,1,2025-05-13T09:09:52+0900,859433900546457885,3,0,0
eric****,4Lprc,"ㅋ 니네들의 상식은 늘 국민의 상식을 배신해 왔지!!! 그래서 다시 상식이 문제야, 이 바보이~~",True,1,2025-05-13T09:09:08+0900,859433852613951548,3,0,0
skgh****,,,False,1,2025-05-13T09:50:19+0900,859436506215874682,0,0,0
fire****,1VOxb,채상병이 누군지를 몰랐는데 무슨 착오냐ㅋㅋ,True,1,2025-05-13T12:18:18+0900,859446039600431226,2,0,0
yooh****,iIh1,욕받이 역하느라 욕본다 용태야 ㅋㅋ,True,1,2025-05-13T09:58:22+0900,859437024514408582,2,0,0
kmr1****,2aOdu,매년 선거해야할듯~ 정치꾼들 선거때만 국민한테 머리를 조아린다 ㅋㅋㅋ,True,1,2025-05-13T09:58:13+0900,859437014984949833,2,0,0
kimd****,axiSH,"국힘당 지지하나, 개인 욕심에 단일화 사기공약한 김문수 못찍음.",True,1,2025-05-13T09:50:16+0900,859436502927540316,2,0,0
twot****,g6Ik,수행팀 잘못이구나..누구하고 비슷하네..ㅋㅋ,True,1,2025-05-13T09:48:52+0900,859436412750004525,2,0,0
qaz_****,PSMv,"김용태는 그냥 1회용품으로 소모되고 말 것임, 재활용도 안된다는 게 본인에겐 더 문제",True,1,2025-05-13T09:43:47+0900,859436085258748213,2,0,0
lsh2****,EStU,국짐은 늙은 놈들이나 어린 놈들이나 ᆢ입만 열면 개구라 치는게 일상이다,True,1,2025-05-13T09:38:14+0900,859435727501394014,2,0,0
nhoy****,bMJNV,김운수가 사과한해도 그 말을 믿을 국민이 몇이나 될까요?,True,1,2025-05-13T09:31:49+0900,859435314077237503,2,0,0
mans****,38KFe,"내란 내각 각료이고 탄핵인용을 이해도  못하는데~~~기대 안한다
 그냥 수구꼴통",True,1,2025-05-13T09:25:08+0900,859434883540320311,2,0,0
idis****,z8G8,저 당 전매특허. 윤석렬도 정치공부시켜서 대통령하면 된다더니ㅋ,True,1,2025-05-13T09:21:51+0900,859434672499720458,2,0,0
ktou****,vzKv,젊음을 꼬붕으로 잡았구만..이찍들아 그냥 막찍지말고 아닌가싶으면 그냥 놀러나가라 아닌놈 알면서 찍찍허지말고,True,1,2025-05-13T09:18:04+0900,859434428709994522,2,0,0
hsle****,IGBb,"채상병, 이태원, 계엄 특검 3년동안 반대하다가 대선이 되니 이제 반성한다. 먼 개소리야. 국짐은 해체하고 책임있는 자들은 모두 처벌받아라.",True,1,2025-05-13T09:13:57+0900,859434163260883239,2,0,0
rhdd****,9sB9Q,애 쓴다.의식높은 수도권 시민들은 투표날만 기다리고 있다.큰 차이로 이재명 당선 예측,True,1,2025-05-13T09:12:16+0900,859434054796181591,2,0,0
pppp****,5mvnc,누가 뭐래도 당선후 윤석열을 박살낼 후보를 찍을까가 관건이다 김건희도 마찬가지 박살,True,1,2025-05-13T09:11:48+0900,859434024362311909,2,0,0
yoon****,PTsS,용태야 김문수는 관심도 없는데 너혼자 헛소리를 하면 안되지?,True,1,2025-05-13T09:08:46+0900,859433829276844241,2,0,0
kks8****,xBjV,"진정성 없어요 계엄해제하러 안오고 투표도 안한것들이 
내란우두머리 감싸는 내란당 내란공범들 내란당해체 
양심있으면 인간적으로 대선후보 못내지싶어요",True,1,2025-05-13T09:07:14+0900,859433729989279810,2,0,1
aja7****,3v8Sj,국민암당 뭘해도 썩은넘들이 그냥 뒤비져 있어라... 전부 감빵 보내주께,True,1,2025-05-13T09:05:23+0900,859433611072372873,2,0,0
dong****,13mwM,불량 또는 저질 신상품 보는 느낌이다....  정치는 쉽사리 검증되지 않은 신상품으로 하는 것이 아니다.,True,1,2025-05-13T09:03:23+0900,859433482189799528,2,0,0
hwaw****,2d0mVU,한동훈을 은근 까면서 대통령 협치?? 십상시 간신들은 술로 만나 주면서 당대표 피한거 모르나 그래서 계엄?  헐 젊은게 소신도 줏대도 없이 ㅉㅉ 국민들은 다 알고 있지,True,1,2025-05-13T09:03:10+0900,859433468700917797,2,0,0
danv****,5M0zP,뭔 개소리냐? 이미 탄핵의 강에 풍덩 빠져서 헤엄치며 즐겼던 놈들이..이제와서 건너겠다고? 내란선동놈들아...지나가는 개가 웃는다..,True,1,2025-05-13T10:20:12+0900,859438431401410634,4,3,0
ykhh****,2dd3w,지지율 안나오면 또 무팍 끍고 살려달라고 잘못했다고 하겠지. 똑같은 레퍼토리~ 🐕 🐖 들은 속고 또 속고~또 후회하고~ ㅋ,True,1,2025-05-13T10:21:21+0900,859438505439264905,2,1,0
hots****,3c77m,"진심이 없는  사과  몇마디 한다고 해소되는 문제는 아니다 !  반성과 사과에는 실천이  더 필요한것 !  가장 확실한것은 후보를 내지 않은것인데 !  이미  출마해서  "" 내란상속 후보"" 가   된 상황이다 !   아무리 사과해봐야  소용없다 !",True,1,2025-05-13T10:16:28+0900,859438190782578852,2,1,0
pens****,2BIi0,김용태씨... 도....이제. 물들어서. 싫다.,True,1,2025-05-13T09:51:10+0900,859436560926375996,2,1,0
rhrt****,bkNCh,"보수 정권이 잘 한 적 있나. 박정희는 공이 많지만 독재로  마감,  전두환 군사쿠테타,  이명박  개인 치부  문제.  박근혜 비선실세와 세월호 사건 지휘 부실, 윤통  친위쿠테타. 쿠톄타에 의한 인권 무시와 무능력이 이들의 공통점이다. 그래도 보수를 기대하나.",True,1,2025-05-13T09:45:03+0900,859436166242369554,2,1,0
hbbo****,NSW5,또 청년팔이. 젊은 애 하나 질질 끌고 다니며 꼭두각시로 쳐 써먹고 있네. 김용태 저것도 계엄이랑 탄핵 때 민낯 다 드러났는데 무승 뉴페이스인 것처럼 개뻘짓하고 있네,True,1,2025-05-13T09:32:22+0900,859435349628158097,2,1,0
endy****,1QLi1,"어차피 김문수는, 우파로 전향한 사람인데 우파 정당의 대선후보를 해보고, 실질적으론 당권을 잡아서 권력도 누리고 호가호위하는 겁니다. 이유가 뭐가 되었든, 탄핵에 반대한 것도 사과하고, 김용태 손을 빌려서 미친 내란수괴를 출당시키세요. 그러면 내란세력 척결의 시대적 과업에 부응하는 셈이 됩니다. 미친 요녀와 내란수괴의 미친 욕망을 좌절시키는 거니까요.",True,1,2025-05-13T09:08:30+0900,859433811811762320,2,1,0
rive****,21nBw,용태의 입이 준석이의 입이냐? 뭔 헛소리야?,True,1,2025-05-13T12:35:16+0900,859447133172924508,1,0,0
eors****,,,False,1,2025-05-13T10:44:33+0900,859439999500681462,0,0,0
sseg****,1L7Cw,내란에 대해서 이번에 말고 언제 반성하고 사죄했냐 너도 안철수 닮아가냐?,True,1,2025-05-13T10:33:55+0900,859439314755387743,1,0,0
k135****,,,False,1,2025-05-13T10:21:59+0900,859438546509889909,0,0,0
fera****,1ObXb,미방문이 아니고 누구인지도 몰랐잖아,True,1,2025-05-13T10:03:55+0900,859437382271762739,1,0,0
kiss****,2Ix9P,"진정한  마음으로   사과를 해야지  관심1도없으면서
표얻으려고  개사과하는건  국민을  우롱하는거지",True,1,2025-05-13T09:48:06+0900,859436363206885419,1,0,0
bibl****,QXWX,소모품 총알받이 역할인줄도 모르고 뭐라고 된마냥 헬렐레 착각하고 있는 30대 꼰대 용태,True,1,2025-05-13T09:42:24+0900,859435996456943775,1,0,0
shin****,1QX1m,너희들은 진정성이 없어.말이 그때그때 손바닥 뒤집듯이 달라.지금도 속마음은 탄반인데 찬반 이라고 하겠어?,True,1,2025-05-13T09:36:49+0900,859435636099121444,1,0,0
ekam****,,,False,1,2025-05-13T09:26:02+0900,859434941153280012,0,0,0
a596****,7EaWj,나는 내란당이 싫어요,True,1,2025-05-13T09:26:01+0900,859434940230533135,1,0,0
dudy****,,,False,1,2025-05-13T09:20:30+0900,859434585358860449,0,0,0
ksw0****,,,False,1,2025-05-13T09:19:36+0900,859434527494242499,0,0,0
kesy****,2cPvh6,내란 탄핵 정국에 제일 비겁하게 군 김용태가 인제와서 젊은 소장파인 척 하고 있넼ㅋㅋㅋㅋㅋㅋㅋㅋㅋㅋㅋㅋㅋㅋㅋㅋㅋㅋㅋㅋㅋㅋㅋㅋㅋㅋㅋㅋㅋㅋㅋㅋㅋㅋㅋㅋㅋㅋㅋㅋㅋㅋㅋㅋㅋㅋㅋㅋㅋㅋㅋㅋㅋㅋㅋㅋㅋㅋㅋㅋㅋㅋㅋㅋㅋㅋㅋㅋㅋㅋㅋㅋㅋㅋㅋㅋㅋㅋㅋㅋㅋㅋㅋㅋㅋㅋㅋㅋㅋㅋㅋㅋㅋㅋㅋㅋㅋㅋㅋㅋㅋㅋㅋㅋㅋㅋㅋㅋㅋㅋㅋㅋㅋㅋㅋㅋㅋㅋㅋㅋㅋㅋㅋㅋㅋㅋㅋㅋㅋㅋㅋㅋㅋㅋㅋㅋㅋㅋㅋㅋㅋㅋㅋㅋㅋㅋㅋㅋㅋㅋㅋㅋㅋㅋㅋㅋㅋㅋㅋㅋㅋㅋㅋㅋㅋㅋㅋㅋㅋㅋㅋㅋ,True,1,2025-05-13T09:18:17+0900,859434442567974997,1,0,0
jayn****,bhUXC,픕 일본놈이 무슨 상식 타령 참 어이없다야,True,1,2025-05-13T09:17:56+0900,859434420254277908,1,0,0
ever****,7oIhT,하지 마라...뇌속은 내란옹호인데 입술로만 사과한들 누가 믿겠냐... 김문수 놈은 내란수괴보다 더 할 놈.,True,1,2025-05-13T09:16:45+0900,859434343934722338,1,0,0
mstu****,Hewh,"그때는 계엄 혼자 사과 안 하고 전광훈 반탄집회 굽신거리며 이득은 취할 대로 취하고 이제 또 탄핵의강을 건넌다는, 상식 없는 인간들.",True,1,2025-05-13T09:13:55+0900,859434160509419825,1,0,0
engl****,,,False,1,2025-05-13T09:13:04+0900,859434106419675158,0,0,0
aman****,2SaZq,넘길 어딜 넘어 탄핵의 강에 풍덩 빠져 해체되길 바랄게 ~~국민의 이름으로!!!,True,1,2025-05-13T09:12:09+0900,859434047229657138,1,0,0
7454****,3dRIJ,용태야 입으로 지꺼리지말거라. 윤두목 니당에서 제명먼저하고 지꺼려라,True,1,2025-05-13T09:11:31+0900,859434006477799582,1,0,0
thys****,5ixNW,탄핵이 생각할게있고 없고의 문제냐  채상병묘역참배도그래  뭐가 착오냐 보수꼴통이어서 그것도 인정못하는거지,True,1,2025-05-13T09:11:18+0900,859433992519155808,1,0,0
wind****,3IRAG,생각할 수 있는 시간은 원하는 대로 주겠지만 표는 주지 않겠다.,True,1,2025-05-13T09:11:11+0900,859433984734527561,1,0,0
cyw6****,Pf0Y,채상병건은 사고처리에 대한 공식적인 사과와 정당한 후속조치가 필요한 것이지 국가유공자 차원에서 국가 주요인사들이 꼭 참배를 해야하는 것은 아니라고 본다.,True,1,2025-05-13T10:09:58+0900,859437772409143662,3,3,1
yes1****,,,False,1,2025-05-13T10:21:23+0900,859438507737743510,0,0,0
tr_a****,32j3v,"것들 중에 그나마 정신이 덜 혼미한 자가 있네? 사과할 건 하고 반성할 건 하고, 좀 해라. 극우가 아니라면… .",True,1,2025-05-13T09:24:17+0900,859434828779487330,1,1,0
elyb****,2c2mnH,...채상병이  누구냐는    김문수 질문에      연평해전으로   순직하신분이라  김문수에게  설명해준  김용태~   이게  국힘  후보 수준이고  선대위수준,True,1,2025-05-14T01:08:27+0900,859495655951827008,0,0,0
geor****,2c7YgZ,내란의힘 이x끼들 말은 하나도 믿어선 안된다. 김용태 너도 앞장서서 탄핵 반대했던거 다 기억한다.,True,1,2025-05-13T11:49:35+0900,859444189845258518,0,0,0
just****,,,False,1,2025-05-13T11:00:58+0900,859441057421590950,0,0,0
lml1****,5xrZp,김용태 저 광운대 잡대 나온 족보없는새끼는 왤케 설쳐대는거냐 구의원급도 안되는새끼가,True,1,2025-05-13T10:24:21+0900,859438698779902064,0,0,0
y621****,3bH4K,"김용태 인마 너 채상병특검 반대했잖어 시카들
주둥아리는 참. 못됐다 거짓말을 조둥이에 다고살어 표 얻을려고 거짓으로 참배 하지마라",True,1,2025-05-13T10:20:23+0900,859438443564892315,0,0,0
yhk0****,2J0D5,역사의식이 국민과 다르고 윤석열을 보는 관점이 국민과 다른데 그 나이에 사람이 달라질 것도 아니고...어차피 쉰내나는작자 기대할 바 없으니 애쓰지마라,True,1,2025-05-13T10:15:23+0900,859438120804810902,0,0,0
hcso****,icrR,하는 일마다 한심해,True,1,2025-05-13T10:11:44+0900,859437886192222512,0,0,0
smk1****,1Btgp,사형에 처해야 할 내란수괴 윤석열을 싸질러 놓은해체 마땅한 내란당이 또 무슨 대선 놀음인가? 국민들을 진짜 개돼지로 보고있나? 2찍들 정신 바싹 차려. 니들이 문제야. 감옥갈 내란동조범들은 싹다 잡아다 콩밥 멕이고 국민의 짐은 아예 산산이 부숴버려야 찐보수가 살고 나라가 산다.,True,1,2025-05-13T10:02:18+0900,859437278286577774,0,0,0
hist****,,,False,1,2025-05-13T10:00:39+0900,859437171449266415,0,0,0
yumi****,6YERP,용산 들락거리던 친윤 구태들의 얼굴마담일뿐,True,1,2025-05-13T09:50:37+0900,859436525543227613,0,0,0
plai****,eKwII,인생은 무수한 선택의 결과☆☆☆젊은게 계엄내란 새벽쿠데타에 편승하다니■ 감투 바지사장 기회주의? 평생에 오점으로 기록되는 마귀가 쫒아다닐거다...,True,1,2025-05-13T09:45:36+0900,859436202346938615,0,0,0
mjst****,bhg7,고민이나 조율의 대상인가? ㅋ ㅋ 거기서 잘못된거지.,True,1,2025-05-13T09:43:33+0900,859436070025035983,0,0,0
ppcd****,,,False,1,2025-05-13T09:42:26+0900,859435998319214767,0,0,0
nova****,VgHQ,극우꼴통 국짐후보와 똘마니,True,1,2025-05-13T09:41:28+0900,859435935555649682,0,0,0
inpa****,2oS1f,마음에 없는 소리를 하려니까 속이 부대끼는거지..,True,1,2025-05-13T09:41:08+0900,859435914819010615,0,0,0
yell****,4QOzi,"잘못했다. 죄송하다. 송구스럽다가 아니라, 채상병이 누구인지 아예 모르던데. 아예 모르더라고 개**",True,1,2025-05-13T09:39:04+0900,859435781507252250,0,0,0
wlxo****,,,False,1,2025-05-13T09:36:47+0900,859435633800642835,0,0,0
ksh9****,dgVND,개사과,True,1,2025-05-13T09:36:33+0900,859435619087024316,0,0,0
dark****,g56k,말이 되는 소리를 해라 지 혼자 모가지 뻣뻣하게 쳐 들고 잘못없다고 우기던 꼬라지가 얼마나 됐다고? 전광훈이 구속영장 청구(발부도 아님) 소식에 눈물을 쳐 흘리신 분이 퍽이나 상식에 맞는 말을 하겠다,True,1,2025-05-13T09:36:19+0900,859435603752648824,0,0,0
kayk****,64081,누군지도 잘 모르는 김용태를 세워놓은 것을 보니 박지현 비대위원장 때가 생각나노,True,1,2025-05-13T09:33:20+0900,859435412307837055,0,0,0
aodt****,3KcUW,김용태제외하고 모두 탄핵동조범들 김용태이용하는 국힘 문제다,True,1,2025-05-13T09:32:43+0900,859435372109627610,0,0,0
jaeh****,2cp0M,"지금와서 맘에 없는 말 한다고

어쩌라고",True,1,2025-05-13T09:31:01+0900,859435262269194248,0,0,0
ksw0****,,,False,1,2025-05-13T09:29:40+0900,859435175312883949,0,0,0
zd20****,1G9RZ,지랄맞네요.,True,1,2025-05-13T09:28:04+0900,859435072535658520,0,0,0
sumo****,2h8eL,9ㅇ년대생도 생태 대가리임,True,1,2025-05-13T09:25:44+0900,859434922597679357,0,0,0
elly****,,,False,1,2025-05-13T09:21:48+0900,859434668372525307,0,0,0
nksc****,,,False,1,2025-05-13T09:20:24+0900,859434578580865149,0,0,0
neos****,2etmQ,용태야 말을 똑바로 해라. 대통령이 아니고 전직 대통이고. 윤석열 피의자 이다. 그리고 솔직해져라. 사과로 끝낼게 아니고 출당시켜야지! 못하는건 0.1퍼라도 내란세력들 표라도 구걸하는거 아니겠냐만 그런다고 갸들이 니들에게 표를 줄까?,True,1,2025-05-13T09:19:53+0900,859434545831739674,0,0,0
vark****,,,False,1,2025-05-13T09:18:26+0900,859434451711557783,0,0,0
rind****,aw6Cg,"이것도젊은 구태
제2의이준석이다
논리에 맟지않는말지껄이고
비서실장도 모르던게엄을 한동훈이 어떻게아냐?",True,1,2025-05-13T09:18:19+0900,859434444547686505,0,0,0
calm****,1y3k8,결구 다 표인가 ㅉㅉㅉ 참.... 그리고 이들은 선거가 끝나면 윤석렬이 풀어다라고 지랄들 하겠지,True,1,2025-05-13T09:16:00+0900,859434295482122245,0,0,0
jaga****,O5jO,내란 동조당에 있는 사람들은 죄다 청산 대상이지.,True,1,2025-05-13T09:13:45+0900,859434149839110367,0,0,0
newn****,4r6Y5,국짐은 이전에 2등만해도 선방한거야 준석이한테 따이면 당해체해야지? ㅎㅎ,True,1,2025-05-13T09:12:10+0900,859434048471171132,0,0,0
hjdg****,33sdL,용태= 얼굴마담 = 바지사장,True,1,2025-05-13T09:11:48+0900,859434024932737259,0,0,0
jhc2****,,,False,1,2025-05-13T09:08:20+0900,859433801342779500,0,0,0
dpsd****,3yj0q,언제까지 강을 넘을꺼니?,True,1,2025-05-13T09:05:00+0900,859433586040766465,0,0,0
ppia****,2CH8b,"이제와서
개룻겨 ㅋㅋㅋ
속열이나출당시켜",True,1,2025-05-13T09:04:12+0900,859433535155470403,0,0,0
dave****,kjJK,"표 얻겠다고 마음에도 없는 사과하는게 무슨 의미가 있을까 ?    사과도 다 때가 있는 법인데, 문수는 이미 늦었다...  국회에서 꿋꿋이 앉아 있을때 너는 이미 윤도야지 그늘을 벗어나지 못한거야",True,1,2025-05-13T10:19:52+0900,859438409960128825,3,4,0
drea****,6C9aI,용태야~ 너의 운명은 토사구팽이야 걍 여기서 못 해먹겠다고 사퇴해,True,1,2025-05-13T10:20:18+0900,859438437206327403,1,2,0
leet****,2lJYb,"정체성을 말로 표현하는것 보다는 행동으로 표현하는게 더욱 신뢰받는다. 이미 말과 행동으로 탄핵된자를 두둔해왔고, 동조해왔다. 지금에 이르러서도, 탈당시키지 않고 있음은, 그 / 그당의 정체성을 말보다 강한 의지와 행동으로 밝힌것이다. 곡학아세로 왜곡하고 속이는 집단을 왜 정당이라 불러야 하나. 해산시키고 수사받도록 강제해야 한다.",True,1,2025-05-13T10:15:46+0900,859438145567981871,1,2,0
hayd****,14bit,"애쓴다. 근데 토사구팽 이란말뜻은 알지? 
걔들한테 많이들 당했다. 준석이, 준표, 상욱이... 그다음은 누구게?",True,1,2025-05-13T09:49:08+0900,859436430265417787,0,1,1
stsl****,MmaU,헌재 탄핵은 헌법 법률의 절차를 위반한 위법한 재판이었다. 보수 우파 대다수 국민은 헌재 결정 불인정한다. 상소절차가 없어서 참고 있을 뿐이다.,True,1,2025-05-13T09:20:51+0900,859434607639003421,0,1,1
ergr****,qfk0,그래도 잘하고 있네 과거의 과오는 반성하고 앞으로 사아가야지,True,1,2025-05-13T10:20:48+0900,859438470005784897,2,4,0
omin****,,,False,1,2025-05-13T09:34:44+0900,859435501998833944,0,0,1
cini****,,,False,1,2025-05-13T09:04:42+0900,859433567334170839,0,0,0
js73****,1vAQA,사람은 살아온 행적이 그 사람을 증명합니다.두 분다 경기도지사 시절  때 이룬 성과를 비교해보세요.김문수씨는 공장근로자로 노동운동가로 행정가로서의  경험이 지도자로서 자격이 충분합니다.,True,1,2025-05-13T10:29:03+0900,859439001877086230,2,6,0
ab90****,6Dc7L,개딸 대깨문 대진연것들이 이런것들은 대진연것들이 용산가서 대법원에서 시위하는것들이고 이런것들은 구속해라 ㅡ전라판사넘들도 계속해서 기각하니까 ㅡ개딸 대깨문 대진연것들이 답도안하고있다 ㅡ이런것들은 체포해서 구속하고 숙청을 해야한다,True,1,2025-05-13T09:09:18+0900,859433863519141981,0,4,2
elvi****,2BvEp,"김 후보는 경선 승리 직후 경기 포천 한센인 정착 마을부터 찾았다. 김 후보는 15년 전 경기지사를 할 때 그곳에서 한센인들의 손을 잡아주고, 그들과 하룻밤을 함께 보냈다. 한센인들이 운영하던 무허가 염색 공장을 섬유 산업 단지로 조성했고, 한글 등을 배울 수 있는 교육 시설도 만들어줬다. 김 후보가 이번에 방문하자 한 마을 주민은 ‘당시 사람들은 우리를 괴물 취급하듯 핍박하고 돌을 던졌지만 김 후보는 우리와 함께 하룻밤을 새우고 함께 밥을 먹었다. 낮은 곳에서 사는 사람들을 늘 지켜보고 안아주는 분’이라는 감사 편지를 낭독했다.",True,1,2025-05-13T09:03:13+0900,859433472123469882,0,5,0
j654****,,,False,1,2025-05-13T09:52:46+0900,859436664190140683,0,0,1
ok23****,3s1bo,"전 민주당 조응천씨가  민주당보면
  무섭다라고.  이재명의 나라
  위험이 걱정스럽다고",True,1,2025-05-13T09:26:11+0900,859434951001505860,0,9,1
