user_nickname,userIdNo,comments,visible,replyLevel,regTime,parentCommentNo,sympathyCount,antipathyCount,replyAllCount
jw30****,AUlp,"그래 이제야 서서히 정신들 돌아오지. 자칫잘못하다간 진짜 나라 후진국. 되는건 시간 문제다.
필리핀 태국 이런나라들이. 한순간 훅 간건 꼭 용산 두인간같은것들이 나라망친 전례가 있잖아 
입으로 공정정의 짖는 사기꾼 에게 더이상 놀아나선 안된다.
정신 똑바로차려야 이나라를 위험에서 탈출할수있다.
이건 진보와 보수의 문제가 아니라 이나라가 미래에 어떤 나라가 될지 중요한 갈림길에 놓여진 것이다",True,1,2024-11-12T16:19:18+0900,842577190892601506,350,16,6
hipa****,2XHKz,"탄핵을 위한, 탄핵에 의한,탄핵에 시간이 열린것 같습니다...대구에도 바람이 불었습니다...!!!+++",True,1,2024-11-12T16:01:24+0900,842576037391892631,241,22,4
jean****,2Dqfn,"국민의힘은 극우도 보수도 아닌 한반도 분단의 비극에 기생하는 기생충일 뿐이고, 반공전사로 전향한 친일매국노 후예들에 불과하다. 그런데도 계속 윤완용이 시청하는 수꼴매국 틀튜버들을 극우유튜버라고 소개하고, 그동안 해오던 대로 그냥 아무 생각없이 관성적으로 국민의힘이 보수정당이라는 개소리를 고장난 축음기처럼 지겹도록 떠들어제끼는, 구태의연한 한국언론들도 친일수꼴매국 세력들과 공범이고 진정한 대한민국 대표 적폐다. 의도적이든 아니든 언론들이 국민의힘을 보수정당이라고 지속적으로 국민한테 세뇌시키는 해악이 커도 너무 크다.",True,1,2024-11-12T16:08:32+0900,842576496752066787,201,12,1
jean****,2Dqfn,"국힘은 이승만, 박정희, 전두환 등 과거에 집착하고 그때를 그리워한다는 점에서 보수가 아니라 친일수구꼴통이다. 그들이 내놓는 정책도 대부분 그 시절, 그러니까 개발독재시대에 잘 먹히던 토건개발사업들인 이유. 반면 극우는 보수의 극단적 형태인데, 과격한 민족주의와 민족우월주의가 강하게 나타난다. 국민의힘이 친일매국적행위를 하고 그럼에도 그 지지자들이 그들을 지지하는 건 극우라서가 아니라 그들이 좋은 시절이라고 생각하는 과거에 갇혀있기 때문. 극우라면 그런 행위를 절대 용납 못함. 국힘은 그저 반공전사로 전향한 친일매국노의 후예들일 뿐",True,1,2024-11-12T16:09:51+0900,842576581628002695,135,13,4
arse****,45z0p,보수란말 막쓰지마라 국짐이보수냐? 자꾸보수라고하니까지들이진짜정치하는보수인줄알잖아 세비반땅같은것도막하는그냥사기꾼이해집단이지,True,1,2024-11-12T20:43:17+0900,842594197973237861,82,1,2
henr****,MNU5,윤두광 김견희 한뚜껑 검새  독재  일당 들을 몰아내고 대한민국 국민들 숨  좀 쉬고 살자 ᆢ 못살겠다  ᆢ  끔찍한 검찰독재공화국,True,1,2024-11-12T17:15:49+0900,842580831363924321,64,3,3
a_a1****,2AVx3,진짜 국민투표진행하면 탄핵 확정이다,True,1,2024-11-12T16:11:44+0900,842576703329927501,57,7,0
wlsv****,5HNIC,빤스런 승만이는 하와이에서 죽었고 닭까끼 마사오는 궁정동 안가에서 죽었다.  윤완용은 후쿠시마에서 죽어 야스쿠니에 봉안될 운명.  그건희 알고 싶다🙄,True,1,2024-11-12T19:50:41+0900,842590808824611035,34,1,0
heyk****,cguCP,아니 김영선 해줘라 하는 녹취록이 나왓는데 공천관련해서 얘기한적없다니… 이 무슨개소리에여??,True,1,2024-11-12T19:56:31+0900,842591185137565872,32,1,0
jup2****,1GuQw,대구가무슨 보수의 심장? 그냥국힘이고 경상도당리라 찍는거지.. 지금 국힘이 보수의역활을 하고 있나? 매국친일 정당인데.. 지금 보수는 민주당이다.. 우리나라 진보당은 망햇다.,True,1,2024-11-12T17:28:41+0900,842581660745597222,12,2,0
bhch****,,,False,1,2024-11-12T17:43:35+0900,842582620469461249,0,0,0
js03****,,,False,1,2024-11-12T22:57:39+0900,842602854345605342,0,0,0
magu****,2cWh2,"대구,경북엔 개,돼지만 사는 줄 알았는데..아니네..어찌 됬든 대구 경북도 정상적인 사람들이 더 많아지길 바래본다..",True,1,2024-11-12T17:13:37+0900,842580689864884499,10,2,2
stkp****,5n68x,윤석열과 신검부는 범죄집단이다 윤석열이 보다 훨씬 더 나쁜 넘들이 수구꼴통 대구경북 노인네들이다,True,1,2024-11-12T17:39:21+0900,842582347822923906,7,2,0
byfi****,cwfAg,윤석열이 부경대에서 정당한 시위를 하는데 경찰을 200명을 보내 폭력 진압을 했다.그 학생수가 단8명인데 말이다,True,1,2024-11-12T21:15:58+0900,842596303631286645,4,0,0
simr****,,,False,1,2024-11-12T20:41:18+0900,842594070248292436,0,0,1
kmh0****,78bVq,이제서야 멧돼지 정체를 알앗는가? 이미 대한민국은 몰락 하고 있습니다.,True,1,2024-11-12T18:49:02+0900,842586836634173459,4,0,0
jami****,Nzmt,TK에도 배운 사람들은 그나마 낫구나...역시 못배우고 무식하면 대부분 국짐..,True,1,2024-11-12T16:43:45+0900,842578765786644811,4,0,0
ogik****,JsSM,대구는 죽어도 빨간당인 기라. 옳고 그름의 문제가 아니고 색깔의 문제지? 얘들은 안 변해.,True,1,2024-11-12T20:45:07+0900,842594315531190323,4,1,0
smdy****,,,False,1,2024-11-12T16:05:26+0900,842576296918646979,0,0,1
asa2****,3v5qm,누가 보수 심장이레 똥구멍이지 쪽팔린줄 알기라,True,1,2024-11-12T19:41:20+0900,842590206556110967,3,0,0
lee5****,5IrIz,이제야 정신차란건가 경북의 지성인들이 진즉에 손바닥에 왕자보고 모지리를 알아봤어야지 이제라도 국가를 바로세우는데 일조하세요,True,1,2024-11-12T18:55:38+0900,842587262809014504,3,0,0
pine****,,,False,1,2024-11-12T20:07:31+0900,842591893186412721,0,0,0
knit****,,,False,1,2024-11-12T18:46:55+0900,842586700906496312,0,0,1
nh52****,4d1zS,"이 인간은 그래도 물러나지 않을 것이다 또한 탄핵 최종 판결을 받으면 김건희(그외 가솔들)와 함께 망명을 할 것이다 그러기 전에 우리가(민초들이) 먼저,탄핵 후 처단한 다음 국외로 추방시켜야 한다 그 가솔,충견들과 함께 영원히(물론 영구적 입국금지 조치도 병행)!~~~",True,1,2024-11-13T04:53:10+0900,842625757594255374,2,0,0
psy3****,IunW,그래 대학생들이 이런 부조리에 깨어나야한다. 이제 다들 정신차리나봄.,True,1,2024-11-12T23:25:50+0900,842604669858480358,2,0,0
docc****,,,False,1,2024-11-12T22:39:52+0900,842601707941658914,0,0,0
8you****,4nMqz,경북대 이름값 이제한다,True,1,2024-11-12T22:05:12+0900,842599475229753418,2,0,0
pete****,c8Dh1,"아무리 tk라지만, 젊은 분들은 깨어있으리라 믿는다",True,1,2024-11-12T21:57:21+0900,842598969598017638,2,0,0
thet****,4zJpy,학생들마저 방관하지 않아 정말 다행스럽다..,True,1,2024-11-12T21:33:16+0900,842597418192076880,2,0,0
kim2****,pVI2,김건희가 한국의 이멜다가 되기 전에 멈추게 해야한다,True,1,2024-11-12T18:45:01+0900,842586578466373641,2,0,0
aktw****,1p6Ps,행동하는 양심들 ㅡㅡㅡ   홧팅 !!!,True,1,2024-11-12T17:47:58+0900,842582902981001631,2,0,0
sred****,4QDmq,"경북대생들이 더 낫네. 조국사태때 서울대 연고대 학생넘들 공정과 정의 시부리면서 연일 집회열더만 윤재앙,쥴리때는 입다 닫고 뭐하고 있나 몰라? 그때는 맞고 지금은 틀려? 내로남불? 반성해라 서울대,연고대 무식한 학생들아?",True,1,2024-11-12T16:51:33+0900,842579268398481661,2,0,0
bbbb****,1RPUq,왠만해야 가만히 있지.. 탄핵 갑시다!!!,True,1,2024-11-12T16:37:48+0900,842578382779580846,2,0,1
va******,23ixC,보수의 심장은 무슨 ..보수의항문이지,True,1,2024-11-12T16:11:14+0900,842576670580801638,2,0,0
wpwp****,39QcC,"제발 대구는 정신차려야 된다.
나라꼴 이렇게 만든 책임이 대구가 제일크다.",True,1,2024-11-13T07:09:28+0900,842634539191763004,2,1,0
aldk****,5k9P0,진짜   박수가 나오네요~~~~~역시   대학생들이    앞장서야  합니다    당신들을 위해   뒤에서   응원합니다,True,1,2024-11-13T00:49:09+0900,842610037409972260,2,1,0
dark****,1r78N,학생들이 들고 일어났다는건...이미 그정권은 끝났다고 보면됨 왠만하면 학생들 학업.취업.알바해야돼서 저런거 안함 점점 산으로 가는군 더 거세지면 윤대통령 내려오는게 맞음,True,1,2024-11-12T22:23:14+0900,842600636934520907,2,1,0
por0****,3lrTk,조심하세요 경찰들 과잉진압 할거 같음...이미 분위기상 내부지침으로 명령 내렸을거 같음...윤통은 하고도남음...,True,1,2024-11-12T20:19:01+0900,842592634689028106,2,1,0
yhk6****,3vAIh,나라가 망하고있다.,True,1,2024-11-12T18:15:09+0900,842584654304247865,2,1,0
jll1****,2YmIH,뻑하면 대구 서면시장 가서 떡뽁이 먹더니 이젠 돌 맞을까봐 가지도 못하겠네,True,1,2024-11-13T03:26:47+0900,842620193128579122,1,0,0
kkk6****,cZFap,대구에도 저런 이성적인 사람이 사는구만,True,1,2024-11-13T03:07:54+0900,842618976830750788,1,0,0
jly1****,ezG6S,이렇게 무능한 양아치 윤섴열을 국짐당 의원들은 아직도 감싸는걸 보고 ~~ 당을 해체해야 된다는 생각이 들었다!!,True,1,2024-11-13T02:35:02+0900,842616858539458565,1,0,0
wros****,1cffS,이제 전국의 대학생들이 일어났다. 부경대 학생들처럼 사지가 붙들려 끌려가는 상황이 줄줄이 일어날것이다. 독재정권은 물러나라.,True,1,2024-11-12T23:51:58+0900,842606353720541415,1,0,0
sang****,4ic9k,"부산,대구,경상도는 절대 변하지 않는다.특히,60~70대 고연령층이 없어지지 않는 한 저것들은 변하지 않는다.가장 비민주적인 집단이지.국짐당에서 내려보내는 사람은 능력이  없고 부정부패 인사도 '우리가 남이가'라며 무조건 뽑는다.대한민국 정치발전에 가장 큰 걸림돌 집단이다. 헌법이 부여한 투표권도 제대로 행사 못하는 집단 부산,대구,경상도!!",True,1,2024-11-12T22:35:47+0900,842601445546000613,1,0,0
estr****,250zN,다시 돌아온 드럼통에게 호구가 되어 나라 갖다바칠 오사럴 놈들! 가만둬야 쓰겄소?,True,1,2024-11-12T22:00:40+0900,842599182484111615,1,0,0
chai****,2mgBv,대구경북 노인들은 그렇다쳐도 대학생들은 진작 들고일어났어야지,True,1,2024-11-12T21:51:46+0900,842598609995170062,1,0,0
mudl****,,,False,1,2024-11-12T21:15:43+0900,842596287625822460,0,0,0
soho****,5llIh,어차피 안될거 뻔히 아니 이참에 쇼 해서 떨어진 학교위신 올리자는것아니겠나  할려면 부산대 전남대같이 대외 투쟁해 시민대표로 부마사태 518같이 혁명 사명으로 대정부 투쟁 해봐라 대자보 갖고는 위에서 눈이나 깜빡 하것나 학생들 눈으로 보면 뜯어고칠게 얼마나 많겠노 건투를 빈다,True,1,2024-11-12T21:10:01+0900,842595919416262672,1,0,0
jsw4****,,,False,1,2024-11-12T20:52:53+0900,842594816247202073,0,0,0
kish****,18Jkp,지들 범죄는 무죄만들고 남들 범죄는 탈탈털어서 악마화시키고 ㅋㅋㅋㅋㅋ. 근데 제일더러운것들이 깨끗한척(((윤똥 술밥이. 대머리깐조기)))),True,1,2024-11-12T20:16:34+0900,842592476496658612,1,0,0
yusm****,rd2H,대한민국이 어쩌다 이리 됐냐? 처참하다..대구경북은 진짜 분리 독립해라..,True,1,2024-11-12T19:59:16+0900,842591361818427492,1,0,0
rlae****,au88f,보수의 심장인 대구도 어쩔 수 없지... 개석열이는 보수가 아니고 그냥 개니까... 사기꾼 뇽 거니와 함께 두마리 개 ㅋㅋㅋ 왈왈 멍멍 하다가 도살되야지...,True,1,2024-11-12T19:38:28+0900,842590022325502122,1,0,0
jskj****,3Hxr,대구 소재 대학생들아~느그 할아버지 할머니 그리고 애미 애비들이 싼똥이 이 나라를 온통 똥밭을 만들고 있단다 느그들이라도  정신차려서 치워야되지 않겠냐,True,1,2024-11-12T19:32:24+0900,842589631131156623,1,0,0
ccsy****,Fg0W,애국자다,True,1,2024-11-12T19:29:10+0900,842589422573584445,1,0,0
ji27****,2cR98,빨리 서문시장으로가야지,True,1,2024-11-12T18:36:38+0900,842586038659449058,1,0,0
kang****,,,False,1,2024-11-12T18:31:56+0900,842585735713259842,0,0,0
yhs9****,2h6GH,대구경북의 상징 경북대라도 참여해야지....나라가 산다,True,1,2024-11-12T18:30:06+0900,842585617199005733,1,0,0
tjdg****,lts4,일부 전라도민들의 선동질이지. 이재명이 지지하는 인간들이야.,True,1,2024-11-12T18:08:46+0900,842584243228901682,1,0,0
use_****,,,False,1,2024-11-12T17:47:47+0900,842582890599416109,0,0,0
bjan****,Ygym,친일과 매국의 본거지,True,1,2024-11-12T17:38:43+0900,842582307490496800,1,0,0
tols****,2ANun,"역시 경북대입니다,  참 잘했어요!",True,1,2024-11-12T17:18:17+0900,842580990244159612,1,0,0
tedd****,,,False,1,2024-11-12T17:11:03+0900,842580524256985113,0,0,1
johw****,1IBn0,전국 지성의 전당에서 들불이 퍼지고 있군요. 나라가 살아나는 길입니다. 응원합니다!,True,1,2024-11-12T17:07:32+0900,842580297781346550,1,0,0
topk****,2IYuX,윤석열만 문제가 아니다 허수아비 대통령 앞세워 뒤에서 온갖 비리로 사익 취한 기득권 공무원 검찰 경찰 부역자들 있다면 모조리 찾아서 사법처리 받게 해야함!,True,1,2024-11-12T17:04:41+0900,842580114876137766,1,0,0
smjy****,1FrBa,이왕 고생하는 김에 서문시장에도 붙여 주세요!,True,1,2024-11-12T16:59:55+0900,842579807165219217,1,0,0
vivi****,1yZIl,대구 갱북 너거들이 싼 똥 치와라~~,True,1,2024-11-12T16:50:37+0900,842579208034058523,1,0,0
soot****,1Lv4y,드디어 대구의 청년들도...,True,1,2024-11-12T16:23:37+0900,842577468438085989,1,0,0
aslj****,2bMkUy,"보수라하지마라 이익집단들이다
진짜보수는 깨어있는진보시민이다",True,1,2024-11-12T18:42:24+0900,842586409922461865,1,1,0
have****,2cfeUB,"김건희 여사 문제뿐만 아니라 채상병 특검, 뉴라이트 인사, 이태원 참사 등 윤석열 정부에서 벌어진 일들에 대한 책임을 묻는 내용이 들어간다""고 밝혔다.   굿",True,1,2024-11-12T18:23:16+0900,842585177401065561,1,1,0
inbc****,2j5lk,"대통령의 최근 대국민담화·기자회견에 대해 ""김건희 여사의 국정농단, 공천개입을 증명하는 녹취록이 공개돼 큰 파장이 일었는데도 (대통령은) 제대로 된 사과나 해명은커녕 자신의 처를 '악마화 한다'는 이야기만 늘어놨다""라고 직격했다.
ㆍ",True,1,2024-11-12T18:15:06+0900,842584650680369189,1,1,0
anne****,2vJ43,빨리 탄핵되길 바래봅니다,True,1,2024-11-12T18:10:11+0900,842584334698283077,1,1,0
kwj6****,,,False,1,2024-11-12T18:07:42+0900,842584173938999548,0,0,0
wink****,,,False,1,2024-11-12T17:44:31+0900,842582680900993247,0,0,0
help****,2xGLM,그래도 선거하면 80프로 2찍 나오는 동네. 대한민국을 망조들게하는 동네.,True,1,2024-11-12T17:33:53+0900,842581996105367881,1,1,1
podo****,6aiRb,"윤석렬 정부의 탄핵은 지역을 넘어 우리 
대한민국의 미래를 위한 일입니다.
용기 있게 궐기하고 동참을 시작한 대구 시민들 화이팅하세요.",True,1,2024-11-12T17:24:42+0900,842581404406513968,1,1,0
qbbg****,Ol6w,경북은 정말 우파 동네인데.. 여기서 까지 이런다면 진짜 심각한겁니다.. 민심 제대로 좀 보세요.,True,1,2024-11-12T16:40:02+0900,842578526006673446,1,1,0
jooy****,1pHwN,윤불통 속히 탄핵하는게 국익과 자유민주주의 회복하는지름길이다.,True,1,2024-11-15T13:20:33+0900,842843988690993346,0,0,0
wish****,6p7Wr,에휴 나잇살들 먹고 사리분별을 못하니 살 날 많은 어린 것들한테 쓰레기장 물려주네 안 그래도 지구는 인간 싫다고 나가라고 해서 얼마나 더 살 수 있을지 장담도 못하는데...,True,1,2024-11-14T20:55:30+0900,842780527764177057,0,0,0
jiyo****,2JmB9,"대구 경북 땜에 나라꼬라지가.....
정신 못 차리는 노인네들",True,1,2024-11-13T20:36:07+0900,842686506752540743,0,0,0
9119****,p8It,"대구, 경북은 나라가 망해가도 윤거니를 지키려고 하는 사람이 더 많다. 불쌍한 사람들~",True,1,2024-11-13T13:32:47+0900,842659233810874675,0,0,0
hoki****,8fO0X,가슴팍에 진보당 ㅋㅋㅋㅋㅋㅋㅋㅋㅋㅋㅋㅋ,True,1,2024-11-13T12:37:49+0900,842655692643893552,0,0,0
cad0****,3xAZL,부산경남이ㅡ더ㅡ윤석열ㅡㅡ조아한다ㅡㅡ보수심장이ㅡ부경으로ㅡ바뀐지가ㅡ언제인데ㅡㅡㅡ,True,1,2024-11-13T09:48:50+0900,842644806311084357,0,0,0
cad0****,,,False,1,2024-11-13T09:47:27+0900,842644717291176098,0,0,0
bioi****,,,False,1,2024-11-13T08:28:35+0900,842639636042875042,0,0,0
4myl****,,,False,1,2024-11-13T06:39:26+0900,842632604594208823,0,0,0
driv****,38Fqk,대구경북 꼴통들 각성좀 하자 박정희독재자에 아직도 헤어나오지 못하니 답답 젊은사람들이야 다르겠지만 나든 노인들이 문제다,True,1,2024-11-13T06:30:06+0900,842632002493480964,0,0,0
shin****,2Z7bv,국짐당이. 나라를팔아도. 대구경북은. 빨간당짂는다,True,1,2024-11-13T06:22:04+0900,842631485553901569,0,0,0
jaem****,,,False,1,2024-11-13T04:23:08+0900,842623823231582217,0,0,0
ever****,22prl,문재인도 문제였지만 석열이는 419때 이승만깉다. 석열이 이자를 때려 잡아야 한다 그래야 우리 민족의 불행의 속도를 늦출 수 있다,True,1,2024-11-13T04:16:26+0900,842623392057131040,0,0,0
shyl****,1djk7,잘한다 경북대. 사라있네!!!,True,1,2024-11-13T03:37:00+0900,842620851164545025,0,0,0
sich****,,,False,1,2024-11-13T02:28:02+0900,842616408272535558,0,0,0
jisa****,1xTcv,애들데리고 선전선동 방탄볼모로 삼지마라~ 범죄자가 원흉이다. 북돼지 앞잽이 지령받았나? 선전전~오마이 똘마니 세작인가?,True,1,2024-11-13T01:22:14+0900,842612169106260005,0,0,0
adam****,1wkM8,보수의 심장이 왜 대구냐? 그보다 더 많은 인구를 가진 충청이나 강원도 있는데 심장이 활발한 몸뚱이에 피 공급을 원할히 공급을 못하니 조만간 심장마비 올듯하군 보수를 가장한 이기주의 새끼들,True,1,2024-11-13T00:41:39+0900,842609554645581966,0,0,0
xpun****,,,False,1,2024-11-13T00:05:19+0900,842607213972291673,0,0,0
ycj0****,4fc9G,"대구가 보수의 심장이면 대가리는 누구냐?
  앞뒤모르고 껄떡거리며 평생고생하는 심장이 대구 모지리들에게는 딱 맞는말인데, 이 모지리들을 조종하는 무리는
  대구에 4년에 한달밖에 없지.",True,1,2024-11-13T00:03:44+0900,842607111262175403,0,0,0
xpun****,,,False,1,2024-11-13T00:02:57+0900,842607060964081898,0,0,0
sunj****,3lqSb,젊은세대들은 짝대기만 꽂아도 뽑는 청맹과니들과는 다르구만!,True,1,2024-11-12T23:47:59+0900,842606096391602447,0,0,0
jiho****,rV,아내한테 충성한다는 데 뭐가 문제냐 ㅋㅋ 참 OOO이죠,True,1,2024-11-12T22:59:19+0900,842602961065476220,0,0,0
jbky****,,,False,1,2024-11-12T22:52:26+0900,842602518465740934,0,0,0
qaz7****,,,False,1,2024-11-12T22:26:00+0900,842600814638792705,0,0,0
zizx****,Cmqh,순방가서 안왔으면,True,1,2024-11-12T22:22:17+0900,842600575781568606,0,0,0
smg6****,8bQH1,그래도 조금 깨어있는 시민들  교수 학생들이네 ㆍ잘못하면 아무리 보수집단이라도 행동으로 표현할수 있는게  선진시민이다 ㆍ지금까지는 그렇지 못했다 ㆍ참 찰한일이다,True,1,2024-11-12T22:16:37+0900,842600211061670075,0,0,0
clas****,,,False,1,2024-11-12T21:55:44+0900,842598865713496272,0,0,0
lhy5****,,,False,1,2024-11-12T21:48:45+0900,842598415077474587,0,0,0
e231****,,,False,1,2024-11-12T21:46:00+0900,842598237993959425,0,0,0
bruc****,2C0SB,"태극기 가슴에 두른 녀석도 메엣돼지 욕하는거보고 깜짝 놀랐는데 지지율 10% 맞네.. 미취인 다악뇬 때 보다 더 최악이야.. 재명이가 적폐판사만 아니면 낼모래 별 문제 없을텐데, 이상이 생기면 우리나라 대한민국, 아주 재밌어 진다.",True,1,2024-11-12T21:39:03+0900,842597790428168217,0,0,0
bruc****,,,False,1,2024-11-12T21:36:20+0900,842597615542468726,0,0,0
hsh0****,,,False,1,2024-11-12T21:34:22+0900,842597488773824663,0,0,0
mygs****,2BoUv,윤 은 보수도 진보도 아니다 그냥 명신이 남편 이다,True,1,2024-11-12T21:28:17+0900,842597096421851218,0,0,0
kyk1****,4xVSo,대구경북 시민들도 학생들 보고 깨어나길 기대해 본다.,True,1,2024-11-12T21:17:33+0900,842596404999225557,0,0,0
myen****,,,False,1,2024-11-12T21:16:40+0900,842596348359344346,0,0,0
lsg1****,unF6,대통령 선거때  좀 잘하지 ㅜㅜㅜㅜ,True,1,2024-11-12T21:11:34+0900,842596019962118325,0,0,0
cown****,,,False,1,2024-11-12T21:08:43+0900,842595836687810807,0,0,0
wktk****,12m7T,멋있다 우리 후배들,True,1,2024-11-12T21:06:28+0900,842595690793140379,0,0,0
pjk6****,1sASE,보수가 뭐고 진보가 먼지도 모르는것들이 그저 이쪽동넨 보수 저쪽동넨 진보라하네  언론것들이란,True,1,2024-11-12T21:02:13+0900,842595417492291664,0,0,0
leep****,,,False,1,2024-11-12T21:01:19+0900,842595359040471150,0,0,0
ilai****,7cHqZ,웬일로 대구에서?,True,1,2024-11-12T21:00:03+0900,842595277620641807,0,0,0
kuri****,1TiCp,최근 이 나라는 정부의 꼬라지는 40년전 모습이고... 대학은 박근혜 탄핵 직전의 모습과 상당히 닮아 있는 듯...,True,1,2024-11-12T20:57:45+0900,842595129159057686,0,0,0
dapp****,2bYZSM,더불어 쓰레기 집단 똘마니들 .... 열심히 군불 때네.,True,1,2024-11-12T20:52:55+0900,842594818612789559,0,0,0
asa2****,3v5qm,보수 방광이라구,True,1,2024-11-12T20:00:03+0900,842591412166852626,0,0,0
nse3****,,,False,1,2024-11-12T19:43:11+0900,842590325372354622,0,0,0
redf****,1nrO2,부모님한테 들키지 안기를 빈다.~,True,1,2024-11-12T19:42:22+0900,842590273111326838,0,0,0
nse3****,,,False,1,2024-11-12T19:41:51+0900,842590239556895032,0,0,0
bink****,,,False,1,2024-11-12T19:38:56+0900,842590051584966973,0,0,0
kim8****,,,False,1,2024-11-12T19:38:15+0900,842590008115200090,0,0,0
soze****,2cQKx,계속지지해라 새삼스럽네 ㅋㅋㅋ ㅋㅋㅋ ㅋㅋㅋ,True,1,2024-11-12T19:37:52+0900,842589983318475040,0,0,0
neof****,,,False,1,2024-11-12T19:37:03+0900,842589930721902613,0,0,0
i100****,1VZo4,"전라, 광주 윤석열  상승?",True,1,2024-11-12T19:36:23+0900,842589887302467715,0,0,0
as45****,2byQW8,진보당~~~~ㅋㅋㅋ~~~~~~그냥  없애라~~~~~이것들은  있으나마나~~~~~~,True,1,2024-11-12T19:35:56+0900,842589858210775395,0,0,0
5799****,1Xjjp,정말 하루하루 뉴스보는게 스트레스,True,1,2024-11-12T19:33:43+0900,842589716241973490,0,0,0
nice****,2v6aK,두창아 이제 서문시장 가면 돌 맞겄다.,True,1,2024-11-12T19:32:26+0900,842589633161199765,0,0,0
k211****,6kXRz,맨날 찍고나서 내가 저칼줄 알았나 카더라...에휴,True,1,2024-11-12T19:23:23+0900,842589050538819724,0,0,0
tedd****,tFZK,진보도 보수도 결국 다 나라 잘되기를 바라면서 지지하는 것인데 보수탈 쓰고 나라 망치려고 고사지내는 대통령이 있으면 당연히 더 화나지,True,1,2024-11-12T19:22:16+0900,842588977708925019,0,0,0
bane****,6P5iB,다음 대선 투표때  신중하게 해 주셨으면 감사 하겠습니다!!!,True,1,2024-11-12T19:14:12+0900,842588458353426509,0,0,0
bizz****,1kIT8,곧 대구도 반월당에서 대규모 탄핵시위 시작 하겠구나. 열심히 나가야지.,True,1,2024-11-12T19:10:58+0900,842588250081067312,0,0,0
hung****,MUAI,헌재판새들이 굥거니 친구들이잖아. 혁명해서 단두대 세워야 함. 어중간하게 탄핵하면 굥거니 2기 또 나온다.,True,1,2024-11-12T19:09:36+0900,842588162369781990,0,0,0
dlax****,1jKSH,이제껏 경상도 분들을 오해한거같군요.,True,1,2024-11-12T19:08:49+0900,842588111165718828,0,0,1
090o****,zJiQ,"윤석열 특검 거부하는 이유,
과거 검찰총장시절  유명한 말""특검거부하는자가 범인""
고로 김건희 범죄 여럿 들통나니깐 거부하는거지~",True,1,2024-11-12T19:07:57+0900,842588056035787079,0,0,0
sskj****,P7Kq,조직적 댓글 다는 좌파이적놈들,True,1,2024-11-12T19:05:44+0900,842587912573812965,0,0,0
jinw****,GYsK,"나도 경북 *주가 고향이지만
제발 경북 인간들아 정신좀 차리자
당신들 뽑는 대통령 죄다 감옥가고 탄핵되고 지지율 이따구면 좀 느끼는거 없냐!
윤석렬이 다른데는 돌맞아 뒤질까봐 못가고 그저 서문시장하고 자갈치만 가는데
우리가 남이가 하면 묻지마로 손내밀고 악수하려는 아지매 할매들 제발 좀 정신 차리자
뉴스좀 보고 살라고!!  KBS 이런거 보지말고 좀 MBC JTBC 보라고 !!
이 멍청한 아지매 할매들아 ㅠㅠ
그런 인식으로 살면서 살기힘들다고 징징대지 말고!!",True,1,2024-11-12T19:05:13+0900,842587879254261821,0,0,0
dean****,31P3w,대구경북 대학교수들이 옳고 그름을 외면하겠냐? 다행이다. 그나마 선생들은 중심잡고 바른말 하고있으니,True,1,2024-11-12T19:03:06+0900,842587743107153955,0,0,0
waxe****,11xZx,대라디언 분탕종자들이 곳곳에 침투했구나ㅉㅉ,True,1,2024-11-12T19:03:04+0900,842587741597204503,0,0,0
sunm****,3EAwS,2류대 티내고 있네.OOO들  공부나 하지.,True,1,2024-11-12T18:59:19+0900,842587499300651116,0,0,0
koab****,3u8Xw,서울대보다 낫네 응원합니다 힘내세요,True,1,2024-11-12T18:53:51+0900,842587147901862168,0,0,0
sun8****,4gW7g,국민투표해라!!!!,True,1,2024-11-12T18:47:55+0900,842586765549109554,0,0,0
