user_nickname,userIdNo,comments,visible,replyLevel,regTime,parentCommentNo,sympathyCount,antipathyCount,replyAllCount
magi****,2lppe,언론이란게 앞장서서 이런걸기사화하고있으니 나라꼴이 이렇지.탄핵당하고 국민한테 사과한마디없이 무슨개선장군처럼하는 행태를 꾸짖기는커녕 오히려 그걸 대변하는듯한보도가 가당키나함?,True,1,2025-04-12T17:41:46+0900,856590968814567601,91,67,1
naya****,1plos,"줄탄핵29번 행정마비 10:0 기각 전원복귀 내란수괴는 민주당 이재명 박찬대 정청래~ 간첩법반대 국가보안법 전과자가 정청래 포함해서 22명이나 되는 반국가세력 알게해준 비상계엄,  우리법연구회 좌파카르텔 장악한 법치주의 무너뜨린 판결, 부정선거 윤 again ~",True,1,2025-04-12T18:25:08+0900,856593762573353001,32,14,1
powe****,2S1r8,내란의힘 해체,True,1,2025-04-12T18:34:05+0900,856594339525034010,12,2,0
pdso****,2IKiU,어개인 윤석렬 화이팅,True,1,2025-04-12T18:27:05+0900,856593888519913497,11,5,2
kimt****,5CZ7f,난 비민주주의자요.난 반헌법주의자요.난 독재주의자요.하고 아우성치는 극우개돼지들.,True,1,2025-04-12T17:57:37+0900,856591989708161162,23,20,0
hana****,1aL7w,"우리나라 비상상황이라고 대통령이 얘기해도  에이 설마… 간첩이 어딧어…감히 국민에게 총부리를?????
이러고만 잇다. 즁귝인들이 아뮤리 간첩질을 하고 기사가 나와도 계엄이 잘못이네. 북한 지령을 받은 간첩들이 곳곳에 잇어도 계엄이
잘못이네. 자유가 슬슬 사라진다는데도 잘 못느끼는게 당연하지. 한번도 잃은적이 없으니까. 
저사람들은 시간남아서 저기 나온줄 아냐
자유를 잃지않으려고 그런다. 홍콩처럼 된다해도 그저 평화로운줄만 알지. 
이제 남은건 셰셰 뿐이야. 마지막 선거다",True,1,2025-04-12T18:33:08+0900,856594277751324706,5,3,0
wdvy****,CBPl,"그러게....애초부터 찢이 전과4범 12기소 범죄자 아니였으면, 탄핵도 덤덤히 받아들였을꺼다. 웃기잖아. 살인자가, 도둑을 전기의자 에 앉힌다는 거....거기다 국민의 신망을 받아야하는 헌재판결...그중에 야동맨이 있는데...신뢰가 가겠나. 판결문도 오류 투성이 이고, 윤석열이 국회에 의구심을 가진건 착각이고...홍장원/곽종근 의 오염된 증언으로 국헌문란의 의구심은 확신이고...6:2라도 나왔으면 그려러니 했을 꺼다. 8:0 쥐어짜서 만든거니..판결자체가 사주를 받은 인위적 판결 이라는 소리이지.",True,1,2025-04-12T18:04:13+0900,856592415245467696,5,3,1
davi****,2Jplx,정신병자들 많네요. 술주정뱅이 무당건희들,True,1,2025-04-12T18:18:57+0900,856593363913146613,4,2,0
wars****,qzkF,극우땜시 나라가 산으로 간다..이를 이용해 다리 걸친 보수도 문제고..아무튼 늙은이들 불쌍타..뭘 알고 저러겠노..,True,1,2025-04-12T18:09:00+0900,856592723744915457,4,2,1
arno****,3xvSD,유용한 기사군요.. 사실 탄핵 이후 우리사회의 참 모습이 궁금했는데..  감사합니다,True,1,2025-04-12T18:12:02+0900,856592918780051464,3,1,0
jdk0****,1wN3k,28%프로 사이비와영남당 외에 과연 머리에 총맞지않은이상 모지리를 지지할까?그리고 한가지만 물어보자 윤석열 잘한거3가지만 되봐라 맞으면 나도 계몽될께 ㅋㅋ,True,1,2025-04-12T23:03:39+0900,856611706426622133,2,0,0
eeuu****,5qjhP,"끝난지가 언제인데 아직도
  참환자많네",True,1,2025-04-12T21:11:09+0900,856604458082107425,2,0,0
kkbs****,cBSz2,전광훈. 조배숙 죗값 어떻게 감당 하려고 하냐? 그만 자제 자숙해라! 지겹다!,True,1,2025-04-12T17:49:03+0900,856591437888749583,19,18,1
euko****,,,False,1,2025-04-12T18:00:52+0900,856592199037485258,0,0,0
lee6****,1LOvo,언론들만봐도 알수있다 진실을 보도하지않고 힘센놈돈주는놈한테 붙어서 대한민국이 지금 얼마나 중국한테 먹히고 있는지 알려주지 않으니 정치에 무관심한 국민들의 눈과 귀를 멀게 하고 있다 이런걸 없애려고 한 계엄을 오로지 계엄이라는 이유로 잘못됐다 말하는 우동사리들이 있으니 참으로 걱정이다,True,1,2025-04-13T00:06:49+0900,856615775908135078,5,4,0
jhle****,7q1o0,아무튼 현재 지지율이 가장 높은 윤통-00대학교 이00교수 경제학박사-,True,1,2025-04-12T18:48:53+0900,856595292387016923,1,0,0
ggld****,4QxDR,"우두머리도 지지자도 망상에서 헤어나지 못하고있군,,",True,1,2025-04-12T18:22:13+0900,856593575138295858,1,0,0
jeff****,10qWM,몇천만 중에 저정도 꼴통은 어디나 있기 마련.,True,1,2025-04-12T18:14:28+0900,856593075110150244,1,0,0
saga****,4KV0Z,종교와 정치~ 유투브가 결합되면 저렇게된다... 조심하거라...미처버란 잡단 약도 없음,True,1,2025-04-12T17:59:16+0900,856592096277037123,1,0,0
sona****,9kFZ5,윤석열과 내란의 힘 자체가 사기 집단이다!!!,True,1,2025-04-12T18:02:16+0900,856592289902886975,19,19,0
scki****,,,False,1,2025-04-12T17:50:47+0900,856591549356572885,0,0,0
orio****,1lxdQ,수괴를 즉각 구속하라~~,True,1,2025-04-12T23:07:42+0900,856611967412994242,2,2,0
yvoy****,16Fbm,아크로비스타 주민들 지긋지긋하겠다 윤이 감옥가길  고대하겠네,True,1,2025-04-13T06:14:46+0900,856639480218517554,1,1,0
uki8****,3kxLD,사기 탄핵이래...얼마나 무식하면 저렇게 생각할수가 있을까...문맹률이 가장 낮은 나라인데 지능과 상식도 낮은 사람들이 많구나,True,1,2025-04-12T20:06:53+0900,856600318069178577,1,1,0
nora****,oWy5,으이그 한심한 것들....,True,1,2025-04-12T19:10:23+0900,856596677463638115,1,1,0
sill****,Li3C,전광훈에게 헌금내고 짝퉁목사 배불려 주느라 애들 쓴다!!!,True,1,2025-04-12T18:52:29+0900,856595524348805250,1,1,0
sera****,74zTq,꼴보나 개딸들이  정치를 망치고 있다.파연된자를 왜 지지하는건지!,True,1,2025-04-12T18:50:08+0900,856595373035094045,1,1,0
loxn****,6os9A,대선에서 내란 국짐당을 처절하게 응징해야합니다,True,1,2025-04-12T17:58:16+0900,856592032053854279,1,1,0
newf****,62aFt,모든게 다 음모..부정.. 니들 근데 왜 예수는 믿냐?ㅋㅋㅋㅋㅋㅋㅋㅋㅋㅋㅋㅋㅋㅋㅋ,True,1,2025-04-13T10:10:14+0900,856654650663764024,0,0,0
cell****,,,False,1,2025-04-13T09:43:36+0900,856652934740443259,0,0,0
mh27****,6bonl,천벌받을것들,True,1,2025-04-13T09:24:36+0900,856651710674763890,0,0,0
mh27****,6bonl,나라말아먹는역적놈들 언 론이란것들이 젤 문재다 대한민국은  양심없는 언론땡순에 망한다더니 정말그렇다 썪어빠진  사법부 ㆍ언론들 온라라가 쓰레기하치장뿐이다,True,1,2025-04-13T09:13:05+0900,856650968064851981,0,0,0
1472****,,,False,1,2025-04-13T05:46:56+0900,856637687069671473,0,0,0
seop****,2zgly,노인네들 힘이 남아도나보네 ㅋㅋㅋ,True,1,2025-04-12T23:08:22+0900,856612009926459493,0,0,0
mkyn****,8VM5D,알바천국,True,1,2025-04-12T22:41:18+0900,856610265884524634,0,0,0
naya****,7O3ZZ,언론에서  따라다니니 점점 비상식적인 행동을 하고 있아요,True,1,2025-04-12T21:09:50+0900,856604373004845311,0,0,0
four****,5RtyV,노친네들 외로워서 뛰쳐나가   목청터지라 윤석열 외쳤더니  과쟘젊은대학생 몇명불러 늙은이들 무시나하고  윤건희 지들도 늙은이면서,True,1,2025-04-12T20:43:11+0900,856602656142000185,0,0,0
cabi****,3uVKl,저런 진상 내한몸 던지고 싶다~,True,1,2025-04-12T20:11:08+0900,856600591604908062,0,0,0
lott****,5lX6h,2% 부족한 친구들이냐??,True,1,2025-04-12T20:09:23+0900,856600479398887527,0,0,0
gjtn****,3ns0w,yoon again 🇰🇷🇰🇷🇰🇷🇰🇷짱깨는 나가주세요,True,1,2025-04-12T20:06:53+0900,856600318069178575,0,0,0
dlsg****,7TpCB,정신들좀 차려라,True,1,2025-04-12T18:45:39+0900,856595084685082758,0,0,0
hjyj****,1uJkR,참~~~할일들 없나보네...,True,1,2025-04-12T18:42:55+0900,856594908020998355,0,0,0
jhle****,7q1o0,지지자들을 보니 아무래도 윤통도 언제건 재출마해야겠다. 마치 브라질의 경우 부패혐의로 대통령직에서 축출당한 전 대통령 룰라가 후에 재출마해 당선된 것처럼. 한국이나 브라질이나 판사들이 문제가 심각하다-00대학교 이00교수 경제학박사-,True,1,2025-04-12T18:42:29+0900,856594880741245046,0,0,0
jong****,4AhLU,"저 사기꾼 광훈이 좀 집어 넣어라 사이비종교 신도들은 뭔 잘못이냐 미치겠다 진짜 
사이비집단 저거 진짜 문제다",True,1,2025-04-12T18:42:11+0900,856594860944130091,0,0,0
mati****,4Cfes,계속  국민들 가슴에  염장질  하세요...폭력도  행사 하세요...공권력들은  엄정대처  하세요 ..봐주지  말고..오늘  또  사법부의  봐주기가  시전되었습니다..왜  재판 방송  못하게  막는거냐,True,1,2025-04-12T18:41:42+0900,856594830443151519,0,0,0
ktjt****,,,False,1,2025-04-12T18:38:30+0900,856594623328419982,0,0,0
seoh****,xEiX,내란당,True,1,2025-04-12T18:36:34+0900,856594499797778601,0,0,0
milo****,Kksw,집권2년반동안. 폭탄주나. 마시다.  계엄을 하고. 자기발로. 국민들한데. 탄핵이나당한  🐕 쓰레기을. 지지하는것들이야말로. 북한에있는. 김 정은 만도. 못한것들이지. 재물이. 눈이멀어. 쓰레기 하치장에나갈것들. 모아놓고. 성조기나. 흔드는것들,True,1,2025-04-12T18:33:55+0900,856594328066195694,0,0,1
hkk8****,,,False,1,2025-04-12T18:31:10+0900,856594151469219896,0,0,0
0820****,2BjtL,헌재가서 하던지 말던지해! 정신병자들~,True,1,2025-04-12T18:30:23+0900,856594101003354222,0,0,0
mind****,39XTc,어딜가나 원숭이들 천지네,True,1,2025-04-12T18:28:25+0900,856593974066937983,0,0,0
hanh****,2BxIM,전광훈이 5만원준다고 다 모이라더냐?,True,1,2025-04-12T18:19:43+0900,856593413439488186,0,0,0
kamu****,153Fc,ㅋㅋㅋ 헌재결과 승복한다더니 ㅋㅋㅋ,True,1,2025-04-12T18:15:30+0900,856593142588113025,0,0,0
ssda****,1IqeB,아직도 정신 못차리네 이완용보다 더한 년놈들,True,1,2025-04-12T18:10:29+0900,856592818519408769,0,0,0
ythb****,7NZK3,대구리는 장식인걸로 ㅋㅋ,True,1,2025-04-12T18:08:31+0900,856592692421853328,0,0,0
kimh****,5coMk,"윤괴물지지 뇌없는 아스팔트 맹신도
별의별 _*@;/-^.?!",True,1,2025-04-12T18:06:44+0900,856592577481146565,0,0,0
i111****,35pW3,사기? 당하는 놈이 등신이지,True,1,2025-04-12T18:06:03+0900,856592532971192340,0,0,0
hoku****,,,False,1,2025-04-12T18:05:56+0900,856592525941539057,0,0,0
kang****,d0Pkm,바로세우기는  전광훈이가   나라 무너뜨리겠구나,True,1,2025-04-12T18:05:17+0900,856592484350820434,0,0,0
k510****,5QroN,ㅋㅋㅋㅋㅋㅋㅋㅋㅋㅋㅋㅋㅋㅋㅋㅋㅋㅋㅋㅋㅋㅋㅋㅋㅋㅋ,True,1,2025-04-12T18:04:56+0900,856592461349257483,0,0,0
gang****,4zBgE,이미 끝난 걸 가지고. 저기 가서 저러는 사람들은 진짜 ㄷ신임. 전광훈한테 놀아나는 건데. 아는데도 가는 거야? 진짜 몰라서 가는 거야?,True,1,2025-04-12T18:01:30+0900,856592240141664383,0,0,0
k2******,,,False,1,2025-04-12T17:58:23+0900,856592039251279983,0,0,0
site****,3CdgD,"개검스러운  똥석렬과  쫄개들...국민갈라치기 정책.정권.. ..  내린수괴  , 법의심판을 받으리라... 이게나라냐",True,1,2025-04-12T17:57:52+0900,856592006032392435,0,0,0
k2******,,,False,1,2025-04-12T17:56:44+0900,856591932967616736,0,0,0
camt****,,,False,1,2025-04-12T17:55:42+0900,856591866697613493,0,0,0
ljs2****,3nYWG,끝날때 까지는 끝난게 아니다 👍,True,1,2025-04-12T17:54:39+0900,856591799051878565,0,0,0
chob****,CKip,좌파들은 아직 지들이 무슨짓을 하고 있는지 모르지.,True,1,2025-04-13T07:03:32+0900,856642622557519929,3,4,0
cabi****,3uVKl,내란 수과자의 진상에 치가 떨린다 ㆍㆍ,True,1,2025-04-12T20:09:04+0900,856600458981015570,2,3,0
qeyo****,6xvb4,국민에게 반성도없고사과도없는  이런 기사 언론이앞장서서 올리지말아주세요,True,1,2025-04-13T06:33:01+0900,856640656385245186,1,2,0
jiwo****,5oMU4,"오늘 인왕산 갔다가 광화문으로해서 종로까지 걸어오는데
비오는데 무대에 목사님 수고 많이 하시더라고

대놓고 헌금 내라고 하고
목사 고함소리가 인왕산까지 들리고
그집회로 도로도 막히고.

성경책이 이런거 가르치나 의구심이 들기만 하고

여튼 여행온 외국인들께 쪽팔렸던 하루입니다.",True,1,2025-04-12T19:39:37+0900,856598561578549384,1,2,0
song****,4pqLG,지이랄도 풍년이다 ㅋㅋ,True,1,2025-04-13T00:42:16+0900,856618058985242672,0,1,0
anje****,bQdIf,불법탄핵 사기탄핵이면 법꾸라지가  순순히   탄핵당햇겟냐~~???무지랑이들아    늙다리,True,1,2025-04-12T21:35:36+0900,856606033714348171,0,1,0
mise****,3bPTf,ㅋㅋㅋㅋㅋㅋ 극우 내란당 짖어라!!!,True,1,2025-04-12T20:05:41+0900,856600240357114009,0,1,0
bobs****,2Qfir,당초부터 태어나지 말았어야 할 것들의 미친쇼와 그 졸개들이 가증스럽다,True,1,2025-04-12T19:55:44+0900,856599599769452715,0,1,0
rlat****,nzTB,돌았나. 헌법이 니위에 있냐? 도라이도 저런 도라이가없네. 국민들이 인정한 탄핵이다. 국민들의 부름을 받고 올라갔으면 국민들이 내려오라고하면 내려와라. 개소리말고,True,1,2025-04-12T18:47:07+0900,856595179107254306,0,1,0
lsw0****,1dBRS,굥 자체가 사기인디 ㅋ 사기굥건희라고 해야지,True,1,2025-04-12T18:43:27+0900,856594942447845488,0,1,0
mysm****,2Ikaf,딱 그수준이네,True,1,2025-04-12T18:39:44+0900,856594703842279621,0,1,0
asia****,,,False,1,2025-04-12T18:15:15+0900,856593125626347593,0,0,0
blac****,,,False,1,2025-04-12T17:55:45+0900,856591869868507331,0,0,0
miso****,2btxL,확실히  돈을 안주니 극우 댓글들이  줄어들었네 .  MBN도  이렇게  제목 달지마라   윤석열은  엄청난 국민세금 낭비하며 용산이전 하고 파면된  범죄자  내란수괴 이다. 내란죄를 어떻게 처벌 하는것이   국가 발전인지에대해  특별 취재  바람,True,1,2025-04-13T01:16:33+0900,856620267856724048,2,4,0
anje****,bQdIf,너무  무지한  늙은이들 많아     그 세월동안  남들 공부할때 뭐한거야????,True,1,2025-04-12T21:36:40+0900,856606101695627423,0,2,0
nim9****,4AdBQ,이사가라  거기사는 주민들은 무슨죄냐  건희동네로  허이허이,True,1,2025-04-12T18:33:15+0900,856594285619839036,0,2,0
jap3****,cJt4e,내난동조범이 있는한 또 계엄 생긴다.  뿌리를뽑아 일본으로 후꾸시마로 보네야 민주주의가 지속된다.,True,1,2025-04-12T18:25:59+0900,856593817384517897,0,2,1
joor****,38F3s,서초동 현장인데! 2030들 1만명 넘었음. 윤어게인~~~,True,1,2025-04-12T17:36:14+0900,856590612114178102,4,11,0
