user_nickname,userIdNo,comments,visible,replyLevel,regTime,parentCommentNo,sympathyCount,antipathyCount,replyAllCount
cant****,1ZHWJ,니가 아직 감옥에 안간게 더 믿기지 않음. 주변인이 도대체 몇명이 죽은거여?,True,1,2025-03-09T17:25:25+0900,853435691726536796,705,91,18
jmk5****,6iEuS,"나도 믿기지가 않아.
범죄자가 거대야당 대표인게.",True,1,2025-03-09T17:32:19+0900,853436135601340505,418,54,10
hany****,,,False,1,2025-03-09T18:15:02+0900,853438887752630283,0,0,4
hard****,2WhMN,응 국민들은 전과4범 니가 아직까지 구속이 안됬다는게 믿기지않는다 이 개뻔뻔한 내로남불 ㅇㅇ ㅉㅉㅉ,True,1,2025-03-09T18:26:28+0900,853439624272412805,303,41,2
okju****,55Jv9,심장이 오그라들고 다리에 힘빠져 휘청거리제 너때문에 돌아가신 7영 원혼들이  구천을 떠돌고 있는데  두다리 뻗고 편하게 자면 안되제 너는  아마도 끝까지   비열하고 추잡스럽게  끌려 갈거 같다  이제  주변 정리해라.,True,1,2025-03-09T17:53:21+0900,853437491636600943,237,31,0
pari****,drnnM,이상해 범죄 전과 4범이 자기 살려고 선동에 열정인게 믿기지 않음,True,1,2025-03-09T18:09:52+0900,853438555479867593,105,16,0
yak3****,am55l,"50여일 이죄명  이 넘  대통령이나ㅈ된듯 깝치더니  ㅎㅎㅎㅎㅎ   꼴  좋다~~~!!!
이죄명 구속 될 날만 남았다",True,1,2025-03-09T17:54:00+0900,853437532690448385,101,14,0
jsg5****,,,False,1,2025-03-09T20:32:30+0900,853447744713392288,0,0,1
taij****,20qKJ,"니네는 앞뒤가 안맞아도, 과정이 위헌이어도, 자료가 다 거짓이어도 같은편이면 괜찮고 다른편을 치기 위해서는 다 용인되지. 정의로운 자유민주주의 대한민국에서는 그게 안되거든. 니가 그래서 믿기지가 않는거야. 그런 세계가 좋으면 우리나라에서 당대표하지 말고 중국이나 북한에 가서 살아",True,1,2025-03-09T20:34:27+0900,853447869418438826,58,12,1
dbsw****,4szCm,니가 아직도 감빵안가고 정치질하고있는게 믿기지않는다 믿기지않는다 믿기지않는다ㅋ,True,1,2025-03-09T21:13:56+0900,853450413716799803,46,8,0
huih****,1Q6Hy,대통령으로서 다른거 다 엉망진창이지만 이재명 하나만 조져도 윤석열은 업적 하나 만드는것.,True,1,2025-03-09T18:04:57+0900,853438238507925783,44,8,2
doct****,1k2ep,"중국 간첩이 판치는 마당이라서 계엄은 정당했다고 본다. 지금 우리 나라는 하이브리드전 한가운데 있고, 기술 유출은 심각한 상황이고, 나라가 중국 속국이 되느냐 마느냐의 기로에 있다. 윤석열 대통령님은 국가의 이러한 위기 상황을 알리고, 중국 간첩들이 활개칠수 있도록 선거를 조작한 선관위를 털려고 계엄을 하신 거다.",True,1,2025-03-09T21:15:03+0900,853450485758165025,45,10,1
band****,Vb2M,감옥갈까 겁나서 그런가보네,True,1,2025-03-09T17:49:23+0900,853437235263963237,38,6,0
shal****,301LW,도련님 형수 거기를 찢겠다는 말을 도저히 믿을 수가 없지만 진짜네요~,True,1,2025-03-09T17:52:41+0900,853437447915176128,32,5,0
sush****,,,False,1,2025-03-09T17:53:54+0900,853437526482878708,0,0,0
hoh7****,,,False,1,2025-03-09T21:31:16+0900,853451530374742114,0,0,0
guap****,S3v3,"지네가 내란죄를 빼놓고 내란수괴라고 하고!! 어디서 북한에서 쓰는말을 쓰고 대통령에게 내란수괴가 모냐! 못배워먹은x,, 빨리 감옥으로 가야함!!",True,1,2025-03-09T20:40:33+0900,853448262491832485,23,5,0
bae8****,,,False,1,2025-03-10T00:56:28+0900,853464750133084247,0,0,1
sung****,1trKk,이재명이 거짓말쟁이지........아마 본인도 떨고 있을걸...불안해서....,True,1,2025-03-09T22:28:06+0900,853455191767253031,22,4,0
jjoo****,,,False,1,2025-03-09T17:33:19+0900,853436200847933545,0,0,0
jwp1****,1LlhO,"재명이와 민주당은 정신차려라! 너희들이 공수처를 압박해서, 무리한 수사를 하다가 내란범 썩열이가 풀려나온 책임이 있다. 그리고 극우가 아닌 많은 중도층 국민들이 계엄령은 잘못되었다하지만, 탄핵반대를 부르짖는 이유를 알거라. 바로 썩열이 보다 더 뱀같은 재명이 때문이다. 재명이가 대통령이 되고 홍위병 같은 개딸들과 극좌들이 인민재판으로 대한민국을 절딴낼 것이라는 것을 알고 있기 때문이다. 썩열이와 재명이가 대한 민국의 지도라라는게 대한민국의 불행이다.",True,1,2025-03-09T20:27:30+0900,853447422557290662,17,3,0
issh****,,,False,1,2025-03-09T22:47:06+0900,853456415849709612,0,0,1
soak****,r0is,난 전과4범이 대통 후보로 나왔다는 사실이 믿기지 않는다고 3천번 외쳤다~~,True,1,2025-03-09T23:35:42+0900,853459547182858446,14,3,2
gree****,2nOhh,난 전과4범이 제1야당 당대표인게 더 믿기지 않는다.  인물이 그리업더냐??,True,1,2025-03-09T22:23:41+0900,853454906722353400,10,2,0
sscs****,,,False,1,2025-03-09T23:47:43+0900,853460320713179338,0,0,0
lmks****,3gzj5,"이재명은
아직강력처벌않는이유.이해불가
구속후죄상하나하나추가.무기까지가야할사항",True,1,2025-03-09T23:51:58+0900,853460594433458488,7,2,0
litt****,,,False,1,2025-03-10T01:56:45+0900,853468633706266713,0,0,0
isar****,5JXEp,"믿기지 않겠지 곧 당신이 깜방가야 한다는 현실이..,
인과응보 사필귀정 , 이 모든 일들을  곧 믿게 될거야.  미리 축하해 죄명",True,1,2025-03-10T05:04:20+0900,853480719375138833,7,3,0
iwmj****,2IVOK,나는 찢재명같은 국민이 극혐하는 자가 대권을 도모하는 지금이 믿기지 않는다.,True,1,2025-03-10T04:09:10+0900,853477164366954502,6,2,0
hank****,1TRLf,너재판연기가 이렇게나 가능한지 믿을수가없다,True,1,2025-03-10T00:04:19+0900,853461390696906851,6,2,0
ley2****,5ji0w,전과4범 주제에 대통령을 넘보는게 더 믿기지않는다,True,1,2025-03-10T03:41:39+0900,853475391686311968,5,1,2
joon****,,,False,1,2025-03-10T00:10:49+0900,853461809506549994,0,0,0
jyc6****,3rAPR,감옥에 있어야 할 이재명이 대권후보 라는 사실이 믿기지 않는다.,True,1,2025-03-10T10:45:39+0900,853502707644760363,4,0,0
sjto****,TLgQ,천하의 조선족 수장 개잡범이 아직도 야당 대표를 하고 있다는 게 믿기지 않는다,True,1,2025-03-10T00:46:55+0900,853464134660915395,4,0,0
flut****,oLmD,"찢명아 니가 국회위원인게 더 안믿긴다ㅉㅉ
어떻게 전과4범이ㅉㅉㅉ",True,1,2025-03-09T18:20:14+0900,853439223397613634,4,0,1
rnfj****,56dai,죄명이가 감옥안간거  제일 이상하다,True,1,2025-03-09T17:39:12+0900,853436579794911298,4,0,0
hsy4****,1SCAH,난 니가 아직도 감빵에 있지 않은게 더 신기하다.....전과4범도 모자라 지금도 재판을 받고있는데.....판사는 다 니 편인가보다...몇년째 질질 끌어온거보니.....,True,1,2025-03-10T12:02:21+0900,853507649575059582,3,0,0
yoon****,,,False,1,2025-03-10T10:12:03+0900,853500542930911265,0,0,0
aszx****,639ct,너나잘하세요,True,1,2025-03-10T01:57:47+0900,853468700563472478,3,0,0
rbkh****,2bXzWc,"이재명 이제 주제파악 좀 해라
대통령 되겠다는 꿈깨라~~~",True,1,2025-03-10T01:22:34+0900,853466431277236320,3,0,0
kell****,5cbQs,"찢이 아직도 구속되지 않았다는게
정말 믿기지 않는다",True,1,2025-03-10T00:22:22+0900,853462553139871858,3,0,0
koji****,1nGUp,나도 안믿긴다. 한 인간주변에서 그렇게 많은 사람이 의문사한것이~,True,1,2025-03-10T00:19:22+0900,853462359950229617,3,0,0
khjk****,3myfG,난 너가 믿기지 않는다.구속이 안되고 아직 뭐하고 있는가요,True,1,2025-03-09T23:21:53+0900,853458657185104133,3,0,0
devi****,28oUp,재판전 단식으로 재판연기시킨 당신을 절대 믿을수가 없음 ㅋㅋ,True,1,2025-03-09T23:13:59+0900,853458148030153026,3,0,0
make****,jreA,야당대표가 범죄자이며 주변인몇명을죽게한건 믿기나?이게더기현실적인데,True,1,2025-03-09T22:58:16+0900,853457135005073480,3,0,0
wait****,1KzNc,난 니가 아직도 교도소에 있지 않다는데 믿기지 않아 재명아,True,1,2025-03-09T22:29:36+0900,853455288135581879,3,0,0
rakh****,7t6vh,"믿기지않겠지
본인은 한번가면 못나올테니까",True,1,2025-03-09T22:16:58+0900,853454474155393373,3,0,0
epah****,1ASFg,니가 아직도 깜빵 안간게 믿기지않는다,True,1,2025-03-09T18:27:50+0900,853439713191657666,3,0,0
rudn****,3rdRH,너란 인간이 아직까지 감옥에 들어가지 않았다는게 믿기지 않는다...,True,1,2025-03-09T17:55:35+0900,853437634914025608,3,0,0
xhoi****,2svIh,역시 검찰은 해체가 답이다. 비상식적인 집단.,True,1,2025-03-10T04:58:13+0900,853480324305256470,4,2,0
etwa****,6A3fG,너가 아직도 감옥 안가고 있는게 믿기지 않는다,True,1,2025-03-10T03:13:35+0900,853473583773515844,4,2,0
mjhm****,2Yldz,찢이 아직도 감옥에 안간게 믿기지 않는다,True,1,2025-03-09T22:46:02+0900,853456347029569544,4,2,0
tado****,1yhWY,이재명 저거 하나만 사라져도 나라 정상화된다. 앞으로 언론에서 이재명 안 보는 날이 왔으면. 감방을 갔거나 중국으로 망명했거나 등,True,1,2025-03-10T08:28:24+0900,853493866102259821,3,1,2
ever****,,,False,1,2025-03-10T04:35:24+0900,853478855191560223,0,0,0
eeps****,3zPXD,이재명 당신이 구속수사 받지 않는것이  더더욱  이해할수 없다,True,1,2025-03-10T04:01:02+0900,853476641052033026,3,1,0
hurz****,iVIR,대통령 놀이 재밌었지? ㅋㅋㅋㅋㅋ,True,1,2025-03-10T00:20:07+0900,853462408453160994,3,1,0
csn8****,laRl,ㅉ이 지지율 1위라는게 더욱 믿기지 않는다만,True,1,2025-03-09T22:46:10+0900,853456355602726967,3,1,0
ldm9****,,,False,1,2025-03-10T11:21:45+0900,853505034191634790,0,0,0
shk2****,3O9hW,나는 전과4범이 거대야당의 대표라는게 믿어지지않는다.,True,1,2025-03-10T10:20:23+0900,853501079986372807,2,0,0
yu26****,,,False,1,2025-03-10T10:05:28+0900,853500119692083397,0,0,0
kim1****,bniMr,"윤피고인은   뭐가 그리촣아 싱글벙글  눈과입보면 진짜 간신  배신자  당신때문에  지금 구속 되어있는사람들  안보이세요   누구때문에 그리 되엇는데  김치찌게니  뭐니하
면서정신좀 차리세요 계엄성공했음  아주
 진짜    끔찍스럽다   이번에  하나님이 도왔다 원래  남저주 하고  주술 부리면  역풍맞는다
이번에도  되로벌받았잖아  지금도 건이는 주술 부리고  있을걸  김건이 아주  사탄 무당",True,1,2025-03-10T08:59:10+0900,853495848414216246,2,0,0
dw19****,d6I8O,너같은 전과4범에 각종 사법리스크를 가지고 거짓말과 뻔뻔함으로 국정혼란을 일으키고 오로지 권력욕에만 눈이 먼 x이 우째 공당의 대표란게 웃기는 일이고 도덕적ㆍ사회적 부적응자인 소시오패스가 대권까지 노린다는게 평범하게 법을 지켜며 살아온 나로썬 도저히 이해가 안된다ᆢ 범죄수괴 찢재명아ᆢ이제 고마해라~~,True,1,2025-03-10T08:43:56+0900,853494866896748815,2,0,1
hanh****,3tnrr,"국가지도자가 되고자하는자는 도덕적 흠결은 없어야한다.  국격을 지키기위해 국민은현명한 선택을
해야한다",True,1,2025-03-10T04:38:09+0900,853479032291852301,2,0,1
skyl****,18ogS,범죄자 죄명이   안돼   범죄자  주제에   어떻게   저리 당당히    저러고 있어  ?왜?니옆엔  여자들  있어서   좋아~~??   어  재밌는  여자도  있넹  ~~,True,1,2025-03-10T02:48:48+0900,853471987169755203,2,0,0
jsj8****,,,False,1,2025-03-10T02:11:34+0900,853469588682178614,0,0,0
ever****,23gof,국민들은 니가 아직도 감빵 안간게 더 안믿긴다. 알겠니?,True,1,2025-03-10T02:03:11+0900,853469048439046163,2,0,0
hoya****,2jGpU,전과4범이 야당대표도 하는데ᆢ나는 배운것도 없는데 나쁜짓 음주해서 그나마 밥벌이도 끊겨서 5년동안 하던일을 못하게 됐는데ᆢ이 사회가 공정한거가? 저런 전과4범이 의원? 존나 웃기네,True,1,2025-03-10T01:20:18+0900,853466285516783671,2,0,0
swin****,,,False,1,2025-03-10T01:18:34+0900,853466174048960601,0,0,0
kore****,4gZAa,전과5범은 전기의자에 앉아야하는데 믿기지 않는다,True,1,2025-03-10T00:16:44+0900,853462190064140466,2,0,0
jaeh****,Ezno,드럼통당한 원혼들이 꿈에 나오나,True,1,2025-03-10T00:07:48+0900,853461615243165921,2,0,0
oki5****,2zbv1,야당대표라서 구속하지 않는다는 유창훈이의 희안한 궤변으로 살아난 넘이 할말은 아니지,True,1,2025-03-09T23:24:50+0900,853458846499209434,2,0,0
ruby****,5KLUt,대통되는 착각속에 조기대선 꿈꾸고있는죄명이는  하나하나가  다  심장이 출렁거리겟지.,True,1,2025-03-09T22:49:25+0900,853456564898496633,2,0,0
k197****,1QS78,40여일간 대통령놀이 했음 이제 들어가도 여한이 없지 않나? 들어갈 땐 난 안들어갈거라 믿었는데 3번 외치고,True,1,2025-03-09T22:37:44+0900,853455812440359172,2,0,0
jjed****,be9f4,나는 네가 감옥에 아직도 가지않은것이 믿기지 않는다,True,1,2025-03-09T22:26:35+0900,853455093654094016,2,0,0
jjan****,50hwB,지가 감방 갈까봐 믿기지 않겠지.,True,1,2025-03-09T20:59:38+0900,853449491909443790,2,0,0
yooj****,6im1Y,전과4범 이재명 이가 감옥에 안가는게 이해가 되질않는다 민주당 과 개딸들아,True,1,2025-03-09T20:31:21+0900,853447670239330407,2,0,0
mac0****,1WxdR,죄명이가 지금까지 빵에 안가고 X빵 안맞은게 믿기지가 않는다,True,1,2025-03-09T20:29:27+0900,853447547916648588,2,0,0
rr******,3ntE8,계엄이 내란이냐? 계엄이 내란이라는 프레임은 대통의 국헌준수를 부정하는 국헌문란이다.계엄은 대통이 국회의 해제의결을 가납함으로써 종결 되었다.대통이 계엄강행 중에 불법한 행동이 있어 공권력에 의해 체포되어 계엄이 중단된 게 아니다.국회의결을 존중하고 국법을 준수하는 내란도 있나? 말이 되는 상식적인 얘기를 하라.,True,1,2025-03-09T20:17:59+0900,853446808511185153,2,0,0
hadi****,dyt49,재명아 너가 아직 밖에서 범죄를 저지르는게 우리나라 법이 무너진 증거,True,1,2025-03-09T19:45:16+0900,853444701443850331,2,0,0
mjk6****,14ztW,이런 당연한 결과도 예측 못한 무능하기 짝이 없는 자가 무슨 생각으로 나라를 이끌겠다는건지.,True,1,2025-03-09T19:22:57+0900,853443263284117764,2,0,0
hyon****,3FQOI,"교도소는 죄지은 놈이 가는곳이다  대통령을 불법 탄핵시켜 끌어내리려고 ""진짜""내란을 일으킨 죄 추가됐네",True,1,2025-03-09T18:20:28+0900,853439237943459948,2,0,0
ahc8****,37E9l,너가 아직 안들어간게 믿기지않아,True,1,2025-03-09T18:04:42+0900,853438222536016066,2,0,0
okju****,55Jv9,죄명아  그렇게 설치던 개딸인지 중국인인지 조선족인지 다 어디같냐 .,True,1,2025-03-09T17:57:26+0900,853437754216808565,2,0,0
qzax****,ewokb,수십년간 지들 맘대로 하고 싶은건 다했으니. 안되니 부들부들,True,1,2025-03-09T17:35:03+0900,853436311946657810,2,0,0
mans****,3p2Yo,"전과4범이 겁나나보지?
더불어만주당 입법부의전횡이 백일하에 들러났다.삼척동자도 다안다.입법부의 횡포를.탄핵은 기각내지는 각하가되야한다.",True,1,2025-03-10T06:25:15+0900,853485931418615837,5,4,3
yoon****,eDmas,꼬시다 이재명 대통 놀이 지겨워,True,1,2025-03-10T05:30:32+0900,853482407280508967,5,4,1
love****,5JTS8,"탄핵을 더 강하게 밀고갔어야됐어..
최상목 검찰총장을 같이 빠르게 내렸어야했는데..
지금 이라도 하자!!",True,1,2025-03-09T22:44:54+0900,853456273746690327,5,4,1
dyjs****,6zs9p,죄명이 밑에있던 사람들도 다구속되지않았나,True,1,2025-03-10T08:06:25+0900,853492449417363573,3,2,0
chan****,6TiwF,인제 빵갈생각하니 믿기지않치?,True,1,2025-03-10T04:39:02+0900,853479089049174018,3,2,0
kna0****,,,False,1,2025-03-10T00:09:39+0900,853461734428508340,0,0,0
park****,ekj7A,29번 탄핵으로  정부 기능마비시키는 이재명과 민주당은 내란죄다. 내란죄는 국회의원도  면책특권 불체포특권이 없다  이재명을 즉시 구속하라,True,1,2025-03-10T04:04:41+0900,853476875698176028,2,1,0
lbh2****,iG0x,안믿기시죠? 저는 형 지지율이 35~40%라는게 안믿겨요.,True,1,2025-03-10T03:42:50+0900,853475468123308100,2,1,1
mjap****,fTUn,"탄핵남발당.계속해봐,어디.",True,1,2025-03-10T03:26:11+0900,853474395723661329,2,1,0
simo****,1vufv,좌파  대표가  대통령 대표는 아니지  흉내  내고 다니면서   똥폼  잡아  봐야 그냥  전과4범으로 본다. 국민들은...,True,1,2025-03-10T03:18:35+0900,853473906248384559,2,1,0
muay****,avkmz,이재명을 버리면 민주당은 살아난다,True,1,2025-03-10T02:59:37+0900,853472684095307822,2,1,0
haky****,1UOLi,"너가튼게 아직도 재판질질끌고 당대표하는게 
믿기지않고 너가튼잡범을따라다니는애들이 믿기지않는다",True,1,2025-03-10T02:57:01+0900,853472516440588289,2,1,0
witc****,1RF1h,니가 아직 콩밥 먹으러 안간게 믿기지 않는다!!!!,True,1,2025-03-09T23:34:57+0900,853459498763813140,2,1,0
dogd****,,,False,1,2025-03-09T22:47:29+0900,853456440679989420,0,0,0
ysj3****,CmlN,"너님 감옥 안간게 더 신기해...;;;
법꾸라지야",True,1,2025-03-09T18:11:28+0900,853438657971880062,2,1,0
jsyi****,,,False,1,2025-03-09T17:58:44+0900,853437837431800014,0,0,0
chhc****,d31zt,따불당. 국개돼지들은.  내편이 아니면.  무조건. 죽인다,True,1,2025-03-09T17:35:27+0900,853436337901011064,2,1,0
yuta****,,,False,1,2025-03-11T08:09:15+0900,853585402945077323,0,0,0
zd42****,,,False,1,2025-03-11T01:46:39+0900,853560754194874447,0,0,0
dhki****,4oRe8,표정 썩어서 얼마나 불안하면 했던말 또하고…. 오줌지린건 아니지?,True,1,2025-03-10T14:39:58+0900,853517804152816047,1,0,0
ning****,2GROg,대통령놀이 계속해보지 왜?,True,1,2025-03-10T12:40:20+0900,853510096766894215,1,0,0
qpdl****,,,False,1,2025-03-10T12:13:37+0900,853508375760077043,0,0,0
jkh1****,djqs5,믿던가 말던가. 개목줄은 스스히 조여온다.,True,1,2025-03-10T12:04:10+0900,853507766042492998,1,0,0
june****,3uLwi,너만 없어져도 뉴스를 좀 볼것같다,True,1,2025-03-10T11:08:31+0900,853504180952760557,1,0,0
kssu****,,,False,1,2025-03-10T11:00:34+0900,853503668610138335,0,0,0
psy4****,2cwABv,민주당없어져야 나라가 평온하다,True,1,2025-03-10T10:57:54+0900,853503497750970769,1,0,0
rock****,Ggqm,헝수 거기 찢는다는 말은 믿기지 않는다.,True,1,2025-03-10T10:07:57+0900,853500279763501435,1,0,0
dooh****,dqDaz,리짜이밍! 이놈은 기승전 검찰탓 ㅡㅡ지겹다,True,1,2025-03-10T10:03:34+0900,853499996631204097,1,0,0
lmgm****,2RyMX,지가 조작에 1등이니. 모든사람이 지처럼 사는줄 안다 죄명아 제발 정신 차릴수는 없는거니?,True,1,2025-03-10T10:00:47+0900,853499817182101860,1,0,0
moth****,2qdks,비리수괴의 탄핵놀이 지겹다,True,1,2025-03-10T09:58:45+0900,853499686554698025,1,0,0
sbju****,,,False,1,2025-03-10T08:59:12+0900,853495850175823934,0,0,0
lsh2****,ep0c,똥줄 타나보네!ㅋㅋㅋㅋ,True,1,2025-03-10T08:48:31+0900,853495161622102164,1,0,0
anwj****,,,False,1,2025-03-10T08:39:31+0900,853494581851848885,0,0,0
allo****,drksL,"본인들 뜻대로 되는 것들에 대해서는 편법이나 불법이 난무해도 사법부를 존중하라면서, 뜻대로 안되는 부분에 대해서는 본인들이 직접 나서서 사법부를 부정하는게 너무 웃긴것 같음.. 니들 그런식으로 계속 하다간 지지율은 앞으로도 계속 떨어질거임.",True,1,2025-03-10T08:38:53+0900,853494540680560906,1,0,0
kim2****,2Z0uz,전두환 군사쿠데타로 성공한 경험을 가진 분들이 그 가족을 검찰총장에 국회의원등 권력과 언론의 꼭대기에 있게 했으니 권력유지를 위해 국민은 안중에도 없고 경제민생이 불확실하거나 말거나 친위쿠데타만 실행하고 옹호하는듯 하네요 이번에도 성공한 경험을 갖게 된다면 이 나라는 법치가 아니라 폭력이 지배할듯요 그러니 이재명대표와 함께 헌정질서를 회복하고 민주주의를 지켜야겠어요 이재명대표를 응원하고 지지합니다,True,1,2025-03-10T08:37:42+0900,853494464612663503,1,0,0
khy0****,XAAX,"도둑이 주인을 혼내는격이지~~~
전과4범 전과범은 정치못하게 법좀 만들어야~~~",True,1,2025-03-10T08:31:57+0900,853494094389838079,1,0,0
flee****,UD7N,위증한 자는 징역형인데 위증교사한 자는 무죄라는게 믿기지 않는다 믿기지 않는다 믿기지 않는다,True,1,2025-03-10T08:12:10+0900,853492819556302894,1,0,0
kjmi****,UJiP,오늘 당장 탄핵 발의하고 통과시켜라!  국민이 불안해서 살겠나?,True,1,2025-03-10T07:50:48+0900,853491443824591035,1,0,0
yeon****,cThsC,악마 인간 이재명이 니도 돌아 다니면서 재판 받는데 너도 교도소 들어가서 재판 받아라 니는 남 한텐 엄격하고 니잘못은 깔아 뭉게고 관대 하게 아무릇지도 안은듯 할려고 하고 재명아 이젠 안된다 너 악마를 퇴치할 시간이 왔다 고통의 시간 재명이 너의 시간이다 악마야.,True,1,2025-03-10T03:21:01+0900,853474062477819906,1,0,0
popy****,2BeFJ,산수같은 소리하네 판결문 봐라,True,1,2025-03-10T03:21:01+0900,853474062461042690,1,0,0
yunj****,1wvZb,당신이 야당 대표로 그리 큰 소리 치고 있다는 게 믿기지 않을 일이다,True,1,2025-03-10T02:43:59+0900,853471676791259210,1,0,0
dmld****,2Wf1h,ㅈㄴ 당황스럽겠지 빵갈준비허자ㅋㅋ,True,1,2025-03-10T02:13:04+0900,853469685352497157,1,0,0
naks****,23KIL,제일 쫄리는게 저넘아니야?,True,1,2025-03-10T02:11:36+0900,853469591148429380,1,0,0
jms9****,dS3w6,죄명아꿈도야무지다.감방가라.,True,1,2025-03-10T01:52:55+0900,853468386661761151,1,0,0
park****,1eDkH,억울한 영혼들이 너를 찢을것이다,True,1,2025-03-10T01:48:51+0900,853468125172072568,1,0,0
ekfr****,BlhQ,법정구속 몇일 안남았네.ㅎㅎ,True,1,2025-03-10T01:48:13+0900,853468084688650267,1,0,0
dewy****,2HX08,쿠데타라고 하는데 정권을 잡고있는 사람이 왜 쿠데타를 일으키냐! 지금 민주당이 하는게 쿠데타인거지! 기본적인것도 틀려멱은것들이 말도 안되는 짓거리를 하고있네! 그리고 이재명이 구속 안된게 믿을수가 없고! 증거를 갖다두고도 위증교사 무죄 받은게 믿을수가 없는거다!,True,1,2025-03-10T01:42:24+0900,853467709197778992,1,0,0
kss0****,62GO,"난 너가 활보하고 돌아다니것이 믿기지 않는다.
너 측근들이 죽는것도 믿기지 않는다.",True,1,2025-03-10T01:28:41+0900,853466825357262944,1,0,0
new2****,2jVzH,대통령감 없으면 입좀 닫으시게요,True,1,2025-03-10T01:26:22+0900,853466676123926588,1,0,0
1983****,aiARL,"니가 곧 들어가야하는게 믿기지가 않지,,,ㅋㅋㅋ",True,1,2025-03-10T00:48:32+0900,853464239132639345,1,0,0
cdps****,4kAZf,당신은 왜 구속 기소 안된거냐??,True,1,2025-03-10T00:45:06+0900,853464018025709600,1,0,0
uheh****,1HrzE,대북송금은 이적행위로 사형감이다,True,1,2025-03-10T00:43:14+0900,853463897565298740,1,0,0
jnh6****,2ccYy,모지리 계모임중.. 멀쩡한 사람이 없네,True,1,2025-03-10T00:40:13+0900,853463703167696946,1,0,1
cjdd****,1U3PN,이재명아저씨 범죄협의에 대해 아직도 재판을 안받고 있다는게 놀랍다 누가 할소리 대북송금재판 대장동재판 등등,True,1,2025-03-10T00:28:13+0900,853462930576900150,1,0,0
lsy1****,YNtu,ㄱ소리 말고 빨리 재판 받고 이제 니가 갈 차례다~ 영원히 아웃^^ 무섭지 쫄리지 ㅋㅋㅋ 인생 종쳤다,True,1,2025-03-10T00:14:34+0900,853462050695807130,1,0,0
rede****,6IQx,댓글 알바들 몰려왔나봄,True,1,2025-03-10T00:00:15+0900,853461128720678986,1,0,0
yoon****,1BWoA,도저히 믿을 수 없어 드럼통을 주문 했다,True,1,2025-03-09T23:24:05+0900,853458798180827162,1,0,0
heya****,26ty7,현실부정단계진입 ㅋㅋ 이제 본인이 들어가야할텐데,True,1,2025-03-09T23:22:47+0900,853458714512851187,1,0,0
jin7****,9c2nP,찢명아 웃긴게 국민들을 얼마나 개돼지로 보길래 혁명혁명 거리냐ㅋ 범죄다는 감옥 가는게 룰이다 빨랑가자ㅋㅋㅋㅋㅋㅋㅋㅋㅋㅋㅋㅋㅋㅋㅋㅋㅋㅋㅋㅋㅋㅋㅋㅋㅋㅋㅋㅋㅋㅋㅋㅋㅋㅋㅋㅋㅋㅋㅋㅋㅋㅋㅋㅋㅋㅋㅋㅋㅋㅋㅋㅋㅋ,True,1,2025-03-09T22:57:28+0900,853457083851341976,1,0,0
xxx9****,ukg4,"이제  이죄명만  징역  가면
나라가  조용해지겠구먼",True,1,2025-03-09T22:57:25+0900,853457080948883618,1,0,0
j_do****,XcuE,자네가 아직 당대표라는 것도 믿을 수가 없다!!! 둘이 사이좋게 감방으로 직행해야 하는건데…,True,1,2025-03-09T22:55:59+0900,853456988321874246,1,0,0
ahns****,,,False,1,2025-03-09T22:54:59+0900,853456923477934395,0,0,0
korg****,3bZyh,"재명이부터 감옥 보내고 죗값 치루자
 그러면 평생 보수지지하던 꼴통같은 나도 진보쪽으로 눈 돌려줄게
나도 윤석열은 비호감 이더든. 허나 만에 하나 이재명이 끝까지 무죄 받고 차기 대통령까지 된다면 난 감옥 가던 맞아죽던 보수 고집할 생각이다",True,1,2025-03-09T22:54:38+0900,853456900660920520,1,0,0
auro****,2HZyR,응 나도 니가 사악한 전과4범 주제에 대통령 될 생각했다는게 믿기지가 않는다,True,1,2025-03-09T22:49:16+0900,853456554949607510,1,0,0
