user_nickname,userIdNo,comments,visible,replyLevel,regTime,parentCommentNo,sympathyCount,antipathyCount,replyAllCount
yoon****,ESyq,다섯명 보니 딱 그냥 한심한 인간들이네~~~국회의원 수 줄이고 특권도 좀 손보자!!!,True,1,2025-03-09T22:48:12+0900,853456486414680135,1,0,0
tjyo****,1zcLx,국민은 네가 아직도 감옥 가지 않은게 믿기지 않는다.,True,1,2025-03-09T22:44:46+0900,853456265274196232,1,0,0
jaek****,2D1W3,너가 내란 쿠데타 수괴다,True,1,2025-03-09T22:43:53+0900,853456208701423913,1,0,0
dund****,2kuV,찢죄명 징역30년 때리면 믿기지 않을것이야 100년예상,True,1,2025-03-09T22:42:30+0900,853456118943318194,1,0,0
wjde****,CVJe,이재명도 싫지만 윤석열이 더한것아니냐? 국민들아 정신좀 차려라 ㅉㅉ,True,1,2025-03-09T22:35:27+0900,853455665018962073,1,0,0
bmk8****,2zZDo,니가 아직도 버젓이 돌아다닌다는게 난 더 믿기지가 않는다 찢아,True,1,2025-03-09T22:30:59+0900,853455377323262302,1,0,0
aba1****,2xxU4,생긴게 얍삽하게 생겼다,True,1,2025-03-09T22:28:29+0900,853455215943221419,1,0,0
khse****,2b6Pu,당신이 야당 우두머리인게 믿기지 않는다.,True,1,2025-03-09T22:26:11+0900,853455068790259781,1,0,0
nami****,PaKf,닌 대통령되면 다를꺼같지? 닌 더하면 더했다 대한민국 대통령 될만한 인재가 그렇게 없다냐 지금 생각하면 노무현 대통령이 그립네,True,1,2025-03-09T22:18:54+0900,853454599011434812,1,0,0
yunh****,4iAAD,오마이갓~~~ 이재명  감옥으로,True,1,2025-03-09T22:15:15+0900,853454363845197917,1,0,0
elfp****,rPz4,실수로 클릭함 여기기사 안봄,True,1,2025-03-09T22:14:21+0900,853454306081243269,1,0,0
youn****,65qYN,"전과자 국회의원 반대
나라살림  전과자가 무엇을 하겠는가
비례대표없애고 전과자 없애자",True,1,2025-03-09T21:28:37+0900,853451360035668165,1,0,0
ewon****,2y8Ff,"이재명 니 재판은???
양심좀 챙기면서 말 해라",True,1,2025-03-09T20:50:25+0900,853448898432204924,1,0,0
ile2****,2ECza,니가 아직도 대중앞에서 당당하게 입을 놀리고 있다는게 더더더 신기한데?,True,1,2025-03-09T20:25:02+0900,853447263307956233,1,0,0
pc35****,wej3,"난 니가아직 감방안간게 더믿기지 않아.
이 개 잡범아",True,1,2025-03-09T20:09:19+0900,853446251004297297,1,0,0
sh83****,6bR9c,수사권도 없는 공수처 몰아붙여 구속하게 만든게 민주당 아닌가?  항상 떠넘기기~,True,1,2025-03-09T19:27:49+0900,853443577353601288,1,0,0
teas****,7rA0N,니넘구속 안한것이  더 믿기지않는다...!,True,1,2025-03-09T19:22:14+0900,853443217331322941,1,0,0
yshe****,1P7Z0,재명이는 웁니다. 이제 난 가는구나..ㅜ,True,1,2025-03-09T17:37:32+0900,853436471682531461,1,0,0
ribo****,2cZ7eb,에라이양반아 봄같은 소리하네 당신이정권잡으면 그게겨울이야 무슨 봉창두드리는소리를 하고있어,True,1,2025-03-09T17:37:31+0900,853436471195992206,1,0,0
jjk7****,arkjR,니가 더이해안간다,True,1,2025-03-09T17:36:00+0900,853436373149941762,1,0,0
dlsr****,AHIK,관심없습니다. 이제 대통령복귀,True,1,2025-03-10T08:54:12+0900,853495528019722302,2,2,0
mund****,pWTM,"내란공범 심우정이 검찰총장직을 아직도 수행중이라니
미친나라 현실이다 특수본 수사지휘권도 없는자가 석방을 지휘해 인간백정놈을 풀어준 내란핵심 반역자 심우정을 긴급 체포하고 구속수사하라 헌재는 국민 생존권, 나라경제를
파국으로 만든 내란수괴 윤석열을 신속하게 파면하라",True,1,2025-03-10T08:04:19+0900,853492314478215255,2,2,0
suna****,QAGt,나도 안믿겨 너같은 노가 한국에 살다니 믿기지가 않아 나라가 이모양인데 웃고다니냐ㅜ웃음이나오냐 니배 부르나ㅜ좋냐 너같은 노가,True,1,2025-03-10T04:08:10+0900,853477100563202061,2,2,0
mir3****,1kpvZ,"이재명 정적 죽이기 표적수사??250번 압수수색해서 7만5천원 법인카드 사용 내역 하나 건졌어.. 왜 김건희는 명품백  수수 ,도이치주가조작, 삼부토건 주가조작, 고속도로 이권개입, 창원공단 이권개입, 공천개입, 언론사 폭파협박, 뭐 셀수 없는데 압수 수색 한 번 안하드라.",True,1,2025-03-10T03:33:40+0900,853474877548527666,2,2,2
drea****,,,False,1,2025-03-10T03:12:26+0900,853473509685329962,0,0,0
drea****,6KWXp,나도 믿기지 않는다. 국가 보안법 위반 사범들과 전과자들이 수두룩한 더불당이 정당하게 선출된 대통령을 탄핵하려 들고도 이토록 뻔뻔하다는 사실이.,True,1,2025-03-10T02:21:45+0900,853470244755210321,2,2,0
sagi****,10syN,제일 시꺼먼 밤 같은놈이 새벽을 얘기하고 있으니 진짜 어이가 없네...,True,1,2025-03-10T01:02:55+0900,853465165469843647,2,2,0
yooj****,5wh3P,민주당것들 공수처 지네들이 만들어놓고선 개소리 실언중 그러게 공수처는 왜 만들어가지고 그선동에 속은 인간들이 얼마나 아무생각이 없는지 말해주는거지 좌우 할것없이,True,1,2025-03-10T09:06:48+0900,853496339953090815,1,1,0
man7****,2jIFZ,범죄자를 풀어주는 이 나라. 대단한 나라.  대단한판사.   이 나라는 망하겠다.  범죄자를 옹호하는 이상한 나라.   집권당이. 나라땅 독도를 일본한테 넘겨주려고 안달난 이 나라.   국민을 위한 정치를 하는게 아니구 지들 먹구사는데만 적극적인 이 나라.,True,1,2025-03-10T08:20:13+0900,853493338643365941,1,1,0
real****,2x4ZA,윤석열 구속 취소??  아.. 이젠 앞으로 동급 친구가 말을 안 들으면 폭력으로 해도 괜찮은 거네요? ㅋㅋ 윤석열씨도 풀어줬는데.. ㅎㅎ. 온통 학생들이 이러고 다님,True,1,2025-03-10T08:15:07+0900,853493010179031070,1,1,0
kimb****,,,False,1,2025-03-10T08:04:38+0900,853492334476656810,0,0,0
lngy****,alMvt,니는~?  그런 말할 자격도 있냐~~?? 조용히좀 살자,True,1,2025-03-10T08:01:14+0900,853492115483656251,1,1,0
miso****,3G8fe,다른 이유도 아니고 산수가 잘못돼서 석방된건 전례가 없는 일이고 있어서도 안되는 일 아닌가ㅡ 검찰의 의도된 무능으로 나라만 더 시끄럽다,True,1,2025-03-10T07:54:24+0900,853491675266285664,1,1,0
miyo****,P3Or,니가 아직도 감방이 아닌 밖에서 이렇게 돌아다니는게 나도 믿기지 않는다,True,1,2025-03-10T07:54:00+0900,853491649412595716,1,1,0
senm****,9WpGA,또 탄핵이냐? 징글징글하다,True,1,2025-03-10T07:43:59+0900,853491003758215366,1,1,1
gywn****,3dQpI,으~ 지긋지긋한 댓글부대~,True,1,2025-03-10T05:02:01+0900,853480569403604996,1,1,0
ahre****,c9RMv,미꾸라지 한마리가 온동네를  흑탕물로  만드는구나 왜저럴까 도대체 뭐가 있기에 이번 사퇴가 장기되더라도  그노마 임기에 있었던 모든   연류 의혹 철저히 파헤쳐 모든 재산 다 몰수하고감방쳐넣어야 한다 검찰들 정말 이정도일줄 몰랐다 이렇게까지 썩어 을줄   만약이건이 그냥 넘어간다면 이제모든법 즉 지킬이유가없다  법이없는데 검사 판사가 무슨 필요있겠는가,True,1,2025-03-10T04:37:23+0900,853478982245416989,1,1,0
mdh4****,4PmDN,이재명은 탄핵고추가 달렸나요! 심심하면 탄핵소추 하려 합니까!,True,1,2025-03-10T04:30:02+0900,853478509044039684,1,1,0
whit****,1oxLo,"난 이재명이 자기 심복들 다 비리 혐의 밝혀져서 수감되어 있는데, 그들에게 이재명 죄 다 뒤집어 씌우고.. 재판도 질질 시간 끌기하며 감옥에 들어갔어도 수십번은 갔어야 하는데 방탄조끼를 입고 멀쩡히 지금 대통령 되겠다고 나서는 이재명의 행태가 믿기지 않는다고 100번은 말할 수 있다!!!",True,1,2025-03-10T04:21:47+0900,853477977239846955,1,1,0
shin****,477jq,믿기지 않는다 니가 사람이라는게 ..,True,1,2025-03-10T04:21:09+0900,853477937041637383,1,1,0
univ****,cTaeq,이재명은 국가원수로 부적함 죄인인 범죄자가 적합함,True,1,2025-03-10T04:04:05+0900,853476837009915908,1,1,0
soon****,5BjHH,다음은  재명이너가 들어가야하니까,True,1,2025-03-10T04:02:22+0900,853476726666166298,1,1,0
hmk1****,1TK7S,오마이 전과자 일뿐 오마이뉴스는 전과자와 같은 생각,True,1,2025-03-10T03:56:06+0900,853476322788245511,1,1,0
dudd****,2qB2r,당신이 아직 감옥에 안간게 믿기지 않아요,True,1,2025-03-10T03:54:20+0900,853476209139384347,1,1,0
kytf****,2EUHX,이찟 당신이 입을 찟고싶다,True,1,2025-03-10T03:52:08+0900,853476067707453445,1,1,0
wodl****,,,False,1,2025-03-10T02:47:52+0900,853471926872440907,0,0,0
jgh2****,131Qk,난 5명 자살 시키고 전과4범에 9건의 범죄 고발 재판 중인 놈이 정치하고 있다는 것이 정말 믿기지 않는다.,True,1,2025-03-10T02:19:23+0900,853470092384534560,1,1,0
dksw****,1ylLm,윤석열 곧 파면ㆍㆍ탕탕탕,True,1,2025-03-10T01:17:19+0900,853466093467992115,1,1,0
miny****,pLyh,난 니가 대권을 노리고 있는게 진짜 믿기지않는다. 어찌 감히 범죄자가!!!! 이재명이 갈곳은 감옥!!!,True,1,2025-03-10T01:15:52+0900,853465999599468686,1,1,0
myal****,3uob3,이제 부하들도 곧 석방될거니까 걱정하지마.,True,1,2025-03-10T01:07:26+0900,853465456990748734,1,1,0
rlat****,1rILB,난 그쪽이 대한민국 국회의원뱃지 달고 설치는게 세상에서 제일 이해안갑니다,True,1,2025-03-10T00:59:51+0900,853464967800684700,1,1,0
lees****,,,False,1,2025-03-10T00:58:12+0900,853464862204887081,0,0,0
shan****,EmDu,빨리 파면되고 새 정부에서 검찰을 해체해야 나라가 바로선다.,True,1,2025-03-10T00:14:29+0900,853462045964632202,1,1,0
itki****,2Vb2W,찢죄명이 언제까지 개소리 할거냐 그만하누 빵으로 어떠냐 죄명아???,True,1,2025-03-10T00:09:51+0900,853461746608767204,1,1,0
hari****,1latD,"머하는 애들이고 일이나 하지 사기범하고 그외4명으로만
보이는데",True,1,2025-03-10T00:05:28+0900,853461464214667402,1,1,0
ckh9****,5Ivok,이재명을 비롯한 깡패 집단이 어떻게  국회의원으로 진입됐는지 도무지 이해안 감. 빨리 해체해라,True,1,2025-03-10T00:04:01+0900,853461371604434952,1,1,0
ball****,,,False,1,2025-03-09T22:58:19+0900,853457138343739489,0,0,0
kyou****,dkqVG,이번기회에 국회해산권한을 대통령에게 줘야다수당의 횡포를 막을수있다!!!,True,1,2025-03-09T22:55:52+0900,853456980721795369,1,1,0
ccss****,4M1ft,국민은 이죄명이 윤석열이 고소한건하나도없다는게 믿기지않고. 니네 경선때 문재인이그낙연이 고발한 사건이라는게 믿기지않고. 더 믿기지않는건 그많은 범죄사건이 10년간 25가지 재판인데 겨우 3개만 재판중.인게 더 믿기지않는다,True,1,2025-03-09T22:49:49+0900,853456590332756243,1,1,0
kimy****,2IOiM,믿기지 않는건 당신이 국회의원이 되고 당대표가 됬다는 사실임..정말 미스테리한 일임..,True,1,2025-03-09T22:20:32+0900,853454704338796732,1,1,0
ange****,4qsvE,이재명구속,True,1,2025-03-09T22:07:31+0900,853453865360556195,1,1,0
podo****,J5yC,"범죄자야 니가 자꾸 판결 안난 사건으로 내란수괴자ㅡ거리면 앞으로 전국민이 너를 &lt;대북송금범&gt;, &lt;형보수찢범&gt;이런 식으로 불러도 불만없는거지?",True,1,2025-03-09T22:04:19+0900,853453659067908210,1,1,0
bodo****,eLZB,"믿기지 않겠지.자기눈에 대들보 박힌것은 못보는 거니깐.명백한 위헌적 계엄령에 나라가 두쪽난거는 그리고 이런 말도 안되는 석방 결정이 난것은 여지껏 민주당이 보여온 허접하고 독선적인 행태와 이재명의 존재 때문인걸 저들은 알고도 모르쇠로 일관하는건지 아니면 달리 자기들이 존재할수 있는 방법이 없기 때문인지는 모르지만,이렇게 명백한 범죄를 저지른 대통령쪽 일당들이 저리 당당할수 있는것은 단하나 민주당과 이재명 때문이란것이 아니면 달리 설명할 방법이 없다는것 또한 명백하다.",True,1,2025-03-09T21:31:58+0900,853451575388012852,1,1,0
blue****,8x2yT,니가 안가니까 개석열도 안가잖아 빨리꺼져 개석열도 꺼질수있게,True,1,2025-03-09T17:31:15+0900,853436067334848581,1,1,0
khj9****,18iG3,재명아 이제 그만 억지부리고 들어가자 가야 할 곳은 정해져 있어 국군통수권자가 아닌 어둡고 컴컴한 니 방으로,True,1,2025-03-14T01:06:00+0900,853836449554890756,0,0,0
sabi****,2bHJJu,범죄자에 불과한 이재명 한 놈 살리자고 탄핵과 특검을 남발하며 오만의 권력을 남용하고있다,True,1,2025-03-11T16:19:44+0900,853617002898522432,0,0,0
hyer****,1U6VQ,너같은 인간이 야당당대표인게 더 믿기지않는다,True,1,2025-03-11T15:31:20+0900,853613884114731140,0,0,0
chic****,4trVy,대표 빨 갱이들 다 나왔네. 무능한 주제에 사리사욕에 거짓말에 저질스런 것들. 이런 것들이 없어져야 대한민국 자유민주주의가 산다.,True,1,2025-03-11T12:57:23+0900,853603966448042132,0,0,0
dmsw****,3P4Rr,진짜 내란세력은 민주당,True,1,2025-03-11T01:29:56+0900,853559677634478205,0,0,0
yooj****,5wh3P,리짜우밍이 저런소리하믄 뭐다 윤 대통령 석방은 잘했다 ㅋㅋ,True,1,2025-03-11T00:33:56+0900,853556070214271197,0,0,0
kkh7****,1LZRJ,내란유발자,True,1,2025-03-10T21:13:06+0900,853543131071643692,0,0,0
hsli****,5HGCv,"주옥같은 인간들이 다모였네. 자유민주주의 대한민국 체제의 모든 혜택을 누리고 호가호위하며 친북,친중 공산주의를 찬양하는 공산주의자들의 친목도모를 거창하게 포장해 기사써주는 조선노동당 기관지 오 마이 뉴스!!!~역시 눈이 썩겠네!!! 죄명아, 니만 감옥가면 대한민국에 태양도 뜨고 봄도 알아서 올거야!!! 쓰레기장 어디냐??? 싹다 처넣고 시프다~",True,1,2025-03-10T20:51:57+0900,853541768510046523,0,0,0
capr****,2vPnO,죄명아 니가 아직 감옥에 안간게 믿기지 않아요,True,1,2025-03-10T20:05:02+0900,853538746094583822,0,0,0
lgh3****,T8kA,저런말하는게 믿기지가않는다,True,1,2025-03-10T19:21:33+0900,853535944282734773,0,0,0
ikur****,4qLeu,난 너가 아직도 빵에 가지 않은게 믿기지 않는다.,True,1,2025-03-10T14:46:13+0900,853518206000693357,0,0,0
than****,4dl7t,양아치 니 쫄았제? 느그 짜바리 애들 조져봤자. 우물안 개구리들이야. 어디 우물 밖으론 나오지도 못하는 게 자랑스런 대한민국을 먹을려고 그래!,True,1,2025-03-10T13:43:28+0900,853514164184809683,0,0,0
ksng****,vK0Y,야당이 미적되는 시간에 나라와 국민은 골로 가고 있다. 내란공조자들은 공직자및 공무원은 전부 탄핵하라~ㅓㄴ력을 빡서야 2차 3차 국기문란행위를 할수 없는것이다.,True,1,2025-03-10T13:23:27+0900,853512874503438548,0,0,0
wjsu****,,,False,1,2025-03-10T12:59:40+0900,853511342022197523,0,0,0
kkal****,1vZ8A,내란수괴 찢!! ㅋ,True,1,2025-03-10T12:59:37+0900,853511338582868234,0,0,0
kwg2****,4Kz8n,죄명아  뭐하냐  ㅡ 심우정  탄핵 시켜라   ..  이죄명  말로만 쫄랑  거리지  말고 .  심우정  탄핵시킨다며  ㅡ  빨리  탄핵 시켜,True,1,2025-03-10T12:49:17+0900,853510673366253685,0,0,0
euri****,3v8Lc,재명아 넌 세상이 삐딱하게 보이지? 그런 심성으로 무슨 정치를 하냐? 너는 그렇기 때문에 안되는 거다!!,True,1,2025-03-10T11:58:08+0900,853507378052595764,0,0,0
yjso****,,,False,1,2025-03-10T11:35:24+0900,853505912864768181,0,0,0
kwg2****,4Kz8n,이죄명은  뭐하냐  빨리  심우정을  탄핵시켜라  ㅡㅡ  심우정은  똑똑해서  자진사퇴  안한다   ㅡㅡ  죄명아  빨리  탄핵시켜러,True,1,2025-03-10T10:39:04+0900,853502284372377638,0,0,0
duda****,22jEo,재명아 우리도 믿기지 않는다 대체윤석열이 떵깨들이 얼마나 풀렸길래 이렇게 멋대로인지 나라가 개판이네,True,1,2025-03-10T10:31:42+0900,853501809208066366,0,0,0
elpo****,16MFx,양아치 거래수괴 노릇으로 부족하냐?  웬 쪼무라기 아가리만 깐 년들 모아서 뒷골목 야마치까지 완장차고 나서니  도둑놈 꼬락서니가 과연 제대로선다!  국민세금 처머코 매닥질 치지말고 그양아치녀들 전부  끌고 나가서 남쪽의 꽃제비노릇이나 하건다!,True,1,2025-03-10T10:23:43+0900,853501295238054209,0,0,0
hanp****,,,False,1,2025-03-10T10:20:49+0900,853501108423754084,0,0,0
ldw8****,,,False,1,2025-03-10T10:17:19+0900,853500882199773326,0,0,0
yhm3****,bMjoA,댓글 수준이 높아졌으니 오마이뉴스도 가끔 봐야겠다,True,1,2025-03-10T10:11:20+0900,853500497699537054,0,0,0
yhm3****,,,False,1,2025-03-10T10:09:04+0900,853500351704203295,0,0,0
rjt7****,1CeYD,찢명이 너는 정신 병자. 히안한 일이 니 주변에는 항상 벌어 지고 있다. 그리고 너는 공산주의자! 도둑 넘! 내란 수괴!,True,1,2025-03-10T10:08:12+0900,853500294997213287,0,0,0
bss6****,7aGRo,"좋은말은 다하고 자빠졌네
제발 언행일치 좀 하자",True,1,2025-03-10T10:06:30+0900,853500186347962546,0,0,0
dbsq****,2XPlz,잡범아! 네가 아직도 구속되지 않고 헛소리 하고 다니는 것이  이해되지 않는다.,True,1,2025-03-10T10:01:12+0900,853499844780621896,0,0,0
gkdk****,7XOKW,이놈의 머릿속은 대체 어떻게 생겨 먹었는지 알수가 없다,True,1,2025-03-10T09:59:31+0900,853499735711940831,0,0,0
jc18****,2c1hre,죄명님이  아직활보하고있는게  미끼지않아~,True,1,2025-03-10T09:54:44+0900,853499428185571620,0,0,0
jagu****,,,False,1,2025-03-10T09:36:37+0900,853498260088684764,0,0,0
pskg****,1kZtZ,또 노인네들 좌표 찍혀서 월월 거리고 있네,True,1,2025-03-10T09:33:04+0900,853498032019210272,0,0,2
jagu****,,,False,1,2025-03-10T09:32:55+0900,853498021969658174,0,0,0
yoon****,1cycc,쿠데타를 일으킬 정도로 무대포인 인간이 그 긴 세월에도 불구하고 아직 이재명을 못 쳐넣은 걸 보면 법리적으로 어떻게 해 볼 도리가 없을 정도로 클린하다는 반증임. 문제는 앞으로 총 칼 들고 16차선 대로변에서 시민 죽이겠다고 난리 쳐도  체포 적부심? 뭐 그딴 걸로 집에서 편하게 재판 받아도 될 듯. 떡검들을 죄다 쓸어버리고 싶음,True,1,2025-03-10T09:24:59+0900,853497511539638667,0,0,1
anam****,3rPx4,26~27일 이재명 서부지법에 영장청구하면 구속영장 발부 될까 ㅋㅋㅋ대통령도 구속영장 발부한곳인데 이재명은 우리인지 뭔지에서 영장 발부 할 까 ㅋㅋㅋㅋㅋ,True,1,2025-03-10T09:24:46+0900,853497497128010007,0,0,0
1ehd****,,,False,1,2025-03-10T09:21:34+0900,853497290818584788,0,0,0
duma****,,,False,1,2025-03-10T09:19:28+0900,853497156047208619,0,0,0
aass****,dVMVz,여기 댓글 왜이래...?,True,1,2025-03-10T08:56:28+0900,853495674015056028,0,0,0
hi******,,,False,1,2025-03-10T08:55:10+0900,853495590699401267,0,0,0
supe****,bI8sK,공수처 위법 수사는 쏙빼고 말함 이게 좌파들이다 자기들 잘못은 쏙 빼고 남의탓만 하는것 지금 우리가 아는 좌파들시각의 역사들을 믿으면 안되는 이유가 이거야 부모세대가 왜 좌파들을 지지를 안할까? 그건 정확히 얘들이 한 짓을 알기 때문인거지,True,1,2025-03-10T08:52:18+0900,853495405059506259,0,0,0
ytc5****,8OQmR,나는니놈이 빵에 않가고 여기저기 쏴돌아다니는게  믿기지않는다,True,1,2025-03-10T08:50:58+0900,853495319210492219,0,0,0
eock****,,,False,1,2025-03-10T08:49:44+0900,853495240458240239,0,0,0
kbw1****,wmBm,난 니가 국회위원 뱃지달고 여기저기 이말저말 하고 남 평가하는게 이해안됨. 니가있어야 할곳은 법원과 판결을 받아야 하는 피고인신분.,True,1,2025-03-10T08:48:04+0900,853495133235052564,0,0,0
supe****,3za2C,아직도 너라는 존재가 믿기지 않음.,True,1,2025-03-10T08:47:23+0900,853495088355999854,0,0,0
0174****,2VD4,너는  이해  안해도  돼,True,1,2025-03-10T08:46:26+0900,853495028008353922,0,0,0
eock****,,,False,1,2025-03-10T08:45:55+0900,853494994470699284,0,0,0
easy****,,,False,1,2025-03-10T08:45:46+0900,853494985025126643,0,0,0
opti****,MGtz,이제 니 차례가 온다는게 믿기지 않겠지,True,1,2025-03-10T08:44:42+0900,853494915601006808,0,0,0
wcd5****,36t91,항상 김재연은 이재명 옆자리에 있나,True,1,2025-03-10T08:42:08+0900,853494750144102442,0,0,0
aky2****,ppnR,이재명이 감옥 안가는게 믿기지 않는다 !,True,1,2025-03-10T08:39:09+0900,853494558212751399,0,0,0
hsp5****,zXq0,2찍 개돼지들의 댓글 놀이터가 되었구만...느그들은 개돼지 처럼 몽둥이로 맞아가며 세상을 살아서 굥건희의 내란의 밤이 전혀 일상과 다를바 없었던 건희? 그저 깔게 야당 대표 이름 석자 밖에 없는 비루한 것들...느그들과는 이 대한민국 이란 세상에서 숨쉬고 사는게 마치 좀비같은 너희들에게 더럽게 오염되고 있는것 같아 역겹다...꺼져라 제발...,True,1,2025-03-10T08:38:33+0900,853494519407050906,0,0,0
jhee****,1aWpl,맛이 갔어 가도 한참 갔어.. 도돌이는 이제 불가,True,1,2025-03-10T08:36:36+0900,853494393863143598,0,0,0
san2****,eICaP,"나도 믿기질 않아 니가 총각인게
가짜총각
가짜검사",True,1,2025-03-10T08:34:38+0900,853494266859618484,0,0,0
arom****,2QXsE,당신이 아직 구속안된거 나는 더안믿겨 × 3000,True,1,2025-03-10T08:32:41+0900,853494141332488378,0,0,0
suna****,26XkJ,법이 멍청하면 사람이라도 현명해야지 상식이 없는 나라 이게 나라냐 개똥멍청이들,True,1,2025-03-10T08:32:07+0900,853494105395691551,0,0,0
tkfk****,2HHY0,난 니가 믿기지 않는다  죄가  하나둘  이어야  나열하지 너무 많아서 오래살겠다,True,1,2025-03-10T08:30:55+0900,853494028270829819,0,0,0
jun0****,1QMap,입으로 먹고사는 편한팔자,True,1,2025-03-10T08:30:44+0900,853494015956353232,0,0,0
pks3****,1FFc8,국민의 뜻이다. 믿어라 이놈아,True,1,2025-03-10T08:27:04+0900,853493779968032790,0,0,0
hnoo****,30D8e,"복귀시켜라 국민들이  나라를 부서버리게 
한넘이 5천만을 가지고  놀고 
법같은건  필요없는  시기가됫다 
조각을  내서  치워버리게",True,1,2025-03-10T08:22:36+0900,853493491718684849,0,0,0
real****,2x4ZA,"윤석열 구속 취소?? 아! 이젠 말 안 듣는
동급생 폭력으로 딱 20분만 위협해도 
되는거죠? 법을 다루는 분들 뭐하는 겁니까?",True,1,2025-03-10T08:18:46+0900,853493244640624838,0,0,0
wjca****,aCfVg,2찍들 좌표받고 준동한다!,True,1,2025-03-10T08:17:12+0900,853493144212209744,0,0,0
kysp****,8C2ox,"탄핵전문당 당수답다, 이해 안가지. 하는일이 탄핵전문인데 구속취소라니 이해안갈기다, 악의축인 좌파 민주당 골로간다",True,1,2025-03-10T08:16:07+0900,853493073949229092,0,0,0
yjki****,1Lcud,이재명씨 사법영웅 지귀연판사는 당신이 가장 존경하는분 맞지? 이재명씨 검찰 잡것 심우정이는 좀비 같은것 맞지? 이재멩씨 그래서 심우정이를 탄핵한다고? 하하하 웃긴다 너만보면 ㅋㅋ,True,1,2025-03-10T08:14:53+0900,853492995381526778,0,0,0
k840****,,,False,1,2025-03-10T08:10:58+0900,853492742834094358,0,0,0
jooc****,3Axhj,윤석열 썩을놈때문에 나라가 후진국이 되었다  망할놈 윤석열 나라 망쳐놓고 뭘 잘났다고 뻔뻔스럽게 행동하냐 즉각 파면하고 사형시켜라,True,1,2025-03-10T08:07:37+0900,853492526408007851,0,0,0
moon****,XqE,즉시 사퇴라니? 즉시 탄핵해야 한다.,True,1,2025-03-10T08:06:29+0900,853492454031097979,0,0,0
pyeo****,c0Hz1,재앙아 세월호 시즌4 가잖께~,True,1,2025-03-10T07:51:00+0900,853491455904186375,0,0,0
cadz****,2c3gJC,ㅡㅡ뱀눈깔  쌩양아치ㅡㅡ이재명 ㅡㅡㅡ엄청  설쳐대는구나ㅡㅡ애정결핍이냐ㅡㅡ왜ㅡ이리ㅡ설치냐ㅡ,True,1,2025-03-10T07:18:53+0900,853489387525111961,0,0,0
k676****,1dh0j,당ㅈ신이 구속 안된게 믿기지 않는다!!!,True,1,2025-03-10T04:13:15+0900,853477427484033043,0,0,0
sky1****,opgN,뒤로는 넣기로 약속했나?,True,1,2025-03-10T04:04:07+0900,853476839778156554,0,0,0
athe****,b2O0E,국민은 죽어나가는데 니들 머하노???  나라안에 따로 만들어서 살아라.,True,1,2025-03-10T03:58:51+0900,853476500677066805,0,0,0
hanm****,egzmC,"정신  나간 자슥들  같으니
국정의 혼란과  내란은
니놈들이  한짖이여
이젠 탄핵 특검  말만 들어도  지겹다
니들은 집에가서  집청소나 해라
국민들이  니들 다음에는  내 쫒아 버릴 테니까
지겹다  니들 얼굴 보는것도",True,1,2025-03-10T03:58:44+0900,853476492573671468,0,0,0
gomi****,8QCcA,민주당 진짜 미쳤다. 탄핵을 밥먹듯하네. 니들 뜻대로 안되면 탄핵하는데 윤통 계업도 뜻대로 한건데 뭐가 내란이냐? 니들이 하는 이 짓거리들이 곧 내란이다.,True,1,2025-03-10T03:50:50+0900,853475983922036780,0,0,0
hane****,,,False,1,2025-03-10T03:45:03+0900,853475610679312388,0,0,0
hane****,,,False,1,2025-03-10T03:43:40+0900,853475522179498031,0,0,0
kimw****,c9UXs,너는 전과범이자너 말 오지게 많네,True,1,2025-03-10T03:24:19+0900,853474274860597279,0,0,0
choo****,iDs6,배설물s,True,1,2025-03-10T03:23:14+0900,853474206006902799,0,0,0
