user_nickname,userIdNo,comments,visible,replyLevel,regTime,parentCommentNo,sympathyCount,antipathyCount,replyAllCount
nice****,2gB36,법치주의 무시하고 선거에 승복 안하면 민주주의는 무너진다. 우리나라는 망하는 길로 가고 있다,True,1,2025-02-14T07:36:29+0900,851264009914024022,35,37,2
1879****,1s6l7,일당 5만원 준다고하는 전광훈영상도 나왔다. 5만원짜리 댓글부대들과 5만원 인생들은 제발 북한으로가서 김정은 외치며 배급받아 먹어라. 딱 니들이 원하는 세상이다,True,1,2025-02-14T07:42:33+0900,851264400655384690,4,6,2
mrso****,1dz8O,계엄은 잘한 짓이 결코 아니지만 그배경을 살펴보면 국무위원등의 탄핵만 30번에 가깝고 특검벌의만 20번이 넘는다. 과연 민생은 어디로 갔더란 말인가? 작금의 혼란 속에서도 무슨법 무슨법 제정에만 몰두하며 방탄 조기대선에 힘만쓰는 모양새니.. 국민들은 과연 어쩌란말인가.. 도찐개찐.. 그렇다면 어쩔수 없다..,True,1,2025-02-14T07:33:44+0900,851263832780177520,2,4,1
msji****,1DyKf,"국회가 국헌문란, 국가무력화를  시도는데 국회를 무력화 하는게 정당한 권리행사 아니노",True,1,2025-02-14T16:24:23+0900,851298019998433423,1,3,2
home****,577Jn,헌재가 필요한가  과연 그들은 나라를 주무럴 그런 법적 자질을 갖추었는가 . 대통령은 엄연히 국민투표로 당선이 되었다 헌재의 재판관은 사법고시를 패스해서 임명이 된 것이다 고로 대통령은 국민이 재판을 해야하는 것이 마땅하고 헌재도 국민이 재판해야 마땅하다 한데 지금 헌재는 국민위에 굴림을하고 심지어 자질이 한침 모자란 인간들이 집단주의 이기주의에 사로잡혀 일반 국민들이 법을 아주 우습게 보고 있다 앞으로 어떻게 실추된 위상을 잡을지 ...,True,1,2025-02-14T08:28:43+0900,851267375255781546,1,3,0
thmp****,kE4k,아이고 윤석열 나쁜놈아~ 김건희 명태균 강혜경 잘 수사하던 검사들 다 어디로 좌천 시켰나? 이러니까 특검 하겠다는 거야. 이런 특검을 거부하는 놈이 범인이다.,True,1,2025-02-14T08:08:17+0900,851266058932191307,1,3,0
cjd0****,,,False,1,2025-02-14T08:02:02+0900,851265655540809740,0,0,2
kwy7****,,,False,1,2025-02-14T11:51:26+0900,851280434858819757,0,0,0
bedr****,,,False,1,2025-02-14T08:22:17+0900,851266960623665229,0,0,1
enzo****,2mFGE,"막판 증대결심? 또 경고성 계엄하게? 또 사법기관 부수게? 서부지법 관련해서 폭동 일으킨 사람들 반
드시 중형선고바랍니다.앞으로 재발방지 위해서 꼰 필요합니다. 보싁 허가없는 징역형 20년이상 선고해서 가족 사회와 분리바랍니다.",True,1,2025-02-14T08:15:02+0900,851266493898293258,0,2,0
kang****,bqEt2,"헌재는 내란죄를 철회한 이유가 바로 공수처의  홍장원,곽종근등의 거짓 진술을 그대로 밀어 부처
대통령을 파면 할려고 하는 의도가 명백하다. 이것을 지켜본 국민들은 헌재의 불법적이고 불공정한 재판을 진행하고 있는 부분을 예의주시하고 있음을
명심해야 한다.",True,1,2025-02-14T07:59:27+0900,851265489328930898,0,2,1
ckdu****,1ltFX,헌재 히ㅣ산하고~~  문형배 탄핵해라~~,True,1,2025-02-14T07:30:59+0900,851263655595999406,0,2,0
gimd****,4jtbZ,아무리봐도 재판 지연을 위한 시간끌기 작전을 펼치고 있는 것으로 보이는데 잡범도 아니고 대통령으로서 너무나 치사하고 더럽다,True,1,2025-02-14T07:40:50+0900,851264289976090772,2,5,0
reds****,22WcC,헌재는 심판이라는 이름을 빌려 당초 목적한 바를 달성하려고 하고있다. 답을 정해놓고 대국민 사기극을 벌이고있다 헌재는 증인신문 시간을 엄격하게 제한하고 있다 더욱 이해할 수 없는 것은 반대신문사항을 하루 전에 제출하도록 하는 것이다. 일반적으로 증인에 대한 주신문이 이루어지면 상대방은 반대신문을 통해 증인의 증언을 엄격하게 검증한다. 그런데 반대신문사항이 하루 전에 공개되면서 증인들은 상대방이 자신에게 무엇을 물어볼 것인지 예측해 대비하고 있다. 자격없는 문형배 정계선 정정미 이미선정치판새들 사퇴하라,True,1,2025-02-14T08:06:24+0900,851265937096048732,1,4,1
pyow****,1khvi,국민이 선출한 대통령을 단지 비상계엄을 선포했다는 것으로 파면할 수 있는가 의심의 여지 없이 충분히 심의하여 결론을 내라,True,1,2025-02-14T15:06:12+0900,851292982320562266,0,3,2
mari****,1Q2Qa,내란수괴 내란돼지 그냥 빨리 탄핵시키고 사형시켜 버려라. 꿀꿀이죽 주는 세금도 아깝자너,True,1,2025-02-14T07:52:29+0900,851265041125605464,0,3,0
born****,,,False,1,2025-02-14T07:30:11+0900,851263604006060069,0,0,0
5her****,,,False,1,2025-02-14T08:59:08+0900,851269334968827935,0,0,1
cjd0****,,,False,1,2025-02-14T08:00:17+0900,851265543150239813,0,0,2
seiz****,3kRnu,"윤석열 저 xx 는 동네 이장도 하면 안될 xx다.   뭐하나 인정하고 책임지는꼴을 못보네.   모든게 남탓. 평생 그러고 살아도 검사라는 직업이 그걸 가능하게 했다는게 씁쓸하다. 
 개사과 때부터 알아보긴 했지만. 진정한 입벌구.  건희
허수아비",True,1,2025-02-14T08:02:57+0900,851265715485802699,14,19,1
rnjs****,ayaCI,"문형배가 왜 영혼없는 눈빛에 피곤한 얼굴인지 알겠다.
 동창이 운영하는 음란카페에 들어가서 매일 야동이나. 보니 그런 눈빛에 얼굴이었다.
 운형배를 구속수사히지 않을 거면 n번방 조주빈도 풀어줘라!
법앞에 모두가 평등. 이니냐!",True,1,2025-02-14T06:32:22+0900,851259878994346019,11,17,6
sond****,11W9z,내란수괴 빨리 탄핵하고 재판해서 사형집행하자.,True,1,2025-02-14T06:43:19+0900,851260585013149732,6,15,0
pjs1****,1c9q7,어차피 탄핵인데 뭐하러 시간끄냐?,True,1,2025-02-14T07:35:04+0900,851263918545305616,93,111,6
supe****,2Vvl7,윤석렬이 이해가 안되는게 본인은 자유민주주의 외치면서 하는 행동은 북한과 다를거없다. 계엄령에 군대를 동원하는건 북한 정치랑 다를거없지. 독재할려고 한거잖아. 위험한 종자,True,1,2025-02-14T07:58:31+0900,851265429954363484,33,52,8
yysc****,374Zg,"재판이 지연되어 국가 경제에 혼란 및 손실이 발생하는 경우, 손실액을 윤석열 및 그 대리인단의 재산으로 충당해주시기 바랍니다.",True,1,2025-02-14T06:18:02+0900,851258956046139396,136,162,9
