user_nickname,userIdNo,comments,visible,replyLevel,regTime,parentCommentNo,sympathyCount,antipathyCount,replyAllCount
chle****,1GZpU,지금 윤두창 쪽에서 계속해서 떼 쓰는 거 보면 만일 하나라도 복귀하면 바로 헌재부터 무력화 시도를 하겠지. 헌재가 바보냐?ㅋㅋ 그러니까 속전속결로 진행하는 거다. 답은 정해져 있고 내란견들도 내심 알고 있는데 행복회로 돌리면서 정신승리 하는거지ㅋㅋ,True,1,2025-01-14T15:28:36+0900,848418516217364764,3,1,0
bocb****,5DElK,재판받아라~~멧돼,True,1,2025-01-15T00:22:30+0900,848452912026747012,1,0,0
more****,3tfHS,헌재 기각사유가 말인지 방구인지.  헌재의 권위는 이미 실추됐고 판결을 신뢰하는 국민도 많이 없다는 사실을 헌재는 알아야 한다.,True,1,2025-01-21T20:16:31+0900,849086463709544664,0,0,0
sol8****,Gr18,이제 헌재 심리도 중단되어야 하겠지...,True,1,2025-01-15T12:10:07+0900,848498499916922930,0,0,0
chle****,,,False,1,2025-01-14T15:27:35+0900,848418449964138764,0,0,0
zene****,6gMy,헌법재판소는 부정하게 진행된 탄핵철차에 대해 심사숙고하여 이번 탄핵소추를 당장 각하하라,True,1,2025-01-14T15:34:50+0900,848418917226381696,6,7,1
