user_nickname,userIdNo,comments,visible,replyLevel,regTime,parentCommentNo,sympathyCount,antipathyCount,replyAllCount
yhn8****,4WPLy,내란당이 헌법을 유린하고 사법시스템을 붕괴시키려하네. 그렇게 니들이 주장하던 법원 겁박도 니들이 하고있잖아. 추후 니들은 100% 해산이다. 니들 해산후 니들당 예산 국고로 환수되는게 나라 살리는 길이야.,True,1,2025-01-28T23:31:53+0900,849748449132806353,0,1,0
inma****,,,False,1,2025-01-28T23:16:42+0900,849747470987559133,0,0,0
seon****,cKwRZ,지금 국짐 니들이 여당인데 할 말이냐,True,1,2025-01-28T22:56:56+0900,849746197496201520,0,1,0
huhh****,23gCy,정치적으로 쏠려있는 사람은 헌재 자격 없지않나?,True,1,2025-01-28T22:27:07+0900,849744277142503448,0,1,0
kihp****,1AvUs,의심이 아니라 과거 행적과 글을 보면 종북친중 극좌 인원이 헌재에 4명이나 있다는게 말이 됩니까?,True,1,2025-01-28T22:25:32+0900,849744174465941670,0,1,0
tnst****,4wqHU,"반국가세력 , 종북 ,처단하면서  겁주고  군대동원 할때는 편향적
이지 않았냐?",True,1,2025-01-28T22:15:54+0900,849743554531033343,0,1,0
rotc****,109ZL,"편향적으로 삐뚤어진건 내란의 힘이지..
그윽우에 빌붙고 전광후니에게 빌빌대고 ..
얼마나 못났으면 유투버를 보고 그대로 발언하고 무속찿고 빤스먹사에게 고개숙이고 그윽우들에게 빌붙겠나..
국가의 일을 하면 편향된 거 현 정꿘아닌가...",True,1,2025-01-28T22:11:30+0900,849743270861865103,0,1,0
pink****,1q7I2,"윤과 일찌감치 선을 긋고... 사람 잘못 봤다, 우리는 윤과 다르다.. 이러기만 했어도 차기 대선에서 파란당 빨간당 같이 놓고 따졌을 텐데... 지금도 윤석열 구하기가 유일한 목적인 듯.. 12.3사태를 문제 삼는 것이 아니라 12.3사태에 관한 처분이 문제라며 이젠 헌재까지.. 사법기관을 부정하고 법원 폭도들에게 서사를 부여하며... 드러내놓고 선물까지 보내 극우꼴통을 위로 격려하며.... 이러는데 어떻게 차기 대선에서도 빨간당 후보가 당선되길 바라나.. 재선 포기하고 윤에게 일편단심인 빨간당이 감히???",True,1,2025-01-28T21:59:06+0900,849742472199274524,0,1,0
moi1****,3Nue4,요즘 국힘 하는 모양 보면  사법질서보다 자신들의 이익만 위해 내 달리는 불나방 같네.,True,1,2025-01-28T21:57:59+0900,849742399822364950,0,1,0
yjhy****,11sYt,'국민의 힘' 은 당명 바꿔라. ===&gt;  ' 군바리 힘 ' 으로...,True,1,2025-01-28T21:48:00+0900,849741756768452609,0,1,0
jyjy****,,,False,1,2025-01-28T21:34:58+0900,849740917370781962,0,0,0
pos2****,1nMor,"선관위 흔들기가 안먹히니 이제 헌재 흔들기냐?
국힘 흔들기나 해라",True,1,2025-01-28T21:16:37+0900,849739734845489336,0,1,0
runn****,3ahRF,"문.정.이  당신들 양심있으면 탄핵회피하시오.
하늘이 보고있음",True,1,2025-01-28T21:16:14+0900,849739710367531076,0,1,0
iwin****,3Ap0T,사법부내에 하나회 격인 우리법연구회 국제인권법연구회 출신은 색출해서 잘라야 한다.  헌재내에도 있다.,True,1,2025-01-28T20:51:32+0900,849738119166034038,0,1,0
teru****,1YMIN,국짐당으로 전락하고 국폐당으로 달리고 있구나,True,1,2025-01-28T20:50:51+0900,849738075209728195,0,1,1
moni****,2Z8od,대놓고 법치를 무시하는 막가파 정당. 국짐해체!!,True,1,2025-01-28T20:32:47+0900,849736910921269445,0,1,0
pos2****,1nMor,어쩌다가 여당이 정부기관을 비난하게됐나?,True,1,2025-01-28T20:30:40+0900,849736774656721033,0,1,0
pyc0****,16FNa,"우리나라에는 삼권분립이없다,, 부정 국개의원의 독주와 우리법 연구회인지 x인지에 장악되 변질된 종북 사법부만있다,또한  사이비 보수에 잠식되어 정당추구가치가 없는 여당인 국힘당이 있을뿐이다,",True,1,2025-01-28T20:21:20+0900,849736173361299538,0,1,1
fira****,3aRGL,여당이  헌법재판소 를  흔든다라   할말없다  너네들은  어느나라 여당이냐?,True,1,2025-01-28T20:01:35+0900,849734900239040653,0,1,0
skyl****,mUti,진보쪽편향은 안되고 보수쪽편향은 괜찮냐? 뭔 이런 이중잣대가 있어! 너네논리면 민주당에서 윤썩열이 임명한 사람 물고늘어져야 되는데 그렇게 안하잖아?,True,1,2025-01-28T19:51:19+0900,849734239569051725,0,1,0
psn2****,,,False,1,2025-01-28T19:51:15+0900,849734234670104630,0,0,0
goo9****,95onI,노골적으로  기울어지는 헌법재판소 해체하고 AI 대체하는게 옳을 듯,True,1,2025-01-28T19:41:24+0900,849733600390676587,0,1,0
knda****,1pRka,지금 증거만으로도 100프로 만장일치 탄핵일꺼 같은데.  헌법에 위법된 결론이 계속나올텐데 무슨 재판관탓을 하는지....,True,1,2025-01-28T19:38:34+0900,849733417586131085,0,1,0
koo7****,eiia,얼마나 발목잡고 예산으로  정치 못하게 하니 오죽했으면대통령이 국민들한테  호소를 했을까?  젊은 사람들과  호남 분들도 민주당에 등을 돌릴까?,True,1,2025-01-28T23:40:15+0900,849748988704850003,2,4,1
chol****,2u6US,"절대 공감합니다. 무엇보다 헌법에 입각해서
재판해야 할 사람들이 기울어진 운동장과
같은 사람들이라면 어떻게 국민들이
정당한 재판을 할거라고 생각하겠습니까?
의혹이 가는 분들은 스스로 물러가야
합니다.",True,1,2025-01-28T23:16:31+0900,849747459008626853,1,3,2
liko****,12PLj,"민주당은 정당 자격이 없다. 협치도 없고 탄핵만 있다.국민은 없고 정쟁만 있다. 반국가 구호만 있고 국가 발전 방안은 무조건 반대한다. 북한, 중국은 옹호하고 반미, 반일만 외친다. 국민을 위한 정당이라 할 수 없다. 반국가 세력이다.",True,1,2025-01-28T22:43:22+0900,849745323789123685,1,3,0
pnsc****,,,False,1,2025-01-28T19:47:35+0900,849733998262354075,0,0,0
cksj****,IkF9,헌재심리내용도 보면 법리보단 이미 파면 결론 내리고 파면이 정당한 것 인걸 보여주기위해 여론 선동목적으로 심리하고 있음!!! 국헌문란이니 내란이니!!! 이게 성립하려면 대통령이 계엄선포한 사유부터 사실관계를 엄격히 조사해야지!!! 일단 사실이 아니라고 확정지어놓고 제대로 조사도 안하고!! 계엄선포 후 계엄법에 따라 진행된 행동들만 가지고 여론 선동하고 있음!! 계엄사유가 정당하면 계엄하에 내린 명령들 행위자들 모두 계엄법에 따라 적법한 행동을 한것임에도 불구하고!!! 유죄확정해놓고 여론선동할 내용으로 심리하고 있다고!!!,True,1,2025-01-29T00:22:30+0900,849751710640373884,0,2,1
shen****,ehO0C,"선관위 위원장으로 있던 사람이 4명이나 됩니다.
스카이데일리 뉴스 보세요~",True,1,2025-01-29T00:18:49+0900,849751472739451077,0,2,0
naya****,3gwNv,정치성향을 떠나서  문씨는  반국가세력이라고 봐도 될정도던데 ?!??,True,1,2025-01-28T23:08:25+0900,849746937220431996,0,2,1
khl_****,4lNX7,재판관이 정치적 편향주의가 있다면 알아보고 피하는게 맞지않나? 재판관이 하느님도 아니잖니 인간이지,True,1,2025-01-28T21:16:17+0900,849739713773305936,0,2,0
ikgg****,SFin,"문형배씨.. 당신은 헌재재판관으로서 자격이 꽝이야.   625참전 유엔묘지에서 한 너의 발언은,  공산당이 아니고서는 할수 없는 발언이야..",True,1,2025-01-28T20:08:16+0900,849735331832922174,0,2,0
ccoo****,49o4q,헌재는 이미 더불당과 손잡고  답을 정해놓고 신속히 심리하는게 보인다 공수처 불법 체포영장도 눈감아주고,True,1,2025-01-28T19:56:06+0900,849734547900727323,0,2,0
ciw3****,,,False,1,2025-01-28T19:12:00+0900,849731706494648323,0,0,0
mylo****,t84u,"나는 20년 전에도 우파 였지만 노무현 대통령이 탄핵소추를 받을때 인간적 도리인 측은지심의 마음에 복귀하길 바라는 마음이 강하였고, 문재인 대통령 정권때도 비록 우파였지만 잘 이끌어주고 임기 마무리 하길 늘응원하였다.그러나, 좌파들은 끝까지 깡패와 같은 집단 광기적 폭언과 그들이 숭배하는 한사람을 위해 법을 교묘하게 이용 하고 꼼수와 비리를 자행한다.언론까지 지배하여, 현직 대통령을 방송과 언론의 힘을 이용해 세계 최악의 인간으로 만들어 버리는 수치스럽고 이공산당 같은 행태는 무엇이란 말인가!!정의로운 사법부도 마저도 그러한가!!?",True,1,2025-01-28T21:09:36+0900,849739282548523160,1,4,2
jgj9****,,,False,1,2025-01-29T05:58:50+0900,849773377827635251,0,0,0
yjsa****,3BJBZ,진짜  우려된다  가끔은  정은이가   공부 가르쳐 남파한 애들이 판사가 되었나  의심이 들만큼  좌편향적이라 대한민국의 사회주의화가 우려된다,True,1,2025-01-29T00:14:26+0900,849751190563455090,0,3,1
logo****,2NHNI,어쩌다 사법부와 헌재가 좌파 소굴이 외었는가?,True,1,2025-01-29T00:14:14+0900,849751177628221506,0,3,0
sgmn****,KXeC,학교에서는 선생님들도 커피한잔도 학부모들한테 못 받게하는 세상에!! 그건 어떤 상황에 중립적이지 못한 판단을 할까봐 만들법 아닌가! 그런데 한쪽으로 기운 성향의 활동을 하는 판사들이 판단을 한다고!! 이번 계엄사태로 너무 많은 의문이 수면위로 올라왔다!!드럽다 드러워!!,True,1,2025-01-28T22:46:36+0900,849745531944042698,0,3,1
yhkw****,4H8eX,"현재에 좌편향 판사, 우리법 연구회 (국제 인권법 연구회 )소속 판사는 곤란하다. 이해충돌 되는 판사이다. 원래  이해충돌 되면 스스로 내려 와야한다. 예들면 문형배 판사와 이재명의 친구사이등등  우리법연구회 소속 판사가 이해충돌이 꽤 있다. 이건 중립성에서 어긋난다.",True,1,2025-01-28T22:33:44+0900,849744703032131799,0,3,1
cksj****,IkF9,심리내용 자체가 적법하지 않다고 말하는거잖아!! 유죄확정해놓고 심리하니까 하는말 아니냐!! 지금 헌재 심리는 니놈들 민주당 공산독재하에 있을법한 인민재판이고!!! 법리대로 적법하게 심리하라고!!,True,1,2025-01-29T00:39:03+0900,849752776245248011,0,4,0
herj****,1A85Z,"헌재릉 믿을수가 없다 우리법연구소 판사들 
좌파판사 절대 믿을수 없다",True,1,2025-01-29T00:16:02+0900,849751293491675147,0,4,0
