user_nickname,userIdNo,comments,visible,replyLevel,regTime,parentCommentNo,sympathyCount,antipathyCount,replyAllCount
mik3****,2eiEP,김거니가 대통령이네 감옥에서 생을 마감 시켜야합니다 국민의명령이다,True,1,2025-03-06T19:43:16+0900,853166258932154455,4145,182,33
dobe****,1EnrD,윤거니 부부는 사형받아야한다.,True,1,2025-03-06T19:44:20+0900,853166326863102062,1719,89,21
danc****,20lO9,대한민국 악의축은 윤돼지가 맞는지만 윤돼지 머리위에 앉아서 조종한건 김명신이다 후대를 위해서라도 저 아줌마는 반드시 죗값 받아야 된다,True,1,2025-03-06T19:48:08+0900,853166572313772073,1588,33,10
xman****,2k8dY,마누라를 위해 계엄했다!. 신빙성 있는 내용이지.,True,1,2025-03-06T19:48:39+0900,853166605264224480,1062,49,15
hong****,sj2K,정의와 공정을 얘기하면싫어하는 국찜,True,1,2025-03-06T19:45:02+0900,853166372245471243,661,42,10
huno****,,,False,1,2025-03-06T20:03:06+0900,853167536651370537,0,0,1
pks9****,37AVz,김건희 도이치 주가조작불기속 내린 검사들 탄핵이 답이지 정치검사들,True,1,2025-03-06T19:51:45+0900,853166805550629100,145,2,0
topn****,bnYm1,술집작부 하나가 나라를 이렇게 망칠 줄이야,True,1,2025-03-06T20:29:01+0900,853169205900476430,135,2,3
dcdt****,2ccsWP,전세계 지마누라 감옥 막으려고 계엄한. 초유 엽기적 부부..대한민국 치욕역사로 남을듯,True,1,2025-03-06T20:44:25+0900,853170197954035869,125,4,0
namd****,cAXyG,"명태균이 황금폰 3대가 검찰에 제출됐고 김건희 특검법은 통과될것 같으니까 12,3 비상계엄을 발표한게 맞다",True,1,2025-03-06T19:53:18+0900,853166905106628697,118,4,1
hoho****,2mBDp,"윤석열은 대통령의 자리에 대해 얼마만큼의 책임과 무게를 느끼는지 알수가 없었다. 마음에 안들면 불통으로 일관했고 특히 김건희에 관한 일은 더더욱 그랬다. 김건희의 각종 이슈가 총선의 패망원인이었고, 국회연설을 거부하고 시정연설도 거부한 불통의 대통령을 자기 스스로 선택한 것이다. 계엄도 결국 뜻에 맞지않는 국회에 대한 분노 표출이지 그 이상도 이하도아니다. 야당뿐만 아니라 여당에서 조차 자기에게 맞서는 의견을 내는 그 누구와도 소통하지 않고 단절을 선택한 윤석열은 더이상 이나라 대통령이 될 자격이없다",True,1,2025-03-06T23:05:31+0900,853179288537530547,103,3,0
peti****,pe5G,어이가 없네. 김거니가 지은 죄가 얼마나 많은데. 그걸 제대로 수사 못하는 게 나라냐.,True,1,2025-03-06T20:32:24+0900,853169424172056713,93,1,2
eunj****,vDHf,이놈은 텀부터 끝까지 김건희가 원인이고 결론이네...김건희 보호한 검사들 탄핵당할까봐 계엄을 일으킨다??? 미치지않고서야??,True,1,2025-03-06T20:43:02+0900,853170108850241554,83,3,0
spho****,2ld49,"명태균,건진법사,도이치모터스,삼부토건,,양평땅,불법 계엄까지 모든 범죄의 끝엔 김건희가 있다",True,1,2025-03-06T20:35:35+0900,853169628703097038,80,1,2
heeb****,2U7FB,김건희도 반드시 잡아들여야 한다!,True,1,2025-03-06T20:38:30+0900,853169816641470656,74,2,1
pant****,2cGpFz,결국 김거늬 죄 덮을려고 계엄했네.. 근데 이 계엄을 계몽령이라 빨아대는 아이큐 2자리 2찍이들이랑 쩐항길은 대체 얼마나 무식한거여? 경북 경산 꼴통 출신 ❤️,True,1,2025-03-06T20:46:29+0900,853170331014135995,72,5,0
laic****,2dYoa,저건 마누라를 위해 전쟁도 할 놈임,True,1,2025-03-06T19:51:21+0900,853166778992296032,61,3,0
inbc****,2j5lk,"도이치   주가조작  수사를 제대로했으면   검새들    탄핵시키겠나  ?    
       국민 65% 가   김거니  특검하라는게    콜검들이   수사를 개판으로하니까   특검하라고하잖아 .",True,1,2025-03-06T23:03:23+0900,853179151484453007,59,1,0
smol****,MVm6,윤석열 정권은 김건희로 시작해서 김건희로 끝났다..기승전 김건희 내연남 윤씨 곁으로 구속시켜라,True,1,2025-03-06T20:24:41+0900,853168926358503672,52,1,0
park****,29Ccv,마누라때문에 계엄했다는 말이 진짜였네?ㅋㅋㅋㅋㅋ 와 진짜 저런게 우리나라 대통령이었다...미치겠네....,True,1,2025-03-06T20:27:41+0900,853169120353452270,52,2,0
limd****,2xx1R,마누라 죄를 덮으려고 계엄하는 대통령은 세계 역대 다 찾아도 윤떡열 밖에 없을거다. 이 무슨 나라 망닌이냐.,True,1,2025-03-06T23:18:38+0900,853180133186470111,47,1,0
gnt9****,3kuXq,김건희 특검은 반드시 해야겠네.. 무혐의 준 검사 3명은 진실을 덮고 특혜를 준 것이니 감옥에 가야 될게야.,True,1,2025-03-06T23:38:07+0900,853181388759760941,41,1,1
iris****,kgs7,아~~~!!  욜라 웃겨. 주가조작 명품백 건희마마 때문에 계엄한 모지리 막장드라마를 언제까지 봐야하냐?  전무후무하다. 썩을것들.  죄를 지었으면 처벌을 받는거야. 주가조작질 하고 명품백 받았는데 무신 그걸 털어줘. 이러니 개판 되는거야 나라가! 2찍  주적넘들이 대구리 깨져 골로 가기 전까진 대한민국은 요모냥 요 꼬라지겠지! 2찍 박멸 되야 산다. 주적넘들,True,1,2025-03-06T19:57:22+0900,853167167015747719,37,3,0
jums****,aGGKW,"진즉에 건희 방탄 계엄 뻔했는데
윤과 극우세력들은
야당견제와 예산삭감으로 인한 경고용이라고 씨부렸지
특검법을 수십번 거부 않했음 수십번 탄핵할일도 없지않냐,말이다,
법에 예외가 없거늘 
이런게 독재아니면 뭑독재인가",True,1,2025-03-06T21:15:19+0900,853172189208248427,34,0,0
lts5****,6fSaJ,봐라 지마누라죄감추려고 계엄했잖아 모지리들아,True,1,2025-03-06T20:40:09+0900,853169922757361729,27,2,0
calm****,2WDN1,건희가 나라 구석구석 부정부패에 가담 안한게 없네,True,1,2025-03-06T20:36:55+0900,853169714904432952,26,1,0
noda****,2UUtM,윤벌구가 결국 지 여편네 지키려고 나라를말아쳐먹었구나,True,1,2025-03-06T19:57:28+0900,853167173558861986,23,0,0
chak****,2pAUu,이런 팩트가 있는데 극우들 하는것 보면 윤은 신흥종교 교주인거 같다;;;,True,1,2025-03-06T20:22:10+0900,853168764273819711,23,1,0
ulbi****,eyCKg,"계기가 뭐였건, 계엄준비를 2년 가까이 했다는게 핵심이지. 대통령 되고 한 일이라고는 술먹고 해외여행가고 계엄준비한 거 밖에 없으니 원",True,1,2025-03-06T22:56:05+0900,853178680900321313,22,1,0
song****,e0TQy,"결국   마누라가     계엄  촉발시킨거네   .
     계엄령은   완전 게소리이고",True,1,2025-03-06T22:54:35+0900,853178583592468688,19,0,1
cndm****,3Xe62,윤석렬은 당연히 사형이지만 김건희 또한 반드시 사형시켜야 한다.,True,1,2025-03-06T22:48:34+0900,853178196407877836,19,2,0
lotu****,on6y,"사악하고 어리석은 두 사람 빨리 구속하고, 정치 경제 안정 찾자. 꼴 보기도 싫다.",True,1,2025-03-06T20:29:10+0900,853169215463489581,18,1,0
june****,3bY7a,지마누라 수사 안 받게 하려고 전국민을 볼모로 계엄을 하나?,True,1,2025-03-06T22:18:07+0900,853176235117772845,15,2,0
00lg****,26UqV,이런 팩트 있는 뉴스를 보고도 윤돼지를 찬양하는 무지무식한 2찍이들.... 꼭 윤돼지가 김정은같고 2찍이들은 세뇌 당해서 맹목적으로  그를 따르는 북한 주민 같으네...한심해,True,1,2025-03-06T23:03:56+0900,853179186683052376,14,1,0
herb****,16nOp,건희와 그 애미가 주가조작을 상습적으로 하여 수십억원 번 것을 다 알면서 양심을 버리고 권력의 부스러기를 얻기 위해 직무 유기한 검사들이다. 엄벌한 사회 찌꺼기임,True,1,2025-03-06T22:49:12+0900,853178237042294871,13,0,0
05ba****,1RAo6,이런 돌아이 윤석렬이를 감싸는  국적당 놈들도 다음 선거때..무조건 아웃시켜야 한다. 뻔뻔한 놈들,True,1,2025-03-07T00:28:27+0900,853184631862722663,13,1,0
pbh7****,bJ7FK,굥건희 평생 빵에서 썩고 관련 개검들 전부 구속하라,True,1,2025-03-06T19:53:44+0900,853166933091025168,12,1,0
bsle****,,,False,1,2025-03-06T21:35:17+0900,853173475584507984,0,0,0
dodo****,4oAeG,역사를 갈아치웠다.나라의 근간을 흔든 희대의 악녀.장녹수니 장희빈이니 얘네들은 발톱의 때밖에 안되는 수준이며 최서원을 심지어 애처롭게 만든 악녀.반드시 그에 상응하는 처벌과 처분이 있어야한다.,True,1,2025-03-06T19:56:14+0900,853167093531541594,11,1,0
sgh2****,,,False,1,2025-03-06T22:50:43+0900,853178334819909900,0,0,0
cbkh****,eFr8J,대통령의 권력을 마누라 지키는데만 썼구나,True,1,2025-03-06T23:13:23+0900,853179794773246114,10,1,0
unti****,42kT4,그래서? 결국 계엄의빌미는 거니가 문제였네! 천하역적친일매국노윤씨!,True,1,2025-03-06T23:35:31+0900,853181221037932729,9,0,0
stwa****,1tfMW,검사 탄핵뿐 아니라 명태균 폭로도 도화선이 됐겠지,True,1,2025-03-06T21:56:08+0900,853174818885861426,9,0,1
skyw****,1e0vf,"공들인 검사 3명 탄핵되고, 재수사 들어가게 되었을때, 도와주는 검사 걸릴 확률 싸움에서, 명태균 수사를 막아줄 사람이 없다는게 문제라서 터트린거 같은데....  도이치나 삼부는 이미 증거자료 같은건 깨끗하게 지웠을거고, 명태균은 얼마나 들거 있는지 모르니까.. 일부 넘어간 자료 있는거 알고 있고.. 찝찝하니깐 다른 프레임 각 잡으려고..",True,1,2025-03-06T21:42:16+0900,853173925079679066,8,0,0
j_******,LYwT,무당들이 여자때문에 패가망신 죽음에 이른다는 말은 안해주더냐 ㅎㅎㅎ,True,1,2025-03-07T07:57:13+0900,853213543451852856,7,0,0
sese****,2RMaZ,콜검 3마리와 명태 1마리 때문에 비상계엄한 정신병자.,True,1,2025-03-07T05:41:51+0900,853204822420095040,7,0,0
ux75****,532P5,검사들에 붙은  사기꾼 김건희 모녀와  증거조작하고 특활비  팡팡쓰던 특수부 검사들이  망쳤다. 검찰도 망가뜨렸고 나라도 망쳤다,True,1,2025-03-06T21:43:56+0900,853174032638411074,7,0,1
kim2****,,,False,1,2025-03-06T21:34:55+0900,853173451072995629,0,0,0
osir****,27hqc,계몽령 거짓말이 이렇게 들통났는데 광화문 여의도 탄핵반대시위 참가자분들 곧 현타 강하게 와서 이불킥할테니 빨리 탈출하세요. 남은 여생이 괴롭고 가족들에게도 지탄 받습니다. 플리즈~!,True,1,2025-03-06T22:39:44+0900,853177627089830151,10,4,0
kiss****,27v6V,저 범죄자부부땜에 나라꼬라지가 어휴....국짐은  책임지고 해체해라....내란옹호당아....,True,1,2025-03-06T22:56:26+0900,853178702811365519,8,2,0
rcw7****,1rGlO,모지리가 지마누라 살리자고 나라와 국민을 죽이는 반헌법적계엄을 하다니...익히 추정이 가능했던대목이라 놀랍지도 않지만 저런 모지리를 리더로 뽑아놓고 온국민이 농락을 당했다. 두년놈은 사형을 통해 일벌백계 하여야 이나라가 산다,True,1,2025-03-07T12:39:00+0900,853231697087430661,6,0,0
fred****,,,False,1,2025-03-07T06:24:18+0900,853207557005639713,0,0,1
jji9****,dmFjf,"콜걸 기둥서방 하느라고 내란수괴까지 오르고 네놈 
참 이해불가한 個自食이다. 사형당해서 갚아라. 네 죗값은~~",True,1,2025-03-07T05:13:48+0900,853203015060947015,6,0,0
ljj3****,,,False,1,2025-03-07T05:07:47+0900,853202627507257396,0,0,0
rana****,HTsx,김거니 무혐의가 말이 되나 ㅋㅋㅋㅋㅋㅋㅋㅋ 검사 세마리 돌았네 ㅋㅋ,True,1,2025-03-06T21:52:57+0900,853174613499183415,6,0,0
kiky****,1emqL,콜걸 한마리 때문에 나라가 이렇게 엉망이 되었다는것에 웃음도 안나온다ㆍ그런데도 저런 잡탕작부를 여적 구속도 시키지 못하구 있구나 ㆍ,True,1,2025-03-06T20:31:23+0900,853169358506033275,6,0,0
dobi****,7N5aF,"윤두창 그래서 이재명  무죄준 판사를 잡아 주기려  한거냐?

무식하고 포악한 윤서결",True,1,2025-03-06T20:02:15+0900,853167481655656520,7,2,0
leon****,30nh3,지를하네 윤석렬을 사랑꾼처람 포장하지.마라 그동아누여러 횡포들이 있었고 명태균 녹취록 보고서가 올라오고 때마침 건희불기소 처리에 성난민심이 검사탄핵을 외친거였고 검사르루지켜주지 못하면 그 화살이 자기에게로 향할게 두려웠던거지 건희때문은 무슨 언론아ㅜ제대로 써라 좀!!,True,1,2025-03-06T20:02:48+0900,853167517290463476,6,1,0
newb****,1JTFZ,60대70대꼴통태극기들아.. 이기사에 나온 팩트증언이라도 봐.. 니네는 지지하고 싶냐? ㅡㅡㅋ,True,1,2025-03-07T12:27:27+0900,853230952665579693,5,0,0
kokj****,1kPxk,범죄자 마누라 지키려 나라를 시궁창으로 모는 대통령과 국짐당 졸개들~,True,1,2025-03-07T06:28:46+0900,853207844818780250,5,0,0
cxg1****,2fOd6,모든 원흉은 주가 조작범 김건희😡지가 지은죄 무혐의  준 콜검들이 검사 탄핵으로 탄핵되면 김건희 특검 통과할까봐,True,1,2025-03-07T05:53:51+0900,853205595078000717,5,0,0
good****,4Xq9e,어떻게 이런 자를 대통령으로 뽑았는지 너무 원망스럽다.공적 의식이 전혀 없는 사람이다.,True,1,2025-03-07T05:41:53+0900,853204824013930568,5,0,0
redb****,HItr,저딴 것들 좋다고 숭배하는 극우 돌아2찍들 ㅉㅉ… 너넨 그냥 한국을 떠나라,True,1,2025-03-07T05:37:17+0900,853204528130949142,5,0,0
gree****,3dpfo,"이번 내란사태로 나라망치고 국가를 사유화하고 자신이 왕이라곳여기고 개검왕조를 획책하던 윤석열의 탄핵 법정최고형은 기본이고 ᆢ이어서 온갖범죄온상 김건희와 개검 사법부파괴폭동세력, 폭동교사범등 주요조력자들 모두 단죄처벌 정리정돈해야 
나라가 바로서고 제대로된 나라 올바른나라가된다",True,1,2025-03-07T05:03:28+0900,853202348871254056,5,0,0
reme****,xAo7,국가에서 둘 다 평생 관리해줄거니 좋겠다 근데 나는 윤거니 니들 두 바퀴벌레가 지구에서 사라져줬슴 좋겠다,True,1,2025-03-07T00:12:20+0900,853183593302720612,5,0,1
azaa****,,,False,1,2025-03-06T21:02:48+0900,853171382710698278,0,0,0
sung****,,,False,1,2025-03-06T20:57:58+0900,853171071375901005,0,0,1
ksd4****,46jBd,템버린 하나가 나라를 초토화 시켯네... 내 볼땐 도이치주가조작도 있지만 삼부토건 주가 조작질에도 깊숙히 관여해 특검수사시 뽀롱날게 급하니 제정신이 아닌 상황에서 무리하게 내란을 일으켯어. 참 대단한 놈이야...,True,1,2025-03-06T22:13:37+0900,853175944955822366,6,2,0
ksd9****,35woW,"마누라 하나 때문에 나라를
이 지경으로  만들다니
이게 사실이면  국민은 용서안한다",True,1,2025-03-07T07:11:09+0900,853210575612674072,5,1,0
redr****,5CdZ3,내란의 뿌리는 국짐,True,1,2025-03-06T19:51:27+0900,853166785770291357,5,1,0
allg****,pF15,결국은 김거니 지키기로 계엄선포했는데 배경음악으로 부정선거를 깔았고 중졸 고졸들이 덥석 미끼물고 부정선거어쩌구 한거네.,True,1,2025-03-07T10:37:51+0900,853223892158775650,4,0,0
jnh3****,,,False,1,2025-03-07T10:25:21+0900,853223086130987125,0,0,0
love****,dFY,도이치는 암것도 아니더만 삼부토건 주가조작까지 저 여자는 정말 돈욕심이 끝도 없는 인간임...대왕고래도 얼마나 해먹을 결심을 했을지 ㅉㅉ,True,1,2025-03-07T09:49:37+0900,853220783776858351,4,0,0
zayo****,1sj0n,jtbc 아주 소설 쓰고 자빠지셨구만. 최순실 테블릿 사건을 재미보더니 소설이 자랑거리가 된 제티비씨는 파폭하길. 이 글에 동조당하는 사람들도 수준하고는.,True,1,2025-03-07T09:28:02+0900,853219393331527697,4,0,0
blac****,,,False,1,2025-03-07T08:26:21+0900,853215419765358697,0,0,0
skim****,dZ78q,남을 그렇게 탈탈 털었으면 김건희 꺼도 터는 시늉이라도 했어야지 이건 모 국민들을 눈뜬 장님으로 취급하니 언제까지 뭉갤수 있을거라고 생각했냐.,True,1,2025-03-07T08:25:50+0900,853215386915569890,4,0,0
leek****,2GT1S,"명신이 명신이 명신이   김거니 양평고속도로 종점변경 해가지고 무당 청공 명태균 한심한국짐당 김거니 손절해라 용산을왜가냐돈들어차밀 공사수의계약하러갖냐 계험을해가지고 껌뻥가냐 서렬이 바보 
명신이 명태균 명신이 명태균!!!..,,,/",True,1,2025-03-07T08:10:14+0900,853214381004030016,4,0,0
nnam****,bpUOo,"지 부인 방탄하려고 계엄한게 맞잖아. 특검 거부하는게 범인이라더만 그거 덮으려고 한게 맞는거야.
저런 모지리가 대통령이라고...이구...",True,1,2025-03-07T07:56:11+0900,853213476460429350,4,0,0
skak****,,,False,1,2025-03-07T07:13:57+0900,853210755447652524,0,0,0
jaja****,4P06L,마누라를 위해 계엄했다기보단 마누라가 V1이니 바지 사장은 시키는대로 했을듯. 계엄실패 후 엄청난 부부싸움 났을 듯. 그것도 하나 제대로 못한다고 다 집어던졌다에 한표,True,1,2025-03-07T06:42:08+0900,853208705255079953,4,0,0
star****,,,False,1,2025-03-07T05:59:54+0900,853205984410075218,0,0,0
yk******,1vNK5,다시는 이런 일이 반복 되지 않게 사형시켜 역사의 본보기로 남겨야 한다.,True,1,2025-03-07T05:35:13+0900,853204394416537616,4,0,0
mig3****,4jIEL,개검들 전부 물갈이해야 함 다 한통속,True,1,2025-03-07T05:15:50+0900,853203146174890038,4,0,0
doro****,eVNeh,누가 보면 엄청 사랑꾼 같은데 사실 줄리가 지시를 했겠지만 윤돼지도 가담하고 얼굴마담 시켜서 하고싶은데로다하면서 떡고물 받아먹었잖아..그냥 지 죽기싫어 계엄때린거 맞아 ..감사탄핵은 무슨 거기다 명태균도 있도 ...이래나저래나 죽을거같거든,True,1,2025-03-07T05:04:08+0900,853202391770595334,4,0,0
heyl****,4M0uR,별개 다 대통령되서 나라가 개판이네!! 앞으로 검새출신은 영원히 총리도 시키지말아야!!,True,1,2025-03-07T01:24:00+0900,853188209788583939,4,0,0
3spd****,iPDh,거니가 실세니  계엄도  거니가  주도했다는  개소리로 들린다. 썩열이는 뒤에서  거니가 시키는대로 한 것으로 들려.  정권바뀌면 수사해서  거니의  행적 밝혀야한다.,True,1,2025-03-07T00:39:42+0900,853185356437127312,4,0,0
2376****,5oWHb,검사 3명은 탄핵여부와 상관없이 검사로서의 본분을 저버린 그야말로 권력의 주구일뿐이다!,True,1,2025-03-06T23:21:17+0900,853180304246964330,4,0,0
psy6****,,,False,1,2025-03-06T22:42:36+0900,853177811840532695,0,0,0
view****,3JEN0,거니 수사 무마한 검사3 탄핵햇다고 계엄...거니가 세상 전부 였네 모자른 넘이.. 이ㅜ소동을 발이고,True,1,2025-03-06T21:57:40+0900,853174917737218261,4,0,0
lskd****,1XJBd,"마누라님 지키시고 장렬히 전사 하면 되겠네요 ... 뭐 이젠 지키는 것도 어렵게 됐지만...

고인이 되실거 같으니 미리 명복을 빕니다...

계엄 마구잡이로 하는 저 세상 에서 행복하게 사세요... 알콩달콩...도란도란 ...오손도손....",True,1,2025-03-06T20:44:38+0900,853170212063674627,4,0,0
woos****,bXw6c,결국 쥴리를위한 쥴리의의한 쥴리의 계엄이었구만~예끼~ 상 모지리팔불출아~,True,1,2025-03-06T20:08:11+0900,853167864293621818,4,0,0
parr****,f8xR,드러운짓만 일삼은 여자 하나가 감옥 안가려고 독재를 계획하고 실행했네.,True,1,2025-03-06T21:21:32+0900,853172589227409614,5,2,1
sun2****,2DWn8,올해안으로 윤두창 사형집행 거니명신이 무기징역 때려 사기부부 처단하자,True,1,2025-03-06T19:50:53+0900,853166749414064399,5,2,0
teab****,5u9Li,역사사 가장 천박하고 멍청하고 혐오스럽고 쪽팔린 접대부정부의 술돼지,True,1,2025-03-07T10:57:24+0900,853225151490162847,4,1,0
jsyo****,ckLeB,계엄이 김건희와 관련된건 기정사실이다. 김건희 특검도 찬성 2명만 더 있으면 통과될 상황이었고 김건희 무혐의 검사 탄핵되면 김건희가 이슈화되 구속될 거란 생각이 모지리 머리에 꽉 찼던거다.,True,1,2025-03-07T07:44:51+0900,853212746383098028,4,1,0
beli****,,,False,1,2025-03-07T04:12:55+0900,853199092212301887,0,0,0
toco****,26XmU,철없는 조선제일의 사랑꾼. 국민은 오간 데 없고 오로지 지들 목줄을 조여오니까 내린 비상계엄. 사형에 처해야.,True,1,2025-03-07T01:38:37+0900,853189151997034583,4,1,0
simp****,,,False,1,2025-03-06T23:38:07+0900,853181388474548257,0,0,0
some****,2Hjji,국가권력을 업고 나라를 무법천지로 만들려했다는게 끔찍하다. 무식한 사람이 신념을 가지니깐 사악해지는거지. 부창부수,True,1,2025-03-06T21:11:09+0900,853171920756015151,4,1,0
spec****,4p5Bm,윤돼지야 택핵거부를 대체 몇번을 한거니?  거부 안하고 떳떳하게 특검 받았으면 빵에 들어갈일도 없었을텐데. 정상적인. 사고가 안되고 그렇게 죄가 많았니?  특검 거부 하는자가 범인이라메 ~~~~,True,1,2025-03-06T21:06:10+0900,853171599052898368,4,1,0
jyh1****,TVhc,저 검사들은 파면해야한다~~~,True,1,2025-03-07T13:06:29+0900,853233467687698623,3,0,1
nugu****,1TvSv,빨리 끝나면 좋겠다 너무 힘들다 진짜,True,1,2025-03-07T12:52:47+0900,853232585189359894,3,0,0
dmsg****,6LtRq,내란수괴 정권 정리하고 새로운 세상 기대한다 나라가 너무 어지럽다 대통령이 앞장서서 나라 망치고 있으니..,True,1,2025-03-07T12:31:45+0900,853231229086990655,3,0,0
g945****,2qDv8,"[단독] ""내일 탄핵되면"" 김 여사 무혐의 검사 탄핵이 계엄 '방아쇠'....로미오와 쥴리엣을 능가하는 세기의 한국 범죄자 커플의 로맨스...""윤완용과 쥴리"" ㅋㅋㅋㅋ 글로벌 호구 무식, 무능, 핫바지 윤완용과 화류계 걸레 출신 쥴리의 눈물겨운 막장 스펙터클 판타지 호러 로맨스 드라마....그녀를 위해서라면 난 위헌적 계엄이라도 터뜨리고 장렬히 총살로 생을 마감하리라....",True,1,2025-03-07T12:15:48+0900,853230201599951146,3,0,0
sych****,,,False,1,2025-03-07T12:06:27+0900,853229599868321965,0,0,0
qeen****,Bvzr,"이걸 떠나서 중국 속국되길 바라는 인간들 진짜 많네
우원식 시진핑만난것도 그렇고 문재인때 김치 한복 한복매듭 태권도를 중국자기들꺼라고 한것 기억나지? 한국을 홍콩처럼 만드려는 계획 눈치 못챔? 이제 넘어가면 끝나는거야",True,1,2025-03-07T11:30:45+0900,853227299963666697,3,0,0
jeon****,3ueNE,탄핵된 껌 3명 변호사질도 못하게 해야 한다,True,1,2025-03-07T11:15:12+0900,853226297877332052,3,0,0
rudr****,7bowu,지 마누라 지키겠다고 내란 일으킨 정신병자,True,1,2025-03-07T09:58:51+0900,853221379317694794,3,0,0
suki****,,,False,1,2025-03-07T09:49:40+0900,853220787283296513,0,0,0
gutt****,4gFr2,결국은 김건희 때문인데 부정선거며 야당의 패악질이며 뭐며 헛소리를 그렇게 한 건희? 적어도 윤내란이 김건희 쳐냈으면 이지경은 안났을거다. 꼴좋다..!! 나대지 않고 내조만 한다는 약속만 지켰어도 이렇게 안됐겠지? 주가조작 들켰는데도 대통령 영부인 된 다음에 끊임없이 해대더니 결국은 벌 받아야 하겠구나~,True,1,2025-03-07T09:22:22+0900,853219029081391254,3,0,0
onyr****,3ZqXf,지마눌 특검에 명태폰 반납되니 술처묵고 계엄! 이게 정답이지,True,1,2025-03-07T08:23:40+0900,853215246658044083,3,0,0
sads****,1IbLh,결국 사적 보복을 목적으로 계엄를 한거네...도대체 이 인간들은 그 사악함의 끝이 어디인지 모르겠다. 이런 인간들이 대통령 행세를 해왔다는데 소름이 끼친다. 이 모든걸 알면서도 아직도 국민을 개돼지로 알고 속이려고 하는 내란 적극 지지당 국짐당은 해산되어야 마땅하고 여전히 헛소리 하고있는 인간들은 모두 법적 책임을 다 물어야한다. 내란세력들 뿌리를 뽑아야함...,True,1,2025-03-07T07:40:54+0900,853212492023726238,3,0,0
sun9****,1yrCL,결국은 지 마누라한테 우호적인 검사들한테 보답하는 계엄 이었네 모든게 거니를위한 거니에의한 거니만의 세계관 사랑꾼 나셨네,True,1,2025-03-07T07:25:21+0900,853211489887060021,3,0,0
mimi****,,,False,1,2025-03-07T06:52:48+0900,853209392651174003,0,0,0
choh****,cs4Za,"사악하면서도 멍청하고, 큰일은 저지르면서도 허술하고, 친위 쿠데타를 일으킬 정도로 무모하면서 책임질 배짱과 용기는 없고, 권력욕으로 새카만 심장을 가졌으면서 그 권력으로 뭘할지는 새하얀 백지같은 뇌를 가졌고, 부인은 두려워하면서 국민은 두려워하지 않는 윤석열 당신은 최악의 하남자다.",True,1,2025-03-07T06:37:19+0900,853208395849662496,3,0,0
pili****,8JxyO,역시 검찰이 문제였군!  권력의 개 노릇을 하는 사냥개로 전락한 검찰이 문제다.  그냥 기소청으로 하는게 맞다.,True,1,2025-03-07T06:31:03+0900,853207991669751812,3,0,0
love****,3QiP1,도대체 대한민국 모든 정부기관들이 대통령이 김건희 하나를 위해 발벋고 나서는 이유가 뭐니? 마녀인 건희? 치맛바람에 휘둘리는 이유가 뭐니? 당췌... 이게 나라냐!,True,1,2025-03-07T05:50:24+0900,853205372897329178,3,0,0
