user_nickname,userIdNo,comments,visible,replyLevel,regTime,parentCommentNo,sympathyCount,antipathyCount,replyAllCount
jj84****,18P63,마누라 살릴려고 계엄했구나 억울하면 오히려 특검받아들이고 아무것도 없음을 증명해서 정치적으로 분위기를 뒤집었어야지 잘못한게 없는데 뭐가 두렵나? 총선도 측근살린다고 말아먹고 마누라 살리겠다고 계엄하고 대단하다 민주당하는짓도 답없는데 이건 머 패악질로 권력양도 강하게 하는구만 여야 어디도 답안보이는 최악의 저질정치꾼들을 보고있으니 노대통령의 웃음이 더욱 그립다 앞으로 그런사람이 또 나올수있을까?,True,1,2025-03-06T19:54:29+0900,853166981224857747,2,0,0
s77h****,2bJFlc,거니 똥개가 주인지켜려고 개엄한짓,True,1,2025-03-06T19:48:17+0900,853166581927116899,2,0,0
vite****,1ESu5,모자른놈 지 마누라 하나 지키겠다고 이난리를 피웠다고? 대한민국 대통령이? 에라이,True,1,2025-03-07T10:26:52+0900,853223184177037647,3,2,0
kbj7****,3slVC,역쉬 좌파방송 기자들 아니랄까봐 ᆢ 김건희에게 무혐의 내린 검사라서가 아니라  거대야당의 횡포가 극에 달해서다 ᆢ 그전까 탄핵이 몇차례였으며  예산삭감이 얼마였냐 ᆢ 국정마비를 시켜 무능한 대통령을 만들려고 하는데 ᆢ 계엄은 거대야당이 자초한 일이고 ᆢ 거짓 좌파언론에 속아 거대야당을 만들어준 국민들이  원망스러울뿐이다,True,1,2025-03-07T09:38:27+0900,853220064604717259,3,2,0
zint****,,,False,1,2025-03-07T09:30:48+0900,853219572126318887,0,0,2
minj****,t0cz,개염날 생각하면 아직도 어벙벙하다....내란은 사형 탄핵,True,1,2025-03-07T07:27:50+0900,853211649740374155,3,2,0
sons****,2DZkX,"JTBC랑 MBC, 민주당이 왜 자꾸 김건희 물고늘어지는줄 알아? 박근혜 때 최순실로 선동한게 완전 효과 제대로 였거든. 기사보는 사람들이게 대통령과 그 주변인에 대한 증오심을 심고 반복된 기사로 도배하면 사실이든 아니든 그냥 이름만 봐도 아주 징글징글해 하거든. 그리고 그렇게 한 나라의 대통령을 끌어내렸거든. 제발 이제 눈을 뜹시다 여러분.",True,1,2025-03-09T17:55:01+0900,853437598155145222,2,1,0
ckhb****,9Ijwh,"콜걸 지키려고
발악을하는구나",True,1,2025-03-07T12:34:42+0900,853231419659387127,2,1,0
somi****,1aZsq,사형만이 답이다 나라를 쑥대밭을 만들어 놓고 죄값도 안받는 이 상황이 말이되냐,True,1,2025-03-07T11:38:46+0900,853227816567701799,2,1,0
sind****,2dxgB,이런 쓰레기보다 못한 놈을 뽑고 지금도 목소리 터져라 길거리에서 교통방해하는 놈들은 머리속에 뭐가들었나.,True,1,2025-03-07T10:59:02+0900,853225256901410833,2,1,2
blue****,1ZOcD,"윤내란수괴범은 마눌 커버하려라 대똥질 한거임.
모든 이슈들의 종점은 조작녀마눌!!",True,1,2025-03-07T10:57:20+0900,853225147362967677,2,1,0
hjkk****,,,False,1,2025-03-07T10:41:56+0900,853224155158413678,0,0,0
smen****,2bYSFt,모든 길은 거니보살로 통한다...이러한 보살을 보유한 2찍분들은 좋것소 ...,True,1,2025-03-07T10:31:59+0900,853223513933218187,2,1,0
wnrx****,3e8Z1,국민은없고 지마누라지키기위해 그자리간거였던거니...,True,1,2025-03-07T10:07:43+0900,853221950514790665,2,1,0
ya72****,gUBY,2찍들은 김전장관의  진술도 조작이라고 멍멍랄 떨겠지?   저런걸  추종하고 교주처럼 모시는 2찍들 참 불쌍하다....   결국은 최초 얘기 한 대로  마누라 때문에 계엄이 맞았네 ㅎ,True,1,2025-03-07T09:33:49+0900,853219766809133351,2,1,0
2005****,,,False,1,2025-03-07T08:55:47+0900,853217315624321249,0,0,0
joes****,2hHeC,"아 윤석열…… 이 정도로 잡배 수준일줄이야…저런거 믿고 세금 내고 있는 내가 불쌍하고, 대한민국 국민이 불쌍하다.",True,1,2025-03-07T08:18:18+0900,853214901433270370,2,1,0
sbtk****,T3J2,남가족 터는것 전문가인데 내가족 터는건 화가나 견딜수없어 죄가 태산맘큼 쌓여도 털끝도 건드리면 안되는 윤수괴,True,1,2025-03-07T02:27:38+0900,853192309418754100,2,1,0
kmg7****,1xPDH,결론은 지마누라 지킨다고 비상계엄 선포한거자나ㅋㅋㅋㅋㅋㅋㅋㅋㅋㅋㅋㅋㅋ,True,1,2025-03-07T00:02:31+0900,853182960986226827,2,1,1
lhj2****,16NhP,기가 찰 따름ㆍ 지금도 관저에서 별짓거리 다하고 있는 저 여자 당장 끌어내고 법앞에 세워야 한다ㆍ,True,1,2025-03-06T22:57:59+0900,853178802602246491,2,1,0
thom****,1dvgr,JTBC 국가와 국민을 위해 헌신의 노력을 하시네요... 정말 멋진 방송 매체 입니다. 방송국 이미지 보다 국가와 민족 현 국민들을 위해 모든 노력을 다 하시는 JTBC 파이팅 입니다.,True,1,2025-03-06T22:54:00+0900,853178545961172999,2,1,0
dxsu****,d0dR7,명태균때문이다.  12월2일날에 민주당한테넘길려고하는내용. 그뒤에 김건희특검이있기땜에 불안한거죠,True,1,2025-03-06T22:30:49+0900,853177053392929100,2,1,0
smen****,2bYSFt,기둥서방의 비참한 말로가 예외없이 그려지네요...,True,1,2025-03-06T22:27:35+0900,853176844264931555,2,1,0
groo****,6ahZE,볼수록 들을수록 참 모지리입니다 여인네 치마폭에 휘둘리는  대통령이라니,True,1,2025-03-06T22:23:33+0900,853176585174384833,2,1,0
jm04****,2zkAe,윤가의패악질은종지부를찍자 사형이 최선이다,True,1,2025-03-06T22:23:22+0900,853176572859908228,2,1,0
ljk6****,2nvWO,공징한 방송을 해라. 왜그리편파방송이냐.mbc.jtbc,True,1,2025-03-06T22:08:03+0900,853175586040840213,2,1,0
ilov****,5fFQF,주가조작한 지마누라 살리겠다고 계엄.에라이 넌 이번주 탄핵이다,True,1,2025-03-06T22:07:39+0900,853175560472363224,2,1,0
dhdl****,1KTkB,개인 비리를 감추기위해 국가 존망을 두고 장난질을 한 정신병자 윤석열은 사회와 영구히 격리시켜야 합니다.,True,1,2025-03-06T22:06:33+0900,853175489756397753,2,1,0
skim****,dZ78q,너도 니 가족 건드리면 열받지? 그렇게 증거가 차고 넘치는 네 마누라는 털끝 하나 못건드리게 하면서 남의 가족은 표창장 하나로 난장판 만들고 잘 살수 있을거 같았냐.,True,1,2025-03-06T21:20:54+0900,853172548257448279,2,1,0
smil****,1sX9A,영구독재 음모 내란수괴 윤썩열을 사형시켜라 !!!,True,1,2025-03-06T21:18:58+0900,853172424424816978,2,1,0
free****,2bvvkW,특검을 왜 거부합니까 죄가 있으니까 거부하는겁니다 윤석열이 한말이자나 김거니특검을 왜 거부하냐 그렇게 여러번 거부하니까 탄핵한거 쟈나 거니가 V0 윤은 거니 부하 쟈나,True,1,2025-03-11T19:39:29+0900,853629871224520870,1,0,0
hyhy****,,,False,1,2025-03-10T13:43:30+0900,853514165879308521,0,0,0
pili****,8JxyO,접대부 하나가 계엄으로 연결되는 아주 골때리는 정권!  현재까지는 접대부의 세상이군!,True,1,2025-03-09T09:19:51+0900,853404409332236470,1,0,0
friv****,,,False,1,2025-03-07T20:59:24+0900,853263934390534281,0,0,0
stor****,4nitg,네네 두달이 지난 김건희 방탄계엄이네요 명태균 써먹어도 효과가 없니?,True,1,2025-03-07T14:22:42+0900,853238377137307956,1,0,0
happ****,,,False,1,2025-03-07T13:43:34+0900,853235856293495033,0,0,0
roma****,7i4jw,대통령 당선 전부터도 김건희가 문제였는데...결국엔 김건희 때문에 이렇게 되었구나...,True,1,2025-03-07T13:27:24+0900,853234814562599059,1,0,0
wj69****,3rqm8,에휴  마누라땜에 나락으로가네 어차피 탄핵되고 감방가면 이용가치 떨어져서 건희가 이혼하자고할텐데. ㅉㅉ안쓰럽기까지하구나,True,1,2025-03-07T12:48:53+0900,853232333749223754,1,0,0
yang****,4ZcmR,"JTBC MBC 이언론사들 댓글창이
완전 중국인들 놀이터네 누구지령받고 이렇게 선동하눈건지 죄다 중국IP네여 ㅋㅋㅋㅋ",True,1,2025-03-07T12:42:53+0900,853231946497524084,1,0,0
yck5****,3Urad,사적으로...권력을 남발한 검사는...국민이 준 권력을 반드시 회수해야 마땅하다,True,1,2025-03-07T12:42:19+0900,853231909956747388,1,0,0
fkdl****,2sfQ9,지겨워 빨리사형시켜,True,1,2025-03-07T12:41:18+0900,853231844525605000,1,0,0
joho****,1oYMl,"건희 튀었더라..,  한남궁 경호 보안이 요즘 느슨해졌더라... 지나가는 사람 막지도 않고... 망명 준비중인가..?",True,1,2025-03-07T12:34:37+0900,853231414726885611,1,0,0
rlad****,bSX2u,이제 그만 좀 했음좋겠다 빨리 계엄 전의 그저그런 일상으로 돌아가고싶다..썩은 부위는 도려내고 새살이 돋아나길...,True,1,2025-03-07T12:17:38+0900,853230319694774505,1,0,0
jayo****,90Mfq,거니야 너 때문이~야 너 때문이~야 계엄은 너 때문이야~ 나라를 망친 ㄴ여ㄴ,True,1,2025-03-07T12:15:58+0900,853230212924572006,1,0,0
kdyd****,4dbLL,기가찬다,True,1,2025-03-07T12:11:23+0900,853229918014668948,1,0,0
agad****,6gimO,모든것이 술집작부의 지시였네,True,1,2025-03-07T12:09:16+0900,853229781213249638,1,0,0
tntn****,4eKAq,하찬은 템버린 흔들녀 개잡부 때문에 모가지 흔들어데고 인셍 죠졋네  사형 잘가  !,True,1,2025-03-07T12:07:40+0900,853229678503133437,1,0,0
vdvh****,13rVh,검새 3마리 지킬라고 계엄을하다니.. 국격 바닥치는소리니,True,1,2025-03-07T12:06:44+0900,853229618121933070,1,0,0
lim3****,1X6NK,그 3명  🐕 검   누군가요,True,1,2025-03-07T11:57:14+0900,853229005501890677,1,0,0
hoel****,1wxW7,마누라구하기가 계엄의 단초라. 써글노무스크.,True,1,2025-03-07T11:51:21+0900,853228626538135689,1,0,0
powe****,2aZ3r,곽종근이 민주당에 협박 회유 당한 뉴스 한줄 없네 친중언론,True,1,2025-03-07T11:45:20+0900,853228238967668876,1,0,0
tkfk****,2ApS6,이 인간들 민주당 방탄이니 뭐니 거품무는데 결국 김건희 방탄내란이네,True,1,2025-03-07T11:40:14+0900,853227911090536553,1,0,0
jis9****,5pEHU,답이 없네.. 에라이 정신병자야!! 그냥 바로 기 내려오라. 헌재 애들은 먼 죄가 있니.. 만약 너 때문에 애꿎은 전의경 다치면 넌 바로 총살감이야.,True,1,2025-03-07T11:40:13+0900,853227909312151655,1,0,0
bigp****,2m1LT,이 놈은 시작과 끝이 모두 쥴리네,True,1,2025-03-07T11:36:11+0900,853227649248526409,1,0,0
jmin****,8m8Gj,묻지마난동범은 평생을 감옥에서 보내는게 본인 건강에 좋습니다.,True,1,2025-03-07T11:24:18+0900,853226883821600892,1,0,0
minl****,,,False,1,2025-03-07T11:19:47+0900,853226593391214913,0,0,0
jhki****,,,False,1,2025-03-07T11:18:04+0900,853226482711920668,0,0,0
jhki****,,,False,1,2025-03-07T11:14:25+0900,853226246908149940,0,0,0
peak****,,,False,1,2025-03-07T10:58:02+0900,853225192376238099,0,0,0
sfcs****,T2OL,참!! 한심하고 정신나간 대통령이다!!! 우쩨 저런놈이 우리나라 대통령이 되었을까!?,True,1,2025-03-07T10:55:44+0900,853225043495223574,1,0,0
kyhe****,3x2ap,도대체 이 부부 사기단은 파도파도 끝이 없구나...참 우리나라가  쉽구나..올해 내내 특검하다 끝나겠다....,True,1,2025-03-07T10:54:15+0900,853224948670398568,1,0,0
you2****,1kONe,"결국 술집작부 출신, 본인 마누라 건드렸다고 국민들 상대로 계엄 했다는거네.",True,1,2025-03-07T10:54:12+0900,853224944559980645,1,0,1
jiyu****,5tutA,거니 사기친돈 100억 빵에 드갈때 같이 너줘라 고기서 평생쓰고살아,True,1,2025-03-07T10:47:21+0900,853224504191615127,1,0,0
chlw****,1kvrr,기승전결 모두 김건희가 있는거보니 김건희 특검은 무조건 해야 이사단이 조금 마무리되겠네,True,1,2025-03-07T10:46:48+0900,853224468506476857,1,0,0
jsj5****,3dq9d,니들이 무슨 난장판으로 난리를 부려도 죄인때부터 무죄였잖니?,True,1,2025-03-07T10:45:42+0900,853224396901318982,1,0,0
ddso****,18Aaa,시간이 지날수록 퍼즐이 하나씩 완성되는군. 예상대로 거니가 문제였네.,True,1,2025-03-07T10:44:56+0900,853224348364833186,1,0,0
alex****,c0Bl9,대통령이라는 자리는 자신의 권력을 휘두르는 자리가 아니고 국민을 대표해서 국민을 위한일들을 하는자리인것을 정치인들에게 교육시켜야 합니다.,True,1,2025-03-07T10:40:03+0900,853224033188053020,1,0,0
bond****,1JWtA,걸레가 나라를 걸레로 만들었네,True,1,2025-03-07T10:38:42+0900,853223946684727606,1,0,0
mska****,4i8HT,지금도 관저에서 사생결단 진행중...세상 이런 검은 양파는 없을듯..,True,1,2025-03-07T10:38:35+0900,853223938380005610,1,0,0
midi****,1egq4,진짜 세상 조롱거리로 100년간 풍자될 개그같은 계엄이다 ㅋㅋ,True,1,2025-03-07T10:37:37+0900,853223876706959628,1,0,0
unfo****,kAe2,"Of the 건희, For the 건희, By the 건희 ㅋㅋㅋㅋ 대체 결혼을 노예계약으로 한건가? 사랑꾼? ㅋㅋㅋ",True,1,2025-03-07T10:37:34+0900,853223873770946791,1,0,0
kyk3****,3r5a3,"잘못했지  처다봐도  탄액되는세상인데,,,,,",True,1,2025-03-07T10:33:36+0900,853223617733853427,1,0,0
redd****,6mJWh,김건희가 실세였어  2찍들이 이래서 김건희 김건희 한거지 지들도 김건희가 실세라는걸 알았다는거지 그런데도 윤완용을 옹호한다는건  나라망칠계획이었던거지,True,1,2025-03-07T10:29:45+0900,853223369280061732,1,0,0
pgs4****,3uaEq,소설을 써라 맨날 뇌피셜로 기사를 쓰는 것이 기자인가,True,1,2025-03-07T10:29:15+0900,853223337671786585,1,0,0
bksl****,w4kA,검사3명 ㅠㅠ 곳곳에 이런 사람들이 있어서 울 나라가 이모양 이꼴인듯 ㅠㅠ,True,1,2025-03-07T10:21:41+0900,853222850243330337,1,0,0
taiy****,5VDCr,여자 하나때문에 나라를 말아먹네!!,True,1,2025-03-07T10:21:28+0900,853222836066582733,1,0,0
bjt5****,5gk9h,하루 빨리 탄핵해서 감빵 보내라. 지긋지긋하다.,True,1,2025-03-07T10:19:42+0900,853222722367389956,1,0,0
casi****,jcin,한반도에 고조선 부터 대한민국 모든 역사에서 건희 같은 악녀가 있었나 싶네. 악 이라는 단어가 약하게 느낄 정도에 멍청 하기로는 그 누구랑도 비교 안되는 석렬이랑 듀엣으로 아주 국민들이 똥 지대로 밟았어~ 어쩌냐 국운이 이런것을.....똥치우고 다시 나아가보자.,True,1,2025-03-07T10:19:26+0900,853222705153966256,1,0,0
chiy****,8RWtW,내란범 윤가넘과 2찍이들 사형시켜야한다.,True,1,2025-03-07T10:18:23+0900,853222637977993376,1,0,0
vhcj****,6dLfq,"우리 멍청한 윤대통령은
잘못이 없습니다...뒤에서 조종한
마누라..도사님들이 시키는대로
당한겁니다..ㅋ  주가조작..땅투기",True,1,2025-03-07T10:17:51+0900,853222603517591877,1,0,0
oran****,3lPp4,"정의가 어떤것인지  대한민국 국민에게  반드시 알려야 한다

딸랑 딸랑 딸랑 잘해서 초고속 승진하는 대한민국 쉽게 무너질것이다",True,1,2025-03-07T10:07:13+0900,853221917916659800,1,0,0
jdas****,2ee7U,"윤석열 계엄으로  드러난 범죄자들 모두 처벌해야 한다. 다시는 기어나오지 못하게.
최상목도 박근혜때 살아서 나온 사람이란다.
지금은 국민 뒷목 잡게 하고 있다.",True,1,2025-03-07T10:06:52+0900,853221895670071640,1,0,0
smy5****,autXm,국가 안위보다 우선 한것이 거늬 지키기 였단 말인가!,True,1,2025-03-07T10:05:52+0900,853221830993903967,1,0,0
friv****,,,False,1,2025-03-07T10:00:34+0900,853221489493672172,0,0,0
morn****,3pt71,"윤석열, 김건희 사돈의 팔촌까지 전부 샅샅이 뒤져서 부정 축재한 재산 전부 몰수하고 혐의자들은 전부 구속시켜라. 김건희 남매, 최은순, 고모, 이모, 최은순 내연남 김충식,",True,1,2025-03-07T09:58:28+0900,853221354470637725,1,0,0
dlwl****,3M55s,이래도 지지하는것들은 뇌를열어봐야지??,True,1,2025-03-07T09:50:15+0900,853220825317245021,1,0,0
skep****,6NTzo,대한민국이 지 꺼인줄 아는 정 신 이상자,True,1,2025-03-07T09:49:19+0900,853220764550168698,1,0,0
skh8****,1UgS6,지 마누라땜에 꼴랑 빈정상했다고 나라를 아주 쑥대밭으로 만들어놓다니...,True,1,2025-03-07T09:49:03+0900,853220748192383004,1,0,0
jusa****,3Vm0K,단독 3류 소설,True,1,2025-03-07T09:47:24+0900,853220641287962757,1,0,0
blue****,2MIko,좌티비씨!!,True,1,2025-03-07T09:41:09+0900,853220238248902705,1,0,0
bhri****,2V0XY,"29번 탄핵?............ 이것이 ""내란""?",True,1,2025-03-07T09:30:34+0900,853219556691280080,1,0,0
onel****,1vQCs,모든 국가 권력을 사유한 잡것들.,True,1,2025-03-07T09:12:58+0900,853218423038017841,1,0,0
goss****,,,False,1,2025-03-07T09:09:41+0900,853218211259220183,0,0,0
daeb****,2u8zM,"자기 감정도 제어 못하는 격노다발성 환자는
      대통령하면 절대 안된다!
      논리와 진실로 풀어야 사안이
     격노 때문에 해결 못하고,
     항상 대통령 개인의 생각대로 결론난다!",True,1,2025-03-07T09:07:49+0900,853218091704778978,1,0,0
tkse****,3p6tR,결국 개인을 위한 계엄...재산도 국고로 몰수하고 평생 교도서에서 살아라,True,1,2025-03-07T09:03:09+0900,853217790738300978,1,0,0
yoon****,3KFNz,건희야~~ 그냥 탬버린이나 흔들고 어깨춤이나 추고 성형이나 하고 굿이나 하고 심심하면 직접 작두나 타면서 살 것이지 팔자에도 없는 영부인을 하겠다고 이 난리  붓 르스를 추냐 ㅠㅠ,True,1,2025-03-07T09:01:21+0900,853217674757406812,1,0,0
cona****,1H3Gk,핑계겠지... 독재하려고 한 정황이 여기저기 나타 나는데...,True,1,2025-03-07T08:57:18+0900,853217414056247401,1,0,0
skay****,2nEav,"두부부는 그낭 사회에서 매장시켜야한다.
 나라발전보다는 지들주머니속채우려고 주가조작에 나라를아예 개판만들었지.",True,1,2025-03-07T08:55:32+0900,853217300155728018,1,0,0
kps3****,,,False,1,2025-03-07T08:54:47+0900,853217251132702948,0,0,0
intb****,2jNjH,좌BC 마지막까지 애쓴다. 힘내시라! 중국에서 뒷돈 넣고 불러 줄거야.  더불조작당 &amp; CCP OUT. STOP THE STEAL. 고지가 멀지 않았다.,True,1,2025-03-07T08:54:40+0900,853217243633287394,1,0,1
gura****,1ytVB,희한하게 죽어라 기를 쓰고 수사를 막던데..이유가 궁금해지긴 하네. 대체 얼마나 많은 나으리들과 얼마나 많은 비리가 있길래.,True,1,2025-03-07T08:51:55+0900,853217067002757370,1,0,0
qaz4****,3t7xG,"트럼프는 USA  최우선이고,  윤은 마누라 최우선이 맞았구나!",True,1,2025-03-07T08:51:11+0900,853217019170914349,1,0,0
chwa****,,,False,1,2025-03-07T08:50:30+0900,853216975264940171,0,0,0
mkmk****,lngu,김건희의  주가조작은  미국에서는  종신형이다.     개검사들  탄핵이  아니라   감방에  보내야  한다.,True,1,2025-03-07T08:50:01+0900,853216944545857539,1,0,0
dkfh****,2cqQSn,구미호같은김건희를아예 구치소에서 영원히 썩게해야한다...,True,1,2025-03-07T08:44:25+0900,853216584053817459,1,0,0
curt****,UjHX,"희대에 악녀 타이틀 획득이지요 ㅋㅋㅋ 향후 1,000년간은 비빌 악녀가 없을듯",True,1,2025-03-07T08:39:05+0900,853216240037003294,1,0,0
4239****,3cFXl,거니년은 그냥 냅두면 안됨!!!!!!!!!,True,1,2025-03-07T08:37:33+0900,853216141286310041,1,0,0
niha****,,,False,1,2025-03-07T08:35:09+0900,853215986600378405,0,0,0
kawa****,,,False,1,2025-03-07T08:32:17+0900,853215801832898634,0,0,0
ttsi****,5KFMF,폭주돼지와 함께 골로 보내,True,1,2025-03-07T08:27:28+0900,853215491487957125,1,0,0
igna****,3iLxI,"역시 지극히 사적인 동기로 누른 계엄 버튼. 
내란 세력은 끝까지 진압해야 해.",True,1,2025-03-07T08:23:19+0900,853215223924916314,1,0,0
nnam****,bpUOo,결국은 김건희 봐준 검사들이 계엄의 원인이 된거지. 검찰 니들 스스로 이 사태를 자초한거다. 빨리 없어져야할 단체.,True,1,2025-03-07T08:16:18+0900,853214772768800841,1,0,0
peh4****,3xQ1l,빨리 ㅌㅎ 좀... please,True,1,2025-03-07T08:14:45+0900,853214671988064436,1,0,0
proy****,6p09G,거니야 니가 지은죄가 끝이 없다 징글징글하다둘이 손잡고 사이좋게 들어가라,True,1,2025-03-07T08:13:52+0900,853214615180411094,1,0,0
asia****,,,False,1,2025-03-07T08:04:40+0900,853214022760136853,0,0,0
sho6****,1N76H,김건희가족수사 모두다  처벌 이것이 이나라 사법질서회복이고  국민평등원칙이다,True,1,2025-03-07T07:57:07+0900,853213536220872740,1,0,0
cgt1****,3zkvu,검새놈들은 변호사짓을 못하게 법을 바꿘라,True,1,2025-03-07T07:55:42+0900,853213444835377310,1,0,0
doks****,41jFc,거니 판이었다.,True,1,2025-03-07T07:50:43+0900,853213123736240271,1,0,1
kek5****,4UUWF,저딴게 검사라니...너희들도 더럽게 검사된거 맞겠구나 안봐도 뻔하다,True,1,2025-03-07T07:48:18+0900,853212968496660543,1,0,0
go00****,,,False,1,2025-03-07T07:48:00+0900,853212949454520323,0,0,0
kag1****,4mhL5,미친정신병자여자대믄에 나라가망해가구만,True,1,2025-03-07T07:45:26+0900,853212784215720030,1,0,0
s570****,39xUM,아무려믄~~~대한민국국민이  ~~~초딩만두 못한자를 대통령으로 선출 했다는 겁니까????,True,1,2025-03-07T07:44:37+0900,853212731535261809,1,0,0
pdru****,eGaP,처벌하기전에 어디 좀 데리고나가서 망신좀 확 줬으면 좋겠어요 저여자는 정말 저여자야말로 이 나라를 이지경까지만든 그 뒷배입니다,True,1,2025-03-07T07:44:30+0900,853212723180208226,1,0,0
s570****,39xUM,"주가조작수사검사의 무혐의 처리에 대한 국회의 수사검사들 탄핵은~~ 곧 주가조작수사가 봐줬다!!!라는것으로 ~~~여사님의 치부가 드러나게될까봐~~계엄으로 막으려 한것은 대통령수준이~~~~
초딩수준 이하라는겁니까요????
너무!!!심한거 아녀???",True,1,2025-03-07T07:42:37+0900,853212601830604924,1,0,0
ojy1****,1k5kf,"사기꾼과
 눈먼 무식한 칼잡이
 윤거니 조합이 좋아 
 결과물은 평생감방 가자고",True,1,2025-03-07T07:39:01+0900,853212370086920196,1,0,0
mag7****,2crKYO,결국에는 이 나라하고 마누라 하고 바꾸려고 했었네.......,True,1,2025-03-07T07:38:20+0900,853212326449381444,1,0,0
hyun****,kkt2,이모든 사태의 발단은 김여사가 디올빽 받으면서 시작되엇지...그것만 아니엇으면 국회를 민주당이 다먹지는 못했을텐데 남편 잡아먹는 여자라는게 이런거군~,True,1,2025-03-07T07:33:36+0900,853212021036941435,1,0,0
smc2****,,,False,1,2025-03-07T07:33:19+0900,853212002682667063,0,0,0
ch95****,3bc8M,진살을 말해주는 뉴스는 가짜뉴스라고해 언론통제하는 사이비 ㅡㅡㅡㅡ 언론통제해 사기에 세뇌시켜논 광신도한테 진실을 말하는 뉴스보여주면 사이비 사기꾼말안듣거든.ㅡㅡㅡㅡㅡ 언론통제하던 윤천지 범인도 가짜뉴스타령 사이비처럼,True,1,2025-03-07T07:32:44+0900,853211965537910921,1,0,1
smil****,3sAWp,"명태균 스캔들이 아니고 김건희 스캔들이 맞고, 공천뿐 아니라 인사에 깊숙이 개입해 녹진하게 퍼나르다 사고 생기고 수습하다보니 불법 탈법이 다드러나고 그외 잔죄도 덤으로 쳐들어나 좋댓다 싶으니 계엄 박은 거. 극우유툽 돈 잔치 시작되고 국힘꾼들 엮인것들 싹다 드러나면 당깨지고 개인비리 더하니 총력전으로 깽판침. 그바람에 나라는 안중에 없음 드러나고 패망조 들림. 정리하면 이럼. 올핸 경제위기 온다고 난리. 어쩔래 십정치꾼들아.",True,1,2025-03-07T07:27:45+0900,853211644254224520,1,0,0
dode****,1UEt1,모두가 알고 있던 사실. 실체가 드러난 것.,True,1,2025-03-07T07:26:43+0900,853211578437206154,1,0,0
jiny****,rz6G,대단한 러브 스토리 입니다  희대의 사랑꾼,True,1,2025-03-07T07:21:59+0900,853211272555004065,1,0,0
ysk9****,BQcn,"지 잘못을 반성도 못하는 바보같은게 ...
아직도 정신못차리고 뉘우치는게 하나 없더라",True,1,2025-03-07T07:18:48+0900,853211067839414417,1,0,0
boom****,,,False,1,2025-03-07T07:17:19+0900,853210972863594542,0,0,0
sski****,fshx,이 물건한테 그동안 놀아났던 검새들  싹다 잡아들여라,True,1,2025-03-07T06:55:15+0900,853209551279751202,1,0,0
soph****,9gB1y,누구 맘데로 탄핵이라니 좌ㅃ리jtbc 광화문 580만 여의도 40만 애국 물결 못 봤니? 하긴 이것도 못된 프렘 씌웠지 몹쓸 언론같으니라구,True,1,2025-03-07T06:52:41+0900,853209385604743265,1,0,0
jp19****,3k0LB,사기꾼 마누라를 얻으면 안된다는 교훈이다.,True,1,2025-03-07T06:46:30+0900,853208986592215083,1,0,0
deat****,1qDOJ,도이치 관련 다른 범죄자들 진술을 봐도 거니가 빠지면 구성이 되질않는데 저걸 무혐의 준 검사들이 정상인거냨ㅋㅋㅋㅋㅋㅋㅋㅋㅋㅋㅋㅋㅋㅋㅋㅋㅋㅋㅋㅋㅋㅋㅋㅋㅋㅋㅋㅋㅋㅋㅋㅋㅋㅋㅋㅋㅋㅋㅋㅋㅋㅋㅋㅋㅋㅋㅋㅋㅋㅋㅋㅋㅋㅋㅋㅋㅋㅋㅋㅋㅋㅋㅋㅋㅋㅋㅋㅋㅋㅋㅋㅋㅋㅋㅋㅋㅋㅋㅋㅋㅋㅋㅋㅋㅋㅋㅋㅋㅋㅋㅋㅋㅋㅋㅋㅋㅋㅋㅋㅋㅋㅋㅋㅋㅋㅋㅋㅋㅋㅋㅋㅋㅋㅋㅋㅋㅋㅋㅋㅋㅋㅋㅋㅋㅋㅋㅋㅋㅋㅋㅋㅋㅋㅋㅋㅋㅋㅋㅋㅋㅋㅋㅋㅋㅋㅋㅋ 검사 자격 박탈해야짘ㅋㅋㅋㅋㅋㅋㅋㅋㅋㅋㅋㅋ 다른건이지만 이정섭이 같은 놈들도 자격박탈시켰어야지 이제와서 수사한다고 난맄ㅋㅋㅋㅋㅋㅋㅋㅋㅋㅋㅋㅋㅋ,True,1,2025-03-07T06:41:52+0900,853208688511418459,1,0,0
ulba****,lKqm,마누라 때문에  말년에 호강하겠네..ㅋㅋ,True,1,2025-03-07T06:25:12+0900,853207614568267792,1,0,0
