user_nickname,userIdNo,comments,visible,replyLevel,regTime,parentCommentNo,sympathyCount,antipathyCount,replyAllCount
kgw1****,1bGvt,욕 욕 욕 ㅋㅋㅋㅋ,True,1,2025-05-18T10:02:16+0900,859901132120522814,31,1,1
beri****,8Sooi,윤석열 나가자마자 여자 윤석열이 들가네 ㅋ,True,1,2025-05-18T10:03:34+0900,859901216342147185,25,0,0
skew****,3s9hr,"직장에서 2040세대 중 2찍들하고는 밥도 같이 안먹음, 왜냐면 이시국에도 지지한다는 건 그들의 사고가 정상적이지 않다고 생각하기 때문임...",True,1,2025-05-18T10:08:21+0900,859901524187283534,18,1,0
vjda****,KW1G,"이념도 없고,  천박/상스럽고, 4가지도없고,  할줄아는건 오로지 욕밖에 없는 무식한것,  짐승당은 앞날이 훤하네~",True,1,2025-05-18T17:44:19+0900,859930899431555165,17,1,0
haha****,2uOhG,변호사인것도 놀랍고 결혼했다는것도 놀랍다,True,1,2025-05-18T11:56:09+0900,859908469535277097,14,0,0
chap****,c6DMS,내란당 지지자 취향 확고하네.  진보는 적으로 중도는 버리고 극우만 안고간다 이거자나.  이러면 대통령 배출할 때마다 계엄령 때릴 테세.  이미 정당의 선을 넘어섰다고 본다.,True,1,2025-05-18T11:35:29+0900,859907137373995106,14,0,0
jcki****,8lKRn,훌륭한 리더 곁에 훌륭한 영웅호걸들이 모여들듯이 똥통에는 똥만 쌓이는법이지,True,1,2025-05-18T11:34:52+0900,859907097712656576,14,0,0
heal****,4EEau,재수없는 것들은 죄다 극우내란당에 모이는구만...ㅉㅉ,True,1,2025-05-18T16:26:57+0900,859925915021345054,13,0,1
pto6****,6lB7x,비웃음거리 1호로 등극한 계몽년도 입당할정도면 국힘은 진짜 망한거다,True,1,2025-05-18T15:03:43+0900,859920552737898690,13,0,0
silv****,5aN8T,정말 죠오가치 생겼다. 관상은 어쩔수없지 ㅋㅋㅋㅋㅋㅋㅋ,True,1,2025-05-18T14:56:45+0900,859920104165474501,13,0,0
choc****,22rPV,국힘은 이상하게 이상한 사람들만 모여드네 끼리끼리 인가,True,1,2025-05-18T11:37:45+0900,859907283906199741,13,0,0
kiam****,2GJFm,입에 쌍욕을 오토바이처럼 내뱉던 애엄마가 결국 쓰레기장에 들어갔구나.,True,1,2025-05-18T18:12:01+0900,859932684661555209,12,0,0
morb****,,,False,1,2025-05-18T14:52:46+0900,859919847625064661,0,0,0
mdez****,6xVaL,이여자는 변호사를 어떻게 했는지 능지가 의심스럽다. 떠나려는 쓰레기수거차에 잠깐만요~! 하면서 올라탔네ㅎ 잘 소각되거라,True,1,2025-05-18T12:07:52+0900,859909224308670657,12,0,0
jaej****,55Zgx,윤석열이 도움안된다고 판단해서 탈당하도록 한건데 그 추종자가 입당하면 참....설득력있어 보이겠다 그치?,True,1,2025-05-18T11:54:55+0900,859908389709283524,12,0,0
kasi****,7tLd3,쓰레기가 쓰레기통에 들어가는건 당연한거지요 그동안 여기저기 악취풍기며 미관상 너무 불쾌하고  안좋았는데 스스로 틀어가니 마음이 놓이네요,True,1,2025-05-18T10:06:19+0900,859901393761206351,12,0,0
poir****,N8wV,똥은 똥끼리 모인다는데 그래서 입당한듯,True,1,2025-05-18T16:21:28+0900,859925562179715213,11,0,0
kyh2****,,,False,1,2025-05-18T14:38:34+0900,859918932545372319,0,0,1
o_bu****,JFa8,입이 거늬만큼 걸걸하니 천박하던데..역시 그물이 노는곳은 내란당^^,True,1,2025-05-18T12:32:33+0900,859910814486757544,11,0,0
tnh4****,3klba,"김계리 말하는거 보고 정말 놀랬다. 입에 걸레를 물었는지 말끝마다 욕설을.... 이런 사람이 국힘당에 입당? 국힘당에는 아무나 입당하는구나.  중도는 김계리, 권성동 때문이라도 2번은 안찍을것 같다.",True,1,2025-05-18T17:55:46+0900,859931637125742761,12,2,0
fcki****,1S7sD,나는 김계리를 지지한다. 열렬히...  윤수괴의 뒤를 이어 내란당 붕괴에 큰 일을 부탁한다,True,1,2025-05-18T17:04:13+0900,859928316512043085,11,1,0
daff****,4IrCO,쓰레기가 들어갈 곳은 쓰레기통,True,1,2025-05-18T18:23:11+0900,859933403514929216,10,0,0
fbwp****,7yzg,국짐당은  이상한 사람들만 모이는집단인가???,True,1,2025-05-18T16:29:04+0900,859926051302670362,10,0,0
yjan****,1X88w,생긴데로 노는구나 못생긴것이 하는짖도 그렇군,True,1,2025-05-18T15:31:12+0900,859922323539492908,10,0,0
po09****,3qdYC,와~ 토나온다증말,True,1,2025-05-18T15:01:24+0900,859920403957547138,10,0,0
yu13****,,,False,1,2025-05-18T13:30:39+0900,859914557718528159,0,0,0
emob****,EScP,국짐은 정당도 아니다 .. 쓰레기 오물 처리장  ㅠㅠ,True,1,2025-05-18T13:14:19+0900,859913504646234192,10,0,0
soob****,16rBp,참나...쓰레기 하치장도 아니고...,True,1,2025-05-18T13:02:01+0900,859912712174436359,10,0,0
ultr****,2CzZl,똥파리들만 꼬이는곳..,True,1,2025-05-18T12:49:33+0900,859911909116215443,10,0,0
nypd****,vPRe,점점 더 극우정당화 되네 대선 끝나면 당 해체 되고 중도보수주도로 신당 창당 될듯..,True,1,2025-05-18T11:08:25+0900,859905393936040045,10,0,0
khsk****,1m4zx,저런 것도 변호사라고 나대다가 결국은 정치질하려고 한거지,True,1,2025-05-18T10:55:14+0900,859904545008910392,10,0,0
shin****,,,False,1,2025-05-18T10:24:41+0900,859902576924033170,0,0,0
happ****,5RQmF,잘어울려요~~끼리끼리 모인다는 말이 딱 맞는것 같아요~,True,1,2025-05-18T10:22:12+0900,859902416265412655,10,0,0
antk****,cllgB,힘들게법공부해서변호사됐으면어렵고힘든사람변호좀해주지 ᆢ젊디젊은이가저러고있다니ᆢ헛웃음나네ᆢ계몽계리늙어죽을때까지치욕의이름이될것이다.,True,1,2025-05-18T16:20:34+0900,859925504080216250,10,1,0
lsy0****,1qUNL,"니자식어쩌니 너같은걸 엄마라고ㅋㅋㅋㅋ

이댓글꼭바라ㅋㅋ아버지 파면되서 어쩌니 ㅋㅋㅋ",True,1,2025-05-18T10:57:37+0900,859904698168115325,10,1,0
jisu****,1rQnF,입당을 받아쥤나?  정말 인간 이하들의 총 집합소가 국힘이네,True,1,2025-05-18T19:45:48+0900,859938725918933196,9,0,0
kdkd****,3WVt4,지식은 있으나 상식이. 떨어지는 저런 쓰레기들만 국힘에 몽땅 모임,True,1,2025-05-18T19:05:46+0900,859936147311165647,9,0,0
tang****,83C5C,버와 지 사이에 러가 빠졌넼ㅋㅋㅋ,True,1,2025-05-18T18:34:52+0900,859934156610601197,9,0,0
kkdh****,1vSVd,내란 변호사   김계리 국민의힘 입당 고로  국민의힘은 내란당 압잡이 확실!!!,True,1,2025-05-18T17:27:05+0900,859929789920706583,9,0,0
simp****,1UpJ1,"정신머리,,뇌구조가 장애인 사이비집단,,,",True,1,2025-05-18T16:23:26+0900,859925688344379527,9,0,0
soso****,1a8pW,윤버.러.지,True,1,2025-05-18T16:12:38+0900,859924993079771319,9,0,0
hans****,1Zimc,탄핵 재판 시 님이 보여준 행태로 봐서는 전혀 도움이 안될 듯. 아마 역효과가 안나면 다행임. 그것은 본인이 재판 시 어떤 행동을 했는지 생각해 보면 잘 알 텐데...하여간 국힘당의 돌아가는 모습을 보면 어디 소모임보다 더 못한 전혀 준비되지 않은 집단 같은 느낌이 듬. 이런 당에 무엇을 믿고 나라를 또 맡길까! 지금은 입당해서 표를 구걸할게 아니고 그동안 잘못한 행동에 대해 처절하게 반성하는 모습을 보여야 할 것임. 하여간 상식이 안 통하니 무슨 말을 한들 입만 아파요. 알아서 잘 해보시길.누군가 그럽디다. 니 자신을 알라고!,True,1,2025-05-18T13:10:29+0900,859913258474143851,9,0,1
say0****,1nJAV,"국짐 그나마 명목 유지하다가 저여자 등장으로 마져 말아먹기 생겼네. 계몽된 계리,  어서 설쳐라.ㅎ",True,1,2025-05-18T12:50:09+0900,859911948140019745,9,0,0
232c****,nnhT,그나물에 그밥인데  찌질이들이 모여서 뭘 하겠다는 건가 ㅉㅉㅉ,True,1,2025-05-18T12:47:00+0900,859911745202814978,9,0,0
para****,7zLLz,모아 모아  한꺼번에 퍼내자!ㅋㅋ,True,1,2025-05-18T11:50:15+0900,859908088809914425,9,0,0
ryu7****,epVZp,온갓쓰레기는다모이는구나~ㅋㅋㅋㅋㅋ,True,1,2025-05-18T11:46:14+0900,859907830776332350,9,0,0
nate****,66BAe,국짐은 망했네... 진짜 인성 능력 바닥모여라구만..,True,1,2025-05-18T11:21:19+0900,859906224978657369,9,0,0
pili****,1F1Dx,아주 쓰레기처리장을 만드네. ㅎ,True,1,2025-05-18T11:20:46+0900,859906190014939320,9,0,0
harm****,3pVwm,윤씨 딸인듯..  닮았으...ㅋㅋ  생김이나 말이나 행동까지~~~ 개념도 상실,True,1,2025-05-18T11:15:21+0900,859905840881074230,9,0,0
dhdh****,1QZCM,아주 하치장이네 국짐은 ㅋㅋ,True,1,2025-05-18T10:30:42+0900,859902964293173407,9,0,0
rkak****,3eJQ3,욕쟁이여자!! 딱 국짐 수준이네..참 입당 잘 했어요.,True,1,2025-05-18T10:23:19+0900,859902488222892098,9,0,0
cis0****,3zhY1,스레기장 포화상태네,True,1,2025-05-18T17:05:48+0900,859928418215526686,9,1,1
ajun****,334eH,"국힘당은 사람들을 고르고 골라 모아도 저런 조합은 정말  만들기가 쉽지 않다 ㅋㅋㅋ. 김문수 권성동 나베, 윤상현 계몽녀 권영세 등등 참으로 웃음만 나온다 ㅋㅋㅋ",True,1,2025-05-18T13:49:18+0900,859915758614872143,9,1,0
yutt****,7pQk1,너 국짐 입당하는 순간 문수 100만표이상 날라갔다 나는 계몽 안된 중도 보수다,True,1,2025-05-18T11:28:56+0900,859906715812888775,9,1,0
gupd****,1bRhE,국민을 무력으로 제압하려 했던 자를 따르는게 뭐가 그리 자랑스러워서 저러는건가~~ 정치를 하고 싶었던건가~~ 목적 달성을 위해서는 부끄러움도 모르니 국힘 패거리들과 비슷하긴 합니다~,True,1,2025-05-19T14:28:40+0900,860011066824851848,8,0,0
h456****,3whbB,"마누라 구하려고 전쟁유도에 계엄까지 불사한 윤건희 주술 싸이코패스파, 통일/신천지/전광훈 사이비종교파, 노인들 주머니 터는 극우 유투버파 등등 지들끼리 계몽되었다고 정신승리하는 한심파들을 지지기반으로 삼고있는 극우괴뢰정당 국민의힘",True,1,2025-05-18T18:12:22+0900,859932707294019712,8,0,0
mkss****,aaKG7,"잘한다..
 개몽녀~
 윤돼지와 그의 떨거지들은
민주당 선거운동을 너무 잘해~ ㅋ 
대선 끝나고 감사패 강추여~ ㅋㅋ",True,1,2025-05-18T18:09:53+0900,859932547071606997,8,0,0
snea****,7YmBN,윤석렬이가 보수를 이렇게 까지 개작살 내놓을지는 몰랐다 참 기가막힌다,True,1,2025-05-18T17:47:18+0900,859931091832668235,8,0,0
robe****,,,False,1,2025-05-18T17:18:00+0900,859929204748189697,0,0,0
best****,2SWi,콩가루집안에 똥파리만 꼬이는구나. 친일독재내란당. 강아지들.,True,1,2025-05-18T17:13:48+0900,859928933225726213,8,0,0
saeh****,1qbqJ,역시 뭐만 모이는당,True,1,2025-05-18T16:23:47+0900,859925711262056676,8,0,0
korn****,HYRr,관심도 없는데 참 가지가지한다,True,1,2025-05-18T15:44:47+0900,859923198756520190,8,0,0
redy****,RxZO,안간 같지도 않은것들 집합소구만,True,1,2025-05-18T15:37:59+0900,859922760669855999,8,0,0
wind****,zU5P,공천받을려고 그동안 쇼한거 다보이는데 에휴 왜그러고사냐,True,1,2025-05-18T15:06:40+0900,859920742890864830,8,0,0
kdw2****,1vcrq,썩은 고기에 구더기 파리가 꼬이듯...,True,1,2025-05-18T15:01:11+0900,859920389462032445,8,0,0
woo9****,GsNh,국힘 또 표 떨어져나간다,True,1,2025-05-18T14:59:09+0900,859920258901737517,8,0,0
namo****,2soY1,"죄 지은 사람은 버젓이 웃고, 피해입은 국민들은 아둥바둥...
역겹다...",True,1,2025-05-18T14:58:54+0900,859920242644615415,8,0,0
sjya****,1Uwws,그나저나 계리네 아부지는 뭐하는 사람 이길래 집에서 계몽 좀 시켜 내보내지 딸램이 석려리 만나서 계몽하게 만드까?..,True,1,2025-05-18T14:42:09+0900,859919163785740330,8,0,0
ours****,35gcj,혐오 사진은 올리지 말아 주십시오.,True,1,2025-05-18T14:36:24+0900,859918793462251625,8,0,0
koko****,4XnXA,욕을 아주 찰지게 잘하시던데 수준이 딱 국짐내란당 수준,True,1,2025-05-18T14:14:01+0900,859917351208878086,8,0,0
gnlo****,GzJK,쓰레기가 쓰레기통으로 들어가네,True,1,2025-05-18T13:34:55+0900,859914832227336387,8,0,0
ahk2****,2pQpz,온갖 잡것들이 모이는구나 기존것들과 새로운 잡것들이 모이니 더 추잡한당이 되고있네,True,1,2025-05-18T13:29:21+0900,859914473178136656,8,0,0
shar****,zleR,"잘된넘 하나는 옥석을 가리기가 쉬워졌다는 것. 온갖 쓰레기는 국짐으로, 합리적 보수들은 탈출러쉬",True,1,2025-05-18T13:27:37+0900,859914361878085781,8,0,0
toot****,3ZE3q,못된 놈들만 다 모이네…!!!!!!,True,1,2025-05-18T13:18:34+0900,859913778685280365,8,0,0
ksak****,2eNuX,끝까지 꼴갑을^^,True,1,2025-05-18T13:14:55+0900,859913543502266566,8,0,0
zota****,1kmqA,구더기가 똥물에 다이빙,True,1,2025-05-18T13:08:49+0900,859913150395318449,8,0,0
ever****,7oIhT,"암, 당연히 입당해야지...김계리보다 더 내란당에 어울리는 당원이 있으면 나와 봐!.. 욕도 찰지게  잘하고...",True,1,2025-05-18T13:07:35+0900,859913070804205672,8,0,0
chun****,,,False,1,2025-05-18T12:50:34+0900,859911975503659135,0,0,0
aksc****,1nHCJ,그래 잘했다 분리수거를 위해 한곳에 모아두면 처리가 쉽지! 올해 한 일중에 최고! 개몽된거맞네! ㅋ,True,1,2025-05-18T12:50:16+0900,859911955891093577,8,0,0
name****,2vyrV,이게 목적이었겠지. 저어기 어디 경남에 한자리나 빋아서 국회의원 연금이나 받아쳐먹을 심산이었겠지. 근데 그 당 망했거든? 얼마나 잘 쳐 사나 두고봅시다. 본업으로는 못먹고살거같던데 실력보니.,True,1,2025-05-18T12:29:07+0900,859910593446936609,8,0,0
ksch****,5UKtM,"고맙다 계리야~
유유상종,쓰레기는 쓰레기통에",True,1,2025-05-18T12:23:32+0900,859910233340772488,8,0,0
hank****,6cixC,똥물에 똥 한덩어리 추가,True,1,2025-05-18T12:15:21+0900,859909706016096357,8,0,0
ybos****,2EiOA,ㅎ. 내란공법 재백하는 국짐당.빼박.이네. 국짐 니들은 요즘시대를 너무 모른다. 8.90년대야 국민이 금방 잊어버리는 개돼지같았지? 요즘도 그런줄아나봐. 평새 기록은 남고. 검색만해도 다 나온단다. 다음 총선때 보자,True,1,2025-05-18T12:13:35+0900,859909592719556728,8,0,0
rlat****,1LwF8,욕을 찰지게 잘 하던데 국힘 대변인 추천!!!!!!!,True,1,2025-05-18T12:09:41+0900,859909340708995198,8,0,0
sam2****,2HEmQ,그럼 그렇지~정치질 하려고 그 난리친거지~!,True,1,2025-05-18T12:01:14+0900,859908796607103035,8,0,0
cosm****,2DHHl,휴지통에 버려져야 하는 인간들이 스스로 다  한곳으로 모이니  폐기하기 쉽겠구나,True,1,2025-05-18T11:41:55+0900,859907551888670920,8,0,0
esjp****,,,False,1,2025-05-18T11:22:10+0900,859906279974371368,0,0,0
ekf9****,1HQAP,비호감녀 였는데 이로써 김문수 표 더더욱 이탈 되겠군,True,1,2025-05-18T10:56:25+0900,859904621345243220,8,0,0
5908****,umBY,부녀지간인줄 알았다,True,1,2025-05-18T10:45:19+0900,859903906015084609,8,0,1
sunk****,,,False,1,2025-05-18T10:42:27+0900,859903721113387117,0,0,1
okki****,2DtsR,국짐은 쓰. 레. 기. 처리장이 되어가는구나 ㅋㅋ,True,1,2025-05-18T10:32:10+0900,859903058816008225,8,0,0
zoam****,PxsI,"아이고... 안되는 집은 뭘해도 망한다더만, 가뜩이나 침몰해 가는 당에 기름을 부어 불을 질러버리네",True,1,2025-05-18T10:28:10+0900,859902800866312242,8,0,0
kdbl****,44WAV,태어난 애는 무슨 죄냐. 태어나보니 에미란 게 윤버지 즬즬싸는 광신도 ㅋㅋㅋ,True,1,2025-05-18T18:21:59+0900,859933326708834560,8,1,0
ljsh****,dFgvK,"국힘은 건전하고 상식적인 분들은 밀려나고
  이상한 사람들만 모이는 정당이 되었다.
국힘이나 자유통일당이나 도찐개찐 아닌가.
이제 국민의힘이 아니라 국민의 짐.
극우정당이 되었다.",True,1,2025-05-18T17:50:36+0900,859931304802648234,8,1,0
nana****,2Yb3F,"처분하기쉽게 니들 한데모여있어라.
  쓰레기버리기쉽게~~~",True,1,2025-05-18T17:20:20+0900,859929354535174246,8,1,0
yg72****,eKbBf,"쓰레기가 쓰레기통에 들어가는게 뭔 뉴스라고.
금덩어리가 쓰레기통에 들어가야 뉴스지.",True,1,2025-05-18T15:55:14+0900,859923872378519616,8,1,0
jjan****,2WiUC,"ㅋㅋㅋ 가지가지한다...
입당시킬 인물이 그리도 없나?
참나~~~~",True,1,2025-05-18T21:04:22+0900,859943787655331949,7,0,0
yhye****,,,False,1,2025-05-18T20:54:26+0900,859943147872977021,0,0,0
guya****,9qkRC,썩은고기가 갈곳은 역쉬 국짐이지,True,1,2025-05-18T20:40:23+0900,859942242423406700,7,0,0
kond****,29vXO,내란수괸놈이 가니 계몽돼지가 오네,True,1,2025-05-18T20:12:58+0900,859940475950334215,7,0,0
redn****,27YCY,대한민국 쓰레기는 다 모이는구만.. 썩은 내가 진동한다,True,1,2025-05-18T19:57:25+0900,859939475038404719,7,0,0
davi****,87SK6,ㅍㅎㅎㅎㅎ  턱걸이 능력  알린다고?   턱걸이만   잘하면    대통짓도   잘  한다더냐?   대체   이  계몽녀는   뭐가   계몽됐다는건지  ㅋ   대대적인    정신  계몽이  필요할듯,True,1,2025-05-18T19:34:55+0900,859938025302393082,7,0,0
ever****,7oIhT,여러분 이렇게 욕을 찰지게 잘하는 여자 보셨습니까...딱 국짐입니다.,True,1,2025-05-18T19:25:19+0900,859937406357340261,7,0,0
hang****,188Lr,공천받아서 금뱃지 다는게 최종 목적이지 뭐~~,True,1,2025-05-18T18:19:43+0900,859933180579283158,7,0,0
luh2****,,,False,1,2025-05-18T17:46:28+0900,859931038581784714,0,0,0
acn2****,4T1Tp,ㅋ당연한 시나리오 아닌가! 공천 받고 싶어 계몽 된거!,True,1,2025-05-18T17:37:19+0900,859930448376102987,7,0,0
sho8****,1k5yC,정신5000년 나간인간 벌러지네,True,1,2025-05-18T17:31:32+0900,859930075687026841,7,0,0
so_s****,BiZM,윤버지ㅋㅋㅋㅋㅋ개웃김ㅋㅋㅋㅋㅋㅋㅋ,True,1,2025-05-18T17:19:48+0900,859929320578089185,7,0,0
zaza****,5LGO8,"계몽당으로    당명   바꿔라 ㅋ
내란당   계몽당   접대당  극우당  노인당  TK당  골라라 ㅋ",True,1,2025-05-18T17:14:50+0900,859928999814496517,7,0,1
jjja****,1UpDj,국힘 지지율 더 떨어지겠네 완죤 비호감.,True,1,2025-05-18T17:04:40+0900,859928345016533178,7,0,0
sinb****,1MYzJ,욕 맛깔라게 하던 아줌마 들어 오셨네 솔직히 내란당에 잘 어일리는 사람임,True,1,2025-05-18T16:47:52+0900,859927263406194912,7,0,0
beer****,kaiJ,"오..... 계몽년 !!
너의 능력을 보여줘.....ㅋㅋ",True,1,2025-05-18T15:05:05+0900,859920640784728086,7,0,0
lji0****,4PIag,저런게 정치한다고 나대면,True,1,2025-05-18T15:02:27+0900,859920471703945330,7,0,0
mokm****,5Ihbj,이분은 그 찰진 욕만 생각남,True,1,2025-05-18T15:01:27+0900,859920406927114359,7,0,0
kthe****,2lmXY,"이 사람으로 인하여 김문수 후보님 ~~~

,
.
.
.마이너스 5프로 획득~~",True,1,2025-05-18T14:59:04+0900,859920253499473954,7,0,0
rosa****,CG7W,쓰레기 집합소.,True,1,2025-05-18T14:53:38+0900,859919903610634406,7,0,0
abou****,3FvLb,두인간이  면상도 넙대대 비슷  정신도 극우 망상  비슷😂 입이 더러운것도 비슷🤣,True,1,2025-05-18T14:28:35+0900,859918290162548892,7,0,0
affa****,fIox,"쟈식있다며?
그럼 애미가 그러면 안되는거지...ㅉㅉ",True,1,2025-05-18T14:02:39+0900,859916619218944147,7,0,0
blue****,336iR,둘이 닮았네...윤버지가 맞나보네ㅋㅋㅋ뇌구조도 유전받은거 같고...,True,1,2025-05-18T13:10:44+0900,859913274395721881,7,0,0
vjda****,KW1G,"ㅋㅋㅋㅋ 이것들은 어디서 돌때가리 , 무대뽀만 골라오네,  하여튼 없어질 내란당 인증샷 하는듯함",True,1,2025-05-18T13:10:20+0900,859913248609140812,7,0,0
yong****,11o8j,입당 환영합니다. 이로써 국힘은 더 나락으로 가겠네요.,True,1,2025-05-18T13:04:44+0900,859912887848665281,7,0,0
cksl****,sF98,고쳐쓸수가 없다 진짜 국힘은 하아,True,1,2025-05-18T13:03:17+0900,859912794181468222,7,0,0
clev****,3XbXT,계리 입당으로 아주 선명해졌네 극우당,True,1,2025-05-18T13:03:09+0900,859912785356652573,7,0,0
mira****,3tye6,욕계리 국짐 박살 내려고 들어갔네,True,1,2025-05-18T12:53:59+0900,859912194932867319,7,0,0
83sk****,1ah6v,계몽욕쟁이의 저주인가. 윤은 탄핵되고. 윤어게인 신당은 창당 못하고. 국짐당은 곧 정당해산 될 거 같고. 욕도 시원하게 잘 하던데 국짐당도 시원하게 날려주길!!,True,1,2025-05-18T12:49:26+0900,859911902019453040,7,0,0
pbk4****,1Q5qC,딱보니 윤뚱 쁘락지노릇 할라고 들어갔구만,True,1,2025-05-18T12:48:18+0900,859911828451360848,7,0,0
rumb****,1knfi,딱 국짐당 수준에 맞네욥.,True,1,2025-05-18T12:45:37+0900,859911655713144986,7,0,0
kss0****,4W5O3,꼭 부녀같이 잘 어울려 한결같이 끼리끼리 잘노네.,True,1,2025-05-18T12:39:20+0900,859911251617120334,7,0,0
beta****,6aALR,개나소나 정치판에 뛰어드는게 문제. . .그래서 이지경이 된듯!!,True,1,2025-05-18T12:30:34+0900,859910686375936153,7,0,0
tori****,G7ZN,똥물한바가지 추가요ㅋ,True,1,2025-05-18T12:18:18+0900,859909896169062473,7,0,0
jaoh****,2gA0o,ㅎㅎ 가뜩이나  국짐이 밉상인데  또 하나밉상 추가.  볼것도 없다.,True,1,2025-05-18T12:17:28+0900,859909842918178922,7,0,0
nana****,2XGQ4,역시 국짐당 수준!!!!!,True,1,2025-05-18T12:08:53+0900,859909289119056046,7,0,0
park****,,,False,1,2025-05-18T12:07:32+0900,859909202246631532,0,0,0
ne30****,Zbxu,"국짐당은 왜 이럴까?   이판사판 공사판인가?  혐오하다가 이제는 그래도 우리나라의 큰 정당인데 안타깝기까지 하네
이성을 잃은 정당이라는 생각이 드는건 어쩔수 없다",True,1,2025-05-18T12:03:25+0900,859908937351168083,7,0,0
mist****,1Zk4o,국민의 힘은 정당이 아니라 정신이 이상한 사람들이 모여드는 일종의  정신질환자 상태악화 시너지 모임인가요?,True,1,2025-05-18T11:59:50+0900,859908706328903862,7,0,0
hans****,2dfEm,니 자신이나 먼저 계몽하고 살기를 바란다.,True,1,2025-05-18T11:53:00+0900,859908266044424193,7,0,0
happ****,1Byhd,그동안의 검증된 능력? 그게 뭔데? 니가 뭔데? 불법계엄을 옹호한게 니 능력이냐?,True,1,2025-05-18T11:47:57+0900,859907940784537839,7,0,0
pft0****,49Zec,"니가 입당 목적으로 계몽 어쩌고 했찌 
욕찰지게 잘하는거로 들어간거냐  국짐당은 하나 같이 똑같은 것들만 있는지 내 세금이 아깝다 진짜",True,1,2025-05-18T11:46:44+0900,859907862804037785,7,0,0
ycs0****,1G3Ko,쓰레기 매립지 = 국힘 다 모이는구나,True,1,2025-05-18T11:30:06+0900,859906790924484630,7,0,0
marc****,21JPT,이러면 윤석열 탈당이 뭔 의미가 있냐ㅋㅋ 국힘 당무 기조가 극우화되는 것을 목표로 두고 있는 거 아니냐???,True,1,2025-05-18T11:18:03+0900,859906014625923078,7,0,0
vkfp****,2Vni6,윤석렬의 양녀인 계몽녀가 드디어 전면에 등장하는구나.,True,1,2025-05-18T11:06:56+0900,859905298725339354,7,0,0
y196****,38Vxa,계엄을 계몽으로 인식하는 수준으로 정치하겠다니 참으로 가소로울 뿐이다,True,1,2025-05-18T10:52:03+0900,859904340091994122,7,0,0
kys2****,,,False,1,2025-05-18T10:47:18+0900,859904033505148985,0,0,0
jung****,,,False,1,2025-05-18T10:44:23+0900,859903845835210833,0,0,0
navy****,3DheR,"국힘당 ㅋㅋㅋㅋㅋㅋㅋㅋㅋㅋㅋㅋㅋㅋㅋㅋㅋㅋㅋㅋㅋㅋㅋㅋㅋㅋ
미친거 아냐? ㅋㅋㅋㅋㅋㅋㅋㅋㅋㅋㅋㅋㅋㅋㅋㅋㅋㅋㅋㅋㅋㅋㅋ
민주당은 김상욱을 받음과 동시에 합리적 보수 + 국회의석1 석 개꿀 ㅋㅋ

국힘당은 쌍욕쟁이 김괴를 받는다고???
정무적 감각이 있냐?",True,1,2025-05-18T10:38:50+0900,859903488144965853,7,0,0
leef****,a6suf,석열이한테 욕이 계몽되었더군. 저런 것들만 입당하는 계몽 된 국짐 ㅋ,True,1,2025-05-18T10:36:37+0900,859903345857396891,7,0,0
yhso****,2s2LF,쓰레기  집하장,True,1,2025-05-18T10:31:35+0900,859903020966609042,7,0,0
youn****,,,False,1,2025-05-18T10:15:54+0900,859902010894319826,0,0,0
kdm3****,z88c,그래 내란당가서 개몽 꼭해라,True,1,2025-05-18T10:03:57+0900,859901240870437089,7,0,0
daeh****,aJhU9,도라이가고 더 도라이가 들어왔노 ㅋㅋㅋㅋ,True,1,2025-05-18T21:13:23+0900,859944369136861289,8,2,0
21cn****,2e3GP,"사람들은 바보가 아닌데 윤석열과 김계리 너만 바보인거 같다

윤석열과 선수교체 했네
그러면서 윤석열 탈당이라고 쑈를 하는거야..
당이 더더욱 구제 불능이네
급이 둘이 잘 맞겠다..",True,1,2025-05-18T19:42:22+0900,859938505231433815,7,1,0
vict****,aYh4R,푸하하~~~김계몽? 우리는 잘못알고있었다. 계몽이 아니라 개~~몽 이였다는것을ㅋ,True,1,2025-05-18T18:22:05+0900,859933332530528275,7,1,0
eunh****,1JAHO,내란계몽녀,True,1,2025-05-18T17:42:44+0900,859930798197833952,7,1,0
cham****,3rPOI,윤은 대한민국 역사상 가장 최악의 대통령으로 기록될것이다.,True,1,2025-05-18T17:35:11+0900,859930311759233076,7,1,0
arbo****,cF5JX,윤통이 탈당하면서 장예찬 김계리 이런 수준을 꽂아 넣었네...내란수사는 받아야하는데 방패막이인 국힘 끈떨어질까봐 뭐라도 잡아보려는 술수 진짜 추하다 계엄이 그리 정당하셨다니 수사도 당당하게 좀 받으세요 당신 명령에 따랐던 장성들 5개월째 아직 구속중인데 미안하지도 않습니까?,True,1,2025-05-18T16:38:51+0900,859926681941442815,7,1,0
jenv****,3sWrq,계리 거니 같이 줄담배 피며 쌍욕 할것같은 친자매 같다.,True,1,2025-05-18T12:35:07+0900,859910980061102109,7,1,0
sere****,aoTZV,계리 석렬이한테 한번 줬냐?,True,1,2025-05-18T12:31:05+0900,859910719846481942,7,1,0
